"自治体コード","行番号","都道府県名","市区町村名","営業施設名称、屋号又は商号","営業施設名称、屋号又は商号（フリガナ）","営業の種類","業態","営業施設所在地","営業施設方書","緯度","経度","営業施設電話番号","法人名","法人番号","法人住所","許可番号","初回許可年月日","許可年月日","許可開始日","許可満了日","廃業年月日","申請区分","許可条件","備考"
"007000","fBiz00000101200000000002","福島県","福島市","都路のたまご白河GP工場","ミヤコジノタマゴシラカワジーピーコウジョウ","㉓ 卵選別包装業","卵選別包装業","福島県白河市白坂字牛清水40-2","",37.099440,140.171792,"0248282393","有限会社　都路のたまご","3050002020609","茨城県坂東市馬立1204-3","","","","","","","届出","",""
"007000","fBiz00000105670000000002","福島県","福島市","つばさ保育園かすみ園","ツバサホイクエン　カスミエン","㉖ 集団給食施設","保育園","福島県二本松市成田町１丁目812-1","",37.589661,140.421890,"0243-24-9982","株式会社セアリアス","7380001026719","福島県郡山市桑野４丁目５番地の９","","","","","","","届出","",""
"007000","fBiz00000107420000000223","福島県","福島市","株式会社九州屋　ピポット会津若松店","カブシキガイシャキュウシュウヤ　ピポットアイズワカマツテン","⑦ 野菜果物販売業","","福島県会津若松市駅前町1-10","会津若松食品館ピポット内",37.509775,139.931069,"0242-37-0325","株式会社九州屋","4010101000976","東京都八王子市越野24-1","","","","","","","届出","",""
"007000","fBiz00000113080000000051","福島県","福島市","MEGAドン・キホーテUNY会津若松店","メガドン・キホーテユニーアイヅワカマツテン","⑪ 百貨店、総合スーパー","","福島県会津若松市幕内南町9番10号","",37.483492,139.904384,"0570-059-911","UDリテール株式会社","3013301041403","神奈川県横浜市神奈川区入江二丁目18番地","","","","","","","届出","",""
"007000","fBiz00000118550000000021","福島県","福島市","","","㉖ 集団給食施設","","","","","","","","","","","","","","","","届出","",""
"007000","fBiz00000129180000000811","福島県","福島市","ダイソー　メガステージ白河店","ダイソー　メガステージシラカワテン","⑬ その他の食料・飲料販売業","","福島県白河市新高山５番","",37.118844,140.193788,"","株式会社大創産業","7240001022681","広島県東広島市西条吉行東一丁目４番１４号","","","","","","","届出","",""
"007000","fBiz00000129180000000812","福島県","福島市","ダイソー　コープマート保原店","ダイソー　コープマートホバラテン","⑬ その他の食料・飲料販売業","","福島県伊達市保原町市柳町３１－１","",37.814262,140.553708,"","株式会社大創産業","7240001022681","広島県東広島市西条吉行東一丁目４番１４号","","","","","","","届出","",""
"007000","fBiz00000129180000000814","福島県","福島市","ダイソー　メガステージ石川店","ダイソー　メガステージイシカワテン","⑬ その他の食料・飲料販売業","","福島県石川郡石川町字長久保３１３","",37.154255,140.444625,"","株式会社大創産業","7240001022681","広島県東広島市西条吉行東一丁目４番１４号","","","","","","","届出","",""
"007000","fBiz00000129180000000816","福島県","福島市","ダイソー　リオンドール高田店","ダイソー　リオンドールタカダテン","⑬ その他の食料・飲料販売業","","福島県大沼郡会津美里町字布才地５７４－２","",37.462498,139.835521,"","株式会社大創産業","7240001022681","広島県東広島市西条吉行東一丁目４番１４号","","","","","","","届出","",""
"007000","fBiz00000129180000000820","福島県","福島市","ダイソー　リオンドール船引店","ダイソー　リオンドールフネヒキテン","⑬ その他の食料・飲料販売業","","福島県田村市船引町船引字川代８４","リオンドール船引内",37.434539,140.592910,"","株式会社大創産業","7240001022681","広島県東広島市西条吉行東一丁目４番１４号","","","","","","","届出","",""
"007000","fBiz00000129180000000822","福島県","福島市","ダイソー　会津坂下店","ダイソー　アイヅバンゲテン","⑬ その他の食料・飲料販売業","","福島県河沼郡会津坂下町字舘ノ下７２","",37.565324,139.817344,"","株式会社大創産業","7240001022681","広島県東広島市西条吉行東一丁目４番１４号","","","","","","","届出","",""
"007000","fBiz00000129180000000823","福島県","福島市","ダイソー　リオンドール門田店","ダイソー　リオンドールモンデンテン","⑬ その他の食料・飲料販売業","","福島県会津若松市東年貢１丁目２番４号","リオンドール門田店",37.476270,139.925858,"","株式会社大創産業","7240001022681","広島県東広島市西条吉行東一丁目４番１４号","","","","","","","届出","",""
"007000","fBiz00000129180000000824","福島県","福島市","ダイソー　リオンドール保原店","ダイソー　リオンドールホバラテン","⑬ その他の食料・飲料販売業","","福島県伊達市保原町大字上保原字金山１２－３","",37.809049,140.548433,"","株式会社大創産業","7240001022681","広島県東広島市西条吉行東一丁目４番１４号","","","","","","","届出","",""
"007000","fBiz00000129180000001651","福島県","福島市","ダイソー　棚倉店","ダイソー　タナグラテン","⑬ その他の食料・飲料販売業","","福島県東白川郡棚倉町大字花園字広沢１１－１","",37.045839,140.389808,"","株式会社大創産業","7240001022681","広島県東広島市西条吉行東一丁目４番１４号","","","","","","","届出","",""
"007000","fBiz00000135490000000340","福島県","福島市","ファミリーマート南相馬小高店","ファミリーマートミナミソウマオダカテン","⑩ コンビニエンスストア","","福島県南相馬市小高区福岡字有山２２番地","",37.553297,141.006458,"0244-66-1018","株式会社ファミリーマート","2013301010706","東京都港区芝浦３丁目１番２１号 ","","","","","","","届出","",""
"007000","fBiz00000139140000000035","福島県","福島市","東レ建材株式会社福島工場　食堂","トウレケンザイカブシキガイシャフクシマコウジョウ　ショクドウ","⑤ コップ式自動販売機（自動洗浄・屋内設置）","","福島県田村郡小野町大字谷津作字下中沢1-1","",37.263758,140.632126,"0247-72-5101","ナショナル・ベンディング株式会社","4010401021342","東京都品川区上大崎１丁目１５－２２","","","","","","","届出","",""
"007000","fBiz00000139140000000164","福島県","福島市","林精器製造　事務所2F","ハヤシセイキセイゾウ　ジムショニイエフ","⑤ コップ式自動販売機（自動洗浄・屋内設置）","","福島県須賀川市森宿字向日向45","",37.315607,140.365523,"0248-75-3151","ナショナル・ベンディング株式会社","4010401021342","東京都品川区上大崎１丁目１５－２２","","","","","","","届出","",""
"007000","fBiz00000139140000000181","福島県","福島市","ルービィ工業　第3工場","ルービィコウギョウ　ダイサンコウジョウ","⑤ コップ式自動販売機（自動洗浄・屋内設置）","","福島県会津若松市北会津町上米塚字梶田1-1","",37.460194,139.901313,"0242-56-4848","ナショナル・ベンディング株式会社","4010401021342","東京都品川区上大崎１丁目１５－２２","","","","","","","届出","",""
"007000","fBiz00000141030000000003","福島県","福島市","楢葉町デイサービスセンターやまゆり荘","ナラハマチデイサービスセンターヤマユリソウ","㉖ 集団給食施設","","福島県双葉郡楢葉町大字山田岡字大堤入31-1","",37.249549,140.996215,"0240251077","社会福祉法人楢葉町社会福祉協議会","4380005007494","福島県双葉郡楢葉町北田字鐘突堂5-5","","","","","","","届出","",""
"007000","fBiz00000141890000000023","福島県","福島市","ダイナム福島須賀川店","ダイナムフクシマスガカワテン","⑤ コップ式自動販売機（自動洗浄・屋内設置）","","福島県須賀川市古河66","",37.299611,140.386486,"070-1455-7836","株式会社日本ヒュウマップ","4011501008097","東京都荒川区西日暮里5丁目15番7","","","","","","","届出","",""
"007000","fBiz00000141890000000048","福島県","福島市","ダイナム原町店","ダイナムハラマチテン","⑤ コップ式自動販売機（自動洗浄・屋内設置）","","福島県南相馬市原町区下北高平字杉内91番地","",37.652902,140.983603,"070-1455-7419","株式会社日本ヒュウマップ","4011501008097","東京都荒川区西日暮里5丁目15番7","","","","","","","届出","",""
"007000","fBiz00000141890000000051","福島県","福島市","ダイナム二本松店","ダイナムニホンマツテン","⑤ コップ式自動販売機（自動洗浄・屋内設置）","","福島県二本松市中里325","",37.580144,140.424305,"070-1455-9032","株式会社日本ヒュウマップ","4011501008097","東京都荒川区西日暮里5丁目15番7","","","","","","","届出","",""
"007000","fBiz00000141890000000052","福島県","福島市","ダイナム会津若松店","ダイナムアイヅワカマツテン","⑤ コップ式自動販売機（自動洗浄・屋内設置）","","福島県会津若松市門田町飯寺字上川原138番地12","",37.464558,139.906851,"070-1455-8647","株式会社日本ヒュウマップ","4011501008097","東京都荒川区西日暮里5丁目15番7","","","","","","","届出","",""
"007000","fBiz00000141890000000053","福島県","福島市","ダイナム福島塩川店","ダイナムフクシマシオカワテン","⑤ コップ式自動販売機（自動洗浄・屋内設置）","","福島県喜多方市塩川町小府根字曽谷田1番地","",37.616656,139.892930,"070-1455-6008","株式会社日本ヒュウマップ","4011501008097","東京都荒川区西日暮里5丁目15番7","","","","","","","届出","",""
"007000","fBiz00000141890000000055","福島県","福島市","ダイナム福島相馬店","ダイナムフクシマソウマテン","⑤ コップ式自動販売機（自動洗浄・屋内設置）","","福島県相馬市大曲字大毛内116番地1","",37.792955,140.936494,"070-1455-8411","株式会社日本ヒュウマップ","4011501008097","東京都荒川区西日暮里5丁目15番7","","","","","","","届出","",""
"007000","fBiz00000141890000000063","福島県","福島市","ダイナム白河店","ダイナムシラカワテン","⑤ コップ式自動販売機（自動洗浄・屋内設置）","","福島県白河市老久保91番地1","",37.113966,140.199539,"070-1455-6593","株式会社日本ヒュウマップ","4011501008097","東京都荒川区西日暮里5丁目15番7","","","","","","","届出","",""
"007000","fBiz00000141890000000065","福島県","福島市","ダイナム福島白河西郷店","ダイナムフクシマシラカワニシゴウテン","⑤ コップ式自動販売機（自動洗浄・屋内設置）","","福島県西白河郡西郷村小田倉字岩下11番地1","",37.121064,140.177622,"070-1455-6650","株式会社日本ヒュウマップ","4011501008097","東京都荒川区西日暮里5丁目15番7","","","","","","","届出","",""
"007000","fBiz00000141890000000067","福島県","福島市","ダイナム福島矢吹店","ダイナムフクシマヤブキテン","⑤ コップ式自動販売機（自動洗浄・屋内設置）","","福島県西白河郡矢吹町大町226-1","",37.199751,140.318111,"070-1455-7757","株式会社日本ヒュウマップ","4011501008097","東京都荒川区西日暮里5丁目15番7","","","","","","","届出","",""
"007000","fBiz00000141890000000201","福島県","福島市","ダイナム福島本宮店","ダイナムフクシマモトミヤテン","⑤ コップ式自動販売機（自動洗浄・屋内設置）","","福島県本宮市荒井字西原2番地6","",37.493391,140.385704,"070-1455-5613","株式会社日本ヒュウマップ","4011501008097","東京都荒川区西日暮里5丁目15番7","","","","","","","届出","",""
"007000","fBiz00000145040000000006","福島県","福島市","","","⑬ その他の食料・飲料販売業","","","","","","","","","","","","","","","","届出","",""
"007000","fBiz00000145040000000013","福島県","福島市","","","⑬ その他の食料・飲料販売業","ドラッグストア","","","","","","","","","","","","","","","届出","",""
"007000","fBiz00000145040000000033","福島県","福島市","","","⑬ その他の食料・飲料販売業","","","","","","","","","","","","","","","","届出","",""
"007000","fBiz00000145040000000034","福島県","福島市","","","⑬ その他の食料・飲料販売業","","","","","","","","","","","","","","","","届出","",""
"007000","fBiz00000145040000000042","福島県","福島市","","","⑬ その他の食料・飲料販売業","","","","","","","","","","","","","","","","届出","",""
"007000","fBiz00000145040000000056","福島県","福島市","","","⑤ コップ式自動販売機（自動洗浄・屋内設置）","","","","","","","","","","","","","","","","届出","",""
"007000","fBiz00000145040000000056","福島県","福島市","","","⑬ その他の食料・飲料販売業","","","","","","","","","","","","","","","","届出","",""
"007000","fBiz00000145040000000083","福島県","福島市","","","⑬ その他の食料・飲料販売業","ドラッグストア","","","","","","","","","","","","","","","届出","",""
"007000","fBiz00000146310000001551","福島県","福島市","スターバックスコーヒー カインズ会津若松店","スターバックスコーヒー カインズアイヅワカマツテン","⑬ その他の食料・飲料販売業","喫茶店","福島県会津若松市神指町南四合幕内南632-1","",37.481286,139.900570,"0242-23-9923","スターバックスコーヒージャパン株式会社","7011001031943","東京都品川区上大崎2-25-2","","","","","","","届出","",""
"007000","fBiz00000146830000000001","福島県","福島市","都路農場GP工場","ミヤコジノウジョウジーピーコウジョウ","㉓ 卵選別包装業","卵選別包装業","福島県田村市都路町古道字下田41-2","",37.390182,140.784366,"0247752005","有限会社都路農場","7380002015522","福島県田村市都路町古道字下田41-2","","","","","","","届出","",""
"007000","fBiz00000147510000000001","福島県","福島市","","","⑳ 精穀・製粉業","","","","","","","","","","","","","","","","届出","",""
"007000","fBiz00000150970000000121","福島県","福島市","","","③ 乳類販売業","","","","","","","","","","","","","","","","届出","",""
"007000","fBiz00000150970000000285","福島県","福島市","","","⑪ 百貨店、総合スーパー","ドラッグストア","","","","","","","","","","","","","","","届出","",""
"007000","fBiz00000150970000000286","福島県","福島市","","","⑪ 百貨店、総合スーパー","","","","","","","","","","","","","","","","届出","",""
"007000","fBiz00000150970000000287","福島県","福島市","","","⑪ 百貨店、総合スーパー","ドラッグストア","","","","","","","","","","","","","","","届出","",""
"007000","fBiz00000150970000000288","福島県","福島市","","","⑪ 百貨店、総合スーパー","ドラッグストア","","","","","","","","","","","","","","","届出","",""
"007000","fBiz00000150970000000289","福島県","福島市","","","⑪ 百貨店、総合スーパー","ドラッグストア","","","","","","","","","","","","","","","届出","",""
"007000","fBiz00000150970000000292","福島県","福島市","","","⑪ 百貨店、総合スーパー","ドラッグストア","","","","","","","","","","","","","","","届出","",""
"007000","fBiz00000150970000000293","福島県","福島市","","","⑪ 百貨店、総合スーパー","ドラッグストア","","","","","","","","","","","","","","","届出","",""
"007000","fBiz00000150970000000295","福島県","福島市","","","⑪ 百貨店、総合スーパー","","","","","","","","","","","","","","","","届出","",""
"007000","fBiz00000150970000000296","福島県","福島市","","","⑪ 百貨店、総合スーパー","ドラッグストア","","","","","","","","","","","","","","","届出","",""
"007000","fBiz00000150970000000297","福島県","福島市","","","⑪ 百貨店、総合スーパー","ドラッグストア","","","","","","","","","","","","","","","届出","",""
"007000","fBiz00000150970000000298","福島県","福島市","","","⑪ 百貨店、総合スーパー","ドラッグストア","","","","","","","","","","","","","","","届出","",""
"007000","fBiz00000150970000000299","福島県","福島市","","","⑪ 百貨店、総合スーパー","ドラッグストア","","","","","","","","","","","","","","","届出","",""
"007000","fBiz00000150970000000300","福島県","福島市","","","⑪ 百貨店、総合スーパー","ドラッグストア","","","","","","","","","","","","","","","届出","",""
"007000","fBiz00000150970000000301","福島県","福島市","","","⑪ 百貨店、総合スーパー","","","","","","","","","","","","","","","","届出","",""
"007000","fBiz00000150970000000320","福島県","福島市","","","⑪ 百貨店、総合スーパー","","","","","","","","","","","","","","","","届出","",""
"007000","fBiz00000150970000000321","福島県","福島市","","","⑪ 百貨店、総合スーパー","ドラッグストア","","","","","","","","","","","","","","","届出","",""
"007000","fBiz00000153630000000192","福島県","福島市","会津古川町営業所","アイヅフルカワマチエイギョウショ","㉖ 集団給食施設","集団給食施設(デイサービス)","福島県会津若松市古川町１０番８号","",37.477581,139.931190,"0242-36-5123","株式会社ツクイ","1020001136162","神奈川県横浜市港南区上大岡西1丁目6番1号","","","","","","","届出","",""
"007000","fBiz00000153630000000197","福島県","福島市","会津営業所","アイヅエイギョウショ","㉖ 集団給食施設","集団給食施設(デイサービス)","福島県会津若松市中央１－５－３０","",37.500565,139.930566,"0242-39-6210","株式会社ツクイ","1020001136162","神奈川県横浜市港南区上大岡西1丁目6番1号","","","","","","","届出","",""
"007000","fBiz00000153630000000511","福島県","福島市","須賀川営業所","スカガワエイギョウショ","㉖ 集団給食施設","集団給食施設(デイサービス)","福島県須賀川市塚田８９","",37.298892,140.372985,"0248-63-7709","株式会社ツクイ","1020001136162","神奈川県横浜市港南区上大岡西1丁目6番1号","","","","","","","届出","",""
"007000","fBiz00000153630000000535","福島県","福島市","会津金川町営業所","アイヅカナガワマチエイギョウショ","㉖ 集団給食施設","集団給食施設(デイサービス)","福島県会津若松市金川町９－２","",37.502820,139.920026,"0242-37-0323","株式会社ツクイ","1020001136162","神奈川県横浜市港南区上大岡西1丁目6番1号","","","","","","","届出","",""
"007000","fBiz00000153630000000574","福島県","福島市","南相馬国見営業所","ミナミソウマクニミエイギョウショ","㉖ 集団給食施設","","福島県南相馬市原町区国見町３丁目１８－２６","",37.623970,140.947106,"0244-25-3580","株式会社ツクイ","1020001136162","神奈川県横浜市港南区上大岡西1丁目6番1号","","","","","","","届出","",""
"007000","fBiz00000153630000000587","福島県","福島市","白河営業所","シラカワエイギョウショ","㉖ 集団給食施設","集団給食施設(デイサービス)","福島県白河市中田１８７","",37.121224,140.230197,"0248-21-1901","株式会社ツクイ","1020001136162","神奈川県横浜市港南区上大岡西1丁目6番1号","","","","","","","届出","",""
"007000","fBiz00000158170000000034","福島県","福島市","かっぱ寿司　相馬店","カッパズシ　ソウマテン","⑬ その他の食料・飲料販売業","","福島県相馬市馬場野字雨田","129",37.788558,140.930878,"0244-35-6221","カッパ・クリエイト株式会社","7030001001979","神奈川県横浜市西区みなとみらい2-2-1ランドマークタワー12階","","","","","","","届出","",""
"007000","fBiz00000158170000000070","福島県","福島市","かっぱ寿司　会津若松南店","カッパズシ　アイヅワカマツミナミテン","⑬ その他の食料・飲料販売業","","福島県会津若松市西年貢1丁目4-4","",37.478625,139.922661,"0242-38-3538","カッパ・クリエイト株式会社","7030001001979","神奈川県横浜市西区みなとみらい2-2-1ランドマークタワー12階","","","","","","","届出","",""
"007000","fBiz00000158170000000100","福島県","福島市","かっぱ寿司船引店","カッパズシフネヒキテン","⑬ その他の食料・飲料販売業","","福島県田村市船引町船引字小沢川代63","",37.435279,140.592421,"0247-81-1530","カッパ・クリエイト株式会社","7030001001979","神奈川県横浜市西区みなとみらい2-2-1ランドマークタワー12階","","","","","","","届出","",""
"007000","fBiz00000158170000000218","福島県","福島市","かっぱ寿司　白河店","カッパズシ　シラカワテン","⑬ その他の食料・飲料販売業","","福島県白河市老久保123-1","",37.114731,140.198976,"0248-21-0588","カッパ・クリエイト株式会社","7030001001979","神奈川県横浜市西区みなとみらい2-2-1ランドマークタワー12階","","","","","","","届出","",""
"007000","fBiz00000158170000000278","福島県","福島市","かっぱ寿司会津若松店","カッパズシアイヅワカマツテン","⑬ その他の食料・飲料販売業","","福島県会津若松市平安町1-12","",37.501136,139.942344,"0242-37-1278","カッパ・クリエイト株式会社","7030001001979","神奈川県横浜市西区みなとみらい2-2-1ランドマークタワー12階","","","","","","","届出","",""
"007000","fBiz00000168050000000001","福島県","福島市","時任養蜂園","トキトウヨウホウエン","㉔ その他の食料品製造・加工業","","","","","","","","","","","","","","","","届出","",""
"007000","fBiz00000168620000000040","福島県","福島市","ホテル光雲閣","ホテルコウウンカク","⑫ 自動販売機による販売業（コップ式自動販売機（自動洗浄・屋内設置）及び営業許可の対象となる自動販売機を除く）","","福島県二本松市岳温泉1-85","",37.607958,140.352482,"0243-24-2101","ハーゲンダッツジャパン株式会社","1010401023721","東京都目黒区上目黒２丁目１番１号","","","","","","","届出","",""
"007000","fBiz00000168620000000249","福島県","福島市","会津東山温泉　庄助の宿　瀧の湯","アイヅヒガシヤマオンセンショウスケノヤドタキノユ","⑫ 自動販売機による販売業（コップ式自動販売機（自動洗浄・屋内設置）及び営業許可の対象となる自動販売機を除く）","","福島県会津若松市東山町湯本滝の湯108","",37.479831,139.960146,"0242-29-1000","ハーゲンダッツジャパン株式会社","1010401023721","東京都目黒区上目黒２丁目１番１号","","","","","","","届出","",""
"007000","fBiz00000168620000000250","福島県","福島市","大川荘","オオカワソウ","⑫ 自動販売機による販売業（コップ式自動販売機（自動洗浄・屋内設置）及び営業許可の対象となる自動販売機を除く）","","福島県会津若松市大戸町芦牧字下平984","",37.359799,139.890571,"0242-92-2111","ハーゲンダッツジャパン株式会社","1010401023721","東京都目黒区上目黒２丁目１番１号","","","","","","","届出","",""
"007000","fBiz00000168620000000251","福島県","福島市","大江戸温泉物語東山グランドホテル","オオエドオンセンモノガタリヒガシヤマグランドホテル","⑫ 自動販売機による販売業（コップ式自動販売機（自動洗浄・屋内設置）及び営業許可の対象となる自動販売機を除く）","","福島県会津若松市東山町湯本字上湯本5番地","",37.467923,139.962645,"0242-27-3500","ハーゲンダッツジャパン株式会社","1010401023721","東京都目黒区上目黒２丁目１番１号","","","","","","","届出","",""
"007000","fBiz00000168620000000253","福島県","福島市","芦ノ牧グランドホテル","アシノマキグランドホテル","⑫ 自動販売機による販売業（コップ式自動販売機（自動洗浄・屋内設置）及び営業許可の対象となる自動販売機を除く）","","福島県会津若松市大戸町芦牧1044","",37.367340,139.912748,"0242-92-2221","ハーゲンダッツジャパン株式会社","1010401023721","東京都目黒区上目黒２丁目１番１号","","","","","","","届出","",""
