"007000","fBiz00000825330000000041","福島県","福島市","Yショップ二本松病院店","ワイショップニホンマツビョウインテン","⑩ コンビニエンスストア","","福島県二本松市成田町1丁目553","",37.590413,140.422175,"0243-232-7116","ワタキューセイモア株式会社","7130001037872","京都府綴喜郡井手町大字多賀小字茶臼塚12-2","","","","","","","届出","",""
"007000","fBiz00000825330000000042","福島県","福島市","Yショップ小野町綜合病院店","ワイショップオノマチソウゴウビョウインテン","⑩ コンビニエンスストア","","福島県田村郡小野町小野新町槻木内６－２","",37.289698,140.626849,"0247-72-5153","ワタキューセイモア株式会社","7130001037872","京都府綴喜郡井手町大字多賀小字茶臼塚12-2","","","","","","","届出","",""
"007000","fBiz00000825330000000043","福島県","福島市","Yショップひらた中央病院店","ワイショップヒラタチュウオウビョウインテン","⑩ コンビニエンスストア","","福島県石川郡平田村上蓬田字清水内４","",37.244540,140.567998,"0247-57-6765","ワタキューセイモア株式会社","7130001037872","京都府綴喜郡井手町大字多賀小字茶臼塚12-2","","","","","","","届出","",""
"007000","fBiz00000825330000000059","福島県","福島市","Yショップ坂下厚生総合病院店","ワイショップバンゲコウセイイソウゴウビョウインテン","⑤ コップ式自動販売機（自動洗浄・屋内設置）","","福島県河沼郡会津坂下町字上柳田２２１０－１","",37.564620,139.808602,"0243-232-7116","ワタキューセイモア株式会社","7130001037872","京都府綴喜郡井手町大字多賀小字茶臼塚12-2","","","","","","","届出","",""
"007000","fBiz00000825330000000059","福島県","福島市","Yショップ坂下厚生総合病院店","ワイショップバンゲコウセイイソウゴウビョウインテン","⑩ コンビニエンスストア","","福島県河沼郡会津坂下町字上柳田２２１０－１","",37.564620,139.808602,"0243-232-7116","ワタキューセイモア株式会社","7130001037872","京都府綴喜郡井手町大字多賀小字茶臼塚12-2","","","","","","","届出","",""
"007000","fBiz00000831200000000003","福島県","福島市","業務スーパー白河店","ギョウムスーパーシラカワテン","⑦ 野菜果物販売業","","福島県白河市東小丸山68-2","",37.111494,140.206176,"0248211214","有限会社マルキ","3380002013827","福島県郡山市南2丁目184","","","","","","","届出","",""
"007000","fBiz00000842980000000236","福島県","福島市","株式会社西友　保原店","カブシキガイシャセイユウ　ホバラテン","⑪ 百貨店、総合スーパー","","福島県伊達市保原町９丁目５","",37.823030,140.554470,"024-575-4111","株式会社西友","8011503002037","東京都北区赤羽二丁目１番１号","","","","","","","届出","",""
"007000","fBiz00000848110000000001","福島県","福島市","ウエルシア伊達新梁川店","ウエルシアダテシンヤナガワテン","⑪ 百貨店、総合スーパー","ドラッグストア","福島県伊達市梁川町広瀬町43","",37.848790,140.602704,"0245775532","ウエルシア薬局株式会社","3030001002411","東京都千代田区外神田2-2-15","","","","","","","届出","",""
"007000","fBiz00000856430000000001","福島県","福島市","ウエルシア喜多方常盤台店","ウエルシアキタカタトキワダイテン","⑪ 百貨店、総合スーパー","ドラッグストア","福島県喜多方市常盤台46番1","",37.667672,139.871855,"0241211050","ウエルシア薬局株式会社","3030001002411","東京都千代田区外神田2-2-15","","","","","","","届出","",""
"007000","fBiz00000860390000000001","福島県","福島市","ウエルシア西白河西郷店","ウエルシアニシシアラカワニシゴウテン","⑪ 百貨店、総合スーパー","ドラッグストア","福島県西白河郡西郷村米８４番地10","",37.136017,140.180678,"0248212564","ウエルシア薬局株式会社","3030001002411","東京都千代田区外神田2-2-15","","","","","","","届出","",""
"007000","fBiz00000860390000000001","福島県","福島市","ウエルシア西白河西郷店","ウエルシアニシシアラカワニシゴウテン","⑫ 自動販売機による販売業（コップ式自動販売機（自動洗浄・屋内設置）及び営業許可の対象となる自動販売機を除く）","ドラッグストア","福島県西白河郡西郷村米８４番地10","",37.136017,140.180678,"0248212564","ウエルシア薬局株式会社","3030001002411","東京都千代田区外神田2-2-15","","","","","","","届出","",""
"007000","fBiz00000863340000000014","福島県","福島市","ビックつばめ白河店","ビックツバメシラカワテン","⑤ コップ式自動販売機（自動洗浄・屋内設置）","","福島県西白河郡西郷村小田倉字向原93","",37.116022,140.184979,"0248-21-7603","","","","","","","","","","届出","",""
"007000","fBiz00000869550000000001","福島県","福島市","有限会社鈴木多一商店","ユウゲンガイシャスズキタイチショウテン","⑧ 米穀類販売業","","福島県白河市旭町２－２５","",37.120574,140.225586,"0248241413","有限会社鈴木多一商店","8380002017988","福島県白河市旭町2-25","","","","","","","届出","",""
"007000","fBiz00000869550000000002","福島県","福島市","有限会社鈴木多一商店","ユウゲンガイシャスズキタイチショウテン","⑧ 米穀類販売業","","福島県白河市関辺谷中６０－１","",37.080599,140.269858,"09034696956","有限会社鈴木多一商店","8380002017988","福島県白河市旭町2-25","","","","","","","届出","",""
"007000","fBiz00000876550000000001","福島県","福島市","ウエルシア伊達保原北店","ウエルシアダテホバラキタテン","⑪ 百貨店、総合スーパー","ドラッグストア","福島県伊達市保原町大和107番地1","",37.830528,140.561393,"0245743011","ウエルシア薬局株式会社","3030001002411","東京都千代田区外神田2-2-15","","","","","","","届出","",""
"007000","fBiz00000876550000000001","福島県","福島市","ウエルシア伊達保原北店","ウエルシアダテホバラキタテン","⑫ 自動販売機による販売業（コップ式自動販売機（自動洗浄・屋内設置）及び営業許可の対象となる自動販売機を除く）","ドラッグストア","福島県伊達市保原町大和107番地1","",37.830528,140.561393,"0245743011","ウエルシア薬局株式会社","3030001002411","東京都千代田区外神田2-2-15","","","","","","","届出","",""
"007000","fBiz00000891580000000001","福島県","福島市","","","㉓ 卵選別包装業","卵選別包装業","","","","","","","","","","","","","","","届出","",""
"007000","fBiz00000891580000000002","福島県","福島市","","","⑫ 自動販売機による販売業（コップ式自動販売機（自動洗浄・屋内設置）及び営業許可の対象となる自動販売機を除く）","","","","","","","","","","","","","","","","届出","",""
"007000","fBiz00000896150000000001","福島県","福島市","ウエルシア会津美里店","ウエルシアアイヅミサトテン","⑪ 百貨店、総合スーパー","ドラッグストア","福島県大沼郡会津美里町思堀25番地","",37.457319,139.894983,"0242571101","ウエルシア薬局株式会社","3030001002411","東京都千代田区外神田2-2-15","","","","","","","届出","",""
"007000","fBiz00000898440000000001","福島県","福島市","","","⑯ コーヒー製造・加工業（飲料の製造を除く。）","","","","","","","","","","","","","","","","届出","",""
"007000","fBiz00000898880000000001","福島県","福島市","ウエルシア伊達保原店","ウエルシアダテホバラテン","⑪ 百貨店、総合スーパー","ドラッグストア","福島県伊達市保原町前田町27-2","",37.814355,140.551548,"0245742877","ウエルシア薬局株式会社","3030001002411","東京都千代田区外神田2-2-15","","","","","","","届出","",""
"007000","fBiz00000903180000000002","福島県","福島市","","","㉗ 器具、容器包装の製造・加工業（合成樹脂が使用された器具又は容器包装の製造、加工に限る。）","","","","","","","","","","","","","","","","届出","",""
"007000","fBiz00000907380000000001","福島県","福島市","ウエルシア田村船引店","ウエルシアタムラフネヒキテン","⑪ 百貨店、総合スーパー","ドラッグストア","福島県田村市船引町船引字宮ノ前81","",37.440353,140.557601,"0247-81-1074","ウエルシア薬局株式会社","3030001002411","東京都千代田区外神田2-2-15","","","","","","","届出","",""
"007000","fBiz00000915800000000012","福島県","福島市","昭産商事株式会社 福島支店","ショウサンショウジカブシキカイシャ フクシマシテン","⑬ その他の食料・飲料販売業","","福島県本宮市荒井青田原209番11","",37.491335,140.380650,"0243-36-1161","昭産商事株式会社","4011401003108","東京都板橋区板橋1丁目9-3","","","","","","","届出","",""
"007000","fBiz00000916030000000043","福島県","福島市","ココス　会津若松店","ココス　アイズワカマツテン","⑬ その他の食料・飲料販売業","","福島県会津若松市平安町2－46","",37.501736,139.942258,"050-3333-8431","株式会社ココスジャパン","9010401054189","東京都港区港南２丁目１８番１号","","","","","","","届出","",""
"007000","fBiz00000916030000000056","福島県","福島市","ココス原町店","ココスハラマチテン","⑬ その他の食料・飲料販売業","","福島県南相馬市原町区錦町2丁目58－1","",37.641365,140.971080,"050-3333-0599","株式会社ココスジャパン","9010401054189","東京都港区港南２丁目１８番１号","","","","","","","届出","",""
"007000","fBiz00000916030000000084","福島県","福島市","ココス相馬店","ココスソウマテン","⑬ その他の食料・飲料販売業","","福島県相馬市塚ノ町１丁目１４－１","",37.802703,140.928151,"050-3333-3699","株式会社ココスジャパン","9010401054189","東京都港区港南２丁目１８番１号","","","","","","","届出","",""
"007000","fBiz00000916030000000377","福島県","福島市","ココス会津若松門田店","ココス　アイヅワカマツモンデンテン","⑬ その他の食料・飲料販売業","","福島県会津若松市飯寺北3-10-18","",37.479245,139.903295,"050-3333-4526","株式会社ココスジャパン","9010401054189","東京都港区港南２丁目１８番１号","","","","","","","届出","",""
"007000","fBiz00000916030000000379","福島県","福島市","レストランココス須賀川店","レストランココススカガワテン","⑬ その他の食料・飲料販売業","","福島県須賀川市高久田境77-1","メガステージ須賀川ＳＣ",37.273849,140.367661,"050-3529-1757","株式会社ココスジャパン","9010401054189","東京都港区港南２丁目１８番１号","","","","","","","届出","",""
"007000","fBiz00000946340000000001","福島県","福島市","ウエルシア二本松安達店","ウエルシアニホンマツアダチテン","⑪ 百貨店、総合スーパー","ドラッグストア","福島県二本松市油井字濡石27-1","",37.608442,140.461604,"0243-62-8861","ウエルシア薬局株式会社","3030001002411","東京都千代田区外神田2-2-15","","","","","","","届出","",""
"007000","fBiz00000952770000000002","福島県","福島市","東都化工株式会社","トウトカコウカブシキカイシャ","㉗ 器具、容器包装の製造・加工業（合成樹脂が使用された器具又は容器包装の製造、加工に限る。）","","福島県白河市田島里ノ前43番1","",37.115168,140.292505,"0248391011","東都化工株式会社","8380001010837","福島県白河市田島里ノ前４３番地１","","","","","","","届出","",""
"007000","fBiz00000972740000000002","福島県","福島市","","","⑧ 米穀類販売業","","","","","","","","","","","","","","","","届出","",""
"007000","fBiz00000974700000000046","福島県","福島市","ニューデイズ相馬","ニューデイズソウマ","⑩ コンビニエンスストア","","福島県相馬市中村字曲田1","",37.803645,140.925171,"0244-35-5465","株式会社ＪＲ東日本クロスステーション","3011101042662","東京都渋谷区千駄ヶ谷５丁目３３番８号","","","","","","","届出","",""
"007000","fBiz00000974700000000047","福島県","福島市","ニューデイズ原町","ニューデイズハラマチ","⑩ コンビニエンスストア","","福島県南相馬市原町区旭町2丁目27-2","",37.637673,140.971161,"0244-23-1206","株式会社ＪＲ東日本クロスステーション","3011101042662","東京都渋谷区千駄ヶ谷５丁目３３番８号","","","","","","","届出","",""
"007000","fBiz00000974700000000056","福島県","福島市","ニューデイズキオスク会津若松駅改札外","ニューデイズキオスクアイヅワカマツエキカイサツガイ","⑩ コンビニエンスストア","","福島県会津若松市駅前町1-1","",37.511894,139.929470,"0242-22-1241","株式会社ＪＲ東日本クロスステーション","3011101042662","東京都渋谷区千駄ヶ谷５丁目３３番８号","","","","","","","届出","",""
"007000","fBiz00000974700000000057","福島県","福島市","ニューデイズミニ新白河1号","ニューデイズミニシンシラカワイチゴウ","⑩ コンビニエンスストア","","福島県西白河郡西郷村小田倉字道南114","",37.123051,140.188549,"0248-31-2777","株式会社ＪＲ東日本クロスステーション","3011101042662","東京都渋谷区千駄ヶ谷５丁目３３番８号","","","","","","","届出","",""
"007000","fBiz00000974700000000062","福島県","福島市","ニューデイズ会津若松","ニューデイズアイヅワカマツ","⑩ コンビニエンスストア","","福島県会津若松市駅前町1-1","",37.511894,139.929470,"0242-37-2405","株式会社ＪＲ東日本クロスステーション","3011101042662","東京都渋谷区千駄ヶ谷５丁目３３番８号","","","","","","","届出","",""
"007000","fBiz00000974700000000064","福島県","福島市","ニューデイズ須賀川","ニューデイズスカガワ","⑩ コンビニエンスストア","","福島県須賀川市中山63","",37.300319,140.372054,"0248-72-4585","株式会社ＪＲ東日本クロスステーション","3011101042662","東京都渋谷区千駄ヶ谷５丁目３３番８号","","","","","","","届出","",""
"007000","fBiz00000979340000000001","福島県","福島市","ウエルシア伊達掛田店","ウエルシアダテカケダテン","⑪ 百貨店、総合スーパー","ドラッグストア","福島県伊達市霊山町掛田33-1","",37.784758,140.588433,"024-564-2873","ウエルシア薬局株式会社","3030001002411","東京都千代田区外神田2-2-15","","","","","","","届出","",""
"007000","fBiz00001001410000000017","福島県","福島市","ホームセンターカンセキ会津若松店","ホームセンターカンセキアイヅワカマツテン","⑧ 米穀類販売業","ホームセンター","福島県会津若松市門田町黒岩字南青木　98-1","",37.476400,139.934959,"0242293755","株式会社カンセキ","8060001001208","栃木県宇都宮市西川田本町3-1-1","","","","","","","届出","",""
"007000","fBiz00001001410000000017","福島県","福島市","ホームセンターカンセキ会津若松店","ホームセンターカンセキアイヅワカマツテン","⑬ その他の食料・飲料販売業","ホームセンター","福島県会津若松市門田町黒岩字南青木　98-1","",37.476400,139.934959,"0242293755","株式会社カンセキ","8060001001208","栃木県宇都宮市西川田本町3-1-1","","","","","","","届出","",""
"007000","fBiz00001001510000000001","福島県","福島市","ラバーズコーヒー","ラバーズコーヒー","⑯ コーヒー製造・加工業（飲料の製造を除く。）","","福島県会津若松市東栄町１ー６０","幸和ビル１階",37.492670,139.929523,"0242935265","合同会社穂積","2380003004495","福島県会津若松市東栄町１番６０号","","","","","","","届出","",""
"007000","fBiz00001009780000000002","福島県","福島市","ウエルシア会津坂下東店","ウエルシアアイズバンゲヒガシテン","⑪ 百貨店、総合スーパー","ドラッグストア","福島県河沼郡会津坂下町小川原945","",37.557284,139.829261,"0242837866","ウエルシア薬局株式会社","3030001005411","東京都千代田区外神田2-2-15","","","","","","","届出","",""
"007000","fBiz00001010320000000001","福島県","福島市","株式会社二本松農園","カブシキガイシャニホンマツノウエン","⑦ 野菜果物販売業","直販","福島県二本松市新生町490","",37.556315,140.470179,"0243241001","株式会社二本松農園","5380001024682","福島県二本松市新生町490","","","","","","","届出","",""
"007000","fBiz00001010320000000001","福島県","福島市","株式会社二本松農園","カブシキガイシャニホンマツノウエン","⑧ 米穀類販売業","直販","福島県二本松市新生町490","",37.556315,140.470179,"0243241001","株式会社二本松農園","5380001024682","福島県二本松市新生町490","","","","","","","届出","",""
"007000","fBiz00001010320000000001","福島県","福島市","株式会社二本松農園","カブシキガイシャニホンマツノウエン","⑨ 通信販売・訪問販売による販売業","直販","福島県二本松市新生町490","",37.556315,140.470179,"0243241001","株式会社二本松農園","5380001024682","福島県二本松市新生町490","","","","","","","届出","",""
"007000","fBiz00001010320000000001","福島県","福島市","株式会社二本松農園","カブシキガイシャニホンマツノウエン","⑬ その他の食料・飲料販売業","直販","福島県二本松市新生町490","",37.556315,140.470179,"0243241001","株式会社二本松農園","5380001024682","福島県二本松市新生町490","","","","","","","届出","",""
"007000","fBiz00001011860000000001","福島県","福島市","ウエルシア西会津店","ウエルシアニシアイヅテン","⑪ 百貨店、総合スーパー","ドラッグストア","福島県耶麻郡西会津町野沢字原町611","",37.583545,139.643987,"","ウエルシア薬局株式会社","3030001002411","東京都千代田区外神田2-2-15","","","","","","","届出","",""
"007000","fBiz00001017090000000001","福島県","福島市","有限会社　中央商事","ユウゲンガイシャ　チュウオウショウジ","⑧ 米穀類販売業","","福島県西白河郡矢吹町沢尻105-2","",37.194919,140.377643,"0248-45-2306","有限会社 中央商事","2380002018141","福島県西白河郡矢吹町沢尻105-2","","","","","","","届出","",""
"007000","fBiz00001031330000000002","福島県","福島市","ウエルシア伊達桑折店","ウエルシアダテコオリテン","⑪ 百貨店、総合スーパー","ドラッグストア","福島県伊達郡桑折町北町50番地の1","",37.849095,140.517669,"024-581-2136","ウエルシア薬局株式会社","3030001002411","東京都千代田区外神田22-15","","","","","","","届出","",""
"007000","fBiz00001032090000000001","福島県","福島市","ウエルシア伊達国見店","ウエルシアダテクニミテン","⑪ 百貨店、総合スーパー","ドラッグストア","福島県伊達郡国見町大字藤田字中沢一10番地1","",37.872752,140.542279,"024-529-2105","ウエルシア薬局株式会社","3030001002411","東京都千代田区外神田2-2-15","","","","","","","届出","",""
"007000","fBiz00001032090000000001","福島県","福島市","ウエルシア伊達国見店","ウエルシアダテクニミテン","⑫ 自動販売機による販売業（コップ式自動販売機（自動洗浄・屋内設置）及び営業許可の対象となる自動販売機を除く）","ドラッグストア","福島県伊達郡国見町大字藤田字中沢一10番地1","",37.872752,140.542279,"024-529-2105","ウエルシア薬局株式会社","3030001002411","東京都千代田区外神田2-2-15","","","","","","","届出","",""
"007000","fBiz00001035210000000001","福島県","福島市","ウエルシア会津坂下店","ウエルシアアイズバンゲテン","⑪ 百貨店、総合スーパー","ドラッグストア","福島県河沼郡会津坂下町字古町川尻386番地1","",37.563203,139.823321,"0242841330","ウエルシア薬局株式会社","3030001002411","東京都千代田区外神田2-2-15","","","","","","","届出","",""
"007000","fBiz00001057260000000001","福島県","福島市","ウエルシア西白河中島店","ウエルシアニシシラカワナカジマテン","⑪ 百貨店、総合スーパー","ドラッグストア","福島県西白河郡中島村二子塚字浦山32-16","",37.144213,140.348800,"0248-51-1501","ウエルシア薬局株式会社","3030001002411","東京都千代田区外神田2-2-15","","","","","","","届出","",""
"007000","fBiz00001057260000000001","福島県","福島市","ウエルシア西白河中島店","ウエルシアニシシラカワナカジマテン","⑫ 自動販売機による販売業（コップ式自動販売機（自動洗浄・屋内設置）及び営業許可の対象となる自動販売機を除く）","ドラッグストア","福島県西白河郡中島村二子塚字浦山32-16","",37.144213,140.348800,"0248-51-1501","ウエルシア薬局株式会社","3030001002411","東京都千代田区外神田2-2-15","","","","","","","届出","",""
"007000","fBiz00001061450000000002","福島県","福島市","JA全農福島精米工場","ジェイエイゼンノウフクシマセイマイコウジョウ","⑧ 米穀類販売業","米穀製造卸販売","福島県須賀川市森宿字御膳田117","",37.312203,140.368508,"0248-75-3330","JAパールライン福島株式会社","1380001001413","福島県須賀川市森宿字御膳田117","","","","","","","届出","",""
"007000","fBiz00001061450000000002","福島県","福島市","JA全農福島精米工場","ジェイエイゼンノウフクシマセイマイコウジョウ","⑳ 精穀・製粉業","米穀製造卸販売","福島県須賀川市森宿字御膳田117","",37.312203,140.368508,"0248-75-3330","JAパールライン福島株式会社","1380001001413","福島県須賀川市森宿字御膳田117","","","","","","","届出","",""
"007000","fBiz00001064890000000034","福島県","福島市","幸楽苑棚倉店","コウラクエンタナクラテン","⑬ その他の食料・飲料販売業","","福島県東白川郡棚倉町棚倉字宮前12","",37.026069,140.379002,"0247-57-6640","株式会社幸楽苑","4380001025558","福島県郡山市田村町金屋字川久保１番地１","","","","","","","届出","",""
"007000","fBiz00001064890000000064","福島県","福島市","幸楽苑　相馬店","コウラクエン　ソウマテン","⑬ その他の食料・飲料販売業","","福島県相馬市塚ノ町2丁目1－1","",37.800102,140.928944,"0244367234","株式会社幸楽苑","4380001025558","福島県郡山市田村町金屋字川久保１番地１","","","","","","","届出","",""
"007000","fBiz00001064890000000078","福島県","福島市","幸楽苑　矢吹店","コウラクエン　ヤブキテン","⑬ その他の食料・飲料販売業","飲食店営業","福島県西白河郡矢吹町本町299","",37.206746,140.323602,"0248425247","株式会社幸楽苑","4380001025558","福島県郡山市田村町金屋字川久保１番地１","","","","","","","届出","",""
"007000","fBiz00001064890000000108","福島県","福島市","幸楽苑　高田橋店","コウラクエン　タカダバシテン","⑬ その他の食料・飲料販売業","飲食店営業","福島県会津若松市門田町大字飯寺字村西392","",37.476963,139.904876,"0242284818","株式会社幸楽苑","4380001025558","福島県郡山市田村町金屋字川久保１番地１","","","","","","","届出","",""
"007000","fBiz00001064890000000112","福島県","福島市","幸楽苑門田店","コウラクエン　モンデンテン","⑬ その他の食料・飲料販売業","飲食店営業","福島県会津若松市門田町日吉小金井34","",37.479162,139.919431,"0242-28-5506","株式会社幸楽苑","4380001025558","福島県郡山市田村町金屋字川久保１番地１","","","","","","","届出","",""
"007000","fBiz00001064890000000120","福島県","福島市","幸楽苑イオンタウン須賀川店","コウラクエンイオンタウンスカガワテン","⑬ その他の食料・飲料販売業","飲食店営業","福島県須賀川市仲の町75-１　イオンタウン須賀川","",37.297203,140.382970,"0248-63-7828","株式会社幸楽苑","4380001025558","福島県郡山市田村町金屋字川久保１番地１","","","","","","","届出","",""
"007000","fBiz00001064890000000146","福島県","福島市","幸楽苑　一箕町店","コウラクエン　イッキマチテン","⑬ その他の食料・飲料販売業","飲食店営業","福島県会津若松市一箕町大字亀賀字川西149-1","",37.517687,139.934182,"0242-39-7377","株式会社幸楽苑","4380001025558","福島県郡山市田村町金屋字川久保１番地１","","","","","","","届出","",""
