"009201","fBiz00001307530000000001","栃木県","宇都宮市","松庵","ショウアン","① 飲食店営業","そば居酒屋","栃木県宇都宮市池上町２－８","",36.561084,139.882858,"","(株)松之家","9060001022054","栃木県宇都宮市江野町９－１　ＮＩＮＥＳＴＡＲＳビル３F","A080740",2021/11/02,2021/11/02,2021/11/02,2028/01/31,"","許可","　",""
"009201","fBiz00001307530000000002","栃木県","宇都宮市","まんてん　宇都宮店","マンテン　ウツノミヤテン","① 飲食店営業","飲食店","栃木県宇都宮市池上町１－１１　石田ビル１F","",36.561069,139.883219,"","(株)松之家","9060001022054","栃木県宇都宮市江野町９－１　ＮＩＮＥＳＴＡＲＳビル３F","A081092",2022/01/14,2022/01/14,2022/01/14,2028/01/31,"","許可","　",""
"009201","fBiz00001307720000000001","栃木県","宇都宮市","焼鳥　さんぽ","ヤキトリ　サンポ","① 飲食店営業","居酒屋","栃木県宇都宮市江野町１０－１","",36.560070,139.883173,"028-666-5150","(株)ディグワークス","7060001025810","栃木県宇都宮市屋板町５６９－２９","A080741",2021/11/02,2021/11/02,2021/11/02,2028/01/31,"","許可","　",""
"009201","fBiz00001307920000000001","栃木県","宇都宮市","Ａｇａｉｎ","アゲイン","① 飲食店営業","バー","栃木県宇都宮市宿郷１丁目１３番３号","ロイヤルＶビル５階Ｑ号室",36.556545,139.901251,"","池田和樹","","栃木県宇都宮市富士見が丘４丁目８番１号","A080742",2021/11/02,2021/11/02,2021/11/02,2027/11/30,"","許可","　",""
"009201","fBiz00001308170000000001","栃木県","宇都宮市","炙りや　八兵衛","アブリヤ　ハチベエ","① 飲食店営業","やきとり屋","栃木県宇都宮市東宿郷２丁目１７番地１０号","Ｖ－６",36.556267,139.902608,"028-639-6395","臼井亮一","","栃木県下野市文教１丁目２０－１２","A080830",2021/11/18,2021/11/18,2021/11/18,2027/11/30,"","許可","　",""
"009201","fBiz00001309400000000002","栃木県","宇都宮市","ジェイ・バス（株）ユーイングハウス金井台","ジェイ・バス　ユーイングハウスカナイダイ","① 飲食店営業","社員食堂","栃木県宇都宮市下岡本町４５２７－８","",36.600071,139.931293,"028-673-7604","弁辰イーシーエヌ株式会社","7060001001456","栃木県宇都宮市平出町３６１４番地２","A081834",2022/05/26,2022/05/26,2022/05/26,2028/05/31,"","許可","　",""
"009201","fBiz00001312950000000001","栃木県","宇都宮市","ウエルシア宇都宮西川田店","ウエルシアウツノミヤニシカワタテン","⑪ 百貨店、総合スーパー","ドラッグストア","栃木県宇都宮市西川田町913番地1","",36.523863,139.851567,"028-615-0030","ウエルシア薬局株式会社","3030001002411","東京都千代田区外神田2-2-15","","","","","","","届出","",""
"009201","fBiz00001316270000000001","栃木県","宇都宮市","郷間　健一","ゴウマ　ケンイチ","⑧ 米穀類販売業","","","","","","","郷間健一","","","","","","","","","届出","",""
"009201","fBiz00001317930000000001","栃木県","宇都宮市","セブンイレブン宇都宮兵庫塚店","セブンイレブンウツノミヤヒョウゴヅカテン","① 飲食店営業","コンビニ","栃木県宇都宮市兵庫塚１丁目１３－１","",36.504382,139.855921,"","（株）セブン－イレブン・ジャパン","1010001088181","東京都千代田区二番町８番地８","A080739",2021/11/02,2021/11/02,2021/11/02,2028/03/31,"","許可","　",""
"009201","fBiz00001317930000000001","栃木県","宇都宮市","セブンイレブン宇都宮兵庫塚店","セブンイレブンウツノミヤヒョウゴヅカテン","⑩ コンビニエンスストア","コンビニ","栃木県宇都宮市兵庫塚１丁目１３－１","",36.504382,139.855921,"","（株）セブン－イレブン・ジャパン","1010001088181","東京都千代田区二番町８番地８","","","","","","","届出","",""
"009201","fBiz00001324220000000001","栃木県","宇都宮市","居酒屋ありらん（Ａ）","イザカヤアリランカッコエー","① 飲食店営業","居酒屋","栃木県宇都宮市吉野２丁目８－１８","",36.544246,139.871306,"028-636-8537","小野崎賢","","栃木県宇都宮市吉野２丁目８－１８","A080771",2021/11/08,2021/11/08,2021/11/08,2027/11/30,"","許可","　",""
"009201","fBiz00001324330000000001","栃木県","宇都宮市","セブンイレブン河内金井台店","セブンイレブンカワチカナイダイテン","① 飲食店営業","コンビニエンスストア","栃木県宇都宮市下岡本町４５５８－３","",36.600436,139.932922,"028-671-0035","（有）エヌケイチャンネル","3060002000097","栃木県宇都宮市下岡本町４５５８－３","A080764",2021/11/05,2021/11/05,2021/11/05,2027/11/30,"","許可","　",""
"009201","fBiz00001324330000000001","栃木県","宇都宮市","セブンイレブン河内金井台店","セブンイレブンカワチカナイダイテン","⑩ コンビニエンスストア","コンビニエンスストア","栃木県宇都宮市下岡本町４５５８－３","",36.600436,139.932922,"028-671-0035","（有）エヌケイチャンネル","3060002000097","栃木県宇都宮市下岡本町４５５８－３","","","","","","","届出","",""
"009201","fBiz00001324410000000001","栃木県","宇都宮市","喫茶やよい","キッサヤヨイ","① 飲食店営業","軽食，喫茶店","栃木県宇都宮市弥生２丁目１４－１３","",36.541748,139.866345,"028-634-0786","神山牧子","","栃木県宇都宮市弥生２丁目１４－１３","A080834",2021/11/18,2021/11/18,2021/11/18,2027/11/30,"","許可","　",""
"009201","fBiz00001325470000000001","栃木県","宇都宮市","横浜家系ラーメン　稲垣家","ヨコハマイエケイラーメン　イナガキヤ","① 飲食店営業","ラーメン店","栃木県宇都宮市宿郷５丁目３－１６","","","","028-689-9118","稲垣智晶","","栃木県宇都宮市御幸ケ原町１１１－２５","A080804",2021/11/10,2021/11/10,2021/11/10,2027/11/30,"","許可","　",""
"009201","fBiz00001326250000000001","栃木県","宇都宮市","焼鳥　とりはな","ヤキトリ　トリハナ","㉕ そうざい製造業","レストラン，そうざい製造","栃木県宇都宮市塙田１丁目３－１７　八幡ビル","",36.564562,139.884661,"028-621-2326","菅沼俊明","","栃木県宇都宮市不動前４丁目２－３９　朝日プラザシェモア不動前５０１","A080803",2021/11/10,2021/11/10,2021/11/10,2028/04/30,"","許可","　",""
"009201","fBiz00001327560000000001","栃木県","宇都宮市","サンユー　上河内店","サンユー　カミカワチテン","① 飲食店営業","スーパーマーケット","栃木県宇都宮市中里町２２１－１","",36.679397,139.901299,"028-674-8210","（株）サンユー","3060001001880","栃木県宇都宮市平出工業団地４１－１１","A080736",2021/11/02,2021/11/02,2021/11/02,2027/11/30,"","許可","　",""
"009201","fBiz00001327560000000001","栃木県","宇都宮市","サンユー　上河内店","サンユー　カミカワチテン","③ 食肉販売業","スーパーマーケット","栃木県宇都宮市中里町２２１－１","",36.679397,139.901299,"028-674-8210","（株）サンユー","3060001001880","栃木県宇都宮市平出工業団地４１－１１","A080737",2021/11/02,2021/11/02,2021/11/02,2027/11/30,"","許可","　",""
"009201","fBiz00001327560000000001","栃木県","宇都宮市","サンユー　上河内店","サンユー　カミカワチテン","④ 魚介類販売業","スーパーマーケット","栃木県宇都宮市中里町２２１－１","",36.679397,139.901299,"028-674-8210","（株）サンユー","3060001001880","栃木県宇都宮市平出工業団地４１－１１","A080738",2021/11/02,2021/11/02,2021/11/02,2027/11/30,"","許可","　",""
"009201","fBiz00001327560000000001","栃木県","宇都宮市","サンユー　上河内店","サンユー　カミカワチテン","⑪ 百貨店、総合スーパー","スーパーマーケット","栃木県宇都宮市中里町２２１－１","",36.679397,139.901299,"028-674-8210","（株）サンユー","3060001001880","栃木県宇都宮市平出工業団地４１－１１","","","","","","","届出","",""
"009201","fBiz00001327560000000002","栃木県","宇都宮市","（株）サンユー　岩曽店","サンユー　イワゾテン","① 飲食店営業","スーパーマーケット","栃木県宇都宮市岩曽町１３５５","",36.583101,139.912715,"028-662-0127","（株）サンユー","3060001001880","栃木県宇都宮市平出工業団地４１－１１","A082421",2022/09/15,2022/09/15,2022/09/15,2028/10/31,"","許可","　",""
"009201","fBiz00001327560000000002","栃木県","宇都宮市","（株）サンユー　岩曽店","サンユー　イワゾテン","⑪ 百貨店、総合スーパー","スーパーマーケット","栃木県宇都宮市岩曽町１３５５","",36.583101,139.912715,"","（株）サンユー","3060001001880","栃木県宇都宮市平出工業団地４１－１１","","","","","","","届出","",""
"009201","fBiz00001339960000000001","栃木県","宇都宮市","吉野家　宇都宮宮の内店","ヨシノヤ　ウツノミヤミヤノウチテン","① 飲食店営業","牛丼店","栃木県宇都宮市宮の内３丁目１７７－１","",36.505798,139.875618,"028-688-3677","（株）北日本吉野家","5011501020101","東京都中央区日本橋箱崎町３６番２号","A080806",2021/11/10,2021/11/10,2021/11/10,2028/03/31,"","許可","　",""
"009201","fBiz00001341220000000001","栃木県","宇都宮市","焼肉爛爛","ヤキニクランラン","① 飲食店営業","焼肉店","栃木県宇都宮市下荒針町３４７３－９５","",36.563538,139.838991,"028-648-1752","増田竜也","","栃木県宇都宮市下荒針町３４７３－９５","A080865",2021/11/26,2021/11/26,2021/11/26,2028/02/29,"","許可","　",""
"009201","fBiz00001342960000000001","栃木県","宇都宮市","焼肉スンチャン　駅東店","ヤキニクスンチャン　エキヒガシテン","① 飲食店営業","焼肉レストラン","栃木県宇都宮市東宿郷１丁目７－２　アジマコーポ１０２","",36.559617,139.903578,"028-611-3140","ハレルヤフーズ（株）","9013302014402","栃木県宇都宮市東宿郷１丁目７番２号","A080839",2021/11/19,2021/11/19,2021/11/19,2027/11/30,"","許可","　",""
"009201","fBiz00001342960000000001","栃木県","宇都宮市","焼肉スンチャン　駅東店","ヤキニクスンチャン　エキヒガシテン","⑬ その他の食料・飲料販売業","焼肉レストラン","栃木県宇都宮市東宿郷１丁目７－２　アジマコーポ１０２","",36.559617,139.903578,"028-611-3140","ハレルヤフーズ（株）","9013302014402","栃木県宇都宮市東宿郷１丁目７番２号","","","","","","","届出","",""
"009201","fBiz00001349430000000003","栃木県","宇都宮市","コープ越戸店　移動店舗","コープコエドテン　イドウテンポ","⑦ 野菜果物販売業","移動スーパー","栃木県宇都宮市越戸３丁目１２－９","とちぎコープ生活協同組合　コープ越戸店",36.569559,139.925332,"028-663-4411","とちぎコープ生活協同組合","6060005000595","栃木県宇都宮市川田町858","","","","","","","届出","",""
"009201","fBiz00001349430000000004","栃木県","宇都宮市","コープ鶴田店　移動店舗","コープツルタテン　イドウテンポ","⑦ 野菜果物販売業","移動スーパー","栃木県宇都宮市鶴田町８６１","とちぎコープ生活協同組合　コープ鶴田店",36.559877,139.855227,"028-601-8661","とちぎコープ生活協同組合","6060005000595","栃木県宇都宮市川田町858","","","","","","","届出","",""
"009201","fBiz00001352770000000001","栃木県","宇都宮市","ｒｅｌａｘ","リラックス","① 飲食店営業","スナック","栃木県宇都宮市東宿郷２丁目１８番１９号　Ｎｅｗ青山館１階１０２号室","",36.556615,139.902878,"","張丹","","栃木県宇都宮市簗瀬町２２７０番地　コーポブルースカイ４０３号室","A080774",2021/11/08,2021/11/08,2021/11/08,2027/11/30,"","許可","　",""
"009201","fBiz00001352900000000001","栃木県","宇都宮市","Ｊジェイ","ジェイ","① 飲食店営業","キャバクラ","栃木県宇都宮市宿郷１丁目１２番９号　宿郷カサブランカビル７階","",36.556566,139.900196,"","王連青","","栃木県宇都宮市東峰町３０８６番地２","A080776",2021/11/08,2021/11/08,2021/11/08,2027/11/30,"","許可","　",""
"009201","fBiz00001352980000000001","栃木県","宇都宮市","平石農産物直売所","ヒライシノウサンブツチョクバイジョ","⑦ 野菜果物販売業","農産物直売所","栃木県宇都宮市下平出町１６９－１","",36.561244,139.946240,"","髙松仲雄","","栃木県宇都宮市柳田町２５２","","","","","","","届出","",""
"009201","fBiz00001353180000000001","栃木県","宇都宮市","本沢商店","ホンザワショウテン","③ 乳類販売業","小売店","栃木県宇都宮市大塚町１３－８","",36.533597,139.859698,"028-658-6333","本澤猶","","栃木県宇都宮市大塚町１３－８","","","","","","","届出","",""
"009201","fBiz00001353440000000001","栃木県","宇都宮市","雀宮青空市","スズメノミヤアオゾライチ","⑦ 野菜果物販売業","直売所","栃木県宇都宮市東谷町５２９","",36.484908,139.896004,"","篠崎文子","","栃木県宇都宮市羽牛田町１９８","","","","","","","届出","",""
"009201","fBiz00001353440000000001","栃木県","宇都宮市","雀宮青空市","スズメノミヤアオゾライチ","⑧ 米穀類販売業","直売所","栃木県宇都宮市東谷町５２９","",36.484908,139.896004,"","篠崎文子","","栃木県宇都宮市羽牛田町１９８","","","","","","","届出","",""
"009201","fBiz00001353520000000001","栃木県","宇都宮市","Ｂａｒ　Ｌｉｔｔｌｅ　Ｕｌｔｉｓｓ","バー　リトル　アルティス","① 飲食店営業","バー","栃木県宇都宮市東宿郷２丁目１４番３号　ムーンガーデンビル１階Ｃ－１０３号室","",36.557022,139.900322,"","横塚正宣","","栃木県宇都宮市中今泉２丁目１０番１５号　アルファレジデンス今泉７０２","A080775",2021/11/08,2021/11/08,2021/11/08,2027/11/30,"","許可","　",""
"009201","fBiz00001353550000000001","栃木県","宇都宮市","Ｈｕｉｔ","ユイ","① 飲食店営業","スナック","栃木県宇都宮市東宿郷２丁目６番１１号","オーロラタワー３階",36.557562,139.902968,"028-689-8029","見目孝夫","","栃木県小山市羽川８１５番地７","A080780",2021/11/08,2021/11/08,2021/11/08,2027/11/30,"","許可","　",""
"009201","fBiz00001362120000000001","栃木県","宇都宮市","スナック　マミ","スナック　マミ","① 飲食店営業","スナック，バー","栃木県宇都宮市本町６－９　薄井ビル１階北号室","",36.562635,139.881748,"028-612-7477","立石麻果","","栃木県宇都宮市簗瀬町２５４５－２","A080808",2021/11/10,2021/11/10,2021/11/10,2028/04/30,"","許可","　",""
"009201","fBiz00001362890000000002","栃木県","宇都宮市","旬魚旬菜　千石","シュンギョシュンサイ　センゴク","① 飲食店営業","居酒屋","栃木県宇都宮市宿郷１丁目１２－５","",36.556743,139.900416,"028-636-9255","株式会社ＬＩＮＥ","1060001006816","栃木県宇都宮市下平出町３５１番地３","A080818",2021/11/15,2021/11/15,2021/11/15,2027/11/30,"","許可","フグ営業（処理）",""
"009201","fBiz00001370290000000001","栃木県","宇都宮市","宇都宮　もんじ！","ウツノミヤ　モンジ","① 飲食店営業","","栃木県宇都宮市江野町９－２　野崎ビル1Ｆ","",36.560192,139.882845,"028-680-6261","（株）１９２４","9060001029693","栃木県宇都宮市大曽２丁目２番１２号　宇都宮ロイヤルハイツ１０１","A080807",2021/11/10,2021/11/10,2021/11/10,2028/01/31,"","許可","　",""
"009201","fBiz00001370760000000001","栃木県","宇都宮市","Ｌｏｕｎｇｅ　すみれ","ラウンジ　スミレ","① 飲食店営業","パブ","栃木県宇都宮市東宿郷２丁目６－１１","オーロラタワー　６Ｆ",36.557562,139.902968,"","ＹＡＭＡＧＵＣＨＩＡＮＡＢＥＬＬＥ　ＴＲＩＬＬＡＮＡ","","栃木県真岡市熊倉３丁目３７－６ ホワイトヒルズC棟１０１号","A080809",2021/11/10,2021/11/10,2021/11/10,2027/11/30,"","許可","　",""
"009201","fBiz00001371270000000001","栃木県","宇都宮市","中国菜　文富","チュウゴクサイ　ウェンフー","① 飲食店営業","中華レストラン","栃木県宇都宮市峰３丁目３２－２６","",36.550279,139.919011,"028-678-3594","（有）朋友塗装工業","4060002008189","栃木県宇都宮市峰３丁目３１－３０","A080817",2021/11/12,2021/11/12,2021/11/12,2027/11/30,"","許可","　",""
"009201","fBiz00001372980000000003","栃木県","宇都宮市","宇都宮農業協同組合　東部営農経済センター","ウツノミヤノウギョウキョウドウクミアイ　トウブエイノウケイザイセンター","⑧ 米穀類販売業","米穀販売","栃木県宇都宮市平出町３５６１－１","",36.575581,139.949506,"028-660-3535","宇都宮農業協同組合","7060005000702","栃木県宇都宮市戸祭元町３－１０","","","","","","","届出","",""
"009201","fBiz00001372980000000004","栃木県","宇都宮市","宇都宮農業協同組合　西部営農経済センター","ウツノミヤノウギョウキョウドウクミアイ　セイブエイノウケイザイセンター","⑧ 米穀類販売業","米穀販売","栃木県宇都宮市下砥上町１４８６－１","",36.537127,139.848278,"028-658-6565","宇都宮農業協同組合","7060005000702","栃木県宇都宮市戸祭元町３－１０","","","","","","","届出","",""
"009201","fBiz00001372980000000005","栃木県","宇都宮市","宇都宮農業協同組合　河内営農経済センター","ウツノミヤノウギョウキョウドウクミアイ　カワチエイノウケイザイセンター","⑧ 米穀類販売業","米穀販売","栃木県宇都宮市白沢町１７９７","",36.630603,139.938976,"028-673-6911","宇都宮農業協同組合","7060005000702","栃木県宇都宮市戸祭元町３－１０","","","","","","","届出","",""
"009201","fBiz00001372980000000006","栃木県","宇都宮市","宇都宮農業協同組合　北部営農経済センター","ウツノミヤノウギョウキョウドウクミアイ　ホクブエイノウケイザイセンター","⑧ 米穀類販売業","米穀販売","栃木県宇都宮市新里町丙２８６－１","",36.634924,139.830682,"028-665-0550","宇都宮農業協同組合","7060005000702","栃木県宇都宮市戸祭元町３－１０","","","","","","","届出","",""
"009201","fBiz00001373820000000002","栃木県","宇都宮市","ドラッグコスモス鶴田店","ドラッグコスモスツルタテン","⑪ 百貨店、総合スーパー","ドラッグストア","栃木県宇都宮市鶴田町1037","",36.554558,139.852167,"028-666-0359","株式会社コスモス薬品","9290001025414","福岡県福岡市博多区博多駅東２丁目１０番１号第一福岡ビルＳ館４階","","","","","","","届出","",""
"009201","fBiz00001373820000000030","栃木県","宇都宮市","ドラッグコスモス城東店","ドラッグコスモスジョウトウテン","⑪ 百貨店、総合スーパー","ドラッグストア","栃木県宇都宮市城東２丁目２６－１７","",36.551129,139.905980,"028-611-1889","株式会社コスモス薬品","9290001025414","福岡県福岡市博多区博多駅東２丁目１０番１号第一福岡ビルＳ館４階","","","","","","","届出","",""
"009201","fBiz00001373820000001201","栃木県","宇都宮市","ドラッグコスモス岡本店","ドラッグコスモスオカモトテン","⑪ 百貨店、総合スーパー","ドラッグストア","栃木県宇都宮市下岡本町1987-8","",36.598494,139.942949,"028-612-3779","株式会社コスモス薬品","9290001025414","福岡県福岡市博多区博多駅東２丁目１０番１号第一福岡ビルＳ館４階","","","","","","","届出","",""
"009201","fBiz00001374960000000001","栃木県","宇都宮市","Ｓ・ひよこ食堂","エス　ヒヨコショクドウ","① 飲食店営業","学食","栃木県宇都宮市竹下町９０８","作新学院大学学生会館１階食堂",36.543389,139.977358,"028-667-7111","坂本典子","","栃木県宇都宮市富士見町１－１９","A080820",2021/11/16,2021/11/16,2021/11/16,2027/12/31,"","許可","　",""
"009201","fBiz00001376710000000001","栃木県","宇都宮市","ニューりか","ニューリカ","① 飲食店営業","スナック","栃木県宇都宮市東宿郷２丁目１８番１９号","ＮＥＷ青山館南１０１号",36.556615,139.902878,"028-634-1038","ＰＨＩＣＨＡＹＡＹＵＲＥＥ","","栃木県宇都宮市東宿郷３丁目９－１５　富貴塚マンション１０２","A080832",2021/11/18,2021/11/18,2021/11/18,2027/11/30,"","許可","　",""
"009201","fBiz00001377090000000001","栃木県","宇都宮市","無印良品福田屋ショッピングプラザ宇都宮店","ムジルシリョウヒンフクダヤショッピングプラザウツノミヤテン","⑬ その他の食料・飲料販売業","","栃木県宇都宮市今泉町237","福田屋百貨店宇都宮2階",36.573763,139.900497,"0286007900","株式会社良品計画","5013301012443","東京都豊島区東池袋4丁目26-3","","","","","","","届出","",""
"009201","fBiz00001380680000000001","栃木県","宇都宮市","多機能型事業所コパン","タキノウガタジギョウショコパン","⑪ 菓子製造業","菓子販売","栃木県宇都宮市花房２丁目８－６","",36.550914,139.877707,"028-680-7286","（有）コパン","1060002021681","栃木県宇都宮市鶴田町３３５９番地","A080787",2021/11/08,2021/11/08,2021/11/08,2027/11/30,"","許可","　",""
"009201","fBiz00001381880000000001","栃木県","宇都宮市","なかつぼ","ナカツボ","㉔ その他の食料品製造・加工業","農産品加工業","栃木県宇都宮市上小倉町１５６１","",36.709479,139.900293,"028-674-2388","久保井久子","","栃木県宇都宮市上小倉町１５６１","","","","","","","届出","",""
"009201","fBiz00001382630000000001","栃木県","宇都宮市","宝木保育園","タカラギホイクエン","㉖ 集団給食施設","保育園の給食施設","栃木県宇都宮市若草２丁目３番３１号","",36.584035,139.862005,"028-622-1233","社会福祉法人とちぎ健康福祉協会","2060005000772","栃木県宇都宮市駒生町３３３７番地１","","","","","","","届出","",""
"009201","fBiz00001383900000000001","栃木県","宇都宮市","直売所さんと","チョクバイジョサント","㉔ その他の食料品製造・加工業","農産物直売所","栃木県宇都宮市徳次郎町４７番地３６","",36.640263,139.848527,"028-680-5930","（有）タケダ工業","9060002005727","栃木県宇都宮市徳次郎町４７番地３６","","","","","","","届出","",""
"009201","fBiz00001393170000000001","栃木県","宇都宮市","Ｒａｉｎｂｏｗ　Ｆｏｏｄ　Ｌａｂ","レインボー　フード　ラボ","① 飲食店営業","キッチンカー","栃木県宇都宮市西川田町２４５－１","宇都宮西川田総合住宅展示場",36.516010,139.843069,"","小野口　健太","","栃木県栃木市柳橋町１８－３","A080788",2021/11/09,2021/11/09,2021/11/09,2027/03/31,"","許可","とちぎ480く6305/ﾀﾝｸ容量:80L/取扱品目:米飯類，飲料類，煮物類",""
"009201","fBiz00001394670000000005","栃木県","宇都宮市","Ｍｅｉｎｅ　Ｂｉｅｎｅ","マイネ　ビーネ","① 飲食店営業","キッチンカー","栃木県宇都宮市東簗瀬１丁目４１－３","ＴＳＵＴＡＹＡ宇都宮東簗瀬店",36.538901,139.902607,"","永嶋真衣","","栃木県芳賀郡茂木町下菅又1020番地","A080849",2021/11/24,2021/11/24,2021/11/24,2026/11/30,"","許可","宇都宮800せ2681/ﾀﾝｸ容量:80L/取扱品目:菓子類,飲料類",""
"009201","fBiz00001398730000000001","栃木県","宇都宮市","記憶に刻めＰＬＵＳ","キオクニキザメプラス","① 飲食店営業","カフェ","栃木県宇都宮市宮園町５－４","東武宇都宮百貨店内１F",36.560019,139.880450,"","（株）ストロイエ","9060001030833","栃木県大田原市美原１丁目６番１４号","A080826",2021/11/18,2021/11/18,2021/11/18,2028/01/31,"","許可","　",""
"009201","fBiz00001404900000000002","栃木県","宇都宮市","やさい＆くだもの村　桜通り店","ヤサイアンドクダモノムラ　サクラドオリテン","⑦ 野菜果物販売業","直売所","栃木県宇都宮市松原２丁目２－５２","",36.570418,139.871046,"028-627-5410","やさい＆くだもの村（株）","8060001031139","栃木県宇都宮市松原２丁目２番５２号","","","","","","","届出","",""
