"009201","fBiz00000581280000002558","栃木県","宇都宮市","","","⑫ 自動販売機による販売業（コップ式自動販売機（自動洗浄・屋内設置）及び営業許可の対象となる自動販売機を除く）","","","","","","","","","","","","","","","","届出","",""
"009201","fBiz00000581280000002559","栃木県","宇都宮市","","","⑫ 自動販売機による販売業（コップ式自動販売機（自動洗浄・屋内設置）及び営業許可の対象となる自動販売機を除く）","","","","","","","","","","","","","","","","届出","",""
"009201","fBiz00000581280000002573","栃木県","宇都宮市","","","⑫ 自動販売機による販売業（コップ式自動販売機（自動洗浄・屋内設置）及び営業許可の対象となる自動販売機を除く）","","","","","","","","","","","","","","","","届出","",""
"009201","fBiz00000581280000002596","栃木県","宇都宮市","","","⑫ 自動販売機による販売業（コップ式自動販売機（自動洗浄・屋内設置）及び営業許可の対象となる自動販売機を除く）","","","","","","","","","","","","","","","","届出","",""
"009201","fBiz00000581280000002623","栃木県","宇都宮市","","","⑫ 自動販売機による販売業（コップ式自動販売機（自動洗浄・屋内設置）及び営業許可の対象となる自動販売機を除く）","","","","","","","","","","","","","","","","届出","",""
"009201","fBiz00000582270000000001","栃木県","宇都宮市","東一宇都宮青果（株）","トウイチウツノミヤセイカ","⑦ 野菜果物販売業","青果物卸売","栃木県宇都宮市簗瀬町１４９３番地","",36.547044,139.890811,"028-637-6100","東一宇都宮青果（株）","5060001000716","栃木県宇都宮市簗瀬町１４９３番地","","","","","","","届出","",""
"009201","fBiz00000583080000000001","栃木県","宇都宮市","農産直売所あぜみち　駅東店","ノウサンチョクバイジョアゼミチ　エキヒガシテン","⑪ 百貨店、総合スーパー","","栃木県宇都宮市中今泉２丁目１０－２３","農産直売所あぜみち　駅東店",36.568273,139.905142,"028-680-5031","株式会社グリーンデイズ","4060001007290","栃木県宇都宮市上戸祭町３０３１番地３","","","","","","","届出","",""
"009201","fBiz00000583080000000002","栃木県","宇都宮市","農産直売所あぜみち　滝の原店","ノウサンチョクバイジョアゼミチ　タキノハラテン","⑪ 百貨店、総合スーパー","","栃木県宇都宮市滝の原３丁目１－１","農産直売所あぜみち　滝の原店",36.542476,139.863305,"028-632-5431","株式会社グリーンデイズ","4060001007290","栃木県宇都宮市上戸祭町３０３１番地３","","","","","","","届出","",""
"009201","fBiz00000583080000000004","栃木県","宇都宮市","農産物直売所あぜみち上戸祭店","ノウサンブツチョクバイジョアゼミチカミトマツリテン","㉕ そうざい製造業","スーパー","栃木県宇都宮市上戸祭町３０３１－３","",36.592603,139.869612,"028-678-9687","株式会社グリーンデイズ","4060001007290","栃木県宇都宮市上戸祭町３０３１番地３","A080318",2021/08/12,2021/08/12,2021/08/12,2027/08/31,"","許可","　",""
"009201","fBiz00000583080000000004","栃木県","宇都宮市","農産物直売所あぜみち上戸祭店","ノウサンブツチョクバイジョアゼミチカミトマツリテン","⑪ 百貨店、総合スーパー","スーパー","栃木県宇都宮市上戸祭町３０３１－３","",36.592603,139.869612,"028-678-9687","株式会社グリーンデイズ","4060001007290","栃木県宇都宮市上戸祭町３０３１番地３","","","","","","","届出","",""
"009201","fBiz00000583080000000005","栃木県","宇都宮市","農産直売所　あぜみち　西川田店","ノウサンチョクバイジョ　アゼミチ　ニシカワダテン","㉕ そうざい製造業","惣菜店","栃木県宇都宮市西川田町２８７－１","",36.519743,139.847006,"028-678-2398","株式会社グリーンデイズ","4060001007290","栃木県宇都宮市上戸祭町３０３１番地３","A080759",2021/11/04,2021/11/04,2021/11/04,2028/03/31,"","許可","　",""
"009201","fBiz00000583080000000005","栃木県","宇都宮市","農産直売所　あぜみち　西川田店","ノウサンチョクバイジョ　アゼミチ　ニシカワダテン","⑪ 百貨店、総合スーパー","惣菜店","栃木県宇都宮市西川田町２８７－１","",36.519743,139.847006,"028-678-2398","株式会社グリーンデイズ","4060001007290","栃木県宇都宮市上戸祭町３０３１番地３","","","","","","","届出","",""
"009201","fBiz00000583340000000001","栃木県","宇都宮市","Ｍｏｎ　Ｃｈｏｕ","モン　シュ","① 飲食店営業","カフェ","栃木県宇都宮市上戸祭町３０３１－３","",36.592603,139.869612,"","清嶋インターナショナルサービス（有）","7060002003261","栃木県宇都宮市関堀町８７１－２","A080311",2021/08/12,2021/08/12,2021/08/12,2027/08/31,"","許可","　",""
"009201","fBiz00000591050000000002","栃木県","宇都宮市","レストラン　スイッチ","レストラン　スイッチ","① 飲食店営業","キッチンカー","栃木県宇都宮市江野町８－３","オリオンスクエア","","","0285-24-9222","大久保満","","栃木県小山市城東５丁目２６－４０","A080208",2021/07/27,2021/07/27,2021/07/27,2026/07/31,"","許可","とちぎ800さ5806/ﾀﾝｸ容量:200L/取扱品目:ﾄﾞｯｸﾞ類,米飯類,飲料類",""
"009201","fBiz00000593300000000001","栃木県","宇都宮市","光","コウ","① 飲食店営業","居酒屋","栃木県宇都宮市末広２丁目１１－１８","","","","","小森紀子","","栃木県宇都宮市茂原３丁目１２２２－８","A080232",2021/07/29,2021/07/29,2021/07/29,2027/09/30,"","許可","　",""
"009201","fBiz00000593410000000001","栃木県","宇都宮市","ゴールドブッチャー","ゴールドブッチャー","① 飲食店営業","焼肉店","栃木県宇都宮市馬場通り３丁目１－１５","","","","028-666-4298","Ｐｒｉｎｃｉｐｌｅ（株）","8060001033820","栃木県宇都宮市馬場通り３丁目１－１５","A080245",2021/07/30,2021/07/30,2021/07/30,2027/07/31,"","許可","　",""
"009201","fBiz00000593860000000001","栃木県","宇都宮市","","","⑯ コーヒー製造・加工業（飲料の製造を除く。）","通信販売","","","","","","","","","","","","","","","届出","",""
"009201","fBiz00000595570000000001","栃木県","宇都宮市","岩清水　関所庵","イワシミズ　セキショアン","① 飲食店営業","飲食店","栃木県宇都宮市若草２丁目３－４１","",36.583016,139.863271,"028-612-8422","関祐治","","栃木県宇都宮市岩曽町１４６３－１８","A080335",2021/08/19,2021/08/19,2021/08/19,2027/08/31,"","許可","　",""
"009201","fBiz00000597690000000001","栃木県","宇都宮市","和人堂","ワジンドウ","① 飲食店営業","","栃木県宇都宮市上戸祭町３０３１－３","",36.592603,139.869612,"","菊池信貴","","栃木県宇都宮市石井町２４５９－３３","A080310",2021/08/12,2021/08/12,2021/08/12,2027/08/31,"","許可","　",""
"009201","fBiz00000597960000000001","栃木県","宇都宮市","セブン―イレブン　宇都宮上戸祭南店","セブンーイレブン　ウツノミヤカミトマツリミナミテン","① 飲食店営業","コンビニエンスストア","栃木県宇都宮市上戸祭町４２２","",36.589332,139.869878,"028-623-0363","（株）ショップ・イースト・ジャパン","7060001009227","栃木県さくら市喜連川３８６９－１","A080314",2021/08/12,2021/08/12,2021/08/12,2027/08/31,"","許可","　",""
"009201","fBiz00000597960000000001","栃木県","宇都宮市","セブン―イレブン　宇都宮上戸祭南店","セブンーイレブン　ウツノミヤカミトマツリミナミテン","⑩ コンビニエンスストア","コンビニエンスストア","栃木県宇都宮市上戸祭町４２２","",36.589332,139.869878,"028-623-0363","（株）ショップ・イースト・ジャパン","7060001009227","栃木県さくら市喜連川３８６９－１","","","","","","","届出","",""
"009201","fBiz00000598960000000011","栃木県","宇都宮市","中外製薬工業株式会社宇都宮工場","チュウガイセイヤクコウギョウカブシキカイシャウツノミヤコウジョウ","③ 乳類販売業","食品自動販売機","栃木県宇都宮市清原工業団地16-3","",36.544090,139.980550,"","株式会社　八洋","1011101031089","東京都新宿区東五軒町２番１８号","","","","","","","届出","",""
"009201","fBiz00000608710000000001","栃木県","宇都宮市","（株）麺ズファクトリー鵜の木","メンズファクトリーウノキ","① 飲食店営業","麺類製造業","栃木県宇都宮市徳次郎町２６７３番地","",36.659223,139.838591,"028-666-3737","（株）麺ズファクトリー鵜の木","1060001007319","栃木県宇都宮市徳次郎町2673番地","A080246",2021/07/30,2021/07/30,2021/07/30,2027/08/31,"","許可","　",""
"009201","fBiz00000608710000000001","栃木県","宇都宮市","（株）麺ズファクトリー鵜の木","メンズファクトリーウノキ","㉔ 麺類製造業","麺類製造業","栃木県宇都宮市徳次郎町２６７３番地","",36.659223,139.838591,"028-666-3737","（株）麺ズファクトリー鵜の木","1060001007319","栃木県宇都宮市徳次郎町2673番地","A080247",2021/07/30,2021/07/30,2021/07/30,2027/08/31,"","許可","　",""
"009201","fBiz00000608710000000001","栃木県","宇都宮市","（株）麺ズファクトリー鵜の木","メンズファクトリーウノキ","㉕ そうざい製造業","麺類製造業","栃木県宇都宮市徳次郎町２６７３番地","",36.659223,139.838591,"028-666-3737","（株）麺ズファクトリー鵜の木","1060001007319","栃木県宇都宮市徳次郎町2673番地","A082127",2022/08/04,2022/08/04,2022/08/04,2028/08/31,"","許可","　",""
"009201","fBiz00000612010000000114","栃木県","宇都宮市","ラーメン山岡家テクノポリスセンター店","ラーメンヤマオカヤテクノポリスセンターテン","⑬ その他の食料・飲料販売業","","栃木県宇都宮市野高谷町796","",36.561648,139.996953,"028-680-6871","株式会社丸千代山岡家","9430001017223","北海道札幌市東区東雁来七条1丁目4-32","","","","","","","届出","",""
"009201","fBiz00000614780000000001","栃木県","宇都宮市","（株）マル仲水産","マルナカスイサン","⑬ その他の食料・飲料販売業","水産仲卸","栃木県宇都宮市簗瀬町１４９３","",36.547044,139.890811,"028-637-6454","（株）マル仲水産","4060001004239","栃木県宇都宮市簗瀬町１４９３","","","","","","","届出","",""
"009201","fBiz00000615280000000001","栃木県","宇都宮市","（株）鈴万","スズマン","⑬ その他の食料・飲料販売業","鮮魚仲卸","栃木県宇都宮市簗瀬町１４９３","",36.547044,139.890811,"028-637-6450","（株）鈴万","4060001002382","栃木県宇都宮市簗瀬町１４９３","","","","","","","届出","",""
"009201","fBiz00000615400000000001","栃木県","宇都宮市","Ｈｅｒｂａｌ　Ｓｃｅｎｔ～ハーバルセント～","ハーバルセント","⑰ 農産保存食料品製造・加工業","","栃木県宇都宮市清原台４丁目５－１４","",36.557053,139.993084,"","内田優子","","栃木県宇都宮市清原台４丁目５－１４","","","","","","","届出","",""
"009201","fBiz00000615730000000001","栃木県","宇都宮市","東北道　上河内Ｓ．Ａ．上り線","トウホクドウ　カミカワチエスエー　ノボリセン","② 食肉販売業（包装済みの食肉のみの販売）","","栃木県宇都宮市今里町１１４５番地","",36.691147,139.892559,"028-674-2111","（株）あさやホテル","8060001008905","栃木県日光市鬼怒川温泉滝813番地","","","","","","","届出","",""
"009201","fBiz00000615900000000001","栃木県","宇都宮市","川上商店","カワカミショウテン","⑰ 農産保存食料品製造・加工業","加工販売","栃木県宇都宮市上籠谷町３３４９","",36.517680,139.966273,"028-667-1056","川上眞","","栃木県宇都宮市上籠谷町３３４９","","","","","","","届出","",""
"009201","fBiz00000615970000000001","栃木県","宇都宮市","とうふ　惣菜　たちかわ","トウフ　ソウザイ　タチカワ","⑬ その他の食料・飲料販売業","","栃木県宇都宮市立伏町４４７－７３","",36.638704,139.881438,"028-672-0714","立川公彰","","栃木県宇都宮市立伏町４４７－７３","","","","","","","届出","",""
"009201","fBiz00000616690000000001","栃木県","宇都宮市","（有）堺周水産","サカシュウスイサン","⑬ その他の食料・飲料販売業","仲卸業","栃木県宇都宮市簗瀬町１４９３","",36.547054,139.890810,"028-637-6448","（有）堺周水産","8060002002592","栃木県宇都宮市簗瀬町１４９３","","","","","","","届出","",""
"009201","fBiz00000616690000000002","栃木県","宇都宮市","（有）堺周水産","サカシュウスイサン","④ 魚介類販売業","魚介類卸売業","栃木県宇都宮市簗瀬町１４９３","",36.547054,139.890810,"028-637-6448","（有）堺周水産","8060002002592","栃木県宇都宮市簗瀬町１４９３","A082807",2022/11/25,2022/11/25,2022/11/25,2028/11/30,"","許可","　",""
"009201","fBiz00000616890000000001","栃木県","宇都宮市","（株）ギンポーパック　宇都宮工場","ギンポーパック　ウツノミヤコウジョウ","㉗ 器具、容器包装の製造・加工業（合成樹脂が使用された器具又は容器包装の製造、加工に限る。）","","栃木県宇都宮市瑞穂３丁目５－５","",36.505733,139.918009,"028-656-4711","（株）ギンポーパック","3010001019787","東京都千代田区神田須田町二丁目６番地６","","","","","","","届出","",""
"009201","fBiz00000616980000000001","栃木県","宇都宮市","(株)雄都水産","ユウトスイサン","⑬ その他の食料・飲料販売業","水産仲卸","栃木県宇都宮市簗瀬町１４９３　水産仲卸売場Ｅ２０２","",36.546526,139.892172,"","（株）雄都水産","1060001004588","栃木県宇都宮市川田町７９６－１","","","","","","","届出","",""
"009201","fBiz00000616980000000002","栃木県","宇都宮市","（株）雄都水産　水産仲卸売場","ユウトスイサン　スイサンナカオロシウリバ","④ 魚介類販売業","水産仲卸店","栃木県宇都宮市簗瀬町１４９３番地　","水産仲卸売場Ｅ２０２",36.547044,139.890811,"","（株）雄都水産","1060001004588","栃木県宇都宮市川田町７９６－１","A080607",2021/10/11,2021/10/11,2021/10/11,2027/11/30,"","許可","フグ営業（処理以外）",""
"009201","fBiz00000617250000000001","栃木県","宇都宮市","カネツ青果(株)","カネツセイカ","⑦ 野菜果物販売業","青果仲卸","栃木県宇都宮市簗瀬町１４９３","",36.547044,139.890811,"028-637-6343","カネツ青果(株)","4060001001252","栃木県宇都宮市簗瀬町１４９３","","","","","","","届出","",""
"009201","fBiz00000617290000000001","栃木県","宇都宮市","佐藤商店","サトウショウテン","① 飲食店営業","露店","栃木県宇都宮市白沢町１７９１－３（ドリームプールかわち）","",36.631208,139.937738,"","佐藤勇介","","栃木県那須郡那珂川町小川４２４－３－５","A080183",2021/07/20,2021/07/20,2021/07/20,2026/11/30,"","許可","露店営業に限る/取扱品目:喫茶類",""
"009201","fBiz00000617490000000002","栃木県","宇都宮市","ケンタッキー・フライドチキンＦＫＤインターパーク店","ケンタッキー・フライドチキンエフケイディーインターパークテン","① 飲食店営業","","栃木県宇都宮市インターパーク６丁目１－１","ＦＫＤインターパーク店",36.490442,139.906901,"028-657-6333","株式会社チヨダコーポレーション","2070001002111","群馬県前橋市下阿内町３７７番地１１","A080403",2021/09/06,2021/09/06,2021/09/06,2027/09/30,"","許可","　",""
"009201","fBiz00000617490000000002","栃木県","宇都宮市","ケンタッキー・フライドチキンＦＫＤインターパーク店","ケンタッキー・フライドチキンエフケイディーインターパークテン","⑬ その他の食料・飲料販売業","","栃木県宇都宮市インターパーク６丁目１－１","ＦＫＤインターパーク店",36.490442,139.906901,"028-657-6333","株式会社チヨダコーポレーション","2070001002111","群馬県前橋市下阿内町３７７番地１１","","","","","","","届出","",""
"009201","fBiz00000617670000000001","栃木県","宇都宮市","宇都宮中央病院　ホスピア宇都宮","ウツノミヤチュウオウビョウイン　ホスピアウツノミヤ","㉖ 集団給食施設","介護老人保健施設","栃木県宇都宮市東宿郷２丁目１番１号","",36.557785,139.899741,"028-635-1110","医療法人社団　全仁会","8060005000932","栃木県宇都宮市東宿郷２丁目１番１号","","","","","","","届出","",""
"009201","fBiz00000617990000000001","栃木県","宇都宮市","和氣精肉店　２号車","ワキセイニクテン　ニゴウシャ","① 飲食店営業","キッチンカー","栃木県宇都宮市上戸祭町３０３１－３（あぜみち上戸祭店）","",36.592603,139.869612,"","（株）和氣精肉店　","8060001029488","栃木県大田原市佐久山２２２０－３","A080189",2021/07/21,2021/07/21,2021/07/21,2026/08/31,"","許可","那須800さ2040/ﾀﾝｸ容量:40L/取扱品目:揚げ物類",""
"009201","fBiz00000618160000000001","栃木県","宇都宮市","（株）イトーヨーカ堂　宇都宮店","イトーヨーカドウ　ウツノミヤテン","㉕ 行商","自動車営業","栃木県宇都宮市陽東６丁目２－１","",36.555058,139.928244,"028-661-0111","（株）イトーヨーカ堂","2010001098023","東京都千代田区二番町8-8","","","","","","","届出","",""
"009201","fBiz00000619560000000001","栃木県","宇都宮市","(株)櫻屋商店","サクラヤショウテン","㉔ その他の食料品製造・加工業","食品製造","栃木県宇都宮市御幸町１６６","",36.579625,139.921973,"","(株)桜屋商店","1060001001998","栃木県宇都宮市御幸町１６６","","","","","","","届出","",""
"009201","fBiz00000619710000000001","栃木県","宇都宮市","とちぎコープ生活協同組合　コープ越戸店","トチギコープセイカツキョウドウクミアイ　コープコエドテン","① 飲食店営業","スーパーマーケットインストア加工","栃木県宇都宮市越戸３丁目１２－９","",36.569402,139.925317,"028-663-4411","とちぎコープ生活協同組合","6060005000595","栃木県宇都宮市川田町８５８番地","A080186",2021/07/21,2021/07/21,2021/07/21,2027/07/31,"","許可","　",""
"009201","fBiz00000619710000000001","栃木県","宇都宮市","とちぎコープ生活協同組合　コープ越戸店","トチギコープセイカツキョウドウクミアイ　コープコエドテン","⑪ 百貨店、総合スーパー","スーパーマーケットインストア加工","栃木県宇都宮市越戸３丁目１２－９","",36.569402,139.925317,"028-663-4411","とちぎコープ生活協同組合","6060005000595","栃木県宇都宮市川田町８５８番地","","","","","","","届出","",""
"009201","fBiz00000619710000000003","栃木県","宇都宮市","とちぎコープ生活協同組合　鶴田店","トチギコープセイカツキョウドウクミアイ　ツルタテン","⑪ 百貨店、総合スーパー","スーパー","栃木県宇都宮市鶴田町861","",36.559906,139.855206,"028-601-8661","とちぎコープ生活協同組合","6060005000595","栃木県宇都宮市川田町８５８番地","","","","","","","届出","",""
"009201","fBiz00000619710000000018","栃木県","宇都宮市","とちぎコープ生活協同組合　宇都宮センター","トチギコープセイカツキョウドウクミアイ　ウツノミヤセンター","⑨ 通信販売・訪問販売による販売業","配送センター","栃木県宇都宮市平出町4077-1","",36.567020,139.934547,"028-688-8377","とちぎコープ生活協同組合","6060005000595","栃木県宇都宮市川田町８５８番地","","","","","","","届出","",""
"009201","fBiz00000620430000000001","栃木県","宇都宮市","ＴＣ００２","ティーシーゼロゼロニ","⑬ その他の食料・飲料販売業","自動販売機","栃木県宇都宮市今泉町２５３７","",36.571269,139.918170,"","(株)Ｔ＆Ｃ","4010001179011","栃木県宇都宮市戸祭２丁目４番１０号　クラウド２０５号","","","","","","","届出","",""
"009201","fBiz00000620430000000002","栃木県","宇都宮市","ＴＣ００１","ティーシーゼロゼロイチ","⑬ その他の食料・飲料販売業","自動販売機","栃木県宇都宮市戸祭２丁目４番１０号","",36.571256,139.865505,"","(株)Ｔ＆Ｃ","4010001179011","栃木県宇都宮市戸祭２丁目４番１０号　クラウド２０５号","","","","","","","届出","",""
"009201","fBiz00000620430000000003","栃木県","宇都宮市","ＴＣ００３","ティーシーゼロゼロサン","⑬ その他の食料・飲料販売業","自動販売機","栃木県宇都宮市吉野1丁目53番","",36.546177,139.872966,"","(株)Ｔ＆Ｃ","4010001179011","栃木県宇都宮市戸祭２丁目４番１０号　クラウド２０５号","","","","","","","届出","",""
"009201","fBiz00000624090000000001","栃木県","宇都宮市","トミー","トミー","① 飲食店営業","飲食店","栃木県宇都宮市中戸祭１丁目１－４５","",36.575892,139.869278,"028-622-6094","西村美子","","栃木県宇都宮市中戸祭１丁目１－４５","A080334",2021/08/19,2021/08/19,2021/08/19,2027/08/31,"","許可","　",""
"009201","fBiz00000624630000000001","栃木県","宇都宮市","セブンイレブン宇都宮小幡店","セブンイレブンウツノミヤオバタテン","① 飲食店営業","コンビニエンスストア","栃木県宇都宮市小幡２丁目６－１３","",36.562786,139.872845,"028-623-7211","（株）新光社","4060001002102","栃木県宇都宮市泉町１番２０号","A080327",2021/08/19,2021/08/19,2021/08/19,2027/08/31,"","許可","　",""
"009201","fBiz00000624630000000001","栃木県","宇都宮市","セブンイレブン宇都宮小幡店","セブンイレブンウツノミヤオバタテン","⑩ コンビニエンスストア","コンビニエンスストア","栃木県宇都宮市小幡２丁目６－１３","",36.562786,139.872845,"623-7211","（株）新光社","4060001002102","栃木県宇都宮市泉町１番２０号","","","","","","","届出","",""
"009201","fBiz00000624630000000003","栃木県","宇都宮市","セブンイレブン　宇都宮池上店","セブンイレブン　ウツノミヤイケガミテン","① 飲食店営業","コンビニエンスストア","栃木県宇都宮市泉町１番２０号","",36.561912,139.880748,"028-624-7110","（株）新光社","4060001002102","栃木県宇都宮市泉町１番２０号","A081680",2022/04/27,2022/04/27,2022/04/27,2028/04/30,"","許可","　",""
"009201","fBiz00000625040000000001","栃木県","宇都宮市","高橋餃子店","タカハシギョウザテン","① 飲食店営業","","栃木県宇都宮市田下町４５５","",36.609828,139.812608,"028-652-4455","髙橋光江","","栃木県宇都宮市田下町４５５","A081220",2022/02/04,2022/02/04,2022/02/04,2028/02/29,"","許可","　",""
"009201","fBiz00000625040000000001","栃木県","宇都宮市","高橋餃子店","タカハシギョウザテン","㉗ 冷凍食品製造業","","栃木県宇都宮市田下町４５５","",36.609828,139.812608,"028-652-4455","髙橋光江","","栃木県宇都宮市田下町４５５","A080316",2021/08/12,2021/08/12,2021/08/12,2027/08/31,"","許可","　",""
"009201","fBiz00000625760000000001","栃木県","宇都宮市","ファミリーマートのざわや屋板町店","ファミリーマートノザワヤヤイタチョウテン","⑩ コンビニエンスストア","コンビニエンスストア","栃木県宇都宮市屋板町578-58","",36.517370,139.899714,"","","","","","","","","","","届出","",""
"009201","fBiz00000626330000000001","栃木県","宇都宮市","ファミリーマート宇都宮戸祭店","ファミリーマートウツノミヤトマツリテン","⑩ コンビニエンスストア","","栃木県宇都宮市戸祭町3031-2","",36.575791,139.875647,"","","","","","","","","","","届出","",""
"009201","fBiz00000626750000000001","栃木県","宇都宮市","豆富と湯波懐石　月山","トウフトユバカイセキ　ガッサン","㉒ 豆腐製造業","飲食店","栃木県宇都宮市上戸祭４丁目６－１３","",36.596975,139.859926,"028-625-0039","（株）銀河","8011802011647","東京都足立区千住東２丁目２－１","A080341",2021/08/20,2021/08/20,2021/08/20,2027/08/31,"","許可","　",""
