"自治体コード","行番号","都道府県名","市区町村名","営業施設名称、屋号又は商号","営業施設名称、屋号又は商号（フリガナ）","営業の種類","業態","営業施設所在地","営業施設方書","緯度","経度","営業施設電話番号","法人名","法人番号","法人住所","許可番号","初回許可年月日","許可年月日","許可開始日","許可満了日","廃業年月日","申請区分","許可条件","備考"
"009201","fBiz00000101470000000001","栃木県","宇都宮市","ラピスホテルアールメッツ宇都宮店","ラピス　ホテルアールメッツウツノミヤテン","① 飲食店営業","レストラン","栃木県宇都宮市川向町1-23 ","ホテルアール・メッツ宇都宮3F",36.560816,139.898175,"0286789588 ","株式会社ピー・エス・コープ","1010801005971","神奈川県横浜市都筑区中川中央１丁目２９番７号","A080937",2021/12/13,2021/12/13,2021/12/13,2028/05/31,"","許可","　",""
"009201","fBiz00000102980000000001","栃木県","宇都宮市","マルハニチロ株式会社　調味料乾燥食品事業部　調味料製造課","マルハニチロカブシキガイシャ  チョウミリョウカンソウショクヒンジギョウブ  チョウミリョウセイゾウカ","⑱ 調味料製造・加工業","","栃木県宇都宮市清原工業団地8-1","",36.539290,139.981761,"028-667-0839","マルハニチロ株式会社","2010601040697","東京都江東区豊洲3丁目2番20号豊洲フロント","","","","","","","届出","",""
"009201","fBiz00000103010000000001","栃木県","宇都宮市","マルハニチロ株式会社　化成バイオ事業部　生産グループ（宇都宮）","マルハニチロカブシキガイシャ　カセイバイオジギョウブ　セイサングループ　ウツノミヤ","⑮ いわゆる健康食品の製造・加工業","","栃木県宇都宮市清原工業団地8-1","",36.539290,139.981761,"0286676284","マルハニチロ株式会社","2010601040697","東京都江東区豊洲3-2-20","","","","","","","届出","",""
"009201","fBiz00000107420000000219","栃木県","宇都宮市","株式会社九州屋　東武宇都宮店","カブシキガイシャキュウシュウヤ　トウブウツノミヤテ","⑦ 野菜果物販売業","","栃木県宇都宮市宮園町5-4","東武宇都宮百貨店　B1F",36.560019,139.880450,"028-637-0333","株式会社九州屋","4010101000976","東京都八王子市越野24-1","","","","","","","届出","",""
"009201","fBiz00000107420000000220","栃木県","宇都宮市","株式会社九州屋　宇都宮ギフト店","カブシキガイシャキュウシュウヤ　ウツノミヤギフトテン","⑦ 野菜果物販売業","","栃木県宇都宮市宮園町5-4","東武宇都宮百貨店　B1F",36.560019,139.880450,"028-639-8151","株式会社九州屋","4010101000976","東京都八王子市越野24-1","","","","","","","届出","",""
"009201","fBiz00000108070000000008","栃木県","宇都宮市","ココカラ上桑島","ココカラカミクワジマ","㉖ 集団給食施設","小規模保育施設","栃木県宇都宮市上桑島町1316-3","",36.517568,139.927079,"028-680-6191","株式会社ピーエイケア","2380001025254","福島県郡山市開成４丁目９番１７号","","","","","","","届出","",""
"009201","fBiz00000108070000000010","栃木県","宇都宮市","小規模保育事業所　ココカラ雀宮保育園","ショウキボホイクジギョウショ　ココカラスズメノミヤホイクエン","㉖ 集団給食施設","保育園","栃木県宇都宮市雀宮町４１４－１","",36.491223,139.877281,"028-666-8351","株式会社ピーエイケア","2380001025254","福島県郡山市開成４丁目９番１７号","","","","","","","届出","",""
"009201","fBiz00000108410000000174","栃木県","宇都宮市","スポーツクラブ　ベル・フィットネス","スポーツクラブ　ベル・フィットネス","⑤ コップ式自動販売機（自動洗浄・屋内設置）","","栃木県宇都宮市陽東６丁目５－１","イーストサイド1F",36.555877,139.930466,"028-613-5115","株式会社朋コーポレーション","1010601025096","東京都墨田区錦糸１丁目２番１号アルカセントラル５階","","","","","","","届出","",""
"009201","fBiz00000108410000000206","栃木県","宇都宮市","ネクストベルフィットネス","ネクストベルフィットネス","⑤ コップ式自動販売機（自動洗浄・屋内設置）","","栃木県宇都宮市陽東６丁目４－３","",36.556865,139.931774,"028-613-1177","株式会社朋コーポレーション","1010601025096","東京都墨田区錦糸１丁目２番１号アルカセントラル５階","","","","","","","届出","",""
"009201","fBiz00000109950000000009","栃木県","宇都宮市","日本ハム","ニッポンハム","⑬ その他の食料・飲料販売業","販売業","栃木県宇都宮市宮園町5-4　　B1","",36.560019,139.880450,"028-638-5386","日本ハム株式会社","6120001077615","大阪府大阪市北区梅田二丁目4番９号　","","","","","","","届出","",""
"009201","fBiz00000110900000000054","栃木県","宇都宮市","北野エース　東武宇都宮店","キタノエース　トウブウツノミヤテン　","⑬ その他の食料・飲料販売業","","栃木県宇都宮市宮園町５－４","㈱東武宇都宮百貨店Ｂ１Ｆ",36.560019,139.880450,"028-651-4320","株式会社エース","9140001078096","兵庫県伊丹市中央四丁目6番24号","","","","","","","届出","",""
"009201","fBiz00000115920000000225","栃木県","宇都宮市","カルディコーヒーファーム　宇都宮ベルモール店","カルディコーヒーファーム　ウツノミヤベルモールテン","⑬ その他の食料・飲料販売業","小売業","栃木県宇都宮市陽東6丁目2-1　","ベルモール1F",36.555058,139.928244,"028-689-3653","株式会社キャメル珈琲","6010901003292","東京都世田谷区代田2-31-8","","","","","","","届出","",""
"009201","fBiz00000115920000000227","栃木県","宇都宮市","カルディコーヒーファーム　FKDインターパーク店","カルディコーヒーファーム　エフケイディインターパークテン","⑬ その他の食料・飲料販売業","小売業","栃木県宇都宮市インターパーク6丁目1-1　","FKDインターパーク１F",36.490442,139.906901,"028-678-2567","株式会社キャメル珈琲","6010901003292","東京都世田谷区代田2-31-8","","","","","","","届出","",""
"009201","fBiz00000122610000000001","栃木県","宇都宮市","チルメッセ","チルメッセ","⑰ 農産保存食料品製造・加工業","農産加工品の小分け","","","","","","大澄美紀子","","","","","","","","","届出","",""
"009201","fBiz00000123780000000002","栃木県","宇都宮市","和囲輪囲","ワイワイ","⑱ 調味料製造・加工業","","栃木県宇都宮市今泉3丁目2-18","ザ・グランドスパ南大門２F",36.564674,139.894614,"0286273203","株式会社健康ランド南大門","8060001007122","栃木県宇都宮市今泉3丁目2-18","","","","","","","届出","",""
"009201","fBiz00000123780000000003","栃木県","宇都宮市","ザ・グランドスパ南大門","ザ・グランドスパナンダイモン","③ 乳類販売業","売店","栃木県宇都宮市今泉３丁目２－１８","",36.564674,139.894614,"028-622-1126","株式会社健康ランド南大門","8060001007122","栃木県宇都宮市今泉3丁目2-18","","","","","","","届出","",""
"009201","fBiz00000123780000000004","栃木県","宇都宮市","食彩酒房　四季","ショクサイシュボウ　シキ","① 飲食店営業","飲食店","栃木県宇都宮市今泉３丁目２－１８","",36.564674,139.894614,"028-622-1126","株式会社健康ランド南大門","8060001007122","栃木県宇都宮市今泉3丁目2-18","A081943",2022/07/04,2022/07/04,2022/07/04,2028/07/31,"","許可","　",""
"009201","fBiz00000126830000000038","栃木県","宇都宮市","アミング陽東店","アミングヨウトウテン","⑬ その他の食料・飲料販売業","","栃木県宇都宮市陽東6丁目6番6号","",36.553696,139.932892,"0285314006","株式会社アミング","4220001001533","石川県金沢市無量寺５丁目５４番地３","","","","","","","届出","",""
"009201","fBiz00000126830000000041","栃木県","宇都宮市","アミング鶴田店","アミングツルタテン","⑬ その他の食料・飲料販売業","","栃木県宇都宮市鶴田町855","",36.554558,139.852167,"0286786462","株式会社アミング","4220001001533","石川県金沢市無量寺５丁目５４番地３","","","","","","","届出","",""
"009201","fBiz00000126990000000003","栃木県","宇都宮市","焼肉南大門　宇都宮　離宮","ヤキニクナンダイモンウツノミヤリキュウ","⑱ 調味料製造・加工業","","栃木県宇都宮市戸祭町2727","",36.574443,139.879613,"0286667005","株式会社　ファザー","3060001006327","栃木県宇都宮市今泉3丁目2-18","","","","","","","届出","",""
"009201","fBiz00000129180000000008","栃木県","宇都宮市","ダイソー宇都宮細谷ＳＣア・ミューズ店","ダイソー　ウツノミヤホソヤエスシーア・ミューズテン","⑬ その他の食料・飲料販売業","小売業","栃木県宇都宮市細谷町１丁目６－２５","",36.589556,139.854786,"","株式会社大創産業","7240001022681","広島県東広島市西条吉行東一丁目４番１４号","","","","","","","届出","",""
"009201","fBiz00000129180000000009","栃木県","宇都宮市","ダイソーアピタ宇都宮店","ダイソー　アピタウツノミヤテン","⑬ その他の食料・飲料販売業","小売業","栃木県宇都宮市江曽島本町２２－７","",36.531880,139.868039,"","株式会社大創産業","7240001022681","広島県東広島市西条吉行東一丁目４番１４号","","","","","","","届出","",""
"009201","fBiz00000129180000000010","栃木県","宇都宮市","ダイソー宇都宮御幸ヶ原店","ダイソー　ウツノミヤユキガハラテン","⑬ その他の食料・飲料販売業","小売業","栃木県宇都宮市御幸ケ原町６５－２","",36.592212,139.926358,"","株式会社大創産業","7240001022681","広島県東広島市西条吉行東一丁目４番１４号","","","","","","","届出","",""
"009201","fBiz00000129180000000011","栃木県","宇都宮市","ダイソートナリエ宇都宮店","ダイソー　トナリエウツノミヤテン","⑬ その他の食料・飲料販売業","小売業","栃木県宇都宮市駅前通り１－４－６","トナリエ宇都宮４階",36.560437,139.896967,"","株式会社大創産業","7240001022681","広島県東広島市西条吉行東一丁目４番１４号","","","","","","","届出","",""
"009201","fBiz00000129180000000012","栃木県","宇都宮市","ダイソー宇都宮越戸ショッピングセンター店","ダイソー　ウツノミヤコエドショッピングセンターテン","⑬ その他の食料・飲料販売業","小売業","栃木県宇都宮市越戸３－１２－７","越戸ショッピングセンターＡ棟",36.568551,139.924802,"","株式会社大創産業","7240001022681","広島県東広島市西条吉行東一丁目４番１４号","","","","","","","届出","",""
"009201","fBiz00000129180000000013","栃木県","宇都宮市","ダイソー宇都宮大曽シティーカルナ店","ダイソー　ウツノミヤオオゾシティーカルナテン","⑬ その他の食料・飲料販売業","小売業","栃木県宇都宮市大曽３丁目４番５号","",36.574049,139.891120,"","株式会社大創産業","7240001022681","広島県東広島市西条吉行東一丁目４番１４号","","","","","","","届出","",""
"009201","fBiz00000129180000000014","栃木県","宇都宮市","ダイソーヨークタウン宇都宮針ヶ谷店","ダイソー　ヨークタウンウツノミヤハリガヤテン","⑬ その他の食料・飲料販売業","小売業","栃木県宇都宮市針ケ谷町字新田４７２－６","",36.486316,139.852167,"","株式会社大創産業","7240001022681","広島県東広島市西条吉行東一丁目４番１４号","","","","","","","届出","",""
"009201","fBiz00000129180000000015","栃木県","宇都宮市","ダイソー宇都宮ゆいの杜店","ダイソー　ウツノミヤユイノモリテン","⑬ その他の食料・飲料販売業","小売業","栃木県宇都宮市ゆいの杜６丁目１８－２９","",36.567892,139.997229,"","株式会社大創産業","7240001022681","広島県東広島市西条吉行東一丁目４番１４号","","","","","","","届出","",""
"009201","fBiz00000129180000000016","栃木県","宇都宮市","ダイソー　ミュゼ豊郷台店","ダイソー　ミュゼトヨサトダイテン","⑬ その他の食料・飲料販売業","小売業","栃木県宇都宮市豊郷台２－８７","豊郷台ショッピングセンターミュゼ２階",36.604748,139.884649,"","株式会社大創産業","7240001022681","広島県東広島市西条吉行東一丁目４番１４号","","","","","","","届出","",""
"009201","fBiz00000129180000000120","栃木県","宇都宮市","ダイソー　インターパーク宇都宮店","ダイソー　インターパークウツノミヤテン","⑬ その他の食料・飲料販売業","小売業","栃木県宇都宮市インターパーク４丁目１－２","インターパーク内",36.495903,139.905400,"","株式会社大創産業","7240001022681","広島県東広島市西条吉行東一丁目４番１４号","","","","","","","届出","",""
"009201","fBiz00000129180000000234","栃木県","宇都宮市","ダイソー　ヨークベニマル西川田店","ダイソー　ヨークベニマルニシカワダテン","⑬ その他の食料・飲料販売業","小売業","栃木県宇都宮市西川田町９２０ー２","",36.525650,139.851221,"","株式会社大創産業","7240001022681","広島県東広島市西条吉行東一丁目４番１４号","","","","","","","届出","",""
"009201","fBiz00000129180000000599","栃木県","宇都宮市","ダイソー　アクロスプラザ宝木店","ダイソー　アクロスプラザタカラギテン","⑬ その他の食料・飲料販売業","","栃木県宇都宮市細谷町２６０１－４","",36.584991,139.852407,"","株式会社大創産業","7240001022681","広島県東広島市西条吉行東一丁目４番１４号","","","","","","","届出","",""
"009201","fBiz00000129180000000674","栃木県","宇都宮市","ダイソー　カルナ駅東店","ダイソー　カルナエキヒガシテン","⑬ その他の食料・飲料販売業","","栃木県宇都宮市宿郷３－１６－３　","２階",36.555328,139.908022,"","株式会社大創産業","7240001022681","広島県東広島市西条吉行東一丁目４番１４号","","","","","","","届出","",""
"009201","fBiz00000129180000002077","栃木県","宇都宮市","ダイソー　ヨークベニマル石井店","ダイソー　ヨークベニマルイシイテン","⑬ その他の食料・飲料販売業","小売業","栃木県宇都宮市石井町３３５１－１","",36.529063,139.921931,"","株式会社大創産業","7240001022681","広島県東広島市西条吉行東一丁目４番１４号","","","","","","","届出","",""
"009201","fBiz00000131720000000127","栃木県","宇都宮市","ニチイキッズ元今泉保育園","ニチイキッズモトイマイズミホイクエン","㉖ 集団給食施設","","栃木県宇都宮市元今泉4丁目2-10","元今泉ハイタウン1F",36.562289,139.907741,"0286141501","株式会社ニチイ学館","3010001025868","東京都千代田区神田駿河台4丁目6番地","","","","","","","届出","",""
"009201","fBiz00000135490000000295","栃木県","宇都宮市","ファミリーマート宇都宮東簗瀬一丁目店","ファミリーマートウツノミヤヒガシヤナゼイッチョウメテン","① 飲食店営業","コンビニエンスストア","栃木県宇都宮市東簗瀬１丁目３６－１","",36.542314,139.901437,"028-610-2047","株式会社ファミリーマート","2013301010706","東京都港区芝浦三丁目１番２１号 ","A080689",2021/10/21,2021/10/21,2021/10/21,2027/11/30,"","許可","　",""
"009201","fBiz00000135490000000295","栃木県","宇都宮市","ファミリーマート宇都宮東簗瀬一丁目店","ファミリーマートウツノミヤヒガシヤナゼイッチョウメテン","⑩ コンビニエンスストア","コンビニエンスストア","栃木県宇都宮市東簗瀬１丁目３６－１","",36.542314,139.901437,"028-610-2047","株式会社ファミリーマート","2013301010706","東京都港区芝浦三丁目１番２１号 ","","","","","","","届出","",""
"009201","fBiz00000135490000000345","栃木県","宇都宮市","ファミリーマート宇都宮細谷一丁目店","ファミリーマートウツノミヤホソヤイッチョウメテン","① 飲食店営業","コンビニエンスストア","栃木県宇都宮市細谷１丁目６番３５号","",36.590842,139.854008,"028-650-0630","株式会社ファミリーマート","2013301010706","東京都港区芝浦三丁目１番２１号 ","A080962",2021/12/21,2021/12/21,2021/12/21,2028/02/29,"","許可","　",""
"009201","fBiz00000135490000000345","栃木県","宇都宮市","ファミリーマート宇都宮細谷一丁目店","ファミリーマートウツノミヤホソヤイッチョウメテン","⑩ コンビニエンスストア","コンビニエンスストア","栃木県宇都宮市細谷１丁目６番３５号","",36.590842,139.854008,"028-650-0630","株式会社ファミリーマート","2013301010706","東京都港区芝浦三丁目１番２１号 ","","","","","","","届出","",""
"009201","fBiz00000138970000000001","栃木県","宇都宮市","まごころの家宇都宮砥上北原","マゴコロノイエウツノミヤトガミキタハラ","㉖ 集団給食施設","デイサービス、サービス付き高齢者向け住宅","栃木県宇都宮市砥上町３３７番地2","",36.556621,139.842929,"0286665000","コンテック株式会社","4050001023173","茨城県日立市多賀町２丁目１０番７号","","","","","","","届出","",""
"009201","fBiz00000142260000000008","栃木県","宇都宮市","（株）ヨークベニマル石井店","ヨークベニマルイシイテン","③ 食肉販売業","スーパーマーケット","栃木県宇都宮市石井町３３５１－１","",36.529063,139.921931,"028-657-7149","株式会社ヨークベニマル","7380001006893","福島県郡山市谷島町5番42号","A080074",2021/06/17,2021/06/17,2021/06/17,2027/06/30,"","許可","　",""
"009201","fBiz00000142260000000008","栃木県","宇都宮市","（株）ヨークベニマル石井店","ヨークベニマルイシイテン","④ 魚介類販売業","スーパーマーケット","栃木県宇都宮市石井町３３５１－１","",36.529063,139.921931,"028-657-7149","株式会社ヨークベニマル","7380001006893","福島県郡山市谷島町5番42号","A080075",2021/06/17,2021/06/17,2021/06/17,2027/06/30,"","許可","　",""
"009201","fBiz00000142260000000008","栃木県","宇都宮市","ヨークベニマル石井店","ヨークベニマルイシイテン","⑪ 百貨店、総合スーパー","スーパーマーケット","栃木県宇都宮市石井町３３５１－１","",36.529063,139.921931,"028-657-7149","株式会社ヨークベニマル","7380001006893","福島県郡山市谷島町5番42号","","","","","","","届出","",""
"009201","fBiz00000142260000000009","栃木県","宇都宮市","ヨークベニマル戸祭店","ヨークベニマルトマツリテン","⑪ 百貨店、総合スーパー","スーパーマーケット","栃木県宇都宮市戸祭元町12番11号","",36.569396,139.878550,"028-650-6500","株式会社ヨークベニマル","7380001006893","福島県郡山市谷島町5番42号","","","","","","","届出","",""
"009201","fBiz00000142260000000020","栃木県","宇都宮市","（株）ヨークベニマル　細谷店","ヨークベニマル　ホソヤテン","③ 食肉販売業","スーパーマーケット","栃木県宇都宮市細谷町３７５－２","",36.589047,139.853526,"028-650-2449","株式会社ヨークベニマル","7380001006893","福島県郡山市谷島町5番42号","A080371",2021/08/30,2021/08/30,2021/08/30,2027/08/31,"","許可","　",""
"009201","fBiz00000142260000000020","栃木県","宇都宮市","（株）ヨークベニマル　細谷店","ヨークベニマル　ホソヤテン","④ 魚介類販売業","スーパーマーケット","栃木県宇都宮市細谷町３７５－２","",36.589047,139.853526,"028-650-2449","株式会社ヨークベニマル","7380001006893","福島県郡山市谷島町5番42号","A080372",2021/08/30,2021/08/30,2021/08/30,2027/08/31,"","許可","　",""
"009201","fBiz00000142260000000030","栃木県","宇都宮市","ヨークベニマル泉が丘店","ヨークベニマルイズミガオカテン","⑪ 百貨店、総合スーパー","スーパーマーケット","栃木県宇都宮市泉が丘6丁目１番44号","",36.568229,139.919123,"028-683-5051","株式会社ヨークベニマル","7380001006893","福島県郡山市谷島町5番42号","","","","","","","届出","",""
"009201","fBiz00000142260000000052","栃木県","宇都宮市","ヨークベニマル細谷店","ヨークベニマルホソヤテン","⑪ 百貨店、総合スーパー","スーパーマーケット","栃木県宇都宮市細谷町375番地2","",36.589047,139.853526,"028-650-2449","株式会社ヨークベニマル","7380001006893","福島県郡山市谷島町5番42号","","","","","","","届出","",""
"009201","fBiz00000142260000000053","栃木県","宇都宮市","（株）ヨークベニマル針ヶ谷店","ヨークベニマルハリガヤテン","⑪ 百貨店、総合スーパー","スーパーマーケット","栃木県宇都宮市針ケ谷町字新田472番地6","",36.486316,139.852167,"028-688-1161","株式会社ヨークベニマル","7380001006893","福島県郡山市谷島町5番42号","","","","","","","届出","",""
"009201","fBiz00000142260000000135","栃木県","宇都宮市","ヨークベニマル御幸ヶ原店","ヨークベニマルミユキガハラテン","⑪ 百貨店、総合スーパー","スーパーマーケット","栃木県宇都宮市御幸ケ原町50番1号","",36.592171,139.928200,"028-660-4900","株式会社ヨークベニマル","7380001006893","福島県郡山市谷島町5番42号","","","","","","","届出","",""
"009201","fBiz00000142260000000144","栃木県","宇都宮市","ヨークベニマル若松原店","ヨークベニマルワカマツバラテン","⑪ 百貨店、総合スーパー","スーパーマーケット","栃木県宇都宮市北若松原一丁目13番15号","",36.507165,139.866481,"028-645-4911","株式会社ヨークベニマル","7380001006893","福島県郡山市谷島町5番42号","","","","","","","届出","",""
"009201","fBiz00000142260000000188","栃木県","宇都宮市","ヨークベニマル簗瀬店","ヨークベニマルヤナゼテン","③ 食肉販売業","スーパーマーケット","栃木県宇都宮市城東１丁目８番１３号","",36.549533,139.900774,"028-651-3821","株式会社ヨークベニマル","7380001006893","福島県郡山市谷島町5番42号","A082796",2022/11/22,2022/11/22,2022/11/22,2028/11/30,"","許可","　",""
"009201","fBiz00000142260000000188","栃木県","宇都宮市","ヨークベニマル簗瀬店","ヨークベニマルヤナゼテン","④ 魚介類販売業","スーパーマーケット","栃木県宇都宮市城東１丁目８番１３号","",36.549533,139.900774,"028-651-3821","株式会社ヨークベニマル","7380001006893","福島県郡山市谷島町5番42号","A082797",2022/11/22,2022/11/22,2022/11/22,2028/11/30,"","許可","　",""
"009201","fBiz00000142260000000188","栃木県","宇都宮市","ヨークベニマル簗瀬店","ヨークベニマルヤナゼテン","⑪ 菓子製造業","スーパーマーケット","栃木県宇都宮市城東１丁目８番１３号","",36.549533,139.900774,"028-651-3821","株式会社ヨークベニマル","7380001006893","福島県郡山市谷島町5番42号","A082798",2022/11/22,2022/11/22,2022/11/22,2028/11/30,"","許可","　",""
"009201","fBiz00000142260000000188","栃木県","宇都宮市","ヨークベニマル簗瀬店","ヨークベニマルヤナゼテン","㉕ そうざい製造業","スーパーマーケット","栃木県宇都宮市城東１丁目８番１３号","",36.549533,139.900774,"028-651-3821","株式会社ヨークベニマル","7380001006893","福島県郡山市谷島町5番42号","A082799",2022/11/22,2022/11/22,2022/11/22,2028/11/30,"","許可","　",""
"009201","fBiz00000142260000000188","栃木県","宇都宮市","ヨークベニマル簗瀬店","ヨークベニマルヤナゼテン","⑪ 百貨店、総合スーパー","スーパーマーケット","栃木県宇都宮市城東１丁目８番１３号","",36.549533,139.900774,"028-651-3821","株式会社ヨークベニマル","7380001006893","福島県郡山市谷島町5番42号","","","","","","","届出","",""
"009201","fBiz00000142260000000222","栃木県","宇都宮市","ヨークベニマル今泉店","ヨークベニマルイマイズミテン","⑪ 百貨店、総合スーパー","スーパーマーケット","栃木県宇都宮市今泉町158番地1","",36.569693,139.900096,"028-600-7630","株式会社ヨークベニマル","7380001006893","福島県郡山市谷島町5番42号","","","","","","","届出","",""
