"012204","fBiz00000973860000000001","千葉県","船橋市","","","① 飲食店営業","中華定食店","","","","","","","","","第03-1249号",2021/10/27,2021/10/27,2021/10/27,2026/10/31,"","許可","　",""
"012204","fBiz00000975100000000001","千葉県","船橋市","Ｉｎｄｉａｎ　Ｒｅｓｔａｕｒａｎｔ　Ｂｈａｉｒａｂ　Ｓａｍｏｓａ","インディアンレストランバイラブサモサ","① 飲食店営業","インド料理店","千葉県船橋市薬円台５－３２－９　１Ｆ","",35.714776,140.043494,"047-469-3202","ＭＯＯＮ　株式会社","7011501019298","東京都荒川区東日暮里５－２２－１４　２Ｆ","第03-1243号",2021/10/28,2021/10/28,2021/10/28,2027/10/31,"","許可","　",""
"012204","fBiz00000980180000000002","千葉県","船橋市","","","① 飲食店営業","屋台","","","","","","","","","第03-1289号",2021/10/15,2021/10/15,2021/10/15,2026/10/31,"","許可","屋台、露店等での飲食店営業取扱要綱に規定する加熱及び非加熱食品のうち１品目及び飲料に限る",""
"012204","fBiz00000980180000000002","千葉県","船橋市","","","⑬ その他の食料・飲料販売業","屋台","","","","","","","","","","","","","","","届出","",""
"012204","fBiz00000981850000000001","千葉県","船橋市","ららぽーとTOKYO-BAY １階　LaLaSWEETS Fat Witch Bakery（食品催事）","ララポートトウキョウベイイッカイララスイーツファットウィッチベーカリーショクヒンサイジ","⑬ その他の食料・飲料販売業","催事","千葉県船橋市浜町２－１－１","１Ｆ　Ｄ１０１号室",35.679301,139.989817,"0570012784","リボン食品　株式会社","7120001059158","大阪府大阪市淀川区三津屋南３－１５－２８","","","","","","","届出","",""
"012204","fBiz00000982510000000001","千葉県","船橋市","株式会社　魚がし鎌形","カブシキガイシャウオガシカマガタ","④ 魚介類販売業","鮮魚仲卸業","千葉県船橋市市場１－８－１","船橋市地方卸売市場内３３",35.705298,139.994908,"047-424-4000","株式会社魚がし鎌形","6040001064919","千葉県船橋市市場１丁目８番１号","第03-1008号",2021/09/30,2021/09/30,2021/09/30,2027/09/30,"","許可","　",""
"012204","fBiz00000984030000000001","千葉県","船橋市","ｎａｔｕｒｉ","プラスナチュリ","⑪ 菓子製造業","ネット販売、店舗販売","千葉県船橋市本町２ー２４－１２","",35.697845,139.982833,"090-8018-7272","ミーアップ　合同会社","8040003015777","千葉県船橋市本町２－２４－１２","第03-1022号",2021/09/21,2021/09/21,2021/09/21,2027/09/30,"","許可","　",""
"012204","fBiz00000986590000000001","千葉県","船橋市","","","① 飲食店営業","キッチンカー","","","","","","","","","第03-1244号",2021/09/16,2021/09/16,2021/09/16,2026/09/30,"","許可","自動車を利用して行う営業",""
"012204","fBiz00000987010000000001","千葉県","船橋市","ヨークマート藤原店","ヨークマートフジワラテン","⑪ 百貨店、総合スーパー","","千葉県船橋市藤原3丁目36番1号","",35.736781,139.978952,"047-429-4411","株式会社　ヨーク","8010001088324","東京都江東区青海2丁目5番10号　テレコムセンタービル西棟12階","","","","","","","届出","",""
"012204","fBiz00000987010000000002","千葉県","船橋市","株式会社ヨーク　ヨークマート　藤原店","カブシキガイシャヨーク　ヨークマート　フジワラテン　","① 飲食店営業","","千葉県船橋市藤原3丁目36番1号","",35.736766,139.978915,"047-429-4411","株式会社　ヨーク","8010001088324","東京都江東区青海2丁目5番10号　テレコムセンタービル西棟12階","第04-404号",2022/10/21,2022/10/21,2022/10/21,2028/10/31,"","許可","",""
"012204","fBiz00000987080000000001","千葉県","船橋市","RF1","アールエフワン","① 飲食店営業","惣菜屋","千葉県船橋市本町7丁目1番1号","東武百貨店B１",35.702449,139.984470,"047-426-3867","株式会社 ロック・フィールド","4140001002820","兵庫県神戸市東灘区魚崎浜町15番地２","第03-1246号",2021/09/30,2021/09/30,2021/09/30,2027/09/30,"","許可","　",""
"012204","fBiz00000990170000000014","千葉県","船橋市","山田屋まんじゅう　東武船橋店","ヤマダヤマンジュウ　トウブフナバシテン","⑬ その他の食料・飲料販売業","","千葉県船橋市本町7丁目1-1","東武船橋店　B1F",35.702449,139.984470,"047-422-1100","株式会社山田屋","6500001004217","愛媛県松山市正岡神田甲251","","","","","","","届出","",""
"012204","fBiz00000990400000000001","千葉県","船橋市","","","① 飲食店営業","コンビニ","","","","","","","","","第03-1245号",2021/09/21,2021/09/21,2021/09/21,2028/09/30,"","許可","　",""
"012204","fBiz00000990400000000001","千葉県","船橋市","","","⑩ コンビニエンスストア","コンビニ","","","","","","","","","","","","","","","届出","",""
"012204","fBiz00000990480000000001","千葉県","船橋市","花束（ブーケ）","ブーケ","① 飲食店営業","スナック","千葉県船橋市丸山１－１８－１５","",35.743954,139.990409,"047-439-4157","磯野洋史","","千葉県鎌ケ谷市西道野辺３－２３－２０９","第03-1248号",2021/10/21,2021/10/21,2021/10/21,2027/10/31,"","許可","　",""
"012204","fBiz00000991230000000027","千葉県","船橋市","はま寿司　船橋海神店","ハマズシ　フナバシカイジンテン","① 飲食店営業","寿司屋","千葉県船橋市海神町西1丁目1206番地1","",35.702863,139.966453,"047-420-8877","株式会社はま寿司","7010401052896","東京都港区港南二丁目18番1号","第04-214号",2022/07/22,2022/07/22,2022/07/22,2029/07/31,"","許可","　",""
"012204","fBiz00000991790000000001","千葉県","船橋市","オカン餃子","オカンギョウザ","⑬ その他の食料・飲料販売業","","千葉県船橋市馬込西2-18-12","",35.740512,139.992523,"","WIBJAPAN株式会社","9040001107699","千葉県千葉市美浜区高州3-14-4","","","","","","","届出","",""
"012204","fBiz00000992920000000002","千葉県","船橋市","","","① 飲食店営業","レストラン","","","","","","","","","第03-1448号",2021/12/24,2021/12/24,2021/12/24,2027/12/31,"","許可","　",""
"012204","fBiz00000992920000000006","千葉県","船橋市","","","⑪ 菓子製造業","レストラン","","","","","","","","","第03-1043号",2022/03/31,2022/03/31,2022/03/31,2028/03/31,"","許可","　",""
"012204","fBiz00000993050000000001","千葉県","船橋市","","","⑦ 野菜果物販売業","青果卸し","","","","","","","","","","","","","","","届出","",""
"012204","fBiz00000995670000000001","千葉県","船橋市","学校法人　平野学園　印内保育園","ガッコウホウジン　ヒラノガクエン　インナイホイクエン","㉖ 集団給食施設","保育園給食","","","","","0474338368","","","","","","","","","","届出","",""
"012204","fBiz00000996120000000001","千葉県","船橋市","","","③ 乳類販売業","","","","","","","","","","","","","","","","届出","",""
"012204","fBiz00000996120000000002","千葉県","船橋市","","","③ 乳類販売業","","","","","","","","","","","","","","","","届出","",""
"012204","fBiz00000997030000000002","千葉県","船橋市","ウエルシア習志野台5丁目店","ウエルシアナラシノダイゴチョウメテン","⑪ 百貨店、総合スーパー","ドラックストア","千葉県船橋市習志野台5-40-36","",35.719130,140.053304,"047-496-6977","ウエルシア薬局株式会社","3030001002411","東京都千代田区外神田2-2-15","","","","","","","届出","",""
"012204","fBiz00000998860000000001","千葉県","船橋市","","","① 飲食店営業","移動販売車","","","","","","","","","第03-1267号",2021/09/29,2021/09/29,2021/09/29,2026/09/30,"","許可","自動車を利用して行う営業",""
"012204","fBiz00001001710000000001","千葉県","船橋市","ウエルシア船橋習志野台店","ウエルシアフナバシナラシノダイテン","⑪ 百貨店、総合スーパー","ドラッグストア","千葉県船橋市習志野台2-14-17","",35.726819,140.040527,"047-490-1061","ウエルシア薬局株式会社","3030001002411","東京都千代田区外神田2-2-15","","","","","","","届出","",""
"012204","fBiz00001001710000000001","千葉県","船橋市","ウエルシア船橋習志野台店","ウエルシアフナバシナラシノダイテン","⑫ 自動販売機による販売業（コップ式自動販売機（自動洗浄・屋内設置）及び営業許可の対象となる自動販売機を除く）","ドラッグストア","千葉県船橋市習志野台2-14-17","",35.726819,140.040527,"047-490-1061","ウエルシア薬局株式会社","3030001002411","東京都千代田区外神田2-2-15","","","","","","","届出","",""
"012204","fBiz00001001940000000001","千葉県","船橋市","ウエルシア船橋新高根店","ウエルシアフナバシシンタカネ","⑪ 百貨店、総合スーパー","ドラッグストア","千葉県船橋市新高根6-19-19","",35.724003,140.025523,"047-490-1300","ウエルシア薬局株式会社","3030001002411","東京都千代田区外神田2-2-15","","","","","","","届出","",""
"012204","fBiz00001003800000000001","千葉県","船橋市","有限会社　宮間商店","ユウゲンガイシャミヤマショウテン","④ 魚介類販売業","仲卸","千葉県船橋市市場１－８－１","船橋市地方卸売市場内　３７、３８",35.705298,139.994908,"047-422-6995","有限会社　宮間商店","8040002025760","千葉県船橋市市場１－８－１","第03-1010号",2021/10/19,2021/10/19,2021/10/19,2027/10/31,"","許可","　",""
"012204","fBiz00001004020000000002","千葉県","船橋市","","","① 飲食店営業","カフェ","","","","","","","","","第04-286号",2022/08/31,2022/08/31,2022/08/31,2028/08/31,"","許可","　",""
"012204","fBiz00001005310000000007","千葉県","船橋市","こだわりもん一家　津田沼店","コダワリモンイッカ　ツダヌマテン","① 飲食店営業","","千葉県船橋市前原西2丁目14番1号","ダイヤパレス津田沼１F",35.692284,140.020689,"047-470-3535","株式会社一家ダイニングプロジェクト","2040001027978","千葉県市川市八幡二丁目５番６号","第03-1709号",2022/04/15,2022/04/15,2022/04/15,2028/04/30,"","許可","　",""
"012204","fBiz00001005310000000013","千葉県","船橋市","寿司トおでん　にのや　船橋店","スシトオデン　ニノヤ　フナバシテン","① 飲食店営業","居酒屋","千葉県船橋市本町4丁目16番35号","第4シンエイビル2F",35.700527,139.987217,"047-424-5785","株式会社一家ダイニングプロジェクト","2040001027978","千葉県市川市八幡二丁目５番６号","第04-242号",2022/08/17,2022/08/17,2022/08/17,2028/08/31,"","許可","　",""
"012204","fBiz00001005310000000014","千葉県","船橋市","こだわりもん一家　西船橋店","コダワリモンイッカ　ニシフナバシテン","① 飲食店営業","居酒屋","千葉県船橋市西船4丁目24番4号","東和ビル別館",35.708546,139.959171,"047-440-8711","株式会社一家ダイニングプロジェクト","2040001027978","千葉県市川市八幡二丁目５番６号","第04-243号",2022/08/26,2022/08/26,2022/08/26,2028/08/31,"","許可","　",""
"012204","fBiz00001005330000000012","千葉県","船橋市","ルピシア   津田沼店  ","ルピシア　ツダヌマテン","⑬ その他の食料・飲料販売業","物販","千葉県船橋市前原西2-18-1 ","津田沼パルコA館 1F",35.692256,140.022068,"047-470-0866","","","","","","","","","","届出","",""
"012204","fBiz00001005330000000014","千葉県","船橋市","ルピシア  ららぽーと船橋店","ルピシア  ララポートフナバシテン","⑬ その他の食料・飲料販売業","物販","千葉県船橋市浜町2丁目1番1号","ららぽーとTOKYO-BAY 北館 1F",35.679301,139.989817,"047-495-1618","","","","","","","","","","届出","",""
"012204","fBiz00001005720000000001","千葉県","船橋市","","","㉖ 集団給食施設","保育園給食","","","","","","","","","","","","","","","届出","",""
"012204","fBiz00001006740000000001","千葉県","船橋市","あんこのやまか","アンコノヤマカ","⑬ その他の食料・飲料販売業","販売","千葉県船橋市山手１－１－８","",35.712585,139.978117,"047-420-7300","株式会社やまか","4040001083219","千葉県松戸市北松戸２－６－１１　共栄マンション１Ｆ","","","","","","","届出","",""
"012204","fBiz00001006760000000001","千葉県","船橋市","","","① 飲食店営業","居酒屋","","","","","","","","","第03-1512号",2022/03/24,2022/03/24,2022/03/24,2028/03/31,"","許可","　",""
"012204","fBiz00001006760000000002","千葉県","船橋市","","","① 飲食店営業","居酒屋","","","","","","","","","第04-77号",2022/05/27,2022/05/27,2022/05/27,2028/05/31,"","許可","　",""
"012204","fBiz00001007260000000003","千葉県","船橋市","船橋市立高根東小学校","フナバシシリツタカネヒガシショウガッコウ","㉖ 集団給食施設","","千葉県船橋市新高根１－１７－１","",35.725109,140.022349,"047-464-2345","船橋市","6000020122041","千葉県船橋市湊町2丁目10番25号","","","","","","","届出","",""
"012204","fBiz00001007260000000006","千葉県","船橋市","船橋市立湊町小学校","フナバシシリツミナトチョガッコウガッコウ","㉖ 集団給食施設","","千葉県船橋市湊町1-16-5","",35.693189,139.986330,"047-431-4781","船橋市","6000020122041","千葉県船橋市湊町2丁目10番25号","","","","","","","届出","",""
"012204","fBiz00001007260000000007","千葉県","船橋市","船橋特別支援学校　高根台校舎","フナバシトクベツシエンガッコウ　タカネダイコウシャ","㉖ 集団給食施設","","千葉県船橋市高根台2－1－1","",35.734916,140.028689,"0474663631","船橋市","6000020122041","千葉県船橋市湊町2丁目10番25号","","","","","","","届出","",""
"012204","fBiz00001007260000000008","千葉県","船橋市","船橋市立薬円台小学校","フナバシシリツヤクエンダイショウガッコウ","㉖ 集団給食施設","","千葉県船橋市薬円台４－５－１","",35.713362,140.044882,"0474664135","船橋市","6000020122041","千葉県船橋市湊町2丁目10番25号","","","","","","","届出","",""
"012204","fBiz00001007260000000009","千葉県","船橋市","船橋市立夏見台小学校","フナバシシリツナツミダイショウガッコウ","㉖ 集団給食施設","","千葉県船橋市夏見台2-12-1","",35.721945,139.994277,"0474382000","船橋市","6000020122041","千葉県船橋市湊町2丁目10番25号","","","","","","","届出","",""
"012204","fBiz00001007260000000010","千葉県","船橋市","豊富小学校","トヨトミショウガッコウ","㉖ 集団給食施設","","千葉県船橋市船橋市豊富町１","",35.761063,140.066397,"047-457-1565","船橋市","6000020122041","千葉県船橋市湊町2丁目10番25号","","","","","","","届出","",""
"012204","fBiz00001007260000000011","千葉県","船橋市","船橋市立南本町小学校","フナバシシリツミナミホンチョウショウガッコウ","㉖ 集団給食施設","","千葉県船橋市栄町１－７－１","",35.694168,139.976010,"047-433-1864","船橋市","6000020122041","千葉県船橋市湊町2丁目10番25号","","","","","","","届出","",""
"012204","fBiz00001007260000000012","千葉県","船橋市","船橋市立峰台小学校","フナバシシリツミネダイショウガッコウ","㉖ 集団給食施設","","千葉県船橋市宮本6丁目33番1号","",35.699797,139.997183,"047-422-8124","船橋市","6000020122041","千葉県船橋市湊町2丁目10番25号","","","","","","","届出","",""
"012204","fBiz00001007260000000016","千葉県","船橋市","高根台第三小学校","タカネダイダイサンショウガッコウ","㉖ 集団給食施設","","千葉県船橋市高根台1-4-1","",35.729429,140.032422,"","船橋市","6000020122041","千葉県船橋市湊町2丁目10番25号","","","","","","","届出","",""
"012204","fBiz00001007260000000018","千葉県","船橋市","船橋特別支援学校　高根台校舎","フナバシトクベツシエン　タカネダイコウシャ","㉖ 集団給食施設","","千葉県船橋市高根台2-1-1","",35.734916,140.028689,"0474663631","船橋市","6000020122041","千葉県船橋市湊町2丁目10番25号","","","","","","","届出","",""
"012204","fBiz00001007380000000001","千葉県","船橋市","有限会社まぐろ湊屋","ユウゲンカイシャマグロミナトヤ","④ 魚介類販売業","魚介類販売業、仲卸","千葉県船橋市市場1-8-1","船橋市地方卸売市場内　3",35.705298,139.994908,"047-423-1489","有限会社まぐろ湊屋","9040002025330","千葉県船橋市本町３丁目１４番１３号","第03-1011号",2021/10/19,2021/10/19,2021/10/19,2027/10/31,"","許可","　",""
"012204","fBiz00001007980000000001","千葉県","船橋市","竹寿司","タケズシ","① 飲食店営業","すし屋","千葉県船橋市松が丘３－５－１３","",35.734316,140.047235,"047-463-5592","根津猛","","千葉県船橋市松が丘３－５－１３","第03-1252号",2021/10/21,2021/10/21,2021/10/21,2027/10/31,"","許可","　",""
"012204","fBiz00001008460000000001","千葉県","船橋市","ミートパーティー船橋南口店","ミートパーティーフナバシミナミグチテン","① 飲食店営業","肉バル","千葉県船橋市本町４－３－１９","錦屋ビル７Ｆ",35.700537,139.986348,"047-411-7156","古谷商事株式会社","2011101091553","千葉県船橋市本町４－４３－２０","第03-1254号",2021/10/05,2021/10/05,2021/10/05,2027/10/31,"","許可","　",""
"012204","fBiz00001008910000000001","千葉県","船橋市","","","⑯ コーヒー製造・加工業（飲料の製造を除く。）","コーヒー製造","","","","","","","","","","","","","","","届出","",""
"012204","fBiz00001010290000000001","千葉県","船橋市","上海点心　八饅宴","シャンハイテンシンハチマンエン","① 飲食店営業","居酒屋","千葉県船橋市本町４－４５－１３","セブン本町四番館Ｂ",35.700486,139.986831,"047-409-7775","合同会社　丸照","8040003005464","千葉県船橋市本町４－４０－３神戸ビル1階","第03-1256号",2021/09/30,2021/09/30,2021/09/30,2027/09/30,"","許可","　",""
"012204","fBiz00001015460000000001","千葉県","船橋市","","","① 飲食店営業","居酒屋","","","","","","","","","第03-1257号",2021/10/26,2021/10/26,2021/10/26,2027/10/31,"","許可","　",""
"012204","fBiz00001016800000000001","千葉県","船橋市","","","㉖ 集団給食施設","保育園給食","","","","","","","","","","","","","","","届出","",""
"012204","fBiz00001016800000000002","千葉県","船橋市","","","㉖ 集団給食施設","保育園給食","","","","","","","","","","","","","","","届出","",""
"012204","fBiz00001016800000000004","千葉県","船橋市","","","㉖ 集団給食施設","保育園給食","","","","","","","","","","","","","","","届出","",""
"012204","fBiz00001016800000000005","千葉県","船橋市","","","㉖ 集団給食施設","保育園給食","","","","","","","","","","","","","","","届出","",""
"012204","fBiz00001018760000000015","千葉県","船橋市","スーパースロットＺＸ","スーパースロットゼクス","⑬ その他の食料・飲料販売業","","千葉県船橋市習志野4-16-7","",35.708224,140.058641,"047-407-2334","株式会社ロッテ","1011101044248","東京都新宿区西新宿3丁目20番1号","","","","","","","届出","",""
"012204","fBiz00001018760000000024","千葉県","船橋市","(株)デイリートランスポート船橋","カブシキカイシャデイリートランスポートフナバシ","⑬ その他の食料・飲料販売業","","千葉県船橋市高瀬町24-3","",35.669423,139.994628,"047-435-1131","株式会社ロッテ","1011101044248","東京都新宿区西新宿3丁目20番1号","","","","","","","届出","",""
"012204","fBiz00001018760000000251","千葉県","船橋市","フジフーズ(株)新船橋第二工場","フジフーズカブシンフナバシダイニコウジョウ","⑫ 自動販売機による販売業（コップ式自動販売機（自動洗浄・屋内設置）及び営業許可の対象となる自動販売機を除く）","","千葉県船橋市高瀬町24-3","4階食堂",35.669423,139.994628,"","株式会社ロッテ","1011101044248","東京都新宿区西新宿3丁目20番1号","","","","","","","届出","",""
"012204","fBiz00001018760000000269","千葉県","船橋市","スパ＆スポーツユアー習志野","スパアンドスポーツユアーナラシノ","⑫ 自動販売機による販売業（コップ式自動販売機（自動洗浄・屋内設置）及び営業許可の対象となる自動販売機を除く）","","千葉県船橋市習志野台1-19-10","",35.727752,140.039515,"","株式会社ロッテ","1011101044248","東京都新宿区西新宿3丁目20番1号","","","","","","","届出","",""
"012204","fBiz00001018760000000276","千葉県","船橋市","イオンフードサプライ（株）南関東センター","イオンフードサプライカブミナミカントウセンター","⑫ 自動販売機による販売業（コップ式自動販売機（自動洗浄・屋内設置）及び営業許可の対象となる自動販売機を除く）","","千葉県船橋市高瀬町24-12","",35.671717,139.992623,"","株式会社ロッテ","1011101044248","東京都新宿区西新宿3丁目20番1号","","","","","","","届出","",""
"012204","fBiz00001018760000000283","千葉県","船橋市","イルサローネ習志野店","イルサローネナラシノテン","⑫ 自動販売機による販売業（コップ式自動販売機（自動洗浄・屋内設置）及び営業許可の対象となる自動販売機を除く）","","千葉県船橋市習志野4-11-14","",35.706817,140.059443,"","株式会社ロッテ","1011101044248","東京都新宿区西新宿3丁目20番1号","","","","","","","届出","",""
"012204","fBiz00001018760000000581","千葉県","船橋市","おおのやフェリア","オオノヤフェリア","⑫ 自動販売機による販売業（コップ式自動販売機（自動洗浄・屋内設置）及び営業許可の対象となる自動販売機を除く）","","千葉県船橋市市場5-16-23","",35.704093,140.002391,"","株式会社ロッテ","1011101044248","東京都新宿区西新宿3丁目20番1号","","","","","","","届出","",""
"012204","fBiz00001018760000000589","千葉県","船橋市","（株）ミルックス　本社機材センター","カブミルックス　ホンシャキザイセンター","⑫ 自動販売機による販売業（コップ式自動販売機（自動洗浄・屋内設置）及び営業許可の対象となる自動販売機を除く）","","千葉県船橋市南海神2-3","",35.695650,139.964249,"","株式会社ロッテ","1011101044248","東京都新宿区西新宿3丁目20番1号","","","","","","","届出","",""
"012204","fBiz00001018760000000732","千葉県","船橋市","サテライト船橋場外売店","サテライトフナバシジョウガイバイテン","⑫ 自動販売機による販売業（コップ式自動販売機（自動洗浄・屋内設置）及び営業許可の対象となる自動販売機を除く）","","千葉県船橋市若松1-2-25","",35.687390,139.995895,"","株式会社ロッテ","1011101044248","東京都新宿区西新宿3丁目20番1号","","","","","","","届出","",""
"012204","fBiz00001018760000000733","千葉県","船橋市","サテライト船橋場外車券売場","サテライトフナバシジョウガイシャケンバイテン","⑫ 自動販売機による販売業（コップ式自動販売機（自動洗浄・屋内設置）及び営業許可の対象となる自動販売機を除く）","","千葉県船橋市若松1-2-25","",35.687390,139.995895,"","株式会社ロッテ","1011101044248","東京都新宿区西新宿3丁目20番1号","","","","","","","届出","",""
"012204","fBiz00001018760000000737","千葉県","船橋市","船橋競馬場場内５階特別観覧席","フナバシケイバジョウジョウナイゴカイトクベツカンランセキ","⑫ 自動販売機による販売業（コップ式自動販売機（自動洗浄・屋内設置）及び営業許可の対象となる自動販売機を除く）","","千葉県船橋市若松1-2-1","",35.685947,139.994507,"","株式会社ロッテ","1011101044248","東京都新宿区西新宿3丁目20番1号","","","","","","","届出","",""
"012204","fBiz00001018760000000747","千葉県","船橋市","バッティングビビット","バッティングビビット","⑫ 自動販売機による販売業（コップ式自動販売機（自動洗浄・屋内設置）及び営業許可の対象となる自動販売機を除く）","","千葉県船橋市浜町2-2-7","ビビットスクエアヨンカイ",35.687501,139.993265,"","株式会社ロッテ","1011101044248","東京都新宿区西新宿3丁目20番1号","","","","","","","届出","",""
