"013123","fBiz00001012260000000001","東京都","江戸川区","わんぱくすまいる保育園","ワンパクスマイルホイクエン","㉖ 集団給食施設","","東京都江戸川区松島三丁目３９－１５","",35.711716,139.864077,"0358793714","一般社団法人わんぱくSMILE","3011705001163","東京都江戸川区松島４丁目２９番７号","","","","","","","届出","",""
"013123","fBiz00001014390000000001","東京都","江戸川区","ウエルシア江戸川松本店","ウエルシアエドガワマツモトテン","⑪ 百貨店、総合スーパー","ドラッグストア","東京都江戸川区松本1-16-21","",35.715192,139.876071,"03-5678-8262","ウエルシア薬局株式会社","3030001002411","東京都千代田区外神田2-2-15","","","","","","","届出","",""
"013123","fBiz00001014850000000001","東京都","江戸川区","","","㉖ 集団給食施設","","","","","","","","","","","","","","","","届出","",""
"013123","fBiz00001014850000000004","東京都","江戸川区","","","㉖ 集団給食施設","","","","","","","","","","","","","","","","届出","",""
"013123","fBiz00001015920000000001","東京都","江戸川区","高橋物産株式会社","タカハシブッサンカブシキガイシャ","⑬ その他の食料・飲料販売業","その他の食料・飲料販売業","東京都江戸川区鹿骨2-38-13","",35.706129,139.895882,"","高橋物産株式会社","2011701004567","東京都江戸川区鹿骨2-38-13","","","","","","","届出","",""
"013123","fBiz00001018620000000001","東京都","江戸川区","First stepⅡ","ファーストステップツー","㉖ 集団給食施設","","東京都江戸川区西小岩3-26-6","",35.738503,139.877096,"03-6657-8652","","","","","","","","","","届出","",""
"013123","fBiz00001018760000000249","東京都","江戸川区","島忠ホームズ葛西店","シマチュウホームズカサイテン","⑫ 自動販売機による販売業（コップ式自動販売機（自動洗浄・屋内設置）及び営業許可の対象となる自動販売機を除く）","","東京都江戸川区東葛西9-3-6","",35.653853,139.882790,"","株式会社ロッテ","1011101044248","東京都新宿区西新宿3丁目20番1号","","","","","","","届出","",""
"013123","fBiz00001018760000000272","東京都","江戸川区","ケーズデンキ西葛西","ケーズデンキニシカサイ","⑫ 自動販売機による販売業（コップ式自動販売機（自動洗浄・屋内設置）及び営業許可の対象となる自動販売機を除く）","","東京都江戸川区西葛西4-2-18","",35.667003,139.863765,"","株式会社ロッテ","1011101044248","東京都新宿区西新宿3丁目20番1号","","","","","","","届出","",""
"013123","fBiz00001018760000000560","東京都","江戸川区","ＪＲ葛西臨海公園駅駅前広場エスカレーター横","ジェーアールカサイリンカイコウエンエキエキマエヒロバエスカレーターヨコ","⑫ 自動販売機による販売業（コップ式自動販売機（自動洗浄・屋内設置）及び営業許可の対象となる自動販売機を除く）","","東京都江戸川区臨海町6-2","",35.642388,139.860280,"","株式会社ロッテ","1011101044248","東京都新宿区西新宿3丁目20番1号","","","","","","","届出","",""
"013123","fBiz00001018760000000566","東京都","江戸川区","おおのやグループ　クロノス店","オオノヤグループ　クロノステン","⑫ 自動販売機による販売業（コップ式自動販売機（自動洗浄・屋内設置）及び営業許可の対象となる自動販売機を除く）","","東京都江戸川区西小岩1-22-18","",35.732933,139.880516,"","株式会社ロッテ","1011101044248","東京都新宿区西新宿3丁目20番1号","","","","","","","届出","",""
"013123","fBiz00001018760000000578","東京都","江戸川区","コナミスポーツジュニアスクール西葛西","コナミスポーツジュニアスクールニシカサイ","⑫ 自動販売機による販売業（コップ式自動販売機（自動洗浄・屋内設置）及び営業許可の対象となる自動販売機を除く）","","東京都江戸川区西葛西6-13-7","第７山秀ビル５階",35.663708,139.859031,"","株式会社ロッテ","1011101044248","東京都新宿区西新宿3丁目20番1号","","","","","","","届出","",""
"013123","fBiz00001018760000000580","東京都","江戸川区","おおのやオックス本一色","オオノヤオックスホンイッシキ","⑫ 自動販売機による販売業（コップ式自動販売機（自動洗浄・屋内設置）及び営業許可の対象となる自動販売機を除く）","","東京都江戸川区本一色3-40-15","",35.721107,139.875315,"","株式会社ロッテ","1011101044248","東京都新宿区西新宿3丁目20番1号","","","","","","","届出","",""
"013123","fBiz00001018760000000582","東京都","江戸川区","おおのやカイノスネオス","オオノヤカイノスネオス","⑫ 自動販売機による販売業（コップ式自動販売機（自動洗浄・屋内設置）及び営業許可の対象となる自動販売機を除く）","","東京都江戸川区西小岩1-27-31","",35.734078,139.882239,"","株式会社ロッテ","1011101044248","東京都新宿区西新宿3丁目20番1号","","","","","","","届出","",""
"013123","fBiz00001018760000000757","東京都","江戸川区","ロッテ葛西ゴルフ場２Ｆ入口","ロッテカサイゴルフジョウニエフイリグチ","⑫ 自動販売機による販売業（コップ式自動販売機（自動洗浄・屋内設置）及び営業許可の対象となる自動販売機を除く）","","東京都江戸川区臨海町2-4-2","",35.650337,139.857396,"","株式会社ロッテ","1011101044248","東京都新宿区西新宿3丁目20番1号","","","","","","","届出","",""
"013123","fBiz00001021200000000045","東京都","江戸川区","アコレ西葛西大橋通り店","アコレニシカイサイオオハシドオリテン","⑪ 百貨店、総合スーパー","","東京都江戸川区西葛西6-27-1７","Ｓ・Ｅ・ＳＱＵＡＲＥ",35.662183,139.862222,"03-5667-5313","株式会社ビッグ・エー","2011401010881","東京都板橋区大山東町２５番１３号","","","","","","","届出","",""
"013123","fBiz00001021200000000072","東京都","江戸川区","アコレ瑞江２丁目店","アコレミズエニチョウメテン","⑪ 百貨店、総合スーパー","","東京都江戸川区瑞江2-7-3","ラ・ロッサミエル１階",35.694189,139.895883,"03-5664-1131","株式会社ビッグ・エー","2011401010881","東京都板橋区大山東町２５番１３号","","","","","","","届出","",""
"013123","fBiz00001021200000000081","東京都","江戸川区","アコレ京成小岩駅南店","アコレケイセイコイワエキミナミテン","⑪ 百貨店、総合スーパー","","東京都江戸川区北小岩2-7-2","",35.741535,139.882729,"03-5622-0620","株式会社ビッグ・エー","2011401010881","東京都板橋区大山東町２５番１３号","","","","","","","届出","",""
"013123","fBiz00001021200000000087","東京都","江戸川区","アコレ江戸川松島３丁目店","アコレエドガワマツシマサンチョウメテン","⑪ 百貨店、総合スーパー","","東京都江戸川区松島3-48-7","伊東ビル若松レジデンス１階",35.710520,139.865494,"03-5879-1921","株式会社ビッグ・エー","2011401010881","東京都板橋区大山東町２５番１３号","","","","","","","届出","",""
"013123","fBiz00001021200000000106","東京都","江戸川区","アコレ西葛西店","アコレニシカサイテン","⑪ 百貨店、総合スーパー","","東京都江戸川区西葛西6-17-1","ﾌｼﾞﾏﾝｼｮﾝ第2",35.663133,139.859609,"03-3804-2511","株式会社ビッグ・エー","2011401010881","東京都板橋区大山東町２５番１３号","","","","","","","届出","",""
"013123","fBiz00001021200000000107","東京都","江戸川区","アコレ一之江３丁目店","アコレイチノエサンチョウメテン","⑪ 百貨店、総合スーパー","","東京都江戸川区一之江3-2-38","妙見屋ビル",35.687008,139.883391,"03-5678-6330","株式会社ビッグ・エー","2011401010881","東京都板橋区大山東町２５番１３号","","","","","","","届出","",""
"013123","fBiz00001021200000000108","東京都","江戸川区","アコレ江戸川松本店","アコレエドガワマツモトテン","⑪ 百貨店、総合スーパー","","東京都江戸川区松本1-3-2","ダイイチハイム",35.714748,139.874884,"03-5879-0721","株式会社ビッグ・エー","2011401010881","東京都板橋区大山東町２５番１３号","","","","","","","届出","",""
"013123","fBiz00001021810000000028","東京都","江戸川区","FEALDS","フィールズ","㉕ 行商","","","","","","","阿部賢","","","","","","","","","届出","",""
"013123","fBiz00001022060000000002","東京都","江戸川区","","","㉖ 集団給食施設","集団給食施設","","","","","","","","","","","","","","","届出","",""
"013123","fBiz00001022060000000003","東京都","江戸川区","","","㉖ 集団給食施設","集団給食施設","","","","","","","","","","","","","","","届出","",""
"013123","fBiz00001022060000000007","東京都","江戸川区","","","㉖ 集団給食施設","集団給食施設","","","","","","","","","","","","","","","届出","",""
"013123","fBiz00001022060000000009","東京都","江戸川区","","","㉖ 集団給食施設","集団給食施設","","","","","","","","","","","","","","","届出","",""
"013123","fBiz00001022060000000010","東京都","江戸川区","","","㉖ 集団給食施設","集団給食施設","","","","","","","","","","","","","","","届出","",""
"013123","fBiz00001022870000000002","東京都","江戸川区","","","㉖ 集団給食施設","","","","","","","","","","","","","","","","届出","",""
"013123","fBiz00001026830000000005","東京都","江戸川区","新宿中村屋　シャポー小岩","シンジュクナカムラヤ　シャポーコイワ","⑬ その他の食料・飲料販売業","","東京都江戸川区南小岩７丁目２４－１５","",35.732989,139.881708,"","株式会社中村屋","6011101015442","東京都新宿区新宿3丁目26番13号","","","","","","","届出","",""
"013123","fBiz00001032310000000001","東京都","江戸川区","ウエルシア江戸川中葛西店","ウエルシアエドガワナカカサイテン","⑪ 百貨店、総合スーパー","ドラッグストア","東京都江戸川区中葛西6-8-11","",35.659983,139.866132,"0356797817","ウエルシア薬局株式会社","3030001002411","東京都千代田区外神田2-2-15","","","","","","","届出","",""
"013123","fBiz00001032310000000001","東京都","江戸川区","ウエルシア江戸川中葛西店","ウエルシアエドガワナカカサイテン","⑫ 自動販売機による販売業（コップ式自動販売機（自動洗浄・屋内設置）及び営業許可の対象となる自動販売機を除く）","ドラッグストア","東京都江戸川区中葛西6-8-11","",35.659983,139.866132,"0356797817","ウエルシア薬局株式会社","3030001002411","東京都千代田区外神田2-2-15","","","","","","","届出","",""
"013123","fBiz00001032960000000001","東京都","江戸川区","","","㉖ 集団給食施設","","","","","","","","","","","","","","","","届出","",""
"013123","fBiz00001039010000000003","東京都","江戸川区","医療法人社団善千会老人保健施設ヴィット","イリョウホウジンシャダンゼンチカイロウジンホケンシセツヴィット","㉖ 集団給食施設","","東京都江戸川区船堀3-10-7","",35.681598,139.864820,"0356963363","医療法人社団善千会　","3011705000413","東京都江戸川区船堀3-10-7","","","","","","","届出","",""
"013123","fBiz00001042740000000001","東京都","江戸川区","みんなの遊々保育園","ミンナノユウユウホイクエン","㉖ 集団給食施設","集団給食","東京都江戸川区中葛西４－２－１","東京福祉専門学校第二校舎１Ｆ",35.664709,139.864782,"0356593880","学校法人滋慶学園","8011705000499","東京都江戸川区東葛西６丁目１６番２号","","","","","","","届出","",""
"013123","fBiz00001042740000000003","東京都","江戸川区","にじのいるか保育園南葛西","ニジノイルカホイクエンミナミカサイ","㉖ 集団給食施設","集団給食","東京都江戸川区南葛西5-7-2","",35.646269,139.872297,"0362405010","学校法人滋慶学園","8011705000499","東京都江戸川区東葛西６丁目１６番２号","","","","","","","届出","",""
"013123","fBiz00001044900000000001","東京都","江戸川区","ウエルシア江戸川瑞江駅前店","エドガワミズエエキマエテン","⑪ 百貨店、総合スーパー","ドラッグストア","東京都江戸川区南篠崎町3-1-3","",35.693596,139.899077,"03-5664-1151","ウエルシア薬局株式会社","3030001002411","東京都千代田区外神田2-2-15","","","","","","","届出","",""
"013123","fBiz00001051920000000001","東京都","江戸川区","学校法人有馬学園　ソレイユナーサリー小松川","ガッコウホウジンアリマガクエン　ソレイユナーサリーコマツガワ","㉖ 集団給食施設","","東京都江戸川区小松川1-5-2","トニワンショッピングセンター2F",35.688988,139.850301,"0358755787","学校法人有馬学園","2040005003356","千葉県八千代市高津1516","","","","","","","届出","",""
"013123","fBiz00001064890000000590","東京都","江戸川区","幸楽苑 島忠ホームズ葛西店","コウラクエン シマチュウホームズカサイテン","⑬ その他の食料・飲料販売業","飲食店営業","東京都江戸川区東葛西九丁目3番6号","島忠ホームズ葛西店1Ｆフードコート内",35.653853,139.882790,"0358264520","株式会社幸楽苑","4380001025558","福島県郡山市田村町金屋字川久保１番地１","","","","","","","届出","",""
"013123","fBiz00001064890000000732","東京都","江戸川区","幸楽苑   江戸川篠崎店","コウラクエンエドガワシノザキテン","⑬ その他の食料・飲料販売業","","東京都江戸川区篠崎町1-30-55","",35.709585,139.906520,"03-5664-3649","株式会社幸楽苑","4380001025558","福島県郡山市田村町金屋字川久保１番地１","","","","","","","届出","",""
"013123","fBiz00001073050000000001","東京都","江戸川区","","","㉖ 集団給食施設","","","","","","","","","","","","","","","","届出","",""
"013123","fBiz00001073130000000123","東京都","江戸川区","小岩駅ホーム（10025947・10026261）","コイワエキホーム","⑫ 自動販売機による販売業（コップ式自動販売機（自動洗浄・屋内設置）及び営業許可の対象となる自動販売機を除く）","乳類販売業（自動販売機）","東京都江戸川区南小岩七丁目24番15号","",35.732989,139.881708,"0368627381","株式会社ＪＲ東日本クロスステーション","3011101042662","東京都渋谷区千駄ヶ谷５丁目３３番８号","","","","","","","届出","",""
"013123","fBiz00001120510000000001","東京都","江戸川区","ケアレジデンス東京アネックス","ケアレジデンストウキョウアネックス","㉖ 集団給食施設","","東京都江戸川区南篠崎町1-6-14","",35.695040,139.903150,"03-3676-8711","株式会社ケアレジデンス","5050001000907","茨城県水戸市大塚町字清水1661","","","","","","","届出","",""
"013123","fBiz00001073130000000124","東京都","江戸川区","平井駅ホーム（10017598）","ヒライエキホーム","⑫ 自動販売機による販売業（コップ式自動販売機（自動洗浄・屋内設置）及び営業許可の対象となる自動販売機を除く）","乳類販売業（自動販売機）","東京都江戸川区平井三丁目30番1号","",35.706504,139.842829,"0368627381","株式会社ＪＲ東日本クロスステーション","3011101042662","東京都渋谷区千駄ヶ谷５丁目３３番８号","","","","","","","届出","",""
"013123","fBiz00001076140000000001","東京都","江戸川区","江東園ケアセンターつばき","コウトウエンケアセンターツバキ","㉖ 集団給食施設","","東京都江戸川区春江町2丁目5-15","",35.700743,139.887076,"03-5636-6211","社会福祉法人江東園","4011705000511","東京都江戸川区江戸川１丁目１１－３","","","","","","","届出","",""
"013123","fBiz00001088490000000001","東京都","江戸川区","有限会社　ヨコヤマ","ユウゲンガイシャ　ヨコヤマ","㉗ 器具、容器包装の製造・加工業（合成樹脂が使用された器具又は容器包装の製造、加工に限る。）","製造業","東京都江戸川区小松川4-92","",35.700377,139.849877,"0336817301","有限会社ヨコヤマ","7011702012259","東京都江戸川区小松川４丁目９２番地","","","","","","","届出","",""
"013123","fBiz00001089360000000002","東京都","江戸川区","筑前屋 葛西店","チクゼンヤカサイテン","⑬ その他の食料・飲料販売業","","東京都江戸川区東葛西6丁目6-15","",35.662145,139.874844,"03-3877-1012","株式会社カスタマーズディライト","2010001202682","東京都江東区新砂１丁目６番３５号Ｎビル東陽町６階","","","","","","","届出","",""
"013123","fBiz00001089360000000003","東京都","江戸川区","筑前屋 西葛西店","チクゼンヤニシカサイテン","⑬ その他の食料・飲料販売業","","東京都江戸川区西葛西5丁目2-16","庚伸ビル１０１",35.665995,139.859455,"03-5679-1230","株式会社カスタマーズディライト","2010001202682","東京都江東区新砂１丁目６番３５号Ｎビル東陽町６階","","","","","","","届出","",""
"013123","fBiz00001092900000000007","東京都","江戸川区","おれんじハウス西葛西保育園","オレンジハウスニシカサイホイクエン","㉖ 集団給食施設","集団給食施設","東京都江戸川区西葛西5－8－3","小島町二丁目団地3号棟1階",35.666482,139.861153,"0364560412","特定非営利活動法人おれんじハウス","7020005010903","神奈川県横浜市神奈川区栄町1－19グレイス横浜ポートシティ1階","","","","","","","届出","",""
"013123","fBiz00001092900000000008","東京都","江戸川区","おれんじオハナ西葛西保育園","オレンジオハナニシカサイホイクエン","㉖ 集団給食施設","集団給食施設","東京都江戸川区西葛西5－8－3","小島町二丁目団地3号棟1階",35.666482,139.861153,"0364560412","特定非営利活動法人おれんじハウス","7020005010903","神奈川県横浜市神奈川区栄町1－19グレイス横浜ポートシティ1階","","","","","","","届出","",""
"013123","fBiz00001092900000000009","東京都","江戸川区","おれんじハウス中葛西保育園","オレンジハウスナカカサイホイクエン","㉖ 集団給食施設","集団給食施設","東京都江戸川区中葛西6－17－9","クローバーメディカルビル1階",35.660476,139.867946,"0358780501","特定非営利活動法人おれんじハウス","7020005010903","神奈川県横浜市神奈川区栄町1－19グレイス横浜ポートシティ1階","","","","","","","届出","",""
"013123","fBiz00001102880000000002","東京都","江戸川区","ソラスト船堀保育園","ソラストフナボリホイクエン","㉖ 集団給食施設","","東京都江戸川区船堀3丁目15番15号","レガティコーポ船堀1階",35.680401,139.866116,"0366636085","株式会社ソラスト","3010001032864","東京都港区港南1-7-18","","","","","","","届出","",""
"013123","fBiz00001106020000000217","東京都","江戸川区","日本ケンタッキーフライドチキン　株式会社　本一色店","ニホンケンタッキーフライドチキン　カブシキガイシャ　ホンイッシキテン","⑬ その他の食料・飲料販売業","飲食業","東京都江戸川区本一色２－２３－１７","",35.717134,139.874970,"03-5607-7291","日本ケンタッキー・フライド・チキン株式会社","9011001095004","神奈川県横浜市西区みなとみらい4-4-5","","","","","","","届出","",""
"013123","fBiz00001106020000000219","東京都","江戸川区","ＫＦＣ　イオン　葛西店","ケイエフシー　イオン　カサイテン","⑬ その他の食料・飲料販売業","飲食業","東京都江戸川区西葛西３－９－１９","",35.669099,139.858406,"03-5659-2311","日本ケンタッキー・フライド・チキン株式会社","9011001095004","神奈川県横浜市西区みなとみらい4-4-5","","","","","","","届出","",""
"013123","fBiz00001106020000000220","東京都","江戸川区","ケンタッキー・フライド・チキン　イオンフードスタイル船堀店","ケンタッキーフライドチキン　イオンフードスタイルフナボリテン","⑬ その他の食料・飲料販売業","飲食業","東京都江戸川区船堀1-1-51","",35.685079,139.862795,"03-5679-5282","日本ケンタッキー・フライド・チキン株式会社","9011001095004","神奈川県横浜市西区みなとみらい4-4-5","","","","","","","届出","",""
"013123","fBiz00001106020000000221","東京都","江戸川区","日本ケンタッキーフライドチキン　株式会社　イトーヨーカ堂葛西店","ニホンケンタッキーフライドチキン　カブシキガイシャ　イトーヨカドウカサイテン","⑬ その他の食料・飲料販売業","飲食業","東京都江戸川区東葛西９－３－３","",35.651931,139.883048,"03-5675-6835","日本ケンタッキー・フライド・チキン株式会社","9011001095004","神奈川県横浜市西区みなとみらい4-4-5","","","","","","","届出","",""
"013123","fBiz00001106020000000274","東京都","江戸川区","ケンタッキーフライドチキン　瑞江店","ケンタッキーフライドチキン　ミズエテン","⑬ その他の食料・飲料販売業","飲食業","東京都江戸川区東瑞江1-27-4","福田ビル",35.692551,139.898150,"03-5243-7071","日本ケンタッキー・フライド・チキン株式会社","9011001095004","神奈川県横浜市西区みなとみらい4-4-5","","","","","","","届出","",""
"013123","fBiz00001106020000000275","東京都","江戸川区","日本ケンタッキーフライドチキン㈱平井店","ニホンケンタッキーフライドチキンカブシキガイシャヒライテン","⑬ その他の食料・飲料販売業","飲食業","東京都江戸川区平井５－２１－１２","",35.707469,139.842174,"03-5247-7318","日本ケンタッキー・フライド・チキン株式会社","9011001095004","神奈川県横浜市西区みなとみらい4-4-5","","","","","","","届出","",""
"013123","fBiz00001106020000000276","東京都","江戸川区","日本ケンタッキーフライドチキン　株式会社　葛西店","ニホンケンタッキーフライドチキン　カブシキガイシャ　カサイテン","⑬ その他の食料・飲料販売業","飲食業","東京都江戸川区東葛西5-1-2","",35.663936,139.873448,"03-5674-7045","日本ケンタッキー・フライド・チキン株式会社","9011001095004","神奈川県横浜市西区みなとみらい4-4-5","","","","","","","届出","",""
"013123","fBiz00001110830000000001","東京都","江戸川区","ケアレジデンス東京アネックス別館","ケアレジデンストウキョウアネックスベッカン","㉖ 集団給食施設","","東京都江戸川区南篠崎町3-8-15","",35.695180,139.898911,"","株式会社ケアレジデンス","5050001000907","茨城県水戸市大塚町字清水1661","","","","","","","届出","",""
"013123","fBiz00001129320000000001","東京都","江戸川区","社会福祉法人　善隣館保育園","シャカイフクシホウジン　ゼンリンカンホイクエン","㉖ 集団給食施設","","東京都江戸川区上一色1丁目13番1号","",35.724609,139.871982,"","","","","","","","","","","届出","",""
"013123","fBiz00001139310000000001","東京都","江戸川区","株式会社スマイルベジフル","カブシキガイシャスマイルベジフル","⑦ 野菜果物販売業","青果卸売業","東京都江戸川区西瑞江５丁目12-22","",35.680776,139.878427,"0366639044","株式会社スマイルベジフル","3011701024267","東京都江戸川区西瑞江5丁目12-22","","","","","","","届出","",""
"013123","fBiz00001141220000000001","東京都","江戸川区","","","㉖ 集団給食施設","","","","","","","","","","","","","","","","届出","",""
"013123","fBiz00001142850000000001","東京都","江戸川区","","","㉖ 集団給食施設","","","","","","","","","","","","","","","","届出","",""
"013123","fBiz00001144410000000005","東京都","江戸川区","ほっぺるランド中葛西","ホッペルランドナカカサイ","㉖ 集団給食施設","","東京都江戸川区中葛西1-1-15","",35.669190,139.866974,"","株式会社テノ.コーポレーション","4290001022507","福岡県福岡市博多区上呉服町10番10号 ","","","","","","","届出","",""
"013123","fBiz00001148450000000060","東京都","江戸川区","","","㉖ 集団給食施設","給食","","","","","","","","","","","","","","","届出","",""
"013123","fBiz00001148450000000082","東京都","江戸川区","","","㉖ 集団給食施設","","","","","","","","","","","","","","","","届出","",""
"013123","fBiz00001148450000000185","東京都","江戸川区","","","㉖ 集団給食施設","","","","","","","","","","","","","","","","届出","",""
