"自治体コード","行番号","都道府県名","市区町村名","営業施設名称、屋号又は商号","営業施設名称、屋号又は商号（フリガナ）","営業の種類","業態","営業施設所在地","営業施設方書","緯度","経度","営業施設電話番号","法人名","法人番号","法人住所","許可番号","初回許可年月日","許可年月日","許可開始日","許可満了日","廃業年月日","申請区分","許可条件","備考"
"016000","fBiz00000103910000000023","富山県","富山市","Ｖ・drug　魚津店","ブイ・ドラッグ　ウオヅテン","⑪ 百貨店、総合スーパー","ドラッグストア","富山県魚津市上村木413-1 アップルヒル内","",36.822952,137.414449,"0765-23-1111","中部薬品株式会社","4200001020808","岐阜県多治見市高根町四丁目29番地","","","","","","","届出","",""
"016000","fBiz00000103910000000030","富山県","富山市","Ｖ・drug　高岡羽広店","ブイ・ドラッグ　タカオカハビロテン","⑪ 百貨店、総合スーパー","ドラッグストア","富山県高岡市羽広二丁目1番6号","",36.743620,136.993760,"0766-21-6231","中部薬品株式会社","4200001020808","岐阜県多治見市高根町四丁目29番地","","","","","","","届出","",""
"016000","fBiz00000103910000000043","富山県","富山市","Ｖ・drug　砺波店","ブイ・ドラッグ　トナミテン","⑪ 百貨店、総合スーパー","ドラッグストア","富山県砺波市宮丸2番地","",36.653413,136.966174,"0763-34-0007","中部薬品株式会社","4200001020808","岐阜県多治見市高根町四丁目29番地","","","","","","","届出","",""
"016000","fBiz00000103910000000047","富山県","富山市","Ｖ・drug　入善店","ブイ・ドラッグ　ニュゼンテン","⑪ 百貨店、総合スーパー","ドラッグストア","富山県下新川郡入善町上野1285　きららの里","",36.931239,137.497832,"0765-74-2488","中部薬品株式会社","4200001020808","岐阜県多治見市高根町四丁目29番地","","","","","","","届出","",""
"016000","fBiz00000103910000000082","富山県","富山市","Ｖ・drug　福光店","ブイ・ドラッグ　フクミツテン","⑪ 百貨店、総合スーパー","ドラッグストア","富山県南砺市福光神田町201-1 楽藏福光内","",36.561169,136.871156,"0763-52-7776","中部薬品株式会社","4200001020808","岐阜県多治見市高根町四丁目29番地","","","","","","","届出","",""
"016000","fBiz00000103910000000099","富山県","富山市","Ｖ・drug　津沢店","ブイ・ドラッグ　ツザワテン","⑪ 百貨店、総合スーパー","ドラッグストア","富山県小矢部市新西186番1","",36.630696,136.896901,"0766-30-3270","中部薬品株式会社","4200001020808","岐阜県多治見市高根町四丁目29番地","","","","","","","届出","",""
"016000","fBiz00000103910000000100","富山県","富山市","Ｖ・drug　高岡京田店","ブイ・ドラッグ　キョウデンテン","⑪ 百貨店、総合スーパー","ドラッグストア","富山県高岡市京田431番","",36.730699,137.014865,"0766-27-8090","中部薬品株式会社","4200001020808","岐阜県多治見市高根町四丁目29番地","","","","","","","届出","",""
"016000","fBiz00000103910000000102","富山県","富山市","Ｖ・drug　中曽根店","ブイ・ドラッグ　ナカソネテン","⑪ 百貨店、総合スーパー","ドラッグストア","富山県高岡市中曽根2814番","",36.769743,137.072445,"0766-82-2730","中部薬品株式会社","4200001020808","岐阜県多治見市高根町四丁目29番地","","","","","","","届出","",""
"016000","fBiz00000103910000000139","富山県","富山市","Ｖ・drug　高岡木津店","ブイ・ドラッグ　タカオカキヅテン","⑪ 百貨店、総合スーパー","ドラッグストア","富山県高岡市木津458-14","",36.738640,137.001218,"0766-29-3725","中部薬品株式会社","4200001020808","岐阜県多治見市高根町四丁目29番地","","","","","","","届出","",""
"016000","fBiz00000103910000000160","富山県","富山市","Ｖ・drug　伏木店","ブイ・ドラッグ　フシキテン","⑪ 百貨店、総合スーパー","ドラッグストア","富山県高岡市伏木国分１丁目8番8号","",36.801850,137.053185,"0766-53-5712","中部薬品株式会社","4200001020808","岐阜県多治見市高根町四丁目29番地","","","","","","","届出","",""
"016000","fBiz00000103910000000162","富山県","富山市","Ｖ・drug　舟橋店","ブイ・ドラッグ　フナハシテン","⑪ 百貨店、総合スーパー","ドラッグストア","富山県中新川郡舟橋村竹内525","",36.706246,137.306154,"076-464-4121","中部薬品株式会社","4200001020808","岐阜県多治見市高根町四丁目29番地","","","","","","","届出","",""
"016000","fBiz00000108820000000009","富山県","富山市","フードランドアルビス大島店","フードランドアルビスオオシマテン","③ 食肉販売業","","富山県射水市本開発11","",36.728148,137.084954,"0766502300","アルビス株式会社","3230001012605","富山県射水市流通センター水戸田三丁目４番地","000502-002",2021/07/09,2021/07/09,2021/07/22,2027/07/21,"","許可"," ",""
"016000","fBiz00000108820000000010","富山県","富山市","アルビス　野村店","アルビス　ノムラテン","⑪ 百貨店、総合スーパー","","富山県高岡市野村1671番地1","",36.761375,137.043875,"0766-26-2122","アルビス株式会社","3230001012605","富山県射水市流通センター水戸田三丁目４番地","","","","","","","届出","",""
"016000","fBiz00000108820000000011","富山県","富山市","アルビス　姫野店","アルビス　ヒメノテン","⑪ 百貨店、総合スーパー","","富山県高岡市放生津79番地","",36.770557,137.083967,"0766-84-5173","アルビス株式会社","3230001012605","富山県射水市流通センター水戸田三丁目４番地","","","","","","","届出","",""
"016000","fBiz00000108820000000013","富山県","富山市","アルビス　美幸町店","アルビス　ミユキチョウテン","⑪ 百貨店、総合スーパー","","富山県高岡市美幸町1丁目255-1","",36.756080,136.997647,"0766-28-1212","アルビス株式会社","3230001012605","富山県射水市流通センター水戸田三丁目４番地","","","","","","","届出","",""
"016000","fBiz00000108820000000014","富山県","富山市","アルビス　戸出店","アルビス　トイデテン","① 飲食店営業","食品スーパーマーケット","富山県高岡市戸出町4丁目2番8号","",36.685287,136.974537,"0766-62-1300","アルビス株式会社","3230001012605","富山県射水市流通センター水戸田三丁目４番地","040127-001",2022/06/30,2022/06/30,2022/06/30,2028/06/29,"","許可","なし",""
"016000","fBiz00000108820000000014","富山県","富山市","アルビス　戸出店","アルビス　トイデテン","③ 食肉販売業","食品スーパーマーケット","富山県高岡市戸出町4丁目2番8号","",36.685287,136.974537,"0766-62-1300","アルビス株式会社","3230001012605","富山県射水市流通センター水戸田三丁目４番地","040127-003",2022/06/30,2022/06/30,2022/06/30,2028/06/29,"","許可","なし",""
"016000","fBiz00000108820000000014","富山県","富山市","アルビス　戸出店","アルビス　トイデテン","⑪ 百貨店、総合スーパー","","富山県高岡市戸出町4丁目2番8号","",36.685287,136.974537,"0766-62-1300","アルビス株式会社","3230001012605","富山県射水市流通センター水戸田三丁目４番地","","","","","","","届出","",""
"016000","fBiz00000108820000000015","富山県","富山市","アルビス　丸の内店","アルビス　マルノウチテン","⑪ 百貨店、総合スーパー","","富山県高岡市丸の内3番6号","",36.750844,137.018472,"0766-23-2050","アルビス株式会社","3230001012605","富山県射水市流通センター水戸田三丁目４番地","","","","","","","届出","",""
"016000","fBiz00000108820000000016","富山県","富山市","アルビス　タピス店","アルビス　タピステン","⑪ 百貨店、総合スーパー","","富山県高岡市福岡町下蓑385","",36.709686,136.932873,"0766-64-5810","アルビス株式会社","3230001012605","富山県射水市流通センター水戸田三丁目４番地","","","","","","","届出","",""
"016000","fBiz00002629820000000001","富山県","富山市","","","① 飲食店営業","シェアキッチン","","","","","","","","","221649-001",2022/07/22,2022/07/22,2022/07/22,2027/07/21,"","許可","なし",""
"016000","fBiz00000108820000000018","富山県","富山市","アルビス　米島店","アルビス　ヨネジマテン","⑪ 百貨店、総合スーパー","","富山県高岡市米島字表向460-1","",37.309819,140.449612,"0766-27-5300","アルビス株式会社","3230001012605","富山県射水市流通センター水戸田三丁目４番地","","","","","","","届出","",""
"016000","fBiz00000108820000000026","富山県","富山市","アルビス　いみずの小杉店","アルビス　イミズノコスギテン","① 飲食店営業","","富山県射水市一条6番5","",36.713875,137.087603,"0766-57-3500","アルビス株式会社","3230001012605","富山県射水市流通センター水戸田三丁目４番地","000413-003",2021/09/21,2021/09/21,2021/10/01,2027/09/30,"","許可"," ",""
"016000","fBiz00000108820000000026","富山県","富山市","アルビス　いみずの小杉店","アルビス　イミズノコスギテン","③ 食肉販売業","","富山県射水市一条6番5","",36.713875,137.087603,"0766-57-3500","アルビス株式会社","3230001012605","富山県射水市流通センター水戸田三丁目４番地","000413-001",2021/09/21,2021/09/21,2021/10/01,2027/09/30,"","許可"," ",""
"016000","fBiz00000108820000000026","富山県","富山市","アルビス　いみずの小杉店","アルビス　イミズノコスギテン","⑪ 菓子製造業","","富山県射水市一条6番5","",36.713875,137.087603,"0766-57-3500","アルビス株式会社","3230001012605","富山県射水市流通センター水戸田三丁目４番地","000413-004",2021/09/21,2021/09/21,2021/10/01,2027/09/30,"","許可"," ",""
"016000","fBiz00000108820000000041","富山県","富山市","アルビス　中田店","アルビス　ナカダテン","③ 食肉販売業","","富山県高岡市常国327","",36.685885,137.025006,"0766-36-1863","アルビス株式会社","3230001012605","富山県射水市流通センター水戸田三丁目４番地","090593-006",2021/09/09,2021/09/09,2021/09/09,2027/09/08,"","許可","なし",""
"016000","fBiz00000108820000000050","富山県","富山市","アルビス　入善店","アルビスニュウゼンテン","⑪ 百貨店、総合スーパー","","富山県下新川郡入善町上野1296-1","",36.930188,137.497214,"0765-74-2111","アルビス株式会社","3230001012605","富山県射水市流通センター水戸田三丁目４番地","","","","","","","届出","",""
"016000","fBiz00000108820000000063","富山県","富山市","アルビス　立山インター店","アルビスタテヤマインターテン","⑪ 百貨店、総合スーパー","","富山県中新川郡立山町辻64","",36.684611,137.332249,"076-463-6770","アルビス株式会社","3230001012605","富山県射水市流通センター水戸田三丁目４番地","","","","","","","届出","",""
"016000","fBiz00000108820000000068","富山県","富山市","アルビス　小矢部店","アルビスオヤベテン","⑪ 百貨店、総合スーパー","","富山県小矢部市桜町1816","",36.688271,136.873568,"0766-68-3366","アルビス株式会社","3230001012605","富山県射水市流通センター水戸田三丁目４番地","","","","","","","届出","",""
"016000","fBiz00000108820000000096","富山県","富山市","アルビス　パスコ店","アルビスパスコテン","⑪ 百貨店、総合スーパー","","富山県射水市中太閤山1-1","",36.704381,137.096089,"0766-56-5551","アルビス株式会社","3230001012605","富山県射水市流通センター水戸田三丁目４番地","","","","","","","届出","",""
"016000","fBiz00000108820000000097","富山県","富山市","アルビス　中田店","アルビスナカダテン","⑪ 百貨店、総合スーパー","","富山県高岡市常国327","",36.685885,137.025006,"0766-36-1863","アルビス株式会社","3230001012605","富山県射水市流通センター水戸田三丁目４番地","","","","","","","届出","",""
"016000","fBiz00000108820000000099","富山県","富山市","アルビス　いみずの小杉店","アルビスイミズノコスギテン","⑪ 百貨店、総合スーパー","","富山県射水市一条6番5","",36.713875,137.087603,"0766-57-3500","アルビス株式会社","3230001012605","富山県射水市流通センター水戸田三丁目４番地","","","","","","","届出","",""
"016000","fBiz00000108820000000100","富山県","富山市","アルビス　大島店","アルビスオオシマテン","⑪ 百貨店、総合スーパー","","富山県射水市本開発11","",36.728148,137.084954,"0766-50-2300","アルビス株式会社","3230001012605","富山県射水市流通センター水戸田三丁目４番地","","","","","","","届出","",""
"016000","fBiz00000108820000000107","富山県","富山市","アルビス とくし丸 6号車","アルビス トクシマル ロクゴウシャ","㉕ 行商","","富山県高岡市丸の内3番6号","",36.750844,137.018472,"0766-23-2050","アルビス株式会社","3230001012605","富山県射水市流通センター水戸田三丁目４番地","","","","","","","届出","",""
"016000","fBiz00000108820000000110","富山県","富山市","アルビス　小矢部店","アルビス　オヤベテン","① 飲食店営業","","富山県小矢部市桜町1816番地","",36.688271,136.873568,"0766-68-3366","アルビス株式会社","3230001012605","","151073-001",2015/12/04,2021/11/15,2021/12/09,2027/12/08,"","許可","なし",""
"016000","fBiz00000108820000000110","富山県","富山市","アルビス　小矢部店","アルビス　オヤベテン","③ 食肉販売業","","富山県小矢部市桜町1816番地","",36.688271,136.873568,"0766-68-3366","アルビス株式会社","3230001012605","","151073-005",2015/12/04,2021/11/15,2021/12/09,2027/12/08,"","許可","なし",""
"016000","fBiz00000108820000000110","富山県","富山市","アルビス　小矢部店","アルビス　オヤベテン","④ 魚介類販売業","","富山県小矢部市桜町1816番地","",36.688271,136.873568,"0766-68-3366","アルビス株式会社","3230001012605","","151073-006",2015/12/04,2021/11/15,2021/12/09,2027/12/08,"","許可","なし",""
"016000","fBiz00000108820000000111","富山県","富山市","アルビス　歌の森店","アルビスウタノモリテン","⑪ 百貨店、総合スーパー","","富山県射水市戸破1569","",36.714379,137.098603,"0766-57-1166","アルビス株式会社","3230001012605","富山県射水市流通センター水戸田三丁目４番地","","","","","","","届出","",""
"016000","fBiz00000108820000000112","富山県","富山市","アルビス とくし丸 11号車","アルビス トクシマル ジュウイチゴウシャ","㉕ 行商","","富山県氷見市一円","",36.864368,136.987247,"0766-91-7676","アルビス株式会社","3230001012605","富山県射水市流通センター水戸田三丁目４番地","","","","","","","届出","",""
"016000","fBiz00000108820000000113","富山県","富山市","アルビス とくし丸 12号車","アルビス トクシマル ジュウニゴウシャ","㉕ 行商","","富山県氷見市窪295-1(アルビス氷見店)","",36.837151,136.985868,"0766-91-7676","アルビス株式会社","3230001012605","富山県射水市流通センター水戸田三丁目４番地","","","","","","","届出","",""
"016000","fBiz00000108820000000118","富山県","富山市","アルビス　黒部店","アルビス　クロベテン","① 飲食店営業","食品スーパーマーケット","富山県黒部市前沢1016番地","",36.862181,137.452224,"0765-52-1197","アルビス株式会社","3230001012605","富山県射水市流通センター水戸田三丁目４番地","221637-002",2022/07/19,2022/07/19,2022/07/22,2028/07/21,"","許可","なし",""
"016000","fBiz00000108820000000118","富山県","富山市","アルビス　黒部店","アルビス　クロベテン","③ 食肉販売業","食品スーパーマーケット","富山県黒部市前沢1016番地","",36.862181,137.452224,"0765-52-1197","アルビス株式会社","3230001012605","富山県射水市流通センター水戸田三丁目４番地","221637-003",2022/07/19,2022/07/19,2022/07/22,2028/07/21,"","許可","なし",""
"016000","fBiz00000820750000000001","富山県","富山市","けんせいきょう　輝　くろべ","ケンセイキョウカガヤキクロベ","㉖ 集団給食施設","","富山県黒部市牧野750-1","",36.867161,137.440415,"","富山県生活協同組合","2230005000532","富山県富山市金屋５５５","","","","","","","届出","",""
"016000","fBiz00000108820000000118","富山県","富山市","アルビス　黒部店","アルビス　クロベテン","④ 魚介類販売業","食品スーパーマーケット","富山県黒部市前沢1016番地","",36.862181,137.452224,"0765-52-1197","アルビス株式会社","3230001012605","富山県射水市流通センター水戸田三丁目４番地","221637-004",2022/07/19,2022/07/19,2022/07/22,2028/07/21,"","許可","なし",""
"016000","fBiz00000108820000000119","富山県","富山市","アルビス　大島店","アルビス　オオシマテン","① 飲食店営業","食品スーパーマーケット","富山県射水市本開発11","",36.728148,137.084954,"0766-50-2300","アルビス株式会社","3230001012605","富山県射水市流通センター水戸田三丁目４番地","000502-001",2022/07/19,2022/07/19,2022/07/22,2028/07/21,"","許可","　　",""
"016000","fBiz00000108820000000119","富山県","富山市","アルビス　大島店","アルビス　オオシマテン","④ 魚介類販売業","食品スーパーマーケット","富山県射水市本開発11","",36.728148,137.084954,"0766-50-2300","アルビス株式会社","3230001012605","富山県射水市流通センター水戸田三丁目４番地","000502-003",2022/07/19,2022/07/19,2022/07/22,2028/07/21,"","許可","　　",""
"016000","fBiz00000108820000000120","富山県","富山市","アルビス　黒部店","アルビス　クロベテン","⑪ 百貨店、総合スーパー","","富山県黒部市前沢1016","",36.862181,137.452224,"","アルビス株式会社","3230001012605","富山県射水市流通センター水戸田三丁目４番地","","","","","","","届出","",""
"016000","fBiz00000108820000000121","富山県","富山市","アルビス 大島店","アルビス　オオシマテン","① 飲食店営業","","富山県射水市本開発11","",36.728148,137.084954,"0766-50-2300","アルビス株式会社","3230001012605","富山県射水市流通センター水戸田三丁目４番地","000502-004",2022/07/19,2022/07/19,2022/07/22,2028/07/21,"","許可","　　",""
"016000","fBiz00000108820000000125","富山県","富山市","アルビス　とくし丸　15号車","アルビス　トクシマル　ジュウゴゴウシャ","⑬ その他の食料・飲料販売業","","富山県黒部市前沢1016番地　(アルビス黒部店)","",36.862800,137.445938,"076-552-1197","アルビス株式会社","3230001012605","","","","","","","","届出","",""
"016000","fBiz00000108820000000127","富山県","富山市","アルビス　とくし丸　16号車","アルビス　トクシマル　ジュウロクゴウシャ","⑬ その他の食料・飲料販売業","","富山県黒部市前沢1016番地　(アルビス黒部店)","",36.862800,137.445938,"076-552-1197","アルビス株式会社","3230001012605","","","","","","","","届出","",""
"016000","fBiz00000108950000000001","富山県","富山市","日本式道楽割烹　久遠","ニホンシキドウラクカッポウ　クオン","① 飲食店営業","","富山県砺波市柳瀬420","",36.636808,136.995945,"","合同会社久遠","7230003001569","富山県砺波市柳瀬４２０番地","210268-001",2021/06/11,2021/06/11,2021/06/11,2026/06/10,"","許可","なし",""
"016000","fBiz00000113080000000039","富山県","富山市","MEGAドン・キホーテUNY魚津店","メガドン・キホーテユニーウオヅテン","⑪ 百貨店、総合スーパー","","富山県魚津市住吉600番地","",36.807017,137.406266,"0570-094-411","UDリテール株式会社","3013301041403","神奈川県横浜市神奈川区入江二丁目18番地","","","","","","","届出","",""
"016000","fBiz00000113080000000047","富山県","富山市","MEGAドン・キホーテUNY砺波店","メガドン・キホーテユニートナミテン","⑪ 百貨店、総合スーパー","","富山県砺波市太郎丸三丁目69番地","",36.628919,136.960085,"0763-32-7711","UDリテール株式会社","3013301041403","神奈川県横浜市神奈川区入江二丁目18番地","","","","","","","届出","",""
"016000","fBiz00000115920000000017","富山県","富山市","カルディコーヒーファーム　イオンモール高岡店","カルディコーヒーファーム　イオンモールタカオカテン","⑬ その他の食料・飲料販売業","食品販売","富山県高岡市下伏間江383","イオンモール高岡１Ｆ",36.723894,137.016709,"0766-33-4012","株式会社キャメル珈琲","6010901003292","東京都世田谷区代田2-31-8","","","","","","","届出","",""
"016000","fBiz00000115920000000442","富山県","富山市","カルディコーヒーファーム　三井アウトレットパーク 北陸小矢部店","カルディコーヒーファーム　ミツイアウトレットパーク ホクリクオヤベテン","⑬ その他の食料・飲料販売業","食品販売","富山県小矢部市西中野972-1","三井アウトレットパーク 北陸小矢部　1Ｆ",36.689308,136.880789,"0766-68-1650","株式会社キャメル珈琲","6010901003292","東京都世田谷区代田2-31-8","","","","","","","届出","",""
"016000","fBiz00000117420000000001","富山県","富山市","","","㉗ 器具、容器包装の製造・加工業（合成樹脂が使用された器具又は容器包装の製造、加工に限る。）","","","","","","","","","","","","","","","","届出","",""
"016000","fBiz00000119860000000001","富山県","富山市","","","㉗ 器具、容器包装の製造・加工業（合成樹脂が使用された器具又は容器包装の製造、加工に限る。）","","","","","","","","","","","","","","","","届出","",""
"016000","fBiz00000126830000000032","富山県","富山市","アミング高岡店","アミングタカオカテン","⑬ その他の食料・飲料販売業","","富山県高岡市京田445番地","",36.729687,137.013312,"0766540700","株式会社アミング","4220001001533","石川県金沢市無量寺５丁目５４番地３","","","","","","","届出","",""
"016000","fBiz00000129180000000837","富山県","富山市","ダイソー　イオンタウン氷見店","ダイソー　イオンタウンヒミテン","⑬ その他の食料・飲料販売業","","富山県氷見市窪１４０番１","イオンタウン氷見店内",36.840135,136.984131,"","株式会社大創産業","7240001022681","広島県東広島市西条吉行東一丁目４番１４号","","","","","","","届出","",""
"016000","fBiz00000129180000000838","富山県","富山市","ダイソー　高岡戸出店","ダイソー　タカオカトイデテン","⑬ その他の食料・飲料販売業","","富山県高岡市戸出伊勢領２３８０","",36.693621,136.973108,"","株式会社大創産業","7240001022681","広島県東広島市西条吉行東一丁目４番１４号","","","","","","","届出","",""
"016000","fBiz00000129180000000840","富山県","富山市","ダイソー　たかおか四屋店","ダイソー　タカオカヨツヤテン","⑬ その他の食料・飲料販売業","","富山県高岡市四屋６１６－１","",36.761658,137.003026,"","株式会社大創産業","7240001022681","広島県東広島市西条吉行東一丁目４番１４号","","","","","","","届出","",""
"016000","fBiz00000129180000000841","富山県","富山市","ダイソー　越中大島店","ダイソー　エッチュウオオシマテン","⑬ その他の食料・飲料販売業","","富山県射水市中野６５９－１","",36.740512,137.054426,"","株式会社大創産業","7240001022681","広島県東広島市西条吉行東一丁目４番１４号","","","","","","","届出","",""
"016000","fBiz00000129180000000842","富山県","富山市","ダイソー　新湊店","ダイソー　シンミナトテン","⑬ その他の食料・飲料販売業","","富山県高岡市姫野字小円坊２９０－１","",36.770320,137.087353,"","株式会社大創産業","7240001022681","広島県東広島市西条吉行東一丁目４番１４号","","","","","","","届出","",""
"016000","fBiz00000129180000000843","富山県","富山市","ダイソー　イオンモールとなみ店","ダイソー　イオンモールトナミテン","⑬ その他の食料・飲料販売業","","富山県砺波市中神一丁目１７４","イオンモールとなみ店内",36.641579,136.947963,"","株式会社大創産業","7240001022681","広島県東広島市西条吉行東一丁目４番１４号","","","","","","","届出","",""
