"016000","fBiz00001200330000000001","富山県","富山市","","","① 飲食店営業","","","","","","","","","","151005-001",2015/12/01,2021/11/12,2021/12/01,2027/11/30,"","許可","なし",""
"016000","fBiz00001200450000000001","富山県","富山市","北山米穀店","キタヤマベイコクテン","⑧ 米穀類販売業","","富山県高岡市昭和町2-1-10","フレッシュ佐武内",36.753657,137.002360,"0766-25-7618","","","","","","","","","","届出","",""
"016000","fBiz00001200640000000001","富山県","富山市","吉田養蜂","ヨシダヨウホウ","⑰ 農産保存食料品製造・加工業","","富山県高岡市福岡町一歩二歩393","",36.702668,136.948033,"0766-64-3105","","","","","","","","","","届出","",""
"016000","fBiz00001200960000000001","富山県","富山市","ファミリーマート高岡清水町店","ファミリーマートタカオカシミズチョウテン","① 飲食店営業","コンビニエンスストア","富山県高岡市清水町3-32","",36.737969,137.005256,"0766-28-5010","相本ひかる","","富山県高岡市早川138-2","160736-001",2021/10/01,2021/10/01,2021/10/30,2026/10/29,"","許可","なし",""
"016000","fBiz00001200960000000001","富山県","富山市","ファミリーマート高岡清水町店","ファミリーマートタカオカシミズチョウテン","⑩ コンビニエンスストア","コンビニエンスストア","富山県高岡市清水町3-32","",36.737969,137.005256,"0766-28-5010","","","","","","","","","","届出","",""
"016000","fBiz00001201230000000001","富山県","富山市","沢田屋","サワダヤ","⑦ 野菜果物販売業","","富山県高岡市末広町8-46","",36.744431,137.012731,"0766-22-0073","カネサ食品株式会社","2230001009858","富山県高岡市野村968","","","","","","","届出","",""
"016000","fBiz00001201430000000001","富山県","富山市","株式会社トヤマ水産冷蔵事業部","カブシキガイシャトヤマスイサンレイゾウジギョウブ","㉙ その他","","富山県高岡市佐野新町544","",36.724798,136.996783,"0766-23-4447","株式会社トヤマ水産","4230001011812","富山県高岡市本丸町13-16","","","","","","","届出","",""
"016000","fBiz00001202480000000001","富山県","富山市","ひみ番屋街　みのりの番屋","ヒミバンヤガイ　ミノリノバンヤ","⑪ 百貨店、総合スーパー","","富山県氷見市北大町25-5","",36.864984,136.986849,"","氷見まちづくり株式会社","2230001013892","富山県氷見市北大町25-5","","","","","","","届出","",""
"016000","fBiz00001202570000000001","富山県","富山市","焼鳥真ゆき","ヤキトリサネユキ","① 飲食店営業","","富山県高岡市大手町11-14","",36.745712,137.017556,"05088814976","株式会社Progress","4230001017339","富山県砺波市中央町10-47","210314-001",2021/05/27,2021/05/27,2021/06/15,2026/06/14,"","許可","なし",""
"016000","fBiz00001202630000000001","富山県","富山市","みそ・蔵カフェ","ミソ・クラカフェ","① 飲食店営業","カフェ","富山県高岡市和田16","",36.740953,136.986237,"0766-22-1022","長谷川醸庫・福岡フレーム工業株式会社","4230001011283","富山県高岡市和田16","210304-001",2021/06/01,2021/06/01,2021/06/01,2026/05/31,"","許可","なし",""
"016000","fBiz00001202630000000001","富山県","富山市","みそ・蔵カフェ","ミソ・クラカフェ","⑪ 菓子製造業","カフェ","富山県高岡市和田16","",36.740953,136.986237,"0766-22-1022","長谷川醸庫・福岡フレーム工業株式会社","4230001011283","富山県高岡市和田16","210304-002",2021/06/01,2021/06/01,2021/06/01,2026/05/31,"","許可","なし",""
"016000","fBiz00001202850000000002","富山県","富山市","スナック　Masherie","スナック　マシェリ","① 飲食店営業","","富山県射水市太閤山1-7-20","",36.708125,137.093747,"0766-56-8801","長沼怜香","","富山県射水市太閤山1-7-20","210701-001",2021/10/18,2021/10/18,2021/10/20,2026/10/19,"","許可"," ",""
"016000","fBiz00001203330000000033","富山県","富山市","ケンタッキーフライドチキン　高岡西町店","ケンタッキーフライドチキン　タカオカニシマチテン","⑬ その他の食料・飲料販売業","","富山県高岡市西町5-8","",36.750245,136.996588,"","吉田興産株式会社","5100001003697","長野県長野市中御所５丁目１番１８号","","","","","","","届出","",""
"016000","fBiz00001203330000000036","富山県","富山市","ケンタッキーフライドチキン　MEGAドン・キホーテUNY魚津店","ケンタッキーフライドチキン　メガドン・キホーテユニーウオヅテン","⑬ その他の食料・飲料販売業","","富山県魚津市住吉556","MEGAドン・キホーテUNY魚津店駐車場内",36.806098,137.406706,"","吉田興産株式会社","5100001003697","長野県長野市中御所５丁目１番１８号","","","","","","","届出","",""
"016000","fBiz00001203330000000038","富山県","富山市","","","① 飲食店営業","レストラン","","","","","","","","","040092-001",2022/05/13,2022/05/13,2022/06/01,2028/05/31,"","許可","なし",""
"016000","fBiz00001204260000000001","富山県","富山市","スチロ化学工業株式会社","スチロカガクコウギョウ","㉗ 器具、容器包装の製造・加工業（合成樹脂が使用された器具又は容器包装の製造、加工に限る。）","","富山県高岡市中田９５５","",36.680315,137.015246,"0766361212","スチロ化学工業株式会社","6230001011942","富山県高岡市中田９５５番地","","","","","","","届出","",""
"016000","fBiz00001205200000000001","富山県","富山市","","","① 飲食店営業","","","","","","","","","","990118-001",1989/12/01,2021/11/24,2021/12/01,2026/11/30,"","許可","なし",""
"016000","fBiz00001205530000000001","富山県","富山市","株式会社高岡食糧","カブシキガイシャタカオカショクリョウ","⑧ 米穀類販売業","","富山県高岡市能町字打山５５５番地","",36.764887,137.047956,"0766-22-6310","株式会社高岡食糧","5230001010433","富山県高岡市能町字打山５５５番地","","","","","","","届出","",""
"016000","fBiz00001206560000000001","富山県","富山市","","","① 飲食店営業","","","","","","","","","","990214-001",2021/10/18,2021/10/18,2021/11/23,2026/11/22,"","許可"," ",""
"016000","fBiz00001207410000000002","富山県","富山市","社会福祉法人上小泉保育園　","シャカイフクシホウジンカミコイズミホイクエン　","㉖ 集団給食施設","","富山県滑川市上小泉668","",36.757904,137.347329,"0764754575","社会福祉法人上小泉保育園　　","1230005004377","富山県滑川市上小泉668","","","","","","","届出","",""
"016000","fBiz00001207440000000001","富山県","富山市","イベントスペースKOTOHA","イベントスペースコトハ","① 飲食店営業","イベントスペース","富山県黒部市三日市822","阿原ビル",36.873693,137.444181,"","","","","160792-001",2016/11/21,2021/10/15,2021/11/21,2026/11/20,"","許可","なし",""
"016000","fBiz00001208380000000001","富山県","富山市","氷見のいいもの　まるなか屋","ヒミノイイモノ　マルナカヤ","⑪ 百貨店、総合スーパー","","富山県氷見市伊勢大町2-18-17","",36.847106,136.991813,"","合同会社　Ten Up","7230003001643","富山県氷見市伊勢大町2-18-17","","","","","","","届出","",""
"016000","fBiz00001208410000000002","富山県","富山市","","","⑩ コンビニエンスストア","コンビニエンスストア","","","","","","","","","","","","","","","届出","",""
"016000","fBiz00001208410000000003","富山県","富山市","","","⑩ コンビニエンスストア","コンビニエンスストア","","","","","","","","","","","","","","","届出","",""
"016000","fBiz00001213310000000001","富山県","富山市","角井スーパーストア ","カクイスーパーストア ","⑩ コンビニエンスストア","","富山県黒部市荻生807","",36.884845,137.472850,"0765541866","","","","","","","","","","届出","",""
"016000","fBiz00001213310000000002","富山県","富山市","","","⑬ その他の食料・飲料販売業","","","","","","","","","","","","","","","","届出","",""
"016000","fBiz00001220580000000001","富山県","富山市","生地蒲鉾有限会社","イクジカマボコユウゲンガイシャ","⑯ 水産製品製造業","","富山県黒部市生地376","",36.891342,137.415098,"0765568064","生地蒲鉾有限会社","3230002007950","富山県黒部市生地376","990682-001",2021/10/31,2021/10/13,2021/10/31,2026/10/30,"","許可"," ",""
"016000","fBiz00001220580000000002","富山県","富山市","練り天屋　生地蒲鉾","ネリリテンヤ　イクジカマボコ","① 飲食店営業","","富山県黒部市堀切新925-1","",36.875932,137.438487,"090-7588-4006","生地蒲鉾有限会社","3230002007950","富山県黒部市生地376","221074-001",2022/03/24,2022/03/24,2022/04/01,2027/03/31,"","許可","なし",""
"016000","fBiz00001226390000000001","富山県","富山市","稲地商店","イナジショウテン","⑳ みそ又はしょうゆ製造業","","富山県射水市港町9-22","",36.785848,137.075876,"","稲地俊子","","富山県射水市港町9-22","990026-001",2021/11/15,2021/11/15,2021/11/15,2026/11/14,"","許可"," ",""
"016000","fBiz00001226910000000001","富山県","富山市","","","㉖ 集団給食施設","","","","","","","","","","","","","","","","届出","",""
"016000","fBiz00001232250000000001","富山県","富山市","ばらずしアスカ店","バラズシアスカテン","① 飲食店営業","","富山県下新川郡朝日町平柳688","",36.952507,137.553604,"0765-83-9115","","","","990327-001",1992/11/16,2021/10/12,2021/11/16,2026/11/15,"","許可","なし",""
"016000","fBiz00001232250000000002","富山県","富山市","ばらずし　コスモ21店","バラズシコスモニジュウイチテン","① 飲食店営業","仕出し弁当","富山県下新川郡入善町椚山1336","コスモ21",36.942019,137.513634,"0765-74-9115","","","","990799-002",2022/08/10,2022/08/10,2022/08/11,2028/08/10,"","許可","なし",""
"016000","fBiz00001238980000000001","富山県","富山市","森永新川ミルクセンター","モリナガニイカワミルクセンター","⑬ その他の食料・飲料販売業","","富山県下新川郡朝日町草野123-17","",36.952597,137.551187,"0765-83-2436","","","","","","","","","","届出","",""
"016000","fBiz00001247460000000001","富山県","富山市","ファミリーマート射水大門","ファミリーマートイミズダイモン","⑩ コンビニエンスストア","コンビニエンスストア","富山県射水市大門167-2","",36.733476,137.047728,"0766525435","塚本健","","富山県射水市大門167-2","","","","","","","届出","",""
"016000","fBiz00001249880000000001","富山県","富山市","本家かまどや　ＪＲ駅前店","ホンケカマドヤ　ジェイアールエキマエテン","① 飲食店営業","","富山県魚津市上村木１－１１－１５","",36.825010,137.409788,"","","","","990726-001",2021/10/28,2021/10/28,2021/11/22,2027/11/21,"","許可","　",""
"016000","fBiz00001250370000000001","富山県","富山市","ちょっこし屋","チョッコシヤ","㉛ 食品の小分け業","","富山県黒部市宇奈月温泉330-41","",36.815713,137.582967,"0765-32-4037","株式会社　河鹿","1230001016698","富山県黒部市宇奈月温泉330-19","210184-003",2021/10/14,2021/10/14,2021/10/15,2026/10/14,"","許可","なし",""
"016000","fBiz00001250390000000001","富山県","富山市","株式会社富山ビバレッジ","カブシキガイシャトヤマビバレッジ","㉗ 器具、容器包装の製造・加工業（合成樹脂が使用された器具又は容器包装の製造、加工に限る。）","","富山県下新川郡入善町墓ノ木579番地の1","",36.876035,137.539283,"076578221","株式会社富山ビバレッジ","5230001007520","富山県下新川郡入善町墓ノ木579番地の1","","","","","","","届出","",""
"016000","fBiz00001253650000000001","富山県","富山市","","","⑥ 弁当販売業","","","","","","","","","","","","","","","","届出","",""
"016000","fBiz00001254070000000001","富山県","富山市","若林老人いこいの家","ワカバヤシロウジンイコイノイエ","⑰ 農産保存食料品製造・加工業","","富山県砺波市狐島182","",36.652413,136.922870,"","","","","","","","","","","届出","",""
"016000","fBiz00001254210000000001","富山県","富山市","","","⑧ 米穀類販売業","","","","","","","","","","","","","","","","届出","",""
"016000","fBiz00001254210000000002","富山県","富山市","","","⑦ 野菜果物販売業","","","","","","","","","","","","","","","","届出","",""
"016000","fBiz00001254210000000002","富山県","富山市","","","⑧ 米穀類販売業","","","","","","","","","","","","","","","","届出","",""
"016000","fBiz00001254510000000001","富山県","富山市","","","⑰ 農産保存食料品製造・加工業","","","","","","","","","","","","","","","","届出","",""
"016000","fBiz00001254550000000001","富山県","富山市","栴檀野地場産野菜直売所","センダンノジバサンヤサイチョクバイジョ","⑦ 野菜果物販売業","","富山県砺波市福岡257","",36.642778,137.026141,"","","","","","","","","","","届出","",""
"016000","fBiz00001254610000000001","富山県","富山市","伊藤昆布店","イトウコンブテン","⑬ その他の食料・飲料販売業","","富山県南砺市福光本町6895","",36.557968,136.871539,"","","","","","","","","","","届出","",""
"016000","fBiz00001254790000000001","富山県","富山市","ガラパゴスキャンピングパーク～桜ヶ池自遊の森～","ガラパゴスキャンピングパーク　サクラガイケジュウノモリ","① 魚介類販売業（包装済みの魚介類のみの販売）","","富山県南砺市立野原東字丸山1767","",36.498181,136.866441,"","株式会社　ガラパゴス","1230001018848","富山県富山市五福5436-1","","","","","","","届出","",""
"016000","fBiz00001254790000000001","富山県","富山市","ガラパゴスキャンピングパーク～桜ヶ池自遊の森～","ガラパゴスキャンピングパーク　サクラガイケジュウノモリ","② 食肉販売業（包装済みの食肉のみの販売）","","富山県南砺市立野原東字丸山1767","",36.498181,136.866441,"","株式会社　ガラパゴス","1230001018848","富山県富山市五福5436-1","","","","","","","届出","",""
"016000","fBiz00001254790000000001","富山県","富山市","ガラパゴスキャンピングパーク～桜ヶ池自遊の森～","ガラパゴスキャンピングパーク　サクラガイケジュウノモリ","⑦ 野菜果物販売業","","富山県南砺市立野原東字丸山1767","",36.498181,136.866441,"","株式会社　ガラパゴス","1230001018848","富山県富山市五福5436-1","","","","","","","届出","",""
"016000","fBiz00001254920000000001","富山県","富山市","砺波ほほえみ館","トナミホホエミカン","㉖ 集団給食施設","","富山県砺波市平成町1－11","",36.634655,136.959014,"","株式会社ヒューマンケア","2230001015402","富山県砺波市平成町1－11","","","","","","","届出","",""
"016000","fBiz00001254990000000001","富山県","富山市","砺波第2ほほえみ館","トナミダイニホホエミカン","㉖ 集団給食施設","","富山県砺波市太郎丸1－５－９","",36.633517,136.958361,"0763337797","株式会社フォレストリーフ","4230001014988","富山県高岡市木津597－1","","","","","","","届出","",""
"016000","fBiz00001255260000000004","富山県","富山市","ファミリーマート高岡姫野店","ファミリーマートタカオカヒメノテン","⑩ コンビニエンスストア","コンビニ","富山県高岡市放生津10-4","",36.769946,137.083033,"0766842170","城家和弥","","","","","","","","","届出","",""
"016000","fBiz00001260690000000002","富山県","富山市","童和保育園","ドウワホイクエン","㉖ 集団給食施設","","富山県滑川市堀江1796","",36.733285,137.351804,"0764750516","社会福祉法人三ツ和福祉会　","2230005004384","富山県滑川市堀江1796","","","","","","","届出","",""
"016000","fBiz00001261010000000001","富山県","富山市","ハーバリーハウス有限会社","ハーバリーハウスユウゲンガイシャ","⑪ 菓子製造業","","富山県射水市大門158-2","",36.733369,137.048439,"","バーバリーハウス有限会社","8230002014125","富山県射水市土合685","060917-001",2021/11/04,2021/11/02,2021/11/22,2026/11/21,"","許可"," ",""
"016000","fBiz00001268060000000002","富山県","富山市","オートバックス魚津店（ブリック）","オートバックスウオヅテン","③ 乳類販売業","","富山県魚津市吉島","",36.828342,137.416502,"","株式会社ベネフレックス","7230001010927","富山県高岡市内島３５５０番地","","","","","","","届出","",""
"016000","fBiz00001268060000000003","富山県","富山市","コメリパワー魚津店風除室","コメリパワーウオヅテンフウジョシツ","③ 乳類販売業","","富山県魚津市宮津","",36.800543,137.414962,"","株式会社ベネフレックス","7230001010927","富山県高岡市内島３５５０番地","","","","","","","届出","",""
"016000","fBiz00001268060000000004","富山県","富山市","黒部・宇奈月温泉　やまのは社員寮ＢＰ","クロベ・ウナヅキオンセン　ヤマノハシャインリョウ","③ 乳類販売業","","富山県黒部市宇奈月温泉","",36.731971,137.623275,"","株式会社ベネフレックス","7230001010927","富山県高岡市内島３５５０番地","","","","","","","届出","",""
"016000","fBiz00001268060000000005","富山県","富山市","入善町町民会館","ニュウゼンマチチョウミンカイカン","③ 乳類販売業","","富山県下新川郡入善町入膳","",36.933977,137.504695,"","株式会社ベネフレックス","7230001010927","富山県高岡市内島３５５０番地","","","","","","","届出","",""
"016000","fBiz00001268060000000006","富山県","富山市","（株）金太郎温泉カルナの館大広間","キンタロウオンセンカルナノヤカタオオヒロマ","③ 乳類販売業","","富山県魚津市天神野新","",36.829987,137.440751,"","株式会社ベネフレックス","7230001010927","富山県高岡市内島３５５０番地","","","","","","","届出","",""
"016000","fBiz00001268060000000007","富山県","富山市","魚津水族館レストハウス","ウオヅスイゾクカンレストハウス","③ 乳類販売業","","富山県魚津市三ケ","",36.725016,137.545740,"","株式会社ベネフレックス","7230001010927","富山県高岡市内島３５５０番地","","","","","","","届出","",""
"016000","fBiz00001268060000000008","富山県","富山市","入善児童センター　","ニュウゼンジドウセンター　","③ 乳類販売業","","富山県下新川郡入善町入膳4517-3","",36.936372,137.506195,"","株式会社ベネフレックス","7230001010927","富山県高岡市内島３５５０番地","","","","","","","届出","",""
"016000","fBiz00001268060000000009","富山県","富山市","富山医療福祉専門学校食堂　","トヤマイリョウフクシセンモンガッコウショクドウ","③ 乳類販売業","","富山県滑川市柳原149-9","",36.769853,137.358679,"","株式会社ベネフレックス","7230001010927","富山県高岡市内島３５５０番地","","","","","","","届出","",""
"016000","fBiz00001268060000000011","富山県","富山市","シロウマサイエンス 食堂","シロウマサイエンス ショクドウ","③ 乳類販売業","","富山県下新川郡入善町青木5777","",36.917987,137.481084,"","株式会社ベネフレックス","7230001010927","富山県高岡市内島３５５０番地","","","","","","","届出","",""
"016000","fBiz00001268060000000012","富山県","富山市","京セラ（株）富山入善Ｄ棟１Ｆ休憩室","キョウセラカブトヤマニュウゼンディートウイッカイキュウケイシツ","③ 乳類販売業","","富山県下新川郡入善町入膳","",36.933977,137.504695,"","株式会社ベネフレックス","7230001010927","富山県高岡市内島３５５０番地","","","","","","","届出","",""
"016000","fBiz00001268060000000013","富山県","富山市","医療法人社団　浦田病院","イリョウホウジンシャダンウラタビョウイン","③ 乳類販売業","","富山県魚津市石垣","",36.800623,137.453594,"","株式会社ベネフレックス","7230001010927","富山県高岡市内島３５５０番地","","","","","","","届出","",""
"016000","fBiz00001268060000000014","富山県","富山市","池田リハビリテーション病院２Ｆ","イケダリハビリテーションビョウインニカイ","③ 乳類販売業","","富山県黒部市荻生","",36.884845,137.472850,"","株式会社ベネフレックス","7230001010927","富山県高岡市内島３５５０番地","","","","","","","届出","",""
"016000","fBiz00001268060000000015","富山県","富山市","池田リハビリテーション病院３Ｆ","イケダリハビリテーションビョウインサンカイ","③ 乳類販売業","","富山県黒部市荻生","",36.884845,137.472850,"","株式会社ベネフレックス","7230001010927","富山県高岡市内島３５５０番地","","","","","","","届出","",""
"016000","fBiz00001268060000000016","富山県","富山市","厚生連滑川病院　精神科","コウセイレンナメリカワビョウインセイシンカ","③ 乳類販売業","","富山県滑川市常盤町119","",36.769993,137.345417,"","株式会社ベネフレックス","7230001010927","富山県高岡市内島３５５０番地","","","","","","","届出","",""
"016000","fBiz00001268060000000017","富山県","富山市","厚生連滑川病院　売店横","コウセイレンナメリカワビョウインバイテンヨコ","③ 乳類販売業","","富山県滑川市常盤町119","",36.769993,137.345417,"","株式会社ベネフレックス","7230001010927","富山県高岡市内島３５５０番地","","","","","","","届出","",""
"016000","fBiz00001268060000000022","富山県","富山市","アルプラザ小杉　２Ｆベビールーム前　","アルプラザコスギニカイベビールームマエ","③ 乳類販売業","","富山県射水市三ケ","",36.723311,137.087735,"","株式会社ベネフレックス","7230001010927","富山県高岡市内島３５５０番地","","","","","","","届出","",""
"016000","fBiz00001268060000000365","富山県","富山市","イオンモール　１Ｆこども広場","イオンモール　イッカイコドモヒロバ","③ 乳類販売業","","富山県高岡市下伏間江383","",36.723894,137.016709,"","株式会社ベネフレックス","7230001010927","富山県高岡市内島３５５０番地","","","","","","","届出","",""
"016000","fBiz00001268060000000374","富山県","富山市","イオンモール高岡　１Ｆ中央ＥＶ横","イオンモールタカオカ　イッカイチュウオウエレベーターヨコ","③ 乳類販売業","","富山県高岡市下伏間江383","",36.723894,137.016709,"","株式会社ベネフレックス","7230001010927","富山県高岡市内島３５５０番地","","","","","","","届出","",""
"016000","fBiz00001268060000000375","富山県","富山市","イオン高岡南店　１Ｆエスカ横","イオンタカオカミナミテン　イッカイエスカヨコ","③ 乳類販売業","","富山県高岡市下伏間江383","",36.723894,137.016709,"","株式会社ベネフレックス","7230001010927","富山県高岡市内島３５５０番地","","","","","","","届出","",""
"016000","fBiz00001268060000000376","富山県","富山市","イオンモール　１Ｆオーソリティー前","イオンモール　イッカイオーソリティーマエ","③ 乳類販売業","","富山県高岡市下伏間江383","",36.723894,137.016709,"","株式会社ベネフレックス","7230001010927","富山県高岡市内島３５５０番地","","","","","","","届出","",""
"016000","fBiz00001268060000000377","富山県","富山市","イオンモール　１Ｆトイザラス前","イオンモール　イッカイトイザラスマエ","③ 乳類販売業","","富山県高岡市下伏間江383","",36.723894,137.016709,"","株式会社ベネフレックス","7230001010927","富山県高岡市内島３５５０番地","","","","","","","届出","",""
"016000","fBiz00001268060000000378","富山県","富山市","イオンモール高岡　２Ｆ赤ちゃんルーム","イオンモールタカオカ　ニカイアカチャンルーム","③ 乳類販売業","","富山県高岡市下伏間江383","",36.723894,137.016709,"","株式会社ベネフレックス","7230001010927","富山県高岡市内島３５５０番地","","","","","","","届出","",""
"016000","fBiz00001268060000000379","富山県","富山市","オタヤセリオ１Ｆアトリウム","オタヤセリオイッカイアトリウム","③ 乳類販売業","","富山県高岡市御旅屋町101","",36.745517,137.013966,"","株式会社ベネフレックス","7230001010927","富山県高岡市内島３５５０番地","","","","","","","届出","",""
