"025201","fBiz00000301920000002818","滋賀県","大津市","ガスト　膳所店","ガストゼゼテン","⑬ その他の食料・飲料販売業","","滋賀県大津市秋葉台６－１５","",34.991081,135.886278,"077-528-2039","株式会社すかいらーくレストランツ","2012401030556","東京都武蔵野市西久保１丁目２５番８号","","","","","","","届出","",""
"025201","fBiz00000301920000002829","滋賀県","大津市","から好し　大津堅田","カラヨシオオツカタタ","⑬ その他の食料・飲料販売業","","滋賀県大津市本堅田五丁目１４２７－６","",35.117210,135.914071,"077-571-1533","株式会社すかいらーくレストランツ","2012401030556","東京都武蔵野市西久保１丁目２５番８号","","","","","","","届出","",""
"025201","fBiz00000306190000000001","滋賀県","大津市","","","㉖ 集団給食施設","","","","","","","","","","","","","","","","届出","",""
"025201","fBiz00000307830000000003","滋賀県","大津市","マツヤスーパー大津美崎店","マツヤスーパーオオツミサキテン","⑪ 百貨店、総合スーパー","","滋賀県大津市美崎町５－１","",34.982502,135.889577,"0775310006","株式会社マツヤスーパー","1130001013359","京都府京都市山科区竹鼻地蔵寺南町９番地１","","","","","","","届出","",""
"025201","fBiz00000323380000000166","滋賀県","大津市","","","⑪ 百貨店、総合スーパー","","","","","","","","","","","","","","","","届出","",""
"025201","fBiz00000324450000000004","滋賀県","大津市","","","㉖ 集団給食施設","","","","","","","","","","","","","","","","届出","",""
"025201","fBiz00000324450000000005","滋賀県","大津市","","","㉖ 集団給食施設","","","","","","","","","","","","","","","","届出","",""
"025201","fBiz00000324450000000006","滋賀県","大津市","","","㉖ 集団給食施設","","","","","","","","","","","","","","","","届出","",""
"025201","fBiz00000337970000000001","滋賀県","大津市","レイモンド大萱保育園","レイモンドオオガヤホイクエン","㉖ 集団給食施設","","滋賀県大津市大萱四丁目５ー１０","",34.986542,135.916299,"0775728245","社会福祉法人檸檬会　","3170005003350","和歌山県紀の川市古和田240","","","","","","","届出","",""
"025201","fBiz00000339060000000001","滋賀県","大津市","","","㉖ 集団給食施設","","","","","","","","","","","","","","","","届出","",""
"025201","fBiz00000339170000000130","滋賀県","大津市","マックスバリュ膳所店","マックスバリュゼゼテン","⑪ 百貨店、総合スーパー","食品スーパーマーケット","滋賀県大津市におの浜三丁目１ー１４","",35.004972,135.883287,"077-526-0232","マックスバリュ東海株式会社","1080101006499","静岡県浜松市東区篠ケ瀬町1295番地1","","","","","","","届出","",""
"025201","fBiz00000339170000000194","滋賀県","大津市","マックスバリュ大津月輪店","マックスバリュオオツツキノワテン","⑪ 百貨店、総合スーパー","食品スーパーマーケット","滋賀県大津市月輪三丁目３１－１","",34.983479,135.939707,"077-547-1003","マックスバリュ東海株式会社","1080101006499","静岡県浜松市東区篠ケ瀬町1295番地1","","","","","","","届出","",""
"025201","fBiz00000339170000000245","滋賀県","大津市","マックスバリュ大津京店","マックスバリュオオツキョウテン","⑪ 百貨店、総合スーパー","食品スーパーマーケット","滋賀県大津市二本松１－１","ブランチ大津京内",35.029578,135.865288,"0775211101","マックスバリュ東海株式会社","1080101006499","静岡県浜松市東区篠ケ瀬町1295番地1","","","","","","","届出","",""
"025201","fBiz00000339170000000245","滋賀県","大津市","マックスバリュ大津京店","マックスバリュオオツキョウテン","⑫ 自動販売機による販売業（コップ式自動販売機（自動洗浄・屋内設置）及び営業許可の対象となる自動販売機を除く）","食品スーパーマーケット","滋賀県大津市二本松１－１","ブランチ大津京内",35.029578,135.865288,"0775211101","マックスバリュ東海株式会社","1080101006499","静岡県浜松市東区篠ケ瀬町1295番地1","","","","","","","届出","",""
"025201","fBiz00000350030000000001","滋賀県","大津市","フレンドマート膳所店","フレンドマートゼゼテン","⑪ 百貨店、総合スーパー","","滋賀県大津市中庄二丁目１－８５","",34.991552,135.886619,"0775234141","株式会社平和堂","3160001008726","滋賀県彦根市西今町1","","","","","","","届出","",""
"025201","fBiz00000351490000000001","滋賀県","大津市","びわこいいみち店","ビワコイイミチテン","⑥ 弁当販売業","","滋賀県大津市京町四丁目１－１","",35.004367,135.869019,"","滋賀酒造株式会社","1160001005130","滋賀県甲賀市水口町三本柳39番地","","","","","","","届出","",""
"025201","fBiz00000367510000000001","滋賀県","大津市","特別養護老人ホームアシタバ","トクベツヨウゴロウジンホームアシタバ","㉖ 集団給食施設","","滋賀県大津市松が丘七丁目１５－６","",34.971294,135.964632,"077-549-3260","社会福祉法人　近江笑生会","5160005009768","滋賀県大津市松が丘7-15-6","","","","","","","届出","",""
"025201","fBiz00000368870000000001","滋賀県","大津市","ひかり保育園","ヒカリホイクエン","㉖ 集団給食施設","給食施設","滋賀県大津市大萱三丁目１１－１４","",34.988210,135.920099,"077-543-2253","社会福祉法人　大津ひかり福祉会","9160005000005","滋賀県大津市大萱三丁目１１－１４","","","","","","","届出","",""
"025201","fBiz00000371690000000022","滋賀県","大津市","イオンスタイル大津京","イオンスタイルオオツキョウ","⑪ 百貨店、総合スーパー","","滋賀県大津市皇子が丘三丁目１１－１","",35.024323,135.859529,"077-528-5700","イオンリテール株式会社","2040001000456","千葉県千葉市美浜区中瀬一丁目５番地１","","","","","","","届出","",""
"025201","fBiz00000372530000000005","滋賀県","大津市","熊本直送馬肉専門店　さくら","クマモトチョクソウバニクセンモンテン　サクラ","② 食肉販売業（包装済みの食肉のみの販売）","","滋賀県大津市一里山7丁目1番1号","foreo大津一里山 1階",34.974151,135.933235,"09019636813","株式会社Survive","7122001030461","大阪府八尾市上之島町南4丁目2番地","","","","","","","届出","",""
"025201","fBiz00000373930000000004","滋賀県","大津市","ＮＹＤＳ大津市役所店","エヌワイディエスオオツシヤクショテン","⑩ コンビニエンスストア","コンビニエンスストア","滋賀県大津市御陵町３－１","大津市役所新館１F",35.018727,135.854596,"0775250170","株式会社マック","6130001007323","京都府京都市左京区岩倉上蔵町１５８番地","","","","","","","届出","",""
"025201","fBiz00000385330000000001","滋賀県","大津市","一里山ひかりこども園","イチリヤマヒカリコドモエン","㉖ 集団給食施設","給食施設","滋賀県大津市一里山二丁目１９－１０","",34.984605,135.930489,"077-545-1414","社会福祉法人　大津ひかり福祉会","9160005000005","滋賀県大津市大萱三丁目１１－１４","","","","","","","届出","",""
"025201","fBiz00000404950000000001","滋賀県","大津市","鮎家本店","アユヤホンテン","① 魚介類販売業（包装済みの魚介類のみの販売）","食品製造販売業","滋賀県大津市真野二丁目２４－１","",35.127666,135.918491,"077-573-5225","株式会社鮎家本店","9160001000099","滋賀県大津市真野２丁目２４番１号","","","","","","","届出","",""
"025201","fBiz00000430060000000001","滋賀県","大津市","大将軍ひかり保育園","タイショウグンヒカリホイクエン","㉖ 集団給食施設","給食施設","滋賀県大津市大将軍三丁目１９－２","",34.991388,135.927333,"","社会福祉法人　大津ひかり福祉会　","9160005000005","滋賀県大津市大萱三丁目11-14","","","","","","","届出","",""
"025201","fBiz00000436460000000077","滋賀県","大津市","スーパーセンタートライアル滋賀大津店","スーパーセンタートライアルシガオオツテン","⑪ 百貨店、総合スーパー","スーパー","滋賀県大津市玉野浦１０ー１","",34.981294,135.909668,"077-548-3661","株式会社トライアルカンパニー","1290001009110","福岡県福岡市東区多の津一丁目12番2号","","","","","","","届出","",""
"025201","fBiz00000461520000000002","滋賀県","大津市","サコージュみき","サコージュミキ","㉖ 集団給食施設","高齢者向け施設","滋賀県大津市あかね町１４－７","",35.044559,135.863618,"0775216065","有限会社ミキ","4160002004260","滋賀県大津市滋賀里４丁目１１番９号","","","","","","","届出","",""
"025201","fBiz00000463880000000040","滋賀県","大津市","お酒のぷちショップ浜大津店","オサケノプチショップハマオオツテン","⑬ その他の食料・飲料販売業","酒類全般、食料飲料水小売販売業","滋賀県大津市長等三丁目２－２５","プレアール浜大津１階",35.010791,135.861197,"077-548-6690","株式会社サケネット","1160001016276","滋賀県守山市水保町1125-1","","","","","","","届出","",""
"025201","fBiz00000473780000000001","滋賀県","大津市","大津市立比良保育園","オオツシリツヒラホイクエン","㉖ 集団給食施設","","滋賀県大津市南比良５８５－１","",35.217172,135.938645,"0775921186","大津市","9000020252018","滋賀県大津市御陵町3-1","","","","","","","届出","",""
"025201","fBiz00000473780000000002","滋賀県","大津市","大津市立和邇保育園","オオツシリツワニホイクエン","㉖ 集団給食施設","","滋賀県大津市和邇中１７２－１","",35.157380,135.919104,"0775940063","大津市","9000020252018","滋賀県大津市御陵町3-1","","","","","","","届出","",""
"025201","fBiz00000473780000000003","滋賀県","大津市","大津市立伊香立保育園","オオツシリツイカダチホイクエン","㉖ 集団給食施設","","滋賀県大津市伊香立下龍華町５６６","",35.153698,135.893254,"0775982294","大津市","9000020252018","滋賀県大津市御陵町3-1","","","","","","","届出","",""
"025201","fBiz00000473780000000004","滋賀県","大津市","大津市立堅田保育園","オオツシリツカタタホイクエン","㉖ 集団給食施設","","滋賀県大津市本堅田四丁目２６－１","",35.117683,135.918700,"0775721570","大津市","9000020252018","滋賀県大津市御陵町3-1","","","","","","","届出","",""
"025201","fBiz00000473780000000005","滋賀県","大津市","大津市立天神山保育園","オオツシリツテンジンヤマホイクエン","㉖ 集団給食施設","","滋賀県大津市本堅田六丁目３－１","",35.115383,135.907324,"0775720249","大津市","9000020252018","滋賀県大津市御陵町3-1","","","","","","","届出","",""
"025201","fBiz00000473780000000006","滋賀県","大津市","大津市立唐崎保育園","オオツシリツカラサキホイクエン","㉖ 集団給食施設","","滋賀県大津市際川三丁目３７－１","",35.042994,135.865088,"0775253844","大津市","9000020252018","滋賀県大津市御陵町3-1","","","","","","","届出","",""
"025201","fBiz00000473780000000007","滋賀県","大津市","大津市立ひえい平保育園","オオツシリツヒエイダイラホイクエン","㉖ 集団給食施設","","滋賀県大津市比叡平一丁目４５－３","",35.031616,135.835063,"0775292700","大津市","9000020252018","滋賀県大津市御陵町3-1","","","","","","","届出","",""
"025201","fBiz00000473780000000008","滋賀県","大津市","大津市立皇子が丘保育園","オオツシリツオウジガオカホイクエン","㉖ 集団給食施設","","滋賀県大津市皇子が丘一丁目２０－２０","",35.026621,135.852468,"0775256092","大津市","9000020252018","滋賀県大津市御陵町3-1","","","","","","","届出","",""
"025201","fBiz00000473780000000009","滋賀県","大津市","大津市立逢坂保育園","オオツシリツオウサカホイクエン","㉖ 集団給食施設","","滋賀県大津市音羽台６－２０","",35.001613,135.865983,"0775228485","大津市","9000020252018","滋賀県大津市御陵町3-1","","","","","","","届出","",""
"025201","fBiz00000473780000000010","滋賀県","大津市","大津市立朝日が丘保育園","オオツシリツアサヒガオカホイクエン","㉖ 集団給食施設","","滋賀県大津市朝日が丘一丁目２３－３３","",35.001669,135.870380,"0775251470","大津市","9000020252018","滋賀県大津市御陵町3-1","","","","","","","届出","",""
"025201","fBiz00000473780000000011","滋賀県","大津市","大津市立膳所保育園","オオツシリツゼゼホイクエン","㉖ 集団給食施設","","滋賀県大津市昭和町１７－３２","",34.998833,135.888517,"0775240888","大津市","9000020252018","滋賀県大津市御陵町3-1","","","","","","","届出","",""
"025201","fBiz00000473780000000012","滋賀県","大津市","大津市立晴嵐保育園","オオツシリツセイランホイクエン","㉖ 集団給食施設","","滋賀県大津市光が丘町５－１０","",34.971479,135.897587,"0775340707","大津市","9000020252018","滋賀県大津市御陵町3-1","","","","","","","届出","",""
"025201","fBiz00000473780000000013","滋賀県","大津市","大津市立大平保育園","オオツシリツオオヒラホイクエン","㉖ 集団給食施設","","滋賀県大津市大平二丁目３３－２２","",34.950173,135.894370,"0775341750","大津市","9000020252018","滋賀県大津市御陵町3-1","","","","","","","届出","",""
"025201","fBiz00000473780000000014","滋賀県","大津市","大津市立瀬田南保育園","オオツシリツセタミナミホイクエン","㉖ 集団給食施設","","滋賀県大津市三大寺１－３","",34.974290,135.915445,"0775474222","大津市","9000020252018","滋賀県大津市御陵町3-1","","","","","","","届出","",""
"025201","fBiz00000484310000000003","滋賀県","大津市","株式会社比叡ゆば本舗ゆば八　大津工場","カブシキガイシャヒエイユバホンポユバハチ　オオツコウジョウ","㉔ その他の食料品製造・加工業","","滋賀県大津市中央四丁目３－１０","",35.006443,135.870539,"077-526-2689","","","","","","","","","","届出","",""
"025201","fBiz00000489140000000002","滋賀県","大津市","レイモンドみらい園","レイモンドミライエン","㉖ 集団給食施設","","滋賀県大津市中央二丁目２－２０","",35.008918,135.865601,"","社会福祉法人檸檬会","3170005003350","和歌山県紀の川市古和田240","","","","","","","届出","",""
"025201","fBiz00000497960000000044","滋賀県","大津市","クスリのアオキ大津京店","クスリノアオキオオツキョウテン","⑪ 百貨店、総合スーパー","ドラッグストア","滋賀県大津市柳川二丁目５ー１","",35.031771,135.862171,"077-526-7992","株式会社クスリのアオキ","2220001008745","石川県白山市松本町２５１２番地","","","","","","","届出","",""
"025201","fBiz00000497960000000184","滋賀県","大津市","クスリのアオキ比叡辻店","クスリノアオキヒエイツジテン","⑪ 百貨店、総合スーパー","ドラッグストア","滋賀県大津市比叡辻二丁目８ー５","",35.073427,135.885260,"077-548-8551","株式会社クスリのアオキ","2220001008745","石川県白山市松本町２５１２番地","","","","","","","届出","",""
"025201","fBiz00000497960000000410","滋賀県","大津市","クスリのアオキ唐崎店","クスリノアオキカラサキテン","⑪ 百貨店、総合スーパー","ドラッグストア","滋賀県大津市見世一丁目１８ー１","",35.040653,135.860464,"077-511-9755","株式会社クスリのアオキ","2220001008745","石川県白山市松本町２５１２番地","","","","","","","届出","",""
"025201","fBiz00000497960000000699","滋賀県","大津市","クスリのアオキ際川店","クスリノアオキサイガワテン","⑪ 百貨店、総合スーパー","ドラッグストア","滋賀県大津市際川四丁目10番31号","",35.045806,135.868256,"077-572-6150","株式会社クスリのアオキ","2220001008745","石川県白山市松本町２５１２番地","","","","","","","届出","",""
"025201","fBiz00000497960000000705","滋賀県","大津市","クスリのアオキ堅田店","クスリノアオキカタタテン","⑪ 百貨店、総合スーパー","ドラッグストア","滋賀県大津市本堅田六丁目２５－１","",35.118610,135.910282,"077-571-0220","株式会社クスリのアオキ","2220001008745","石川県白山市松本町２５１２番地","","","","","","","届出","",""
"025201","fBiz00000497960000000853","滋賀県","大津市","クスリのアオキ雄琴店","クスリノアオキオゴトテン","⑪ 百貨店、総合スーパー","ドラッグストア","滋賀県大津市雄琴三丁目４－３２","",35.098246,135.902037,"077-572-7152","株式会社クスリのアオキ","2220001008745","石川県白山市松本町２５１２番地","","","","","","","届出","",""
"025201","fBiz00000499030000000025","滋賀県","大津市","","","⑬ その他の食料・飲料販売業","","","","","","","","","","","","","","","","届出","",""
"025201","fBiz00000500710000000001","滋賀県","大津市","有限会社瀬尾養蜂園","ユウゲンガイシャセオヨウホウエン","㉔ その他の食料品製造・加工業","食品製造業（蜂蜜の瓶詰め及び販売）","","","","","","","","","","","","","","","届出","",""
"025201","fBiz00000501190000000026","滋賀県","大津市","","","⑬ その他の食料・飲料販売業","自動販売機による","","","","","","","","","","","","","","","届出","",""
"025201","fBiz00000501190000000030","滋賀県","大津市","","","⑬ その他の食料・飲料販売業","食品自動販売機による","","","","","","","","","","","","","","","届出","",""
"025201","fBiz00000501190000000075","滋賀県","大津市","","","⑬ その他の食料・飲料販売業","食品自動販売機による","","","","","","","","","","","","","","","届出","",""
"025201","fBiz00000501190000000333","滋賀県","大津市","","","⑬ その他の食料・飲料販売業","食品自動販売機による","","","","","","","","","","","","","","","届出","",""
"025201","fBiz00000515980000000013","滋賀県","大津市","ファミリーマート龍谷大学店","ファミリーマートリュウコクダイガクテン","⑩ コンビニエンスストア","","滋賀県大津市瀬田大江町横谷１－５","龍谷大学青雲館1F",34.963749,135.940736,"","株式会社不二家商事","5130001008628","京都府京都市西京区桂上野東町１２９番地","","","","","","","届出","",""
"025201","fBiz00000568340000000158","滋賀県","大津市","餃子の王将 国道大津店","ギョウザノオウショウ　コクドウオオツテン","⑬ その他の食料・飲料販売業","その他の食料・飲料販売業 ","滋賀県大津市中庄二丁目５９８－５","",34.990168,135.889116,"077-526-3974","株式会社王将フードサービス","3130001012441","京都府京都市山科区西野山射庭ノ上町２９４番地の１","","","","","","","届出","",""
"025201","fBiz00000568340000000159","滋賀県","大津市","餃子の王将堅田店","ギョウザノオウショウカタタテン","⑬ その他の食料・飲料販売業","その他の食料・飲料販売業 ","滋賀県大津市本堅田四丁目１６－８","",35.120559,135.917528,"077-573-4015","株式会社王将フードサービス","3130001012441","京都府京都市山科区西野山射庭ノ上町２９４番地の１","","","","","","","届出","",""
"025201","fBiz00000568340000000160","滋賀県","大津市","餃子の王将 瀬田店","ギョウザノオウショウ　セタテン","⑬ その他の食料・飲料販売業","その他の食料・飲料販売業 ","滋賀県大津市大萱一丁目１８－３４","中川ビル１Ｆ",34.986708,135.925695,"077-544-1847","株式会社王将フードサービス","3130001012441","京都府京都市山科区西野山射庭ノ上町２９４番地の１","","","","","","","届出","",""
"025201","fBiz00000568340000000161","滋賀県","大津市","餃子の王将 皇子山店","ギョウザノオウショウ　オウジヤマテン","⑬ その他の食料・飲料販売業","その他の食料・飲料販売業 ","滋賀県大津市松山町１２－９","",35.026872,135.864334,"077-525-8934","株式会社王将フードサービス","3130001012441","京都府京都市山科区西野山射庭ノ上町２９４番地の１","","","","","","","届出","",""
"025201","fBiz00000569600000000003","滋賀県","大津市","株式会社　かね辰商店 滋賀830も・・77","カブシキガイシャ　カネタツショウテン","① 魚介類販売業（包装済みの魚介類のみの販売）","移動販売","滋賀県大津市一円","",34.974151,135.933235,"0775438358","株式会社かね辰商店","4160001000459","滋賀県大津市瀬田大江町５９番地１","","","","","","","届出","",""
"025201","fBiz00000569600000000004","滋賀県","大津市","株式会社　かね辰商店 滋賀830そ193","カブシキガイシャ　カネタツショウテン　シガ　ソ","① 魚介類販売業（包装済みの魚介類のみの販売）","移動販売","滋賀県大津市一円","",35.017837,135.855208,"0775438358","株式会社かね辰商店","4160001000459","滋賀県大津市瀬田大江町５９番地１","","","","","","","届出","",""
"025201","fBiz00000569600000000006","滋賀県","大津市","株式会社　かね辰商店","カブシキガイシャカネタツショウテン","⑬ その他の食料・飲料販売業","仲卸店頭販売","滋賀県大津市瀬田大江町５９－１－１１６","",34.967082,135.931801,"0775438358","株式会社かね辰商店","4160001000459","滋賀県大津市瀬田大江町５９番地１","","","","","","","届出","",""
"025201","fBiz00000581420000000050","滋賀県","大津市","","","⑫ 自動販売機による販売業（コップ式自動販売機（自動洗浄・屋内設置）及び営業許可の対象となる自動販売機を除く）","","","","","","","","","","","","","","","","届出","",""
"025201","fBiz00000581420000000051","滋賀県","大津市","","","⑫ 自動販売機による販売業（コップ式自動販売機（自動洗浄・屋内設置）及び営業許可の対象となる自動販売機を除く）","","","","","","","","","","","","","","","","届出","",""
"025201","fBiz00000581420000000067","滋賀県","大津市","","","⑫ 自動販売機による販売業（コップ式自動販売機（自動洗浄・屋内設置）及び営業許可の対象となる自動販売機を除く）","","","","","","","","","","","","","","","","届出","",""
"025201","fBiz00000581420000000128","滋賀県","大津市","","","⑫ 自動販売機による販売業（コップ式自動販売機（自動洗浄・屋内設置）及び営業許可の対象となる自動販売機を除く）","","","","","","","","","","","","","","","","届出","",""
"025201","fBiz00000581420000000143","滋賀県","大津市","","","⑫ 自動販売機による販売業（コップ式自動販売機（自動洗浄・屋内設置）及び営業許可の対象となる自動販売機を除く）","","","","","","","","","","","","","","","","届出","",""
"025201","fBiz00000581420000000412","滋賀県","大津市","","","⑫ 自動販売機による販売業（コップ式自動販売機（自動洗浄・屋内設置）及び営業許可の対象となる自動販売機を除く）","","","","","","","","","","","","","","","","届出","",""
"025201","fBiz00000581420000000413","滋賀県","大津市","","","⑫ 自動販売機による販売業（コップ式自動販売機（自動洗浄・屋内設置）及び営業許可の対象となる自動販売機を除く）","","","","","","","","","","","","","","","","届出","",""
"025201","fBiz00000581420000000425","滋賀県","大津市","","","⑫ 自動販売機による販売業（コップ式自動販売機（自動洗浄・屋内設置）及び営業許可の対象となる自動販売機を除く）","","","","","","","","","","","","","","","","届出","",""
"025201","fBiz00000581420000000826","滋賀県","大津市","","","⑫ 自動販売機による販売業（コップ式自動販売機（自動洗浄・屋内設置）及び営業許可の対象となる自動販売機を除く）","","","","","","","","","","","","","","","","届出","",""
"025201","fBiz00000581420000000964","滋賀県","大津市","","","⑫ 自動販売機による販売業（コップ式自動販売機（自動洗浄・屋内設置）及び営業許可の対象となる自動販売機を除く）","","","","","","","","","","","","","","","","届出","",""
