"025201","fBiz00000198200000000001","滋賀県","大津市","フードサポート","フードサポート","⑨ 通信販売・訪問販売による販売業","小売業","滋賀県大津市山百合の丘２０－５","",35.139113,135.888077,"09011495503","高橋真司","","滋賀県大津市山百合の丘２０番５号","","","","","","","届出","",""
"025201","fBiz00000198200000000001","滋賀県","大津市","フードサポート","フードサポート","⑬ その他の食料・飲料販売業","小売業","滋賀県大津市山百合の丘２０－５","",35.139113,135.888077,"09011495503","高橋真司","","滋賀県大津市山百合の丘２０番５号","","","","","","","届出","",""
"025201","fBiz00000198490000000001","滋賀県","大津市","Ｋｉｄ’ｓ＆Ｍｏｒｅ瀬田","キッズアンドモアセタ","㉖ 集団給食施設","","滋賀県大津市大萱一丁目１６－４","リモーネ１Ｆ",34.986220,135.926033,"0775726140","社会福祉法人檸檬会","3170005003350","和歌山県紀の川市古和田240","","","","","","","届出","",""
"025201","fBiz00000203180000000003","滋賀県","大津市","滋賀刑務所","シガケイムショ","㉖ 集団給食施設","","滋賀県大津市大平一丁目１－１","滋賀刑務所",34.957279,135.893705,"077-537-3271","滋賀刑務所","9999999999999","滋賀県大津市大平1丁目1番1号","","","","","","","届出","",""
"025201","fBiz00000209750000000002","滋賀県","大津市","株式会社　平和堂　フレンドマート石山寺辺店","カブシキガイシャ　ヘイワドウ　イシヤマテラベテン","⑪ 百貨店、総合スーパー","","滋賀県大津市石山寺四丁目１４－１","",34.954840,135.900533,"077-533-6900","株式会社平和堂","3160001008726","滋賀県彦根市西今町１番地","","","","","","","届出","",""
"025201","fBiz00000209880000000001","滋賀県","大津市","（株）平和堂　フレンドマートグリーンヒル青山店","（カブ）ヘイワドウ　フレンドマートグリーンヒルアオヤマテン","⑪ 百貨店、総合スーパー","","滋賀県大津市青山五丁目１３ー３５","",34.977734,135.969495,"0775498280","株式会社平和堂","3160001008726","滋賀県彦根市西今町1番地","","","","","","","届出","",""
"025201","fBiz00000210040000000001","滋賀県","大津市","平和堂坂本店","ヘイワドウサカモトテン","⑪ 百貨店、総合スーパー","","滋賀県大津市坂本七丁目２４－１","",35.074293,135.878195,"0775783111","株式会社平和堂","3160001008726","滋賀県彦根市西今町１番地","","","","","","","届出","",""
"025201","fBiz00000211190000000001","滋賀県","大津市","株式会社平和堂フレンドマート唐崎店","カブシキガイシャヘイワドウフレンドマートカラサキテン","⑪ 百貨店、総合スーパー","","滋賀県大津市見世二丁目１１ー３５","",35.043480,135.861963,"0775262811","株式会社平和堂","3160001008726","滋賀県彦根市西今町1","","","","","","","届出","",""
"025201","fBiz00000212590000000001","滋賀県","大津市","平和堂フレンドマート大津京店　日配","ヘイワドウフレンドマートオオツキョウテン　ニッパイ","⑪ 百貨店、総合スーパー","","滋賀県大津市柳川二丁目６ー２","",35.031792,135.863901,"","株式会社　平和堂","3160001008726","滋賀県彦根市西今町1番地","","","","","","","届出","",""
"025201","fBiz00000213280000000001","滋賀県","大津市","フレンドマート大津駅前店（日配品）","フレンドマートオオツエキマエテン（ニッパイヒン）","⑪ 百貨店、総合スーパー","","滋賀県大津市春日町１ー５","プレミスト大津１階",35.003345,135.865580,"077-510-0371","株式会社平和堂","3160001008726","滋賀県彦根市西今町1番地","","","","","","","届出","",""
"025201","fBiz00000213510000000001","滋賀県","大津市","フレンドマート大津西の庄店日配","フレンドマートオオツニシノショウテンニッパイ","⑪ 百貨店、総合スーパー","","滋賀県大津市西の庄２０ー１","",35.000939,135.888841,"0775012761","株式会社平和堂","3160001008726","滋賀県彦根市西今町1","","","","","","","届出","",""
"025201","fBiz00000215130000000143","滋賀県","大津市","カネ美食品（株）一里山店","カネミショクヒン　カブ　イチリヤマテン","⑬ その他の食料・飲料販売業","持ち帰り飲食店","滋賀県大津市一里山七丁目１－１","フォレオ大津一里山１Ｆピアゴ一里山店内",34.974151,135.933235,"077-544-5551","カネ美食品株式会社","1180001023411","愛知県名古屋市緑区徳重三丁目107番地","","","","","","","届出","",""
"025201","fBiz00000215540000000008","滋賀県","大津市","トレジャーキッズ　つきのわ保育園","トレジャーキッズ　ツキノワホイクエン","㉖ 集団給食施設","児童福祉施設（認可保育園）","滋賀県大津市月輪二丁目２－２７","",34.987298,135.932646,"0775487838","","","大阪府大阪市北区堂島1-5-17","","","","","","","届出","",""
"025201","fBiz00000218100000000003","滋賀県","大津市","株式会社　平和堂　フレンドマート南郷店","カブシキカイシャヘイワドウフレンドマートナンゴウテン","⑪ 百貨店、総合スーパー","","滋賀県大津市南郷一丁目９－１２","",34.944080,135.908469,"","株式会社平和堂","3160001008726","滋賀県彦根市西今町1","","","","","","","届出","",""
"025201","fBiz00000222140000000003","滋賀県","大津市","","","⑪ 百貨店、総合スーパー","","","","","","","","","","","","","","","","届出","",""
"025201","fBiz00000222140000000004","滋賀県","大津市","スーパーサンライズ坂本店","スーパーサンライズサカモトテン","⑪ 百貨店、総合スーパー","","滋賀県大津市坂本七丁目３３－５９","",35.072630,135.879677,"0775792201","株式会社プロテクト","1130001042498","京都府京田辺市松井ヶ丘１丁目１０－１１","","","","","","","届出","",""
"025201","fBiz00000224190000000001","滋賀県","大津市","アル・プラザ瀬田","アル・プラザセタ","⑪ 百貨店、総合スーパー","","滋賀県大津市月輪一丁目３－８","",34.987203,135.929377,"0775433111","株式会社平和堂","3160001008726","滋賀県彦根市西今町1","","","","","","","届出","",""
"025201","fBiz00000224690000000244","滋賀県","大津市","MEGAドン・キホーテ大津店","メガドン・キホーテオオツテン","⑪ 百貨店、総合スーパー","小売業","滋賀県大津市柳が崎２－５","",35.025853,135.864035,"077-511-4411","株式会社ドン・キホーテ","3011001096370","東京都目黒区青葉台二丁目１９番１０号","","","","","","","届出","",""
"025201","fBiz00000226780000000001","滋賀県","大津市","みどりこども園","ミドリコドモエン","㉖ 集団給食施設","給食","滋賀県大津市瀬田三丁目２３－３","",34.966163,135.909704,"0775450706","社会福祉法人新緑会","5160005000438","滋賀県大津市瀬田３丁目２３番３号","","","","","","","届出","",""
"025201","fBiz00000228040000000001","滋賀県","大津市","フレンドマート雄琴駅前店","フレンドマートオゴトエキマエテン","⑪ 百貨店、総合スーパー","","滋賀県大津市雄琴北二丁目２－１０","",35.097832,135.892772,"077-571-3050","株式会社平和堂","3160001008726","滋賀県彦根市西今町1","","","","","","","届出","",""
"025201","fBiz00000230190000000002","滋賀県","大津市","株式会社平和堂　平和堂石山(滋賀880　り・392）","カブシキガイシャヘイワドウ　ヘイワドウイシヤマ","㉕ 行商","自動車販売","滋賀県大津市一円","",34.974151,135.933235,"0775312820","株式会社平和堂","3160001008726","滋賀県彦根市西今町1番地","","","","","","","届出","",""
"025201","fBiz00000581420000000814","滋賀県","大津市","","","⑫ 自動販売機による販売業（コップ式自動販売機（自動洗浄・屋内設置）及び営業許可の対象となる自動販売機を除く）","","","","","","","","","","","","","","","","届出","",""
"025201","fBiz00000235290000000023","滋賀県","大津市","ドラッグユタカ瀬田店","ドラッグユタカセタテン","⑬ その他の食料・飲料販売業","ドラッグストア","滋賀県大津市大江二丁目３４－１４","",34.975678,135.912599,"077-543-8528","株式会社ユタカファーマシー","6200001014428","岐阜県大垣市林町１０丁目１３３９番地１","","","","","","","届出","",""
"025201","fBiz00000235290000000109","滋賀県","大津市","ドラッグユタカ西大津店","ドラッグユタカニシオオツテン","⑪ 百貨店、総合スーパー","ドラッグストア","滋賀県大津市松山町９－１５","",35.028133,135.863925,"077-524-1141","株式会社ユタカファーマシー","6200001014428","岐阜県大垣市林町１０丁目１３３９番地１","","","","","","","届出","",""
"025201","fBiz00000235290000000109","滋賀県","大津市","ドラッグユタカ西大津店","ドラッグユタカニシオオツテン","⑫ 自動販売機による販売業（コップ式自動販売機（自動洗浄・屋内設置）及び営業許可の対象となる自動販売機を除く）","ドラッグストア","滋賀県大津市松山町９－１５","",35.028133,135.863925,"077-524-1141","株式会社ユタカファーマシー","6200001014428","岐阜県大垣市林町１０丁目１３３９番地１","","","","","","","届出","",""
"025201","fBiz00000235290000000110","滋賀県","大津市","ドラッグユタカ真野店","ドラッグユタカマノテン","⑪ 百貨店、総合スーパー","ドラッグストア","滋賀県大津市真野六丁目７ー２","",35.136414,135.922512,"077-574-2221","株式会社ユタカファーマシー","6200001014428","岐阜県大垣市林町１０丁目１３３９番地１","","","","","","","届出","",""
"025201","fBiz00000235290000000110","滋賀県","大津市","ドラッグユタカ真野店","ドラッグユタカマノテン","⑫ 自動販売機による販売業（コップ式自動販売機（自動洗浄・屋内設置）及び営業許可の対象となる自動販売機を除く）","ドラッグストア","滋賀県大津市真野六丁目７ー２","",35.136414,135.922512,"077-574-2221","株式会社ユタカファーマシー","6200001014428","岐阜県大垣市林町１０丁目１３３９番地１","","","","","","","届出","",""
"025201","fBiz00000235290000000111","滋賀県","大津市","ドラッグユタカフレンドタウン瀬田川店","ドラッグユタカフレンドタウンセタガワテン","⑪ 百貨店、総合スーパー","ドラッグストア","滋賀県大津市瀬田一丁目３１－１","",34.977621,135.909696,"077-547-3301","株式会社ユタカファーマシー","6200001014428","岐阜県大垣市林町１０丁目１３３９番地１","","","","","","","届出","",""
"025201","fBiz00000235290000000111","滋賀県","大津市","ドラッグユタカフレンドタウン瀬田川店","ドラッグユタカフレンドタウンセタガワテン","⑫ 自動販売機による販売業（コップ式自動販売機（自動洗浄・屋内設置）及び営業許可の対象となる自動販売機を除く）","ドラッグストア","滋賀県大津市瀬田一丁目３１－１","",34.977621,135.909696,"077-547-3301","株式会社ユタカファーマシー","6200001014428","岐阜県大垣市林町１０丁目１３３９番地１","","","","","","","届出","",""
"025201","fBiz00000235290000000112","滋賀県","大津市","ドラッグユタカひえい辻店","ドラッグユタカヒエイツジテン","⑪ 百貨店、総合スーパー","ドラッグストア","滋賀県大津市下阪本六丁目１６－１６","",35.069120,135.884104,"077-577-1608","株式会社ユタカファーマシー","6200001014428","岐阜県大垣市林町１０丁目１３３９番地１","","","","","","","届出","",""
"025201","fBiz00000235290000000112","滋賀県","大津市","ドラッグユタカひえい辻店","ドラッグユタカヒエイツジテン","⑫ 自動販売機による販売業（コップ式自動販売機（自動洗浄・屋内設置）及び営業許可の対象となる自動販売機を除く）","ドラッグストア","滋賀県大津市下阪本六丁目１６－１６","",35.069120,135.884104,"077-577-1608","株式会社ユタカファーマシー","6200001014428","岐阜県大垣市林町１０丁目１３３９番地１","","","","","","","届出","",""
"025201","fBiz00000235290000000113","滋賀県","大津市","ドラッグユタカ膳所店","ドラッグユタカゼゼテン","⑪ 百貨店、総合スーパー","ドラッグストア","滋賀県大津市相模町４ー３","",34.996430,135.886220,"077-510-2050","株式会社ユタカファーマシー","6200001014428","岐阜県大垣市林町１０丁目１３３９番地１","","","","","","","届出","",""
"025201","fBiz00000235290000000113","滋賀県","大津市","ドラッグユタカ膳所店","ドラッグユタカゼゼテン","⑫ 自動販売機による販売業（コップ式自動販売機（自動洗浄・屋内設置）及び営業許可の対象となる自動販売機を除く）","ドラッグストア","滋賀県大津市相模町４ー３","",34.996430,135.886220,"077-510-2050","株式会社ユタカファーマシー","6200001014428","岐阜県大垣市林町１０丁目１３３９番地１","","","","","","","届出","",""
"025201","fBiz00000235290000000114","滋賀県","大津市","ドラッグユタカ南郷店","ドラッグユタカナンゴウテン","⑪ 百貨店、総合スーパー","ドラッグストア","滋賀県大津市千町一丁目２５ー１４","",34.945600,135.909734,"077-533-3677","株式会社ユタカファーマシー","6200001014428","岐阜県大垣市林町１０丁目１３３９番地１","","","","","","","届出","",""
"025201","fBiz00000235290000000114","滋賀県","大津市","ドラッグユタカ南郷店","ドラッグユタカナンゴウテン","⑫ 自動販売機による販売業（コップ式自動販売機（自動洗浄・屋内設置）及び営業許可の対象となる自動販売機を除く）","ドラッグストア","滋賀県大津市千町一丁目２５ー１４","",34.945600,135.909734,"077-533-3677","株式会社ユタカファーマシー","6200001014428","岐阜県大垣市林町１０丁目１３３９番地１","","","","","","","届出","",""
"025201","fBiz00000235290000000117","滋賀県","大津市","ドラッグユタカ瀬田西店","ドラッグユタカセタニシテン","⑪ 百貨店、総合スーパー","ドラッグストア","滋賀県大津市瀬田二丁目９－３４","",34.970447,135.910133,"077-543-2558","株式会社ユタカファーマシー","6200001014428","岐阜県大垣市林町１０丁目１３３９番地１","","","","","","","届出","",""
"025201","fBiz00000235290000000117","滋賀県","大津市","ドラッグユタカ瀬田西店","ドラッグユタカセタニシテン","⑫ 自動販売機による販売業（コップ式自動販売機（自動洗浄・屋内設置）及び営業許可の対象となる自動販売機を除く）","ドラッグストア","滋賀県大津市瀬田二丁目９－３４","",34.970447,135.910133,"077-543-2558","株式会社ユタカファーマシー","6200001014428","岐阜県大垣市林町１０丁目１３３９番地１","","","","","","","届出","",""
"025201","fBiz00000235290000000161","滋賀県","大津市","ドラッグユタカ大津市民病院前店","ドラッグユタカオオツシミンビョウインマエテン","⑪ 百貨店、総合スーパー","ドラッグストア","滋賀県大津市竜が丘１－３","",34.999724,135.877626,"077-510-0595","株式会社ユタカファーマシー","6200001014428","岐阜県大垣市林町１０丁目１３３９番地１","","","","","","","届出","",""
"025201","fBiz00000301920000002568","滋賀県","大津市","ステーキガスト　大津瀬田店","ステーキガストオオツセタテン","⑬ その他の食料・飲料販売業","","滋賀県大津市大江二丁目２４－２５","",34.978542,135.912792,"077-547-2733","株式会社すかいらーくレストランツ","2012401030556","東京都武蔵野市西久保１丁目２５番８号","","","","","","","届出","",""
"025201","fBiz00000235290000000177","滋賀県","大津市","ドラッグユタカ大津黒津店","ドラッグユタカオオツクロヅテン","⑬ その他の食料・飲料販売業","ドラッグストア","滋賀県大津市黒津二丁目19番6号","",34.942695,135.916597,"077-546-0125","株式会社ユタカファーマシー","6200001014428","岐阜県大垣市林町１０丁目１３３９番地１","","","","","","","届出","",""
"025201","fBiz00000235860000000001","滋賀県","大津市","社会福祉法人真盛園","シャカイフクシホウジンシンセイエン","㉖ 集団給食施設","給食","滋賀県大津市坂本五丁目１３ー１","",35.081437,135.866600,"0775780044","社会福祉法人真盛園","3160005000432","滋賀県大津市坂本5丁目13番1号","","","","","","","届出","",""
"025201","fBiz00000245240000000003","滋賀県","大津市","アルプラザ堅田","アルプラザカタタ","⑪ 百貨店、総合スーパー","","滋賀県大津市本堅田五丁目２０ー１０","アルプラザ堅田店１Ｆ",35.119206,135.915705,"0775733111","株式会社平和堂","3160001008726","滋賀県彦根市西今町1番地","","","","","","","届出","",""
"025201","fBiz00000245780000000005","滋賀県","大津市","Peace (滋賀４８０て１８０９)","ピース","㉕ 行商","移動販売","滋賀県大津市一円","",34.993294,135.926553,"0775227372","（株）PNS","8160001021278","滋賀県野洲市安治３７９−１","","","","","","","届出","",""
"025201","fBiz00000257810000000021","滋賀県","大津市","尾家産業株式会社　滋賀営業所","オイエサンギョウカブシキガイシャ　シガエイギョウショ","⑦ 野菜果物販売業","","滋賀県大津市瀬田六丁目４－１７","",34.955972,135.911840,"077-544-5005","尾家産業株式会社","5120001061479","大阪府大阪市北区豊崎6-11-27","","","","","","","届出","",""
"025201","fBiz00000257810000000021","滋賀県","大津市","尾家産業株式会社　滋賀営業所","オイエサンギョウカブシキガイシャ　シガエイギョウショ","⑧ 米穀類販売業","","滋賀県大津市瀬田六丁目４－１７","",34.955972,135.911840,"077-544-5005","尾家産業株式会社","5120001061479","大阪府大阪市北区豊崎6-11-27","","","","","","","届出","",""
"025201","fBiz00000257810000000021","滋賀県","大津市","尾家産業株式会社　滋賀営業所","オイエサンギョウカブシキガイシャ　シガエイギョウショ","⑬ その他の食料・飲料販売業","","滋賀県大津市瀬田六丁目４－１７","",34.955972,135.911840,"077-544-5005","尾家産業株式会社","5120001061479","大阪府大阪市北区豊崎6-11-27","","","","","","","届出","",""
"025201","fBiz00000260760000000004","滋賀県","大津市","フレンドマート大津テラス店　日配品","フレンドマートオオツテラステン　ニッパイヒン","⑪ 百貨店、総合スーパー","","滋賀県大津市打出浜１４－３０","Ｏｈ!Ｍｅ大津ＴＥＲＲＡＣＥ１Ｆ",35.004542,135.879173,"077-526-8790","株式会社平和堂","3160001008726","滋賀県彦根市西今町1番地","","","","","","","届出","",""
"025201","fBiz00000264480000000002","滋賀県","大津市","","","⑤ コップ式自動販売機（自動洗浄・屋内設置）","","","","","","","","","","","","","","","","届出","",""
"025201","fBiz00000264480000000032","滋賀県","大津市","","","⑤ コップ式自動販売機（自動洗浄・屋内設置）","","","","","","","","","","","","","","","","届出","",""
"025201","fBiz00000264480000000033","滋賀県","大津市","","","⑤ コップ式自動販売機（自動洗浄・屋内設置）","","","","","","","","","","","","","","","","届出","",""
"025201","fBiz00000264480000000034","滋賀県","大津市","","","⑤ コップ式自動販売機（自動洗浄・屋内設置）","","","","","","","","","","","","","","","","届出","",""
"025201","fBiz00000264480000000040","滋賀県","大津市","","","⑤ コップ式自動販売機（自動洗浄・屋内設置）","","","","","","","","","","","","","","","","届出","",""
"025201","fBiz00000264480000000041","滋賀県","大津市","","","⑤ コップ式自動販売機（自動洗浄・屋内設置）","","","","","","","","","","","","","","","","届出","",""
"025201","fBiz00000264480000000042","滋賀県","大津市","","","⑤ コップ式自動販売機（自動洗浄・屋内設置）","","","","","","","","","","","","","","","","届出","",""
"025201","fBiz00000264480000000043","滋賀県","大津市","","","⑤ コップ式自動販売機（自動洗浄・屋内設置）","","","","","","","","","","","","","","","","届出","",""
"025201","fBiz00000264480000000044","滋賀県","大津市","","","⑤ コップ式自動販売機（自動洗浄・屋内設置）","","","","","","","","","","","","","","","","届出","",""
"025201","fBiz00000264480000000045","滋賀県","大津市","","","⑤ コップ式自動販売機（自動洗浄・屋内設置）","","","","","","","","","","","","","","","","届出","",""
"025201","fBiz00000272470000000437","滋賀県","大津市","","","① 飲食店営業","コーヒーショップ","","","","","","","","","115806-01",2022/08/26,2022/08/26,2022/08/26,2029/06/30,"","許可","",""
"025201","fBiz00000272470000000437","滋賀県","大津市","","","⑬ その他の食料・飲料販売業","コーヒーショップ","","","","","","","","","","","","","","","届出","",""
"025201","fBiz00000275800000000001","滋賀県","大津市","社会福祉法人檸檬会　レイモンド大津保育園","シャカイフクシホウジンレモンカイ　レイモンドオオツホイクエン","㉖ 集団給食施設","認可保育園","滋賀県大津市一里山七丁目１－１","フォレオ大津一里山１Ｆ",34.974151,135.933235,"077-544-0400","社会福祉法人檸檬会","3170005003350","和歌山県紀の川市古和田268-2","","","","","","","届出","",""
"025201","fBiz00000278860000000004","滋賀県","大津市","猫とめがね焙煎所","ネコトメガネバイセンジョ","⑯ コーヒー製造・加工業（飲料の製造を除く。）","","滋賀県大津市桜野町二丁目１０－６－１","",35.026085,135.859615,"09067574807","山田健之","","滋賀県大津市桜野町2丁目10-6-1","","","","","","","届出","",""
"025201","fBiz00000281140000000001","滋賀県","大津市","","","㉖ 集団給食施設","","","","","","","","","","","","","","","","届出","",""
"025201","fBiz00000285990000000001","滋賀県","大津市","","","⑬ その他の食料・飲料販売業","","","","","","","","","","","","","","","","届出","",""
"025201","fBiz00000290440000000001","滋賀県","大津市","FIKA coffee","フィーカコーヒー","⑬ その他の食料・飲料販売業","","滋賀県大津市二本松１－１","",35.029974,135.864175,"","ブライアンテック有限会社","9011102023474","滋賀県大津市和邇南浜403-43","","","","","","","届出","",""
"025201","fBiz00000291350000000001","滋賀県","大津市","（株）平和堂スーパーフレンド大石店","（カブ）ヘイワドウスーパーフレンドオオイシテン","⑪ 百貨店、総合スーパー","","滋賀県大津市大石東四丁目４－１２","",34.915751,135.922635,"","株式会社平和堂","3160001008726","滋賀県彦根市西今町1","","","","","","","届出","",""
"025201","fBiz00000291610000000001","滋賀県","大津市","RF商会","アールエフショウカイ","⑰ 農産保存食料品製造・加工業","","滋賀県大津市和邇中４８３－２","",35.158128,135.907534,"09099929498","ATTA-UR-REHMAN","","京都府京都市山科区栗栖野中臣町１","","","","","","","届出","",""
"025201","fBiz00000291700000000001","滋賀県","大津市","ブランチ大津京　みんなのマフィン","ブランチオオツキョウ　ミンナノマフィン","⑬ その他の食料・飲料販売業","","滋賀県大津市二本松１－１","",35.029974,135.864175,"","北川陽三","","滋賀県彦根市小泉町620-51, アールブラウン101","","","","","","","届出","",""
"025201","fBiz00000301920000002069","滋賀県","大津市","ガスト雄琴店","ガストオゴトテン","⑬ その他の食料・飲料販売業","","滋賀県大津市雄琴六丁目１３－１６","",35.093532,135.900182,"077-577-2039","株式会社すかいらーくレストランツ","2012401030556","東京都武蔵野市西久保１丁目２５番８号","","","","","","","届出","",""
"025201","fBiz00000301920000002616","滋賀県","大津市","ガスト 堅田店","ガストカタダテン","⑬ その他の食料・飲料販売業","ファミリーレストラン","滋賀県大津市真野二丁目３１－２８","",35.127661,135.921834,"077-571-2039","株式会社すかいらーくレストランツ","2012401030556","東京都武蔵野市西久保１丁目２５番８号","","","","","","","届出","",""
