"自治体コード","行番号","都道府県名","市区町村名","営業施設名称、屋号又は商号","営業施設名称、屋号又は商号（フリガナ）","営業の種類","業態","営業施設所在地","営業施設方書","緯度","経度","営業施設電話番号","法人名","法人番号","法人住所","許可番号","初回許可年月日","許可年月日","許可開始日","許可満了日","廃業年月日","申請区分","許可条件","備考"
"029201","fBiz00000116670000000004","奈良県","奈良市","株式会社岩田米穀店","カブシキカイシャイワタベイコクテン","⑧ 米穀類販売業","米穀店","奈良県奈良市西大寺本町１番１２号","",34.694651,135.781889,"0742-33-7859","株式会社岩田米穀店","3150001000238","","","","","","","","届出","",""
"029201","fBiz00000120690000000001","奈良県","奈良市","ドネー　ドゥ　ガトー","ドネー　ドゥ　ガトー","㉑ 製茶業","","奈良県奈良市西大寺南町1-19-208","",34.693565,135.781541,"0742-43-5446","松下恭子","","","","","","","","","届出","",""
"029201","fBiz00000120820000000001","奈良県","奈良市","千壽庵吉宗 近鉄奈良駅店","センジュアンヨシムネ　キンテツナラエキテン","⑬ その他の食料・飲料販売業","小売","奈良県奈良市東向中町29","近鉄奈良駅構内",34.684496,135.828650,"0742-27-8822","","","","","","","","","","届出","",""
"029201","fBiz00000121790000000001","奈良県","奈良市","ダイシン化工株式会社","ダイシンカコウカブシキガイシャ","㉗ 器具、容器包装の製造・加工業（合成樹脂が使用された器具又は容器包装の製造、加工に限る。）","","奈良県奈良市杏町２０３番地の１","",34.659676,135.796493,"","ダイシン化工株式会社","4150001001227","","","","","","","","届出","",""
"029201","fBiz00000121790000000002","奈良県","奈良市","ダイシン化工株式会社","ダイシンカコウカブシキガイシャ","⑪ 菓子製造業","","奈良県奈良市杏町203‐1","",34.659676,135.796493,"0742-62-7951","ダイシン化工株式会社","4150001001227","","102345",2021/07/09,2021/07/09,2021/07/09,2027/07/31,"","許可","　",""
"029201","fBiz00000122250000000001","奈良県","奈良市","クックハウス＆チャオプレッソ西大寺駅店","クックハウスアンドチャオプレッソ　サイダイジエキテン","③ 乳類販売業","","奈良県奈良市西大寺国見町1-1-1","ﾀｲﾑｽﾞﾌﾟﾚｲｽ西大寺",34.693744,135.782851,"0742-36-7366","株式会社近鉄リテーリング","4120001023117","","","","","","","","届出","",""
"029201","fBiz00000122250000000006","奈良県","奈良市","焼肉ライク　大和西大寺駅店","ヤキニクライクヤマトサイダイジエキテン","① 飲食店営業","焼肉店","奈良県奈良市西大寺国見町１－１－１","大和西大寺駅構内",34.693744,135.782851,"0742-35-8929","株式会社近鉄リテーリング","4120001023117","","1210548",2021/12/10,2021/12/10,2021/12/10,2028/03/31,"","許可","　",""
"029201","fBiz00000122250000000016","奈良県","奈良市","マネケン　近鉄大和西大寺駅店","マネケン　キンテツヤマトサイダイジエキテン","⑪ 菓子製造業","","奈良県奈良市西大寺国見町1-1-1","タイムズプレイス西大寺",34.693744,135.782851,"0742-81-8088","株式会社近鉄リテーリング","4120001023117","","1210836",2022/03/22,2022/03/22,2022/03/22,2028/03/31,"","許可","",""
"029201","fBiz00000122250000000017","奈良県","奈良市","カフェ　チャオプレッソ＆クックハウス西大寺駅店","カフェ　チャオプレッソアンドクックハウスサイダイジエキテン","① 飲食店営業","カフェ","奈良県奈良市西大寺国見町１－１－１","タイムズプレイス西大寺",34.693744,135.782851,"0742-33-7121","株式会社近鉄リテーリング","4120001023117","","109399",2022/03/10,2022/03/10,2022/03/10,2028/03/31,"","許可","",""
"029201","fBiz00000122250000000017","奈良県","奈良市","カフェ　チャオプレッソ＆クックハウス西大寺駅店","カフェ　チャオプレッソアンドクックハウスサイダイジエキテン","⑪ 菓子製造業","カフェ","奈良県奈良市西大寺国見町１－１－１","タイムズプレイス西大寺",34.693744,135.782851,"0742-33-7121","株式会社近鉄リテーリング","4120001023117","","109396",2022/03/10,2022/03/10,2022/03/10,2028/03/31,"","許可","",""
"029201","fBiz00000122250000000018","奈良県","奈良市","YAMATO　Craft Beer Table　大和西大寺駅店","ヤマトクラフトビアテーブル　ヤマトサイダイジエキテン","① 飲食店営業","クラフトビールレストラン","奈良県奈良市西大寺国見町1-1-1","タイムズプレイス西大寺",34.693744,135.782851,"0742-81-8829","株式会社近鉄リテーリング","4120001023117","","1210838",2022/03/22,2022/03/22,2022/03/22,2028/03/31,"","許可","",""
"029201","fBiz00000122250000000019","奈良県","奈良市","百楽　大和西大寺駅店","ヒャクラク　ヤマトサイダイジエキテン","① 飲食店営業","テイクアウト","奈良県奈良市西大寺国見町1-1-1"," タイムズプレイス西大寺",34.693744,135.782851,"070-5509-4395","株式会社近鉄リテーリング","4120001023117","","1220018",2022/04/18,2022/04/18,2022/04/18,2029/03/31,"","許可","",""
"029201","fBiz00000122250000000019","奈良県","奈良市","百楽　大和西大寺駅店","ヒャクラク　ヤマトサイダイジエキテン","⑬ その他の食料・飲料販売業","テイクアウト","奈良県奈良市西大寺国見町1-1-1"," タイムズプレイス西大寺",34.693744,135.782851,"070-5509-4395","株式会社近鉄リテーリング","4120001023117","","","","","","","","届出","",""
"029201","fBiz00000122250000000020","奈良県","奈良市","箱夢　大和西大寺駅店","ハコユメ　ヤマトサイダイジエキテン","① 飲食店営業","テイクアウト","奈良県奈良市西大寺国見町1-1-1"," タイムズプレイス西大寺",34.693744,135.782851,"0742-36-6028","株式会社近鉄リテーリング","4120001023117","","1220017",2022/04/18,2022/04/18,2022/04/18,2029/03/31,"","許可","",""
"029201","fBiz00000122250000000021","奈良県","奈良市","箱夢　大和西大寺駅店","ハコユメ　ヤマトサイダイジエキテン","⑥ 弁当販売業","テイクアウト","奈良県奈良市西大寺国見町1-1-1","タイムスプレイス西大寺",34.693744,135.782851,"0742-36-6028","株式会社近鉄リテーリング","4120001023117","","","","","","","","届出","",""
"029201","fBiz00000123050000000001","奈良県","奈良市","株式会社リエゾン","カブシキガイシャリエゾン","⑥ 弁当販売業","","奈良県奈良市押熊町2365","欅邸107",34.717831,135.760743,"0120-830-125","一般社団法人日本コミュニティカレッジ","5150005008481","","","","","","","","届出","",""
"029201","fBiz00000128340000000003","奈良県","奈良市","NPO法人ふぁーちぇ　ぽらりす","エヌピーオーホウジンファーチェ　ポラリス","⑯ コーヒー製造・加工業（飲料の製造を除く。）","コーヒー豆製造、販売","奈良県奈良市学園大和町2-25","松葉マンション103号室",34.688372,135.752224,"0742557567","特定非営利活動法人ふぁ～ちぇ　麻まり","1150005002488","","","","","","","","届出","",""
"029201","fBiz00000128960000000002","奈良県","奈良市","株式会社やまと蜂蜜　奈良工場","カブシキガイシャヤマトハチミツ　ナラコウジョウ","⑨ 通信販売・訪問販売による販売業","","奈良県奈良市田中町322","",34.639701,135.828831,"","株式会社やまと蜂蜜","1150001002467","","","","","","","","届出","",""
"029201","fBiz00000128960000000002","奈良県","奈良市","株式会社やまと蜂蜜　奈良工場","カブシキガイシャヤマトハチミツ　ナラコウジョウ","⑬ その他の食料・飲料販売業","","奈良県奈良市田中町322","",34.639701,135.828831,"","株式会社やまと蜂蜜","1150001002467","","","","","","","","届出","",""
"029201","fBiz00000128960000000002","奈良県","奈良市","株式会社やまと蜂蜜　奈良工場","カブシキガイシャヤマトハチミツ　ナラコウジョウ","⑮ いわゆる健康食品の製造・加工業","","奈良県奈良市田中町322","",34.639701,135.828831,"","株式会社やまと蜂蜜","1150001002467","","","","","","","","届出","",""
"029201","fBiz00000810910000000004","奈良県","奈良市","","","③ 乳類販売業","","","","","","","","","","","","","","","","届出","",""
"029201","fBiz00000128960000000002","奈良県","奈良市","株式会社やまと蜂蜜　奈良工場","カブシキガイシャヤマトハチミツ　ナラコウジョウ","⑯ コーヒー製造・加工業（飲料の製造を除く。）","","奈良県奈良市田中町322","",34.639701,135.828831,"","株式会社やまと蜂蜜","1150001002467","","","","","","","","届出","",""
"029201","fBiz00000128960000000002","奈良県","奈良市","株式会社やまと蜂蜜　奈良工場","カブシキガイシャヤマトハチミツ　ナラコウジョウ","⑱ 調味料製造・加工業","","奈良県奈良市田中町322","",34.639701,135.828831,"","株式会社やまと蜂蜜","1150001002467","","","","","","","","届出","",""
"029201","fBiz00000128960000000002","奈良県","奈良市","株式会社やまと蜂蜜　奈良工場","カブシキガイシャヤマトハチミツ　ナラコウジョウ","⑲ 糖類製造・加工業","","奈良県奈良市田中町322","",34.639701,135.828831,"","株式会社やまと蜂蜜","1150001002467","","","","","","","","届出","",""
"029201","fBiz00000128960000000002","奈良県","奈良市","株式会社やまと蜂蜜　奈良工場","カブシキガイシャヤマトハチミツ　ナラコウジョウ","㉔ その他の食料品製造・加工業","","奈良県奈良市田中町322","",34.639701,135.828831,"","株式会社やまと蜂蜜","1150001002467","","","","","","","","届出","",""
"029201","fBiz00000128960000000002","奈良県","奈良市","株式会社やまと蜂蜜　奈良工場","カブシキガイシャヤマトハチミツ　ナラコウジョウ","㉘ 露店、仮設店舗等における飲食の提供のうち、営業とみなされないもの","","奈良県奈良市田中町322","",34.639701,135.828831,"","株式会社やまと蜂蜜","1150001002467","","","","","","","","届出","",""
"029201","fBiz00000128960000000002","奈良県","奈良市","株式会社やまと蜂蜜　奈良工場","カブシキガイシャヤマトハチミツ　ナラコウジョウ","㉙ その他","","奈良県奈良市田中町322","",34.639701,135.828831,"","株式会社やまと蜂蜜","1150001002467","","","","","","","","届出","",""
"029201","fBiz00000129130000000003","奈良県","奈良市","","","㉗ 器具、容器包装の製造・加工業（合成樹脂が使用された器具又は容器包装の製造、加工に限る。）","","","","","","","","","","","","","","","","届出","",""
"029201","fBiz00000129180000000680","奈良県","奈良市","ダイソー　なら三条大路店","ダイソー　ナラサンジョウオオジテン","⑬ その他の食料・飲料販売業","","奈良県奈良市三条大路３丁目４７５－１","",34.683864,135.796304,"","株式会社大創産業","7240001022681","","","","","","","","届出","",""
"029201","fBiz00000129180000000681","奈良県","奈良市","ダイソー　近鉄奈良駅前店","ダイソー　キンテツナラエキマエテン","⑬ その他の食料・飲料販売業","","奈良県奈良市東向中町１７番地１－２","",34.683549,135.828478,"","株式会社大創産業","7240001022681","","","","","","","","届出","",""
"029201","fBiz00000129180000000683","奈良県","奈良市","ダイソー　エディオンおしくま店","ダイソー　エディオンオクシマテン","⑬ その他の食料・飲料販売業","","奈良県奈良市押熊町６０５","エディオンおしくま店内３階",34.717343,135.772439,"","株式会社大創産業","7240001022681","","","","","","","","届出","",""
"029201","fBiz00000129180000000685","奈良県","奈良市","ダイソー　ならコープ学園前店","ダイソー　ナラコープガクエンマエテン","⑬ その他の食料・飲料販売業","","奈良県奈良市中山町西１丁目７２２－９","ならコープ学園前店２階",34.708683,135.750561,"","株式会社大創産業","7240001022681","","","","","","","","届出","",""
"029201","fBiz00000129180000000687","奈良県","奈良市","ダイソー　奈良サンタウンすずらん館店","ダイソー　サンタウンスズランカンテン","⑬ その他の食料・飲料販売業","","奈良県奈良市右京１丁目３－４","サンタウンプラザすずらん館２１４",34.722703,135.789131,"","株式会社大創産業","7240001022681","","","","","","","","届出","",""
"029201","fBiz00000129180000000700","奈良県","奈良市","ダイソー　イオンタウン富雄南店","ダイソー　イオンタウントミオミナミテン","⑬ その他の食料・飲料販売業","","奈良県奈良市石木町９２番地他","",34.667118,135.758119,"","株式会社大創産業","7240001022681","","","","","","","","届出","",""
"029201","fBiz00000129180000000708","奈良県","奈良市","ダイソー　奈良パワーシティ店","ダイソー　ナラパワーシティテン","⑬ その他の食料・飲料販売業","","奈良県奈良市柏木町４７９－１","",34.671828,135.799189,"","株式会社大創産業","7240001022681","","","","","","","","届出","",""
"029201","fBiz00000129330000000001","奈良県","奈良市","","","⑪ 百貨店、総合スーパー","","","","","","","","","","","","","","","","届出","",""
"029201","fBiz00000129660000000001","奈良県","奈良市","","","㉗ 器具、容器包装の製造・加工業（合成樹脂が使用された器具又は容器包装の製造、加工に限る。）","","","","","","","","","","","","","","","","届出","",""
"029201","fBiz00000130340000000001","奈良県","奈良市","板前焼肉　心","イタマエヤキニク　ココロ","① 飲食店営業","焼肉屋","奈良県奈良市三条大路2-2-22","",34.682089,135.799173,"0742-36-7788","株式会社　日本中央住販","8150001001875","","110089",2022/03/18,2022/03/18,2022/03/18,2028/04/30,"","許可","",""
"029201","fBiz00000130340000000001","奈良県","奈良市","板前焼肉　心","イタマエヤキニク　ココロ","③ 食肉販売業","焼肉屋","奈良県奈良市三条大路2-2-22","",34.682089,135.799173,"0742-36-7788","株式会社　日本中央住販","8150001001875","","110090",2022/03/18,2022/03/18,2022/03/18,2028/04/30,"","許可","",""
"029201","fBiz00000130720000000158","奈良県","奈良市","コーナン三条大路店","コーナンサンジョウオオジテン","⑪ 百貨店、総合スーパー","販売業","奈良県奈良市三条大路２丁目３番２１号","",34.682939,135.797575,"0742368157","","","","","","","","","","届出","",""
"029201","fBiz00000130880000000001","奈良県","奈良市","ママロール","ママロール","⑪ 菓子製造業","ケーキ屋","奈良県奈良市柏木町519-19","アイメール柏木1F",34.672294,135.799080,"0742-37-2632","山本智子","","","109306",2022/03/09,2022/03/09,2022/03/09,2028/04/30,"","許可","",""
"029201","fBiz00000131040000000002","奈良県","奈良市","旬の駅　ならやま","シュンノエキ　ナラヤマ","⑪ 百貨店、総合スーパー","農産物直売所","奈良県奈良市奈良阪町2626-2","",34.708269,135.827936,"0742222930","株式会社　フォレストファーム","4150001017487","","","","","","","","届出","",""
"029201","fBiz00000131040000000006","奈良県","奈良市","","","⑬ その他の食料・飲料販売業","","","","","","","","","","","","","","","","届出","",""
"029201","fBiz00000131790000000001","奈良県","奈良市","竹内孵卵場","タケウチフランジョウ","② 食肉販売業（包装済みの食肉のみの販売）","","奈良県奈良市矢田原町１１１３－１","",34.651500,135.898955,"","株式会社竹内孵卵場","7150001004111","","","","","","","","届出","",""
"029201","fBiz00000131790000000001","奈良県","奈良市","竹内孵卵場","タケウチフランジョウ","㉓ 卵選別包装業","","奈良県奈良市矢田原町１１１３－１","",34.651500,135.898955,"","株式会社竹内孵卵場","7150001004111","","","","","","","","届出","",""
"029201","fBiz00000131940000000002","奈良県","奈良市","","","㉖ 集団給食施設","保育園、給食","","","","","","","","","","","","","","","届出","",""
"029201","fBiz00000131940000000003","奈良県","奈良市","","","㉖ 集団給食施設","保育園","","","","","","","","","","","","","","","届出","",""
"029201","fBiz00000131940000000004","奈良県","奈良市","","","㉖ 集団給食施設","保育園、給食","","","","","","","","","","","","","","","届出","",""
"029201","fBiz00000134490000000001","奈良県","奈良市","","","⑬ その他の食料・飲料販売業","","","","","","","","","","","","","","","","届出","",""
"029201","fBiz00000134490000000002","奈良県","奈良市","","","⑬ その他の食料・飲料販売業","","","","","","","","","","","","","","","","届出","",""
"029201","fBiz00000134490000000002","奈良県","奈良市","","","㉔ その他の食料品製造・加工業","","","","","","","","","","","","","","","","届出","",""
"029201","fBiz00000138290000000001","奈良県","奈良市","特別養護老人ホームあじさい園 宝","トクベツヨウゴロウジンホームアジサイエンタカラ","㉖ 集団給食施設","","奈良県奈良市南肘塚町99番１","",34.664955,135.831466,"0742240878","社会福祉法人　晃宝会","6150005000660","","","","","","","","届出","",""
"029201","fBiz00000138290000000003","奈良県","奈良市","オレンジカフェ　すいもん","オレンジカフェ　スイモン","⑪ 菓子製造業","","奈良県奈良市水門町47-3","",34.687327,135.836891,"0742-93-9791","社会福祉法人　晃宝会","6150005000660","","1210473",2021/10/19,2021/10/19,2021/10/19,2028/05/31,"","許可","　",""
"029201","fBiz00000138290000000005","奈良県","奈良市","オレンジカフェ　すいもん","オレンジカフェ　スイモン","① 飲食店営業","カフェ","奈良県奈良市水門町47-3","",34.687327,135.836891,"0742-93-9791","社会福祉法人　晃宝会","6150005000660","","116526",2022/04/22,2022/04/22,2022/04/22,2028/05/31,"","許可","",""
"029201","fBiz00000139740000000001","奈良県","奈良市","有限会社吉野庵","ユウゲンガイシャヨシノアン","㉔ その他の食料品製造・加工業","製造業","奈良県奈良市東九条町1014-61","",34.663620,135.814423,"0742621244","有限会社吉野庵","2150002003653","","","","","","","","届出","",""
"029201","fBiz00000139750000000018","奈良県","奈良市","ジョイフル奈良七条店","ジョイフルナラシチジョウテン","② 食肉販売業（包装済みの食肉のみの販売）","","奈良県奈良市七条東町172-1","",34.663513,135.785871,"0742-30-6160","株式会社ジョイフル関西","1320001014536","","","","","","","","届出","",""
"029201","fBiz00000139750000000052","奈良県","奈良市","ジョイフルイオンタウン富雄南店","ジョイフルイオンタウントミオミナミテン","② 食肉販売業（包装済みの食肉のみの販売）","","奈良県奈良市石木町100番1","",34.667874,135.757299,"0742-52-5120","株式会社ジョイフル関西","1320001014536","大分県大分市三川新町1丁目1番45号","","","","","","","届出","",""
"029201","fBiz00000139870000000263","奈良県","奈良市","コパンスポーツクラブ高の原","コパンスポーツクラブタカノハラ","⑫ 自動販売機による販売業（コップ式自動販売機（自動洗浄・屋内設置）及び営業許可の対象となる自動販売機を除く）","","奈良県奈良市右京1-4","サンタウンプラザひまわり館5階",34.723065,135.789839,"","株式会社ドクターズ・マン","5010401058417","","","","","","","","届出","",""
"029201","fBiz00000142130000000008","奈良県","奈良市","日興鶏卵荷受株式会社奈良営業所","ニッコウケイランニウケ","⑬ その他の食料・飲料販売業","卸売業","奈良県奈良市古市町753-1","",34.656733,135.832907,"0742611071","日興鶏卵荷受株式会社","7120001006085","","","","","","","","届出","",""
"029201","fBiz00000143330000000001","奈良県","奈良市","小さなパン屋さんMOMO","チイサナパンヤサンモモ","㉔ その他の食料品製造・加工業","菓子パン製造業","奈良県奈良市法蓮町635-1","一條館Ⅱ１F",34.691822,135.815646,"0742240081","社会福祉法人　奈良社会福祉院","6150005000669","","","","","","","","届出","",""
"029201","fBiz00000143330000000002","奈良県","奈良市","小さなパン屋さんMOMO","チイサナパンヤサンモモ","① 飲食店営業","ベーカリー、カフェ","奈良県奈良市法蓮町３９５－１","",34.690510,135.812871,"0742-34-0081","社会福祉法人　奈良社会福祉院","6150005000669","","１２１０５２８",2021/12/27,2021/12/27,2021/12/27,2028/06/30,"","許可","　",""
"029201","fBiz00000143330000000002","奈良県","奈良市","小さなパン屋さんMOMO","チイサナパンヤサンモモ","⑪ 菓子製造業","ベーカリー、カフェ","奈良県奈良市法蓮町３９５－１","",34.690510,135.812871,"0742-34-0081","社会福祉法人　奈良社会福祉院","6150005000669","","１２１０５２７",2021/12/27,2021/12/27,2021/12/27,2028/06/30,"","許可","　",""
"029201","fBiz00000143330000000002","奈良県","奈良市","小さなパン屋さんMOMO","チイサナパンヤサンモモ","㉕ そうざい製造業","ベーカリー、カフェ","奈良県奈良市法蓮町３９５－１","",34.690510,135.812871,"0742-34-0081","社会福祉法人　奈良社会福祉院","6150005000669","","１２１０５２９",2021/12/27,2021/12/27,2021/12/27,2028/06/30,"","許可","　",""
"029201","fBiz00000145410000000022","奈良県","奈良市","やまや菅原店","ヤマヤスガワラテン","⑬ その他の食料・飲料販売業","","奈良県奈良市菅原町637-1","",34.686998,135.772505,"0742-48-3210","やまや関西株式会社","8120901028599","","","","","","","","届出","",""
"029201","fBiz00000145410000000024","奈良県","奈良市","やまや紀寺店","ヤマヤキデラテン","⑬ その他の食料・飲料販売業","","奈良県奈良市南肘塚町204-1","",34.667303,135.832729,"0742-26-4633","やまや関西株式会社","8120901028599","","","","","","","","届出","",""
"029201","fBiz00000145410000000119","奈良県","奈良市","","","⑪ 百貨店、総合スーパー","","","","","","","","","","","","","","","","届出","",""
"029201","fBiz00000145410000000120","奈良県","奈良市","","","⑪ 百貨店、総合スーパー","","","","","","","","","","","","","","","","届出","",""
"029201","fBiz00000146310000000758","奈良県","奈良市","スターバックスコーヒー奈良学園前駅店","スターバックスコーヒーナラガクエンマエエキテン","⑬ その他の食料・飲料販売業","喫茶店","奈良県奈良市学園南3-1-5","",34.696725,135.750251,"0742-48-5056","スターバックスコーヒージャパン株式会社","7011001031943","","","","","","","","届出","",""
"029201","fBiz00000146310000000778","奈良県","奈良市","スターバックスコーヒーJR奈良駅旧駅舎店","スターバックスコーヒージェイアールナラエキキュウエキシャテン","⑬ その他の食料・飲料販売業","喫茶店","奈良県奈良市三条本町1082","",34.679734,135.819075,"0742-25-3820","スターバックスコーヒージャパン株式会社","7011001031943","","","","","","","","届出","",""
"029201","fBiz00000146310000000783","奈良県","奈良市","スターバックスコーヒー奈良鴻ノ池運動公園店","スターバックスコーヒーナラコウノイケウンドウコウエンテン","⑬ その他の食料・飲料販売業","喫茶店","奈良県奈良市法蓮佐保山4-1703-1","",34.696057,135.826348,"0742-25-2610","スターバックスコーヒージャパン株式会社","7011001031943","","","","","","","","届出","",""
"029201","fBiz00000146310000000883","奈良県","奈良市","スターバックスコーヒー奈良公園バスターミナル店","スターバックスコーヒーナラコウエンバスターミナルテン","⑬ その他の食料・飲料販売業","喫茶店","奈良県奈良市登大路町76","奈良公園バスターミナル2F",34.684769,135.834318,"0742-81-8405","スターバックスコーヒージャパン株式会社","7011001031943","","","","","","","","届出","",""
