"017201","fBiz00000700270000001012","石川県","金沢市","マルハン福久","マルハンフクヒサ","⑫ 自動販売機による販売業（コップ式自動販売機（自動洗浄・屋内設置）及び営業許可の対象となる自動販売機を除く）","","石川県金沢市福久東1-25-1","",36.579857,136.668251,"","株式会社ロッテ","1011101044248","東京都新宿区西新宿3-20-1","","","","","","","届出","",""
"017201","fBiz00000700270000001013","石川県","金沢市","ダイナム金沢","ダイナムカナザワ","⑫ 自動販売機による販売業（コップ式自動販売機（自動洗浄・屋内設置）及び営業許可の対象となる自動販売機を除く）","","石川県金沢市専光寺町ヲ１１３－１","",36.580663,136.584101,"","株式会社ロッテ","1011101044248","東京都新宿区西新宿3-20-1","","","","","","","届出","",""
"017201","fBiz00000700270000001014","石川県","金沢市","金沢市中央卸売市場青果場内ベンダーコーナー","カナザワシチュウオウオロシウリシジョウセイカジョウナイベンダーコーナー","⑫ 自動販売機による販売業（コップ式自動販売機（自動洗浄・屋内設置）及び営業許可の対象となる自動販売機を除く）","","石川県金沢市西念4-7-1","",36.586655,136.633157,"","株式会社ロッテ","1011101044248","東京都新宿区西新宿3-20-1","","","","","","","届出","",""
"017201","fBiz00000700270000001392","石川県","金沢市","ディーダス１１３７","ディーダスイチイチサンナナ","⑫ 自動販売機による販売業（コップ式自動販売機（自動洗浄・屋内設置）及び営業許可の対象となる自動販売機を除く）","","石川県金沢市福久町ホ３０－１","屋内１Ｆ",36.613601,136.680634,"","株式会社ロッテ","1011101044248","東京都新宿区西新宿3-20-1","","","","","","","届出","",""
"017201","fBiz00000700270000001569","石川県","金沢市","ミリオンもりの里","ミリオンモリノサト","⑫ 自動販売機による販売業（コップ式自動販売機（自動洗浄・屋内設置）及び営業許可の対象となる自動販売機を除く）","","石川県金沢市もりの里1-159","",36.553736,136.688720,"","株式会社ロッテ","1011101044248","東京都新宿区西新宿3-20-1","","","","","","","届出","",""
"017201","fBiz00000723110000000012","石川県","金沢市","ホクト商事株式会社　北陸事業部","ホクトショウジ　ホクリクジギョウブ","⑬ その他の食料・飲料販売業","","石川県金沢市近岡町170-1","",36.607003,136.628940,"0762376676","ホクト商事株式会社","5180001032631","愛知県名古屋市中村区名駅南１丁目２０番２１号","","","","","","","届出","",""
"017201","fBiz00000737790000000026","石川県","金沢市","一風堂　金沢FORUS店","イップウドウ　カナザワフォーラステン","① 飲食店営業","ラーメン店","石川県金沢市堀川新町3-1","金沢FORUS",36.579148,136.649754,"","株式会社力の源カンパニー","6290001064472","福岡県福岡市中央区大名一丁目１３番１４号","衛指第23110218号",2023/06/01,2023/06/01,2023/06/01,2029/05/31,"","許可","",""
"017201","fBiz00000739250000000017","石川県","金沢市","ことほぎ高柳デイサービス","コトホギタカヤナギデイサービス","① 飲食店営業","","石川県金沢市高柳町二３７","",36.592612,136.660365,"0762516188","日清医療食品株式会社","9010001063474","東京都千代田区丸の内２丁目７番３号","衛指第23110013号",2023/05/01,2023/05/01,2023/05/01,2029/04/30,"","許可","",""
"017201","fBiz00000752430000000004","石川県","金沢市","アル・プラザ金沢乃が美はなれ金沢店特設会場","アル・プラザカナザワノガミハナレカナザワテントクセツカイジョウ","⑬ その他の食料・飲料販売業","","石川県金沢市諸江町30-1","",36.590795,136.645661,"0762590854","株式会社うまいす","4290001079027","福岡県福岡市西区今宿駅前1-15-18 マリブ今宿シーサイドテラス3F","","","","","","","届出","",""
"017201","fBiz00000754090000000002","石川県","金沢市","パートナーズ医王病院店","パートナーズイオウビョウインテン","⑬ その他の食料・飲料販売業","","石川県金沢市金沢市高尾２丁目ニ73","",36.522036,136.638444,"0762046598","ヘルスパートナーズジャパン合同会社","7220003002700","石川県金沢市石引１丁目８番１２号","","","","","","","届出","",""
"017201","fBiz00000756880000000012","石川県","金沢市","どんたく西南部店","ドンタクセイナンブテン","① 飲食店営業","スーパーマーケット","石川県金沢市新保本３丁目８４番地","",36.557414,136.602628,"0762900400","株式会社どんたく","3220001015550","石川県七尾市作事町８０番地","衛指第22110686号",2010/10/15,2022/11/01,2022/11/01,2028/10/31,"","許可"," ",""
"017201","fBiz00000756880000000012","石川県","金沢市","どんたく西南部店","ドンタクセイナンブテン","③ 食肉販売業","スーパーマーケット","石川県金沢市新保本３丁目８４番地","",36.557414,136.602628,"0762900400","株式会社どんたく","3220001015550","石川県七尾市作事町８０番地","衛指第22110687号",2010/10/15,2022/11/01,2022/11/01,2028/10/31,"","許可"," ",""
"017201","fBiz00000756880000000012","石川県","金沢市","どんたく西南部店","ドンタクセイナンブテン","④ 魚介類販売業","スーパーマーケット","石川県金沢市新保本３丁目８４番地","",36.557414,136.602628,"0762900400","株式会社どんたく","3220001015550","石川県七尾市作事町８０番地","衛指第22110688号",2010/10/15,2022/11/01,2022/11/01,2028/10/31,"","許可"," ",""
"017201","fBiz00000756880000000012","石川県","金沢市","どんたく西南部店","ドンタクセイナンブテン","⑪ 百貨店、総合スーパー","スーパーマーケット","石川県金沢市新保本３丁目８４番地","",36.557414,136.602628,"0762900400","株式会社どんたく","3220001015550","石川県七尾市作事町８０番地","","","","","","","届出","",""
"017201","fBiz00000761560000000021","石川県","金沢市","","","① 飲食店営業","居酒屋","","","","","","","","","金沢市指令収衛指第16736号",2022/01/11,2022/01/11,2022/01/11,2028/01/31,"","許可","",""
"017201","fBiz00000774750000000060","石川県","金沢市","株式会社HALLE JAPON","カブシキガイシャアルジャポン","㉕ 行商","","石川県金沢市市内一円","",36.624802,136.625574,"","株式会社HALLE JAPON","5120001168836","東京都港区港南2丁目16-2太陽生命品川ビル28F","","","","","","","届出","",""
"017201","fBiz00000777190000000001","石川県","金沢市","","","⑬ その他の食料・飲料販売業","","","","","","","","","","","","","","","","届出","",""
"017201","fBiz00000777190000000002","石川県","金沢市","","","⑬ その他の食料・飲料販売業","","","","","","","","","","","","","","","","届出","",""
"017201","fBiz00000815870000000003","石川県","金沢市","","","⑬ その他の食料・飲料販売業","","","","","","","","","","","","","","","","届出","",""
"017201","fBiz00000816600000000001","石川県","金沢市","加賀麩不室屋　尾張町店","カガフフムロヤ　オワリチョウテン","⑬ その他の食料・飲料販売業","","石川県金沢市尾張町2-3-1","",36.571808,136.658083,"","株式会社加賀麩不室屋","9220001001990","石川県金沢市かたつ1番地","","","","","","","届出","",""
"017201","fBiz00000816600000000002","石川県","金沢市","加賀麩不室屋　東山店","カガフフムロヤ　ヒガシヤマテン","⑬ その他の食料・飲料販売業","","石川県金沢市東山1-25-3","",36.572313,136.667952,"","株式会社加賀麩不室屋","9220001001990","石川県金沢市かたつ1番地","","","","","","","届出","",""
"017201","fBiz00000816600000000003","石川県","金沢市","加賀麩不室屋　有松店","カガフフムロヤ　アリマツテン","⑬ その他の食料・飲料販売業","","石川県金沢市有松5-8-22","有松三軒家内",36.539847,136.638026,"","株式会社加賀麩不室屋","9220001001990","石川県金沢市かたつ1番地","","","","","","","届出","",""
"017201","fBiz00000816600000000004","石川県","金沢市","加賀麩不室屋　金沢百番街店","カガフフムロヤ　カナザワヒャクバンガイテン","⑬ その他の食料・飲料販売業","","石川県金沢市木ノ新保町1-1","JR金沢駅構内",36.578238,136.647909,"","株式会社加賀麩不室屋","9220001001990","石川県金沢市かたつ1番地","","","","","","","届出","",""
"017201","fBiz00000816600000000006","石川県","金沢市","加賀麩不室屋　香林坊大和店","カガフフムロヤ　コウリンボウダイワテン","⑬ その他の食料・飲料販売業","","石川県金沢市香林坊1－1－1","大和香林坊店内",36.563171,136.654125,"","株式会社加賀麩不室屋","9220001001990","石川県金沢市かたつ1番地","","","","","","","届出","",""
"017201","fBiz00000816600000000007","石川県","金沢市","加賀麩不室屋　金沢エムザ店","カガフフムロヤ　カナザワエムザテン","⑬ その他の食料・飲料販売業","","石川県金沢市武蔵町15-1","金沢エムザ内",36.572005,136.655011,"","株式会社加賀麩不室屋","9220001001990","石川県金沢市かたつ1番地","","","","","","","届出","",""
"017201","fBiz00000822910000000003","石川県","金沢市","WAKEAU金沢拠点","ワケアウカナザワキョテン","⑨ 通信販売・訪問販売による販売業","通信販売","","","","","","オプスデータ株式会社","6011101090213","東京都新宿区新宿3-5-6　キュープラザ新宿三丁目6F","","","","","","","届出","",""
"017201","fBiz00000833870000000001","石川県","金沢市","イタリアンカフェぶどうの森　本店","イタリアンカフェブドウノモリ　ホンテン","⑬ その他の食料・飲料販売業","","石川県金沢市岩出町ハ50番地1","",36.613615,136.698285,"0762580231","株式会社ぶどうの木","1220001005669","石川県金沢市岩出町ハ５０番地１","","","","","","","届出","",""
"017201","fBiz00000833870000000002","石川県","金沢市","レストランぶどうの森　ラ・ヴィーニュ","レストランブドウノモリ　ラ・ヴィーニュ","⑬ その他の食料・飲料販売業","","石川県金沢市岩出町イ50番地1","",36.614125,136.698315,"0762587878","株式会社ぶどうの木","1220001005669","石川県金沢市岩出町ハ５０番地１","","","","","","","届出","",""
"017201","fBiz00000833870000000005","石川県","金沢市","イタリアンカフェぶどうの森　金沢フォーラス店","イタリアンカフェブドウノモリ　カナザワフォーラステン","⑬ その他の食料・飲料販売業","","石川県金沢市堀川新町3番1号","金沢フォーラス6F",36.579351,136.649814,"0762653521","株式会社ぶどうの木","1220001005669","石川県金沢市岩出町ハ５０番地１","","","","","","","届出","",""
"017201","fBiz00000833870000000006","石川県","金沢市","カフェぶどうの森　金沢エムザ店","カフェブドウノモリ　カナザワエムザテン","⑬ その他の食料・飲料販売業","","石川県金沢市武蔵町15番1号","金沢エムザB1F",36.572005,136.655011,"0762601717","株式会社ぶどうの木","1220001005669","石川県金沢市岩出町ハ５０番地１","","","","","","","届出","",""
"017201","fBiz00000833870000000007","石川県","金沢市","レストランぶどうの森　タパス・エ・バール","レストランブドウノモリ　タパス・エ・バール","⑬ その他の食料・飲料販売業","","石川県金沢市本町2丁目9番28号　1F・2F","",36.574619,136.648757,"0762604343","株式会社ぶどうの木","1220001005669","石川県金沢市岩出町ハ５０番地１","","","","","","","届出","",""
"017201","fBiz00000833870000000009","石川県","金沢市","カフェぶどうの森　ファーム金沢百番街店","カフェブドウノモリ　ファームカナザワヒャクバンガイテン","⑬ その他の食料・飲料販売業","","石川県金沢市木ノ新保町1番1号","金沢百番街あんと西1階108区画",36.578238,136.647909,"0762221818","株式会社ぶどうの木","1220001005669","石川県金沢市岩出町ハ５０番地１","","","","","","","届出","",""
"017201","fBiz00000833870000000010","石川県","金沢市","ゆげや萬久　金沢エムザ店","ユゲヤバンキュウ　カナザワエムザテン","⑬ その他の食料・飲料販売業","","石川県金沢市武蔵町15番1号","金沢エムザ B1F",36.572005,136.655011,"","株式会社ぶどうの木","1220001005669","石川県金沢市岩出町ハ５０番地１","","","","","","","届出","",""
"017201","fBiz00000833870000000012","石川県","金沢市","洋菓子工房ぶどうの森　本店","ヨウガシコウボウブドウノモリ　ホンテン","⑬ その他の食料・飲料販売業","","石川県金沢市岩出町ハ50番地1","",36.613651,136.698286,"0762580236","株式会社ぶどうの木","1220001005669","石川県金沢市岩出町ハ５０番地１","","","","","","","届出","",""
"017201","fBiz00000833870000000013","石川県","金沢市","洋菓子工房ぶどうの森　金沢百番街店","ヨウガシコウボウブドウノモリ　カナザワヒャクバンガイテン","⑬ その他の食料・飲料販売業","","石川県金沢市木ノ新保町1番1号","金沢百番街あんと西1階",36.578238,136.647909,"0762221818","株式会社ぶどうの木","1220001005669","石川県金沢市岩出町ハ５０番地１","","","","","","","届出","",""
"017201","fBiz00000833870000000014","石川県","金沢市","洋菓子工房ぶどうの森　イオン金沢店","ヨウガシコウボウブドウノモリ　イオンカナザワテン","⑬ その他の食料・飲料販売業","","石川県金沢市福久2-58","イオン金沢1Ｆ",36.617253,136.681406,"0762587557","株式会社ぶどうの木","1220001005669","石川県金沢市岩出町ハ５０番地１","","","","","","","届出","",""
"017201","fBiz00000833870000000016","石川県","金沢市","洋菓子工房ぶどうの森　イオンもりの里店","ヨウガシコウボウブドウノモリ　イオンモリノサトテン","⑬ その他の食料・飲料販売業","","石川県金沢市もりの里1-70","イオンもりの里1Ｆ",36.551642,136.689980,"0762213117","株式会社ぶどうの木","1220001005669","石川県金沢市岩出町ハ５０番地１","","","","","","","届出","",""
"017201","fBiz00000833870000000017","石川県","金沢市","洋菓子工房ぶどうの森　アルプラフーズマーケット大河端店","ヨウガシコウボウブドウノモリ　アルプラフーズマーケットオコバタテン","⑬ その他の食料・飲料販売業","","石川県金沢市大河端西2丁目15番地","アルプラフーズマーケット大河端内",36.616266,136.639936,"0762386677","株式会社ぶどうの木","1220001005669","石川県金沢市岩出町ハ５０番地１","","","","","","","届出","",""
"017201","fBiz00000833870000000020","石川県","金沢市","まめや金澤萬久　本店","マメヤカナザワバンキュウ　ホンテン","⑬ その他の食料・飲料販売業","","石川県金沢市岩出町ハ50番地1","ぶどうの木本店敷地内",36.613615,136.698285,"0762583366","株式会社ぶどうの木","1220001005669","石川県金沢市岩出町ハ５０番地１","","","","","","","届出","",""
"017201","fBiz00000833870000000021","石川県","金沢市","まめや金澤萬久　金沢百番街店","マメヤカナザワバンキュウ　カナザワヒャクバンガイテン","⑬ その他の食料・飲料販売業","","石川県金沢市木ノ新保町1番1号","あんと百番街館内",36.578238,136.647909,"0762601080","株式会社ぶどうの木","1220001005669","石川県金沢市岩出町ハ５０番地１","","","","","","","届出","",""
"017201","fBiz00000833870000000022","石川県","金沢市","まめや金澤萬久　香林坊大和店","マメヤカナザワバンキュウ　コウリンボウダイワテン","⑬ その他の食料・飲料販売業","","石川県金沢市香林坊1-1-1","香林坊大和地下1階　金沢ふーどパラダイス内",36.563171,136.654125,"0762201111","株式会社ぶどうの木","1220001005669","石川県金沢市岩出町ハ５０番地１","","","","","","","届出","",""
"017201","fBiz00000833870000000023","石川県","金沢市","まめや金澤萬久　金沢エムザ店","マメヤカナザワバンキュウ　カナザワエムザテン","⑬ その他の食料・飲料販売業","","石川県金沢市武蔵町15番1号","金沢エムザ1階　黒門小路内",36.572005,136.655011,"0762602457","株式会社ぶどうの木","1220001005669","石川県金沢市岩出町ハ５０番地１","","","","","","","届出","",""
"017201","fBiz00000833870000000024","石川県","金沢市","ガーデン＆ファーム","ガーデンアンドファーム","⑬ その他の食料・飲料販売業","","石川県金沢市岩出町ハ50番地1","",36.613615,136.698285,"0762580001","株式会社ぶどうの木","1220001005669","石川県金沢市岩出町ハ５０番地１","","","","","","","届出","",""
"017201","fBiz00000833870000000025","石川県","金沢市","ぶどうの森　公式オンラインショップ","ブドウノモリ　コウシキオンラインショップ","⑨ 通信販売・訪問販売による販売業","","石川県金沢市岩出町ハ50番地1","",36.613651,136.698286,"0762580001","株式会社ぶどうの木","1220001005669","石川県金沢市岩出町ハ５０番地１","","","","","","","届出","",""
"017201","fBiz00000833870000000032","石川県","金沢市","ぶどうの木　セントラルキッチン","ブドウノキ　セントラルキッチン","㉔ その他の食料品製造・加工業","","石川県金沢市岩出町ハ45番地1","",36.613169,136.698981,"0762580001","株式会社ぶどうの木","1220001005669","石川県金沢市岩出町ハ５０番地１","","","","","","","届出","",""
"017201","fBiz00000833870000000036","石川県","金沢市","洋菓子工房ぶどうの森　あんと金沢百番街店","ヨウガシコウボウブドウノモリ　アントカナザワヒャクバンガイテン","⑬ その他の食料・飲料販売業","","石川県金沢市木ノ新保町1-1 あんと百番街館内","",36.577651,136.647204,"","株式会社ぶどうの木","1220001005669","石川県金沢市岩出町ハ５０番地１","","","","","","","届出","",""
"017201","fBiz00000846420000000015","石川県","金沢市","ドルチカフェ","ドルチカフェ","⑬ その他の食料・飲料販売業","72702 焼き菓子","石川県金沢市木ノ新保町１−１","金沢リント",36.578238,136.647909,"","有限会社卓矢","4200002002854","岐阜県岐阜市徹明通４丁目１４番地３","","","","","","","届出","",""
"017201","fBiz00000854910000000001","石川県","金沢市","INSPICE","インスパイス","⑨ 通信販売・訪問販売による販売業","オリジナルスパイスの企画開発と販売","石川県金沢市三口町火294-1","",36.608012,136.642208,"0762546024","株式会社ビバラボ","1220001011626","石川県金沢市三口町火２９４番地１","","","","","","","届出","",""
"017201","fBiz00000854910000000001","石川県","金沢市","INSPICE","インスパイス","⑱ 調味料製造・加工業","オリジナルスパイスの企画開発と販売","石川県金沢市三口町火294-1","",36.608012,136.642208,"0762546024","株式会社ビバラボ","1220001011626","石川県金沢市三口町火２９４番地１","","","","","","","届出","",""
"017201","fBiz00000854910000000002","石川県","金沢市","INSPICE KANAZAWA","インスパイス カナザワ","⑬ その他の食料・飲料販売業","飲食店","石川県金沢市東山1丁目10-2","",36.573396,136.667333,"","株式会社ビバラボ","1220001011626","石川県金沢市三口町火２９４番地１","","","","","","","届出","",""
"017201","fBiz00000865580000000002","石川県","金沢市","石川療育センター","イシカワリョウイクセンター","㉖ 集団給食施設","","石川県金沢市上中町イ67-2","",36.519832,136.702878,"0762293033","社会福祉法人　松原愛育会","6220005002071","石川県金沢市上中町イ67-2","","","","","","","届出","",""
"017201","fBiz00001969960000000002","石川県","金沢市","","","⑯ コーヒー製造・加工業（飲料の製造を除く。）","","","","","","","","","","","","","","","","届出","",""
"017201","fBiz00000878140000000001","石川県","金沢市","加賀陣屋　百番街店","カガジンヤ　ヒャクバンガイテン","⑬ その他の食料・飲料販売業","販売","石川県金沢市木ノ新保町1-1","金沢百番街　あんと",36.578238,136.647909,"076-260-3760","株式会社フジセイカ","9220001013367","石川県加賀市黒瀬町３７０番地１","","","","","","","届出","",""
"017201","fBiz00000918560000000009","石川県","金沢市","office28","オフィスツーエイト","⑬ その他の食料・飲料販売業","","石川県金沢市木ノ新保町1-1","金沢rinto1F催事場",36.578238,136.647909,"09077560606","森田大和","","兵庫県芦屋市浜芦屋町9-2","","","","","","","届出","",""
"017201","fBiz00000919470000000050","石川県","金沢市","","","① 魚介類販売業（包装済みの魚介類のみの販売）","","","","","","","","","","","","","","","","届出","",""
"017201","fBiz00000919470000000334","石川県","金沢市","","","① 魚介類販売業（包装済みの魚介類のみの販売）","","","","","","","","","","","","","","","","届出","",""
"017201","fBiz00000919470000000734","石川県","金沢市","スシロー金沢古府店","スシローカナザワコブテン","① 飲食店営業","すし屋","石川県金沢市古府2-77","",36.566068,136.607151,"076-249-8231","株式会社あきんどスシロー","4010001148370","大阪府吹田市江坂町1-22-2","22110379",2022/07/14,2022/07/14,2022/07/14,2028/07/31,"","許可","",""
"017201","fBiz00000919470000000734","石川県","金沢市","スシロー金沢古府店","スシローカナザワコブテン","① 魚介類販売業（包装済みの魚介類のみの販売）","","石川県金沢市古府2-77","",36.566068,136.607151,"076-249-8231","株式会社あきんどスシロー","4010001148370","大阪府吹田市江坂町1-22-2","","","","","","","届出","",""
"017201","fBiz00000957460000000001","石川県","金沢市","大和香林坊店 B1モロゾフ売場","ダイワコウリンボウテン　モロゾフウリバ","⑬ その他の食料・飲料販売業","菓子販売店","石川県金沢市香林坊1丁目1-1","株式会社大和　香林坊店　B1モロゾフ売場",36.563171,136.654125,"076-220-1157","モロゾフ株式会社","2140001002665","兵庫県神戸市東灘区御影本町6-11-19","","","","","","","届出","",""
"017201","fBiz00000957460000000004","石川県","金沢市","大和香林坊店 8Fカフェモロゾフ","ダイワコウリンボウテン　カフェモロゾフ","⑬ その他の食料・飲料販売業","菓子販売店","石川県金沢市香林坊1丁目1-1","株式会社大和　香林坊店　8Fカフェモロゾフ",36.563171,136.654125,"076-220-1481","モロゾフ株式会社","2140001002665","兵庫県神戸市東灘区御影本町6-11-19","","","","","","","届出","",""
"017201","fBiz00000981160000000009","石川県","金沢市","クスリのアオキ東力店","クスリノアオキトウリキテン","⑪ 百貨店、総合スーパー","ドラッグストア","石川県金沢市東力四丁目45番地","",36.563942,136.621949,"076-220-7392","株式会社ナルックス","7220001004871","石川県白山市松本町２５１２番地","","","","","","","届出","",""
"017201","fBiz00000981160000000010","石川県","金沢市","スーパーのアオキみずき店","スーパーノアオキミズキテン","⑪ 百貨店、総合スーパー","ドラッグストア","石川県金沢市みずき1丁目1番地1","",36.618357,136.673450,"076-208-5157","株式会社ナルックス","7220001004871","石川県白山市松本町２５１２番地","","","","","","","届出","",""
"017201","fBiz00000981160000000011","石川県","金沢市","クスリのアオキ桂店","クスリノアオキカツラテン","⑪ 百貨店、総合スーパー","ドラッグストア","石川県金沢市桂町イ122番地3","",36.604874,136.605464,"076-254-0321","株式会社ナルックス","7220001004871","石川県白山市松本町２５１２番地","","","","","","","届出","",""
"017201","fBiz00000981160000000012","石川県","金沢市","クスリのアオキ藤江南店","クスリノアオキフジエミナミテン","⑪ 百貨店、総合スーパー","ドラッグストア","石川県金沢市藤江南3丁目75番地4","",36.587453,136.619080,"076-254-1893","株式会社ナルックス","7220001004871","石川県白山市松本町２５１２番地","","","","","","","届出","",""
