"017201","fBiz00000230450000000549","石川県","金沢市","ｸｱﾄﾛﾌﾞｰﾑ金沢店","クアトロブームカナザワテン","⑤ コップ式自動販売機（自動洗浄・屋内設置）","","石川県金沢市大河端西1-33-1","",36.614425,136.640871,"","株式会社コーシン","6220001000310","石川県野々市市押野２丁目２１６番地","","","","","","","届出","",""
"017201","fBiz00000230450000000594","石川県","金沢市","㈱玉家建設","カブシキガイシャタマヤケンセツ","⑤ コップ式自動販売機（自動洗浄・屋内設置）","","石川県金沢市入江3-29","",36.566786,136.621527,"","株式会社コーシン","6220001000310","石川県野々市市押野２丁目２１６番地","","","","","","","届出","",""
"017201","fBiz00000230450000000595","石川県","金沢市","㈱金沢丸越百貨店　B1休憩所","カブシキガイシャカナザワマルコシヒャッカテン　ビーイチキュウケイジョ","⑤ コップ式自動販売機（自動洗浄・屋内設置）","","石川県金沢市武蔵町15-1","",36.572005,136.655011,"","株式会社コーシン","6220001000310","石川県野々市市押野２丁目２１６番地","","","","","","","届出","",""
"017201","fBiz00000230450000000596","石川県","金沢市","㈱マルストック","カブシキガイシャマルストック","⑤ コップ式自動販売機（自動洗浄・屋内設置）","","石川県金沢市西念4-7-1","",36.586000,136.633418,"","株式会社コーシン","6220001000310","石川県野々市市押野２丁目２１６番地","","","","","","","届出","",""
"017201","fBiz00000230450000000597","石川県","金沢市","(有)サンハート","ユウゲンガイシャサンハート","⑤ コップ式自動販売機（自動洗浄・屋内設置）","","石川県金沢市観音堂町ホ56-1","",36.591086,136.600659,"","株式会社コーシン","6220001000310","石川県野々市市押野２丁目２１６番地","","","","","","","届出","",""
"017201","fBiz00000230450000000645","石川県","金沢市","金沢美術工芸大学","カナザワビジュツコウゲイダイガク","⑫ 自動販売機による販売業（コップ式自動販売機（自動洗浄・屋内設置）及び営業許可の対象となる自動販売機を除く）","","石川県金沢市小立野5-11-1","",36.556128,136.677221,"","株式会社コーシン","6220001000310","石川県野々市市押野２丁目２１６番地","","","","","","","届出","",""
"017201","fBiz00000230450000000646","石川県","金沢市","JR金沢駅　1,2番ﾎｰﾑ","ジェイアールカナザワエキ　イチニバンホーム","⑫ 自動販売機による販売業（コップ式自動販売機（自動洗浄・屋内設置）及び営業許可の対象となる自動販売機を除く）","","石川県金沢市木ノ新保町","",36.578455,136.648376,"","株式会社コーシン","6220001000310","石川県野々市市押野２丁目２１６番地","","","","","","","届出","",""
"017201","fBiz00000230450000000653","石川県","金沢市","トヨタカローラ海環　金沢駅西店","トヨタカローラウミカン　カナザワエキニシテン","⑤ コップ式自動販売機（自動洗浄・屋内設置）","","石川県金沢市大河端西1-35","",36.613739,136.639691,"","株式会社コーシン","6220001000310","石川県野々市市押野２丁目２１６番地","","","","","","","届出","",""
"017201","fBiz00000230450000000656","石川県","金沢市","丸和電業","マルワデンギョウ","⑤ コップ式自動販売機（自動洗浄・屋内設置）","","石川県金沢市松島1-36","",36.561212,136.601568,"","株式会社コーシン","6220001000310","石川県野々市市押野２丁目２１６番地","","","","","","","届出","",""
"017201","fBiz00000230450000000664","石川県","金沢市","石川トヨペットカローラ トヨペット伏見台","イシカワトヨペットカローラ　トヨペットフシミダイ","⑤ コップ式自動販売機（自動洗浄・屋内設置）","","石川県金沢市寺地1-31-20","",36.534868,136.639451,"","株式会社コーシン","6220001000310","石川県野々市市押野２丁目２１６番地","","","","","","","届出","",""
"017201","fBiz00000230450000000672","石川県","金沢市","松原病院　1F外来ロビー","マツバラビョウイン　イッカイガイライロビー","⑤ コップ式自動販売機（自動洗浄・屋内設置）","","石川県金沢市石引4-3-5","",36.558120,136.666968,"","株式会社コーシン","6220001000310","石川県野々市市押野２丁目２１６番地","","","","","","","届出","",""
"017201","fBiz00000230450000000673","石川県","金沢市","宝タクシー","タカラタクシー","⑤ コップ式自動販売機（自動洗浄・屋内設置）","","石川県金沢市神宮寺3-9-11","",36.588096,136.665222,"","株式会社コーシン","6220001000310","石川県野々市市押野２丁目２１６番地","","","","","","","届出","",""
"017201","fBiz00000230450000000674","石川県","金沢市","沖製あん株式会社","オキセイアンカブシキガイシャ","⑤ コップ式自動販売機（自動洗浄・屋内設置）","","石川県金沢市いなほ2-1","",36.551646,136.582406,"","株式会社コーシン","6220001000310","石川県野々市市押野２丁目２１６番地","","","","","","","届出","",""
"017201","fBiz00000230450000000675","石川県","金沢市","サンピア泉ヶ丘　テンナイ","サンピアイズミガオカ　テンナイ","⑤ コップ式自動販売機（自動洗浄・屋内設置）","","石川県金沢市円光寺2-345","",36.534463,136.649412,"","株式会社コーシン","6220001000310","石川県野々市市押野２丁目２１６番地","","","","","","","届出","",""
"017201","fBiz00000230450000000676","石川県","金沢市","石川コンピュータ本社新館　1F食堂廊下","イシカワコンピュータホンシャシンカン　イッカイショクドウロウカ","⑤ コップ式自動販売機（自動洗浄・屋内設置）","","石川県金沢市無量寺町ハ6-1","",36.603004,136.616629,"","株式会社コーシン","6220001000310","石川県野々市市押野２丁目２１６番地","","","","","","","届出","",""
"017201","fBiz00000230450000000699","石川県","金沢市","㈱セキネ　本社","カブシキガイシャセキネ　ホンシャ","⑤ コップ式自動販売機（自動洗浄・屋内設置）","","石川県金沢市米泉町8丁目74","",36.552762,136.625484,"","株式会社コーシン","6220001000310","石川県野々市市押野２丁目２１６番地","","","","","","","届出","",""
"017201","fBiz00000230450000000715","石川県","金沢市","中谷整形外科","ナカタニセイケイゲカ","③ 乳類販売業","","石川県金沢市泉本町4-12","",36.550903,136.640280,"","株式会社コーシン","6220001000310","石川県野々市市押野２丁目２１６番地","","","","","","","届出","",""
"017201","fBiz00000230450000000716","石川県","金沢市","三治整形外科クリニック","サンジセイケイゲカクリニック","③ 乳類販売業","","石川県金沢市粟崎町1-42","",36.628543,136.631189,"","株式会社コーシン","6220001000310","石川県野々市市押野２丁目２１６番地","","","","","","","届出","",""
"017201","fBiz00000230450000000721","石川県","金沢市","金沢エムザ　スカイパーキング3F","カナザワエムザ　スカイパーキングサンカイ","⑤ コップ式自動販売機（自動洗浄・屋内設置）","","石川県金沢市武蔵町15-1","",36.572005,136.655011,"","株式会社コーシン","6220001000310","石川県野々市市押野２丁目２１６番地","","","","","","","届出","",""
"017201","fBiz00000230450000000748","石川県","金沢市","（株）日環商事休憩室０１Ｆ","カブシキガイシャニッカンショウジキュウケイシツイッカイ","⑤ コップ式自動販売機（自動洗浄・屋内設置）","","石川県金沢市無量寺5-75","",36.602215,136.612384,"","株式会社コーシン","6220001000310","石川県野々市市押野２丁目２１６番地","","","","","","","届出","",""
"017201","fBiz00000230450000000749","石川県","金沢市","市場急配ｾﾝﾀｰ(株)駅西 休憩室01F","シジョウキュウハイセンターカブシキガイシャエキニシキュウケイシツイツカイ","⑤ コップ式自動販売機（自動洗浄・屋内設置）","","石川県金沢市駅西本町5-10-20","",36.584713,136.631042,"","株式会社コーシン","6220001000310","石川県野々市市押野２丁目２１６番地","","","","","","","届出","",""
"017201","fBiz00000230450000000750","石川県","金沢市","(株)ｸﾗｽｺ本部 休憩室01F","カブシキガイシャクラスコホンブキュウケイシツイッカイ","⑤ コップ式自動販売機（自動洗浄・屋内設置）","","石川県金沢市西念4-24-21","",36.589629,136.632207,"","株式会社コーシン","6220001000310","石川県野々市市押野２丁目２１６番地","","","","","","","届出","",""
"017201","fBiz00000230450000000751","石川県","金沢市","荏原商事(株)ｽﾏｶﾌｪ休憩室04F","エバラショウジカブシキガイシャスマカフェキュウケイシツヨンカイ","⑤ コップ式自動販売機（自動洗浄・屋内設置）","","石川県金沢市長町2-7-1","",36.565026,136.646667,"","株式会社コーシン","6220001000310","石川県野々市市押野２丁目２１６番地","","","","","","","届出","",""
"017201","fBiz00000230450000000752","石川県","金沢市","(株)ﾎｷﾞﾒﾃﾞｨｶﾙ 金沢営業所","カブシキガイシヤホギメディカルカナザワエイギョウショ","⑤ コップ式自動販売機（自動洗浄・屋内設置）","","石川県金沢市駅西新町1-16-2","",36.589407,136.639629,"","株式会社コーシン","6220001000310","石川県野々市市押野２丁目２１６番地","","","","","","","届出","",""
"017201","fBiz00000230450000000753","石川県","金沢市","株式会社大同通路01F","カブシキガイシャダイドウツウロイッカイ","⑤ コップ式自動販売機（自動洗浄・屋内設置）","","石川県金沢市戸水2-38","",36.604008,136.616552,"","株式会社コーシン","6220001000310","石川県野々市市押野２丁目２１６番地","","","","","","","届出","",""
"017201","fBiz00000230450000000754","石川県","金沢市","名工建設(株)金沢第一ﾋﾞﾙ3F休憩室03F","メイコウケンセツカブシキガイシャカナザワダイイチビルサンガイキュウケイシツサンガイ","⑤ コップ式自動販売機（自動洗浄・屋内設置）","","石川県金沢市広岡1-5-23","金沢第一ビル３Ｆ",36.580519,136.647705,"","株式会社コーシン","6220001000310","石川県野々市市押野２丁目２１６番地","","","","","","","届出","",""
"017201","fBiz00000230450000000755","石川県","金沢市","やまもと商店 自販機ｺｰﾅｰ01F","ヤマモトショウテンジハンキコーナーイッカイ","⑤ コップ式自動販売機（自動洗浄・屋内設置）","","石川県金沢市西念4-7-1","",36.586000,136.633418,"","株式会社コーシン","6220001000310","石川県野々市市押野２丁目２１６番地","","","","","","","届出","",""
"017201","fBiz00000230450000000757","石川県","金沢市","やまもと商店 自販機ｺｰﾅｰ01F","ヤマモトショウテンジハンキコーナーイッカイ","⑤ コップ式自動販売機（自動洗浄・屋内設置）","","石川県金沢市西念4-7-1","",36.586000,136.633418,"","株式会社コーシン","6220001000310","石川県野々市市押野２丁目２１６番地","","","","","","","届出","",""
"017201","fBiz00000230450000000856","石川県","金沢市","石川近鉄ﾀｸｼｰ株式会社本社営業部食堂１階","イシカワキンテツタクシーカブシキガイシャホンシャエイギョウブショクドウイッカイ","⑤ コップ式自動販売機（自動洗浄・屋内設置）","","石川県金沢市北安江2-30-23","",36.589220,136.649535,"","株式会社コーシン","6220001000310","石川県野々市市押野２丁目２１６番地","","","","","","","届出","",""
"017201","fBiz00000230450000000857","石川県","金沢市","北陸病院 １階","ホクリクビョウイン イッカ","⑤ コップ式自動販売機（自動洗浄・屋内設置）","","石川県金沢市泉が丘2-13-43","",36.542377,136.644817,"","株式会社コーシン","6220001000310","石川県野々市市押野２丁目２１６番地","","","","","","","届出","",""
"017201","fBiz00000230450000000858","石川県","金沢市","株式会社ﾎｸｺｸ地水事務所横給湯室給湯室１階","カブシキガイシャホクコクチミズジムショヨコキュウトウシツキュウトウシツイッカイ","⑤ コップ式自動販売機（自動洗浄・屋内設置）","","石川県金沢市御影町25-1","",36.564165,136.638752,"","株式会社コーシン","6220001000310","石川県野々市市押野２丁目２１６番地","","","","","","","届出","",""
"017201","fBiz00000230450000000863","石川県","金沢市","金沢市役所１階通路１階","カナザワシヤクショイッカイツウロイッカイ","⑤ コップ式自動販売機（自動洗浄・屋内設置）","","石川県金沢市広坂1-1-1","",36.561143,136.656542,"","株式会社コーシン","6220001000310","石川県野々市市押野２丁目２１６番地","","","","","","","届出","",""
"017201","fBiz00000230450000000871","石川県","金沢市","KCﾋﾞﾙ NO.1休憩室３階","ケーシイビル　ナンバーワンキュウケイシツサンカイ","⑤ コップ式自動販売機（自動洗浄・屋内設置）","","石川県金沢市鞍月4-133","",36.596044,136.624566,"","株式会社コーシン","6220001000310","石川県野々市市押野２丁目２１６番地","","","","","","","届出","",""
"017201","fBiz00000230450000000872","石川県","金沢市","金沢信用金庫本部自販機ｺｰﾅｰ２階","カナザワシンヨウキンコホンブジハンキコーナーニカイ","⑤ コップ式自動販売機（自動洗浄・屋内設置）","","石川県金沢市香林坊1-3-8","",36.561937,136.655897,"","株式会社コーシン","6220001000310","石川県野々市市押野２丁目２１６番地","","","","","","","届出","",""
"017201","fBiz00000230450000000874","石川県","金沢市","ﾘﾊﾞﾃｨｰ水夢ｸﾗﾌﾞ金沢東店休憩室１階","リバティーミズユメクラブカナザワヒガシテンキュウケイシツイッカイ","⑤ コップ式自動販売機（自動洗浄・屋内設置）","","石川県金沢市疋田2-229","",36.600155,136.674136,"","株式会社コーシン","6220001000310","石川県野々市市押野２丁目２１６番地","","","","","","","届出","",""
"017201","fBiz00000230450000000876","石川県","金沢市","株式会社ｵｽｶｰﾎｰﾑ南営業所事務室１階","カブシキガイシャオスカーホームミナミエイギョウジョジムシツイッカイ","⑤ コップ式自動販売機（自動洗浄・屋内設置）","","石川県金沢市西念1-2-7","",36.582435,136.641319,"","株式会社コーシン","6220001000310","石川県野々市市押野２丁目２１６番地","","","","","","","届出","",""
"017201","fBiz00000230450000000878","石川県","金沢市","金沢ｺﾛﾅﾜｰﾙﾄﾞ1 従業員食堂休憩室１階","カナザワコロナワールドイチ　ジュウギョウインショクドウキュウケイシツイッカイ","⑤ コップ式自動販売機（自動洗浄・屋内設置）","","石川県金沢市無量寺4-121-1","",36.601250,136.614083,"","株式会社コーシン","6220001000310","石川県野々市市押野２丁目２１６番地","","","","","","","届出","",""
"017201","fBiz00000230450000000883","石川県","金沢市","金沢ｺﾛﾅﾜｰﾙﾄﾞ9 南西通路(ﾊﾟﾁﾝｺ)店内１階","カナザワコロナワールドキュウ　ナンセイツウロテンナイイッカイ","⑤ コップ式自動販売機（自動洗浄・屋内設置）","","石川県金沢市無量寺4-121-1","",36.601250,136.614083,"","株式会社コーシン","6220001000310","石川県野々市市押野２丁目２１６番地","","","","","","","届出","",""
"017201","fBiz00000230450000000884","石川県","金沢市","金沢ｺﾛﾅﾜｰﾙﾄﾞ18 北東通路店内１階","カナザワコロナワールドジュウハチ　ホクトウツウロテンナイイッカイ","⑤ コップ式自動販売機（自動洗浄・屋内設置）","","石川県金沢市無量寺4-121-1","",36.601250,136.614083,"","株式会社コーシン","6220001000310","石川県野々市市押野２丁目２１６番地","","","","","","","届出","",""
"017201","fBiz00000230450000000885","石川県","金沢市","金沢ｺﾛﾅﾜｰﾙﾄﾞ14 北東通路店内１階","カナザワコロナワールドジュウヨン　ホクトウツウロテンナイイッカイ","⑤ コップ式自動販売機（自動洗浄・屋内設置）","","石川県金沢市無量寺4-121-1","",36.601250,136.614083,"","株式会社コーシン","6220001000310","石川県野々市市押野２丁目２１６番地","","","","","","","届出","",""
"017201","fBiz00000230450000000886","石川県","金沢市","金沢ｺﾛﾅﾜｰﾙﾄﾞ11 ﾄｲﾚ前(ﾊﾟﾁﾝｺ)ﾛﾋﾞｰ１階","カナザワコロナワールドジュウイチ　トイレマエロビーイッカイ","⑤ コップ式自動販売機（自動洗浄・屋内設置）","","石川県金沢市無量寺4-121-1","",36.601250,136.614083,"","株式会社コーシン","6220001000310","石川県野々市市押野２丁目２１６番地","","","","","","","届出","",""
"017201","fBiz00000230450000000887","石川県","金沢市","株式会社ｼｨｰ･ﾌﾟﾗﾝﾆﾝｸﾞ事務室１階","カブシキガイシャシィー・プランニングジムシツイッカイ","⑤ コップ式自動販売機（自動洗浄・屋内設置）","","石川県金沢市八日市1-639","",36.542924,136.610648,"","株式会社コーシン","6220001000310","石川県野々市市押野２丁目２１６番地","","","","","","","届出","",""
"017201","fBiz00000230450000000888","石川県","金沢市","大原学園金沢校 4階通路４階","オオハラガクエンカナザワコウ　ヨンカイツウロヨンカイ","⑤ コップ式自動販売機（自動洗浄・屋内設置）","","石川県金沢市広岡1-1-15","",36.578332,136.645368,"","株式会社コーシン","6220001000310","石川県野々市市押野２丁目２１６番地","","","","","","","届出","",""
"017201","fBiz00000230450000000890","石川県","金沢市","北陸学院中学校高等学校事務室１階","ホクリクガクインチュウガッコウコウトウガッコウジムシツイッカイ","⑤ コップ式自動販売機（自動洗浄・屋内設置）","","石川県金沢市飛梅町1-10","",36.559342,136.666940,"","株式会社コーシン","6220001000310","石川県野々市市押野２丁目２１６番地","","","","","","","届出","",""
"017201","fBiz00000230450000000891","石川県","金沢市","株式会社ﾌｪﾆｯｸｽ金沢休憩室１階","カブシキガイシャフェニックスカナザワキュウケイシツイッカイ","⑤ コップ式自動販売機（自動洗浄・屋内設置）","","石川県金沢市駅西新町3-12-8","",36.592532,136.633886,"","株式会社コーシン","6220001000310","石川県野々市市押野２丁目２１６番地","","","","","","","届出","",""
"017201","fBiz00000230450000000892","石川県","金沢市","JR金沢駅西第一NKﾋﾞﾙ2階休憩室２階","ジェアールカナザワエキニシダイイチエヌケービルニカイキュウケイシツニカイ","⑤ コップ式自動販売機（自動洗浄・屋内設置）","","石川県金沢市広岡3-3-77","",36.581875,136.648205,"","株式会社コーシン","6220001000310","石川県野々市市押野２丁目２１６番地","","","","","","","届出","",""
"017201","fBiz00000230450000000893","石川県","金沢市","JR金沢駅西第一NKﾋﾞﾙ3階休憩室３階","ジェアールカナザワエキニシダイイチエヌケービルサンカイキュウケイシツサンカイ","⑤ コップ式自動販売機（自動洗浄・屋内設置）","","石川県金沢市広岡3-3-77","",36.581875,136.648205,"","株式会社コーシン","6220001000310","石川県野々市市押野２丁目２１６番地","","","","","","","届出","",""
"017201","fBiz00000230450000000894","石川県","金沢市","JR金沢駅西第一NKﾋﾞﾙ4階休憩室４階","ジェアールカナザワエキニシダイイチエヌケービルヨンカイキュウケイシツヨンカイ","⑤ コップ式自動販売機（自動洗浄・屋内設置）","","石川県金沢市広岡3-3-77","",36.581875,136.648205,"","株式会社コーシン","6220001000310","石川県野々市市押野２丁目２１６番地","","","","","","","届出","",""
"017201","fBiz00000230450000000895","石川県","金沢市","JR金沢駅西第一NKﾋﾞﾙ5階休憩室５階","ジェアールカナザワエキニシダイイチエヌケービルゴカイキュウケイシツゴカイ","⑤ コップ式自動販売機（自動洗浄・屋内設置）","","石川県金沢市広岡3-3-77","",36.581875,136.648205,"","株式会社コーシン","6220001000310","石川県野々市市押野２丁目２１６番地","","","","","","","届出","",""
"017201","fBiz00000230450000000896","石川県","金沢市","JR金沢駅西第一NKﾋﾞﾙ7F休憩室07F","ジェアールカナザワエキニシダイイチエヌケービルナナカイキュウケイシツナナカイ","⑤ コップ式自動販売機（自動洗浄・屋内設置）","","石川県金沢市広岡3-3-77","",36.581875,136.648205,"","株式会社コーシン","6220001000310","石川県野々市市押野２丁目２１６番地","","","","","","","届出","",""
"017201","fBiz00000230450000000897","石川県","金沢市","JR金沢駅西第一NKﾋﾞﾙ7F休憩室07F","ジェアールカナザワエキニシダイイチエヌケービルナナカイキュウケイシツナナカイ","⑤ コップ式自動販売機（自動洗浄・屋内設置）","","石川県金沢市広岡3-3-77","",36.581875,136.648205,"","株式会社コーシン","6220001000310","石川県野々市市押野２丁目２１６番地","","","","","","","届出","",""
"017201","fBiz00000230450000000898","石川県","金沢市","株式会社LAND PLAZA金沢店店内１階","カブシキガイシャランドプラザカナザワテンテンナイイッカイ","⑤ コップ式自動販売機（自動洗浄・屋内設置）","","石川県金沢市入江2-54","",36.564596,136.626687,"","株式会社コーシン","6220001000310","石川県野々市市押野２丁目２１６番地","","","","","","","届出","",""
"017201","fBiz00000230450000000900","石川県","金沢市","石川県信用保証協会5階通路５階","イシカワケンシンヨウホショウキョウカイゴカイツウロゴカイ","⑤ コップ式自動販売機（自動洗浄・屋内設置）","","石川県金沢市尾山町9-25","",36.566841,136.656193,"","株式会社コーシン","6220001000310","石川県野々市市押野２丁目２１６番地","","","","","","","届出","",""
"017201","fBiz00000230450000000902","石川県","金沢市","ｱﾙﾋﾞｽ株式会社西南部店休憩室１階","アルビスカブシキガイシャセイナンブテンキュウケイシツイッカイ","⑤ コップ式自動販売機（自動洗浄・屋内設置）","","石川県金沢市八日市出町822","",36.554662,136.609579,"","株式会社コーシン","6220001000310","石川県野々市市押野２丁目２１６番地","","","","","","","届出","",""
"017201","fBiz00000230450000000904","石川県","金沢市","近江町いちば館夢屋通路１階","オウミチョウイチバカンユメヤツウロイッカイ","⑤ コップ式自動販売機（自動洗浄・屋内設置）","","石川県金沢市青草町88","",36.571554,136.655922,"","株式会社コーシン","6220001000310","石川県野々市市押野２丁目２１６番地","","","","","","","届出","",""
"017201","fBiz00000230450000000905","石川県","金沢市","東亜電機工業株式会社本社休憩室１階","トウアデンキコウギョウカブシキガイシャホンシャキュウケイシツイッカイ","⑤ コップ式自動販売機（自動洗浄・屋内設置）","","石川県金沢市増泉2-18-15","",36.557958,136.637287,"","株式会社コーシン","6220001000310","石川県野々市市押野２丁目２１６番地","","","","","","","届出","",""
"017201","fBiz00000230450000000918","石川県","金沢市","香林坊ｱﾄﾘｵ休憩室地下1階","コウリンボウアトリオキュウケイシツチカイッカイ","⑤ コップ式自動販売機（自動洗浄・屋内設置）","","石川県金沢市香林坊1-1-1","",36.563221,136.654096,"","株式会社コーシン","6220001000310","石川県野々市市押野２丁目２１６番地","","","","","","","届出","",""
