"013123","fBiz00001205590000000040","東京都","江戸川区","すき家　柴又街道小岩店","スキヤ　シバマタカイドウコイワテン","⑬ その他の食料・飲料販売業","牛丼屋","東京都江戸川区東小岩六丁目3番5号","",35.735184,139.885519,"","株式会社すき家","2010401093920","東京都港区港南２丁目１８番１号","","","","","","","届出","",""
"013123","fBiz00001205590000000041","東京都","江戸川区","すき家　14号江戸川一之江店","スキヤ　ジュウヨンゴウエドガワイチノエテン","① 飲食店営業","牛丼屋","東京都江戸川区一之江一丁目8番4号","",35.702272,139.881908,"","株式会社すき家","2010401093920","東京都港区港南２丁目１８番１号","23江衛調第135号",2023/05/23,2023/05/23,2023/05/23,2030/05/31,"","許可","",""
"013123","fBiz00001205590000000041","東京都","江戸川区","すき家　14号江戸川一之江店","スキヤ　ジュウヨンゴウエドガワイチノエテン","⑬ その他の食料・飲料販売業","牛丼屋","東京都江戸川区一之江一丁目8番4号","",35.702264,139.881915,"","株式会社すき家","2010401093920","東京都港区港南２丁目１８番１号","","","","","","","届出","",""
"013123","fBiz00001205590000000042","東京都","江戸川区","すき家　14号江戸川篠崎店","スキヤ　ジュウヨンゴウエドガワシノザキテン","⑬ その他の食料・飲料販売業","牛丼屋","東京都江戸川区篠崎町七丁目1番17号","",35.702914,139.901249,"","株式会社すき家","2010401093920","東京都港区港南２丁目１８番１号","","","","","","","届出","",""
"013123","fBiz00001205590000000043","東京都","江戸川区","すき家　西葛西駅前店","スキヤ　ニシカサイエキマエテン","⑬ その他の食料・飲料販売業","牛丼屋","東京都江戸川区西葛西六丁目8番11号","葛西産業ﾋﾞﾙ",35.664216,139.858544,"","株式会社すき家","2010401093920","東京都港区港南２丁目１８番１号","","","","","","","届出","",""
"013123","fBiz00001205590000000044","東京都","江戸川区","すき家　14号江戸川松江店","スキヤ　ジュウヨンゴウエドガワマツエテン","⑬ その他の食料・飲料販売業","牛丼屋","東京都江戸川区松江一丁目8番8号","",35.703062,139.868252,"","株式会社すき家","2010401093920","東京都港区港南２丁目１８番１号","","","","","","","届出","",""
"013123","fBiz00001205590000000045","東京都","江戸川区","すき家　一之江駅前店","スキヤ　イチノエエキマエテン","⑬ その他の食料・飲料販売業","牛丼屋","東京都江戸川区一之江三丁目2番14号","",35.686734,139.884062,"","株式会社すき家","2010401093920","東京都港区港南２丁目１８番１号","","","","","","","届出","",""
"013123","fBiz00001205590000000046","東京都","江戸川区","すき家　船堀駅前店","スキヤ　フナボリエキマエテン","⑬ その他の食料・飲料販売業","牛丼屋","東京都江戸川区船堀三丁目5番7号","船堀駅前ﾄｷﾋﾞﾙ　1階",35.683020,139.864018,"","株式会社すき家","2010401093920","東京都港区港南２丁目１８番１号","","","","","","","届出","",""
"013123","fBiz00001205590000000047","東京都","江戸川区","すき家　中葛西店","スキヤ　ナカカサイテン","⑬ その他の食料・飲料販売業","牛丼屋","東京都江戸川区中葛西六丁目1番10号","ﾒｿﾞﾝﾄﾞ佐久間1階",35.659848,139.864284,"","株式会社すき家","2010401093920","東京都港区港南２丁目１８番１号","","","","","","","届出","",""
"013123","fBiz00001205590000000048","東京都","江戸川区","すき家　江戸川興宮店","スキヤ　エドガワオキノミヤテン","⑬ その他の食料・飲料販売業","牛丼屋","東京都江戸川区興宮町33番17号","",35.719966,139.877947,"","株式会社すき家","2010401093920","東京都港区港南２丁目１８番１号","","","","","","","届出","",""
"013123","fBiz00001210350000000002","東京都","江戸川区","","","㉙ その他","食品物流","","","","","","","","","","","","","","","届出","",""
"013123","fBiz00001212380000000003","東京都","江戸川区","江戸川区立福祉作業所 分室 ベリィソイズ","エドガワクリツフクシサギョウショ ブンシツ ベリィソイズ","⑬ その他の食料・飲料販売業","","東京都江戸川区中央1-4-1","江戸川区役所",35.706796,139.868206,"0336724905","社会福祉法人江戸川菜の花の会","2011705000678","東京都江戸川区中葛西2-7-2","","","","","","","届出","",""
"013123","fBiz00001212380000000006","東京都","江戸川区","江戸川区立福祉作業所 分室 ベリィソイズ","エドガワクリツフクシサギョウショ ブンシツ ベリィソイズ","⑬ その他の食料・飲料販売業","","東京都江戸川区西小岩5-3-20","東京表現高等学院　MIICA",35.737768,139.882128,"0336724905","社会福祉法人江戸川菜の花の会","2011705000678","東京都江戸川区中葛西2-7-2","","","","","","","届出","",""
"013123","fBiz00001212380000000007","東京都","江戸川区","江戸川区立福祉作業所 分室 ベリィソイズ","エドガワクリツフクシサギョウショ ブンシツ ベリィソイズ","⑬ その他の食料・飲料販売業","","東京都江戸川区東小岩3-23-3","小岩健康サポートセンター",35.733795,139.894004,"0336724905","社会福祉法人江戸川菜の花の会","2011705000678","東京都江戸川区中葛西2-7-2","","","","","","","届出","",""
"013123","fBiz00001212380000000008","東京都","江戸川区","江戸川区立福祉作業所 分室 ベリィソイズ","エドガワクリツフクシサギョウショ ブンシツ ベリィソイズ","⑬ その他の食料・飲料販売業","","東京都江戸川区宇喜田町175","葛西育成室",35.673390,139.860948,"0336724905","社会福祉法人江戸川菜の花の会","2011705000678","東京都江戸川区中葛西2-7-2","","","","","","","届出","",""
"013123","fBiz00001212380000000009","東京都","江戸川区","江戸川区立福祉作業所 分室 ベリィソイズ","エドガワクリツフクシサギョウショ ブンシツ ベリィソイズ","⑬ その他の食料・飲料販売業","","東京都江戸川区北小岩2-14-17","小岩育成室",35.740147,139.884845,"0336724905","社会福祉法人江戸川菜の花の会","2011705000678","東京都江戸川区中葛西2-7-2","","","","","","","届出","",""
"013123","fBiz00001212380000000010","東京都","江戸川区","江戸川区立福祉作業所 分室 ベリィソイズ","エドガワクリツフクシサギョウショ ブンシツ ベリィソイズ","⑬ その他の食料・飲料販売業","","東京都江戸川区松江2-10-18","生活協同組合パルシステム東京江戸川センター",35.699548,139.872097,"0336724905","社会福祉法人江戸川菜の花の会","2011705000678","東京都江戸川区中葛西2-7-2","","","","","","","届出","",""
"013123","fBiz00001212380000000011","東京都","江戸川区","江戸川区立福祉作業所 分室 ベリィソイズ","エドガワクリツフクシサギョウショ ブンシツ ベリィソイズ","⑬ その他の食料・飲料販売業","","東京都江戸川区松江2-21-7","有限会社さいとう加工",35.699378,139.872506,"0336724905","社会福祉法人江戸川菜の花の会","2011705000678","東京都江戸川区中葛西2-7-2","","","","","","","届出","",""
"013123","fBiz00001212380000000012","東京都","江戸川区","江戸川区立福祉作業所 分室 ベリィソイズ","エドガワクリツフクシサギョウショ ブンシツ ベリィソイズ","⑬ その他の食料・飲料販売業","","東京都江戸川区本一色2-24-11","東京都立鹿本学園",35.718427,139.875754,"0336724905","社会福祉法人江戸川菜の花の会","2011705000678","東京都江戸川区中葛西2-7-2","","","","","","","届出","",""
"013123","fBiz00001212380000000013","東京都","江戸川区","江戸川区立福祉作業所 分室 ベリィソイズ","エドガワクリツフクシサギョウショ ブンシツ ベリィソイズ","⑬ その他の食料・飲料販売業","","東京都江戸川区西小岩3-25-15","江戸川区立福祉作業所本館",35.737663,139.877195,"0336724905","社会福祉法人江戸川菜の花の会","2011705000678","東京都江戸川区中葛西2-7-2","","","","","","","届出","",""
"013123","fBiz00001212380000000017","東京都","江戸川区","江戸川区立福祉作業所　分室　ベリィソイズ","エドガワクリツフクシサギョウショ　ブンシツ　ベリィソイズ","⑬ その他の食料・飲料販売業","","東京都江戸川区篠崎町3-18-5","篠崎児童発達支援センター",35.702529,139.912540,"0336724905","社会福祉法人江戸川菜の花の会","2011705000678","東京都江戸川区中葛西2-7-2","","","","","","","届出","",""
"013123","fBiz00001212380000000018","東京都","江戸川区","江戸川区立福祉作業所　分室　ベリィソイズ","エドガワクリツフクシサギョウショ　ブンシツ　ベリィソイズ","⑬ その他の食料・飲料販売業","","東京都江戸川区上一色2-6-10","上一色コミュニティセンター",35.725598,139.872501,"0336724905","社会福祉法人江戸川菜の花の会","2011705000678","東京都江戸川区中葛西2-7-2","","","","","","","届出","",""
"013123","fBiz00001213190000000011","東京都","江戸川区","スエヒロ館　東葛西店","スエヒロカン　ヒガシカサイテン","② 食肉販売業（包装済みの食肉のみの販売）","","東京都江戸川区東葛西6-29-20","",35.659996,139.877247,"03-5659-1129","株式会社スエヒロレストランシステム","1021001031279","神奈川県大和市柳橋１丁目７番地４","","","","","","","届出","",""
"013123","fBiz00001213190000000047","東京都","江戸川区","焼肉　かるび家　船堀駅前店","ヤキニク　カルビヤ　フナボリエキマエテン","② 食肉販売業（包装済みの食肉のみの販売）","","東京都江戸川区船堀3-5-7","船堀駅前　TOKIビル2F",35.683020,139.864018,"0356059021","株式会社スエヒロレストランシステム","1021001031279","神奈川県大和市柳橋１丁目７番地４","","","","","","","届出","",""
"013123","fBiz00001220900000000015","東京都","江戸川区","小鳩ナーサリースクール一之江","コバトナーサリースクールイチノエ","㉖ 集団給食施設","給食","東京都江戸川区一之江7－41－15","ドエル・グリュック１階",35.686612,139.881488,"0358795824","株式会社チャイルド・ピース","9030001054190","東京都港区芝一丁目2番1－2714号","","","","","","","届出","",""
"013123","fBiz00001229240000000016","東京都","江戸川区","洋菓子工房ZEN","ヨウガシコウボウゼン","㉕ 行商","行商　","","","","","","株式会社快善プロジェクト","5012801007226","東京都立川市羽衣町2-34-4","","","","","","","届出","",""
"013123","fBiz00001231220000000001","東京都","江戸川区","","","⑦ 野菜果物販売業","八百屋","","","","","","","","","","","","","","","届出","",""
"013123","fBiz00001231220000000004","東京都","江戸川区","","","⑦ 野菜果物販売業","","","","","","","","","","","","","","","","届出","",""
"013123","fBiz00001231430000000001","東京都","江戸川区","","","⑬ その他の食料・飲料販売業","","","","","","","","","","","","","","","","届出","",""
"013123","fBiz00001254360000000001","東京都","江戸川区","無印良品アリオ葛西店","ムジルシリョウヒンアリオカサイテン","⑬ その他の食料・飲料販売業","","東京都江戸川区東葛西9-3-3","アリオ葛西１階",35.653252,139.880688,"0356756815","株式会社MARINAインターナショナル","5040001032819","千葉県浦安市入船1-5-2　","","","","","","","届出","",""
"013123","fBiz00001256160000000001","東京都","江戸川区","クリスナパレスアジアンストア","クリスナパレスアジアンストア","⑬ その他の食料・飲料販売業","小売店","東京都江戸川区船堀1-7-17","クリスタル船堀202",35.684635,139.863246,"0368080406","RS INTERNATIONAL株式会社","6011701024693","東京都江戸川区船堀7-3-5YKビル201","","","","","","","届出","",""
"013123","fBiz00001256440000000001","東京都","江戸川区","","","⑦ 野菜果物販売業","","","","","","","","","","","","","","","","届出","",""
"013123","fBiz00001258410000000006","東京都","江戸川区","斉藤商店","サイトウショウテン","⑦ 野菜果物販売業","","東京都江戸川区南小岩2丁目2番7号","",35.717696,139.890261,"0336502600","有限会社斉藤商店","5011702004588","東京都江戸川区南小岩2丁目2番7号","","","","","","","届出","",""
"013123","fBiz00001265930000000001","東京都","江戸川区","","","㉖ 集団給食施設","集団給食","","","","","","","","","","","","","","","届出","",""
"013123","fBiz00001272130000000067","東京都","江戸川区","生活協同組合コープみらい　コープデリ　船堀センター","セイカツキョウドウクミアイ　コープデリ　フナホリセンター","㉙ その他","倉庫業","東京都江戸川区東小松川4-41-18","",35.687435,139.863999,"","生活協同組合コープみらい","5030005001408","埼玉県さいたま市南区根岸１丁目５番５号","","","","","","","届出","",""
"013123","fBiz00001272130000000069","東京都","江戸川区","生活協同組合コープみらい　コープデリ平井センター","セイカツキョウドウクミアイ　コープデリヒライセンター","㉙ その他","倉庫業","東京都江戸川区平井7-13-18","",35.714713,139.836572,"03-3610-5601","生活協同組合コープみらい","5030005001408","埼玉県さいたま市南区根岸１丁目５番５号","","","","","","","届出","",""
"013123","fBiz00001272130000000146","東京都","江戸川区","生活協同組合コープみらい　ミニコープなぎさ店","セイカツキョウドウクミアイ　ミニコープナギサテン","⑪ 百貨店、総合スーパー","店舗","東京都江戸川区南葛西7-1-7","",35.645665,139.879768,"03-3675-6461","生活協同組合コープみらい","5030005001408","埼玉県さいたま市南区根岸１丁目５番５号","","","","","","","届出","",""
"013123","fBiz00001272130000000171","東京都","江戸川区","生活協同組合コープみらい　ミニコープ江戸川中央店","セイカツキョウドウクミアイコープミライ　ミニコープエドガワチュウオウテン","⑪ 百貨店、総合スーパー","店舗","東京都江戸川区中央4-3-1","",35.713701,139.865725,"03-3655-8861","生活協同組合コープみらい","5030005001408","埼玉県さいたま市南区根岸１丁目５番５号","","","","","","","届出","",""
"013123","fBiz00001322590000000002","東京都","江戸川区","とくし丸コモディイイダ20号車","トクシマルコモディイイダニジュウゴウシャ","⑬ その他の食料・飲料販売業","移動販売","東京都江戸川区北葛西周辺","",35.675913,139.858566,"090-4530-2125","深澤秀弘","","東京都江戸川区平井4-2-11-205","","","","","","","届出","",""
"013123","fBiz00001272130000000172","東京都","江戸川区","生活協同組合コープみらい　ミニコープ小岩店","セイカツキョウドウクミアイコープミライ　ミニコープコイワテン","⑪ 百貨店、総合スーパー","店舗","東京都江戸川区南小岩2-4-26","",35.720217,139.890426,"03-3672-6941","生活協同組合コープみらい","5030005001408","埼玉県さいたま市南区根岸１丁目５番５号","","","","","","","届出","",""
"013123","fBiz00001280840000000014","東京都","江戸川区","魚力","ウオリキ","① 飲食店営業","寿司、刺身","東京都江戸川区南小岩7-24-15","シャポー小岩B1F",35.733238,139.881454,"0336710265","株式会社魚力","4010101000456","東京都立川市曙町二丁目８番３号","22江衛調第1060号",2023/03/27,2023/03/27,2023/03/27,2030/03/31,"","許可","",""
"013123","fBiz00001280840000000014","東京都","江戸川区","魚力","ウオリキ","④ 魚介類販売業","寿司、刺身","東京都江戸川区南小岩7-24-15","シャポー小岩B1F",35.733238,139.881454,"0336710265","株式会社魚力","4010101000456","東京都立川市曙町二丁目８番３号","22江衛調第1061号",2023/03/27,2023/03/27,2023/03/27,2030/03/31,"","許可","",""
"013123","fBiz00001280840000000014","東京都","江戸川区","魚力","ウオリキ","① 魚介類販売業（包装済みの魚介類のみの販売）","","東京都江戸川区南小岩7-24-15","シャポー小岩B1F",35.733238,139.881454,"0336710265","株式会社魚力","4010101000456","東京都立川市曙町二丁目８番３号","","","","","","","届出","",""
"013123","fBiz00001287220000000894","東京都","江戸川区","サイゼリヤ　江戸川南篠崎店","サイゼリヤ　エドガワミナミシノザキテン","⑬ その他の食料・飲料販売業","","東京都江戸川区南篠崎町2-58-17","リビングパティオ　２Ｆ",35.691938,139.905949,"03-5666-4360","株式会社サイゼリヤ","8030001065552","埼玉県吉川市旭2番地5","","","","","","","届出","",""
"013123","fBiz00001287220000000895","東京都","江戸川区","サイゼリヤ　江戸川春江店","サイゼリヤ　エドガワハルエテン","⑬ その他の食料・飲料販売業","","東京都江戸川区春江町2-40","",35.698380,139.890731,"03-5636-4645","株式会社サイゼリヤ","8030001065552","埼玉県吉川市旭2番地5","","","","","","","届出","",""
"013123","fBiz00001287220000000896","東京都","江戸川区","株式会社　サイゼリヤ　一之江駅前店","カブシキガイシャ　サイゼリヤ　イチノエエキマエテン","⑬ その他の食料・飲料販売業","","東京都江戸川区一之江7-35-22","一富ビルディング2F",35.686099,139.881798,"03-5661-9547","株式会社サイゼリヤ","8030001065552","埼玉県吉川市旭2番地5","","","","","","","届出","",""
"013123","fBiz00001287220000000897","東京都","江戸川区","サイゼリヤ　船堀店","サイゼリヤ　フナボリテン","⑬ その他の食料・飲料販売業","","東京都江戸川区船堀4-16-20","",35.681980,139.867677,"03-5679-5021","株式会社サイゼリヤ","8030001065552","埼玉県吉川市旭2番地5","","","","","","","届出","",""
"013123","fBiz00001287220000000898","東京都","江戸川区","サイゼリヤ　西葛西駅南口店","サイゼリヤ　ニシカサイエキミナミグチテン","⑬ その他の食料・飲料販売業","","東京都江戸川区西葛西6-16-1","第６喜楽ビル　２階",35.663642,139.859704,"03-5659-0751","株式会社サイゼリヤ","8030001065552","埼玉県吉川市旭2番地5","","","","","","","届出","",""
"013123","fBiz00001287220000000899","東京都","江戸川区","サイゼリヤ　イオン葛西店","サイゼリヤ　イオンカサイテン","⑬ その他の食料・飲料販売業","","東京都江戸川区西葛西3-9-19","イオン葛西4階",35.669099,139.858406,"03-5679-8511","株式会社サイゼリヤ","8030001065552","埼玉県吉川市旭2番地5","","","","","","","届出","",""
"013123","fBiz00001287220000000900","東京都","江戸川区","サイゼリヤ　小岩北口駅前店","サイゼリヤ　コイワキタグチエキマエテン","⑬ その他の食料・飲料販売業","","東京都江戸川区西小岩1-19-29","エトワールビル　２Ｆ",35.732687,139.880153,"03-3673-7771","株式会社サイゼリヤ","8030001065552","埼玉県吉川市旭2番地5","","","","","","","届出","",""
"013123","fBiz00001287220000000902","東京都","江戸川区","サイゼリヤ　京成小岩店","サイゼリヤ　ケイセイコイワテン","⑬ その他の食料・飲料販売業","","東京都江戸川区北小岩2-7-4","ラナイプラザファーストステージ　２０１",35.741789,139.882613,"03-5612-3121","株式会社サイゼリヤ","8030001065552","埼玉県吉川市旭2番地5","","","","","","","届出","",""
"013123","fBiz00001287220000000905","東京都","江戸川区","サイゼリヤ　イトーヨーカドー小岩店","サイゼリヤ　イトーヨーカドーコイワテン","⑬ その他の食料・飲料販売業","","東京都江戸川区西小岩1-24-1","イトーヨーカ堂内６Ｆ",35.733624,139.881368,"03-5622-7121","株式会社サイゼリヤ","8030001065552","埼玉県吉川市旭2番地5","","","","","","","届出","",""
"013123","fBiz00001287220000000980","東京都","江戸川区","サイゼリヤアリオ葛西店","サイゼリヤアリオカサイテン","⑬ その他の食料・飲料販売業","","東京都江戸川区東葛西9-3-3","アリオ葛西3F",35.653252,139.880688,"03-5679-0171","株式会社サイゼリヤ","8030001065552","埼玉県吉川市旭2番地5","","","","","","","届出","",""
"013123","fBiz00001287220000001139","東京都","江戸川区","サイゼリヤ　江戸川松本店","サイゼリヤ　エドガワマツモトテン","⑬ その他の食料・飲料販売業","","東京都江戸川区松本1-34－12","",35.716955,139.875487,"03-5607-2330","株式会社サイゼリヤ","8030001065552","埼玉県吉川市旭2番地5","","","","","","","届出","",""
"013123","fBiz00001290610000000238","東京都","江戸川区","ヴィドフランス小岩店","ヴィドフランスコイワテン","① 飲食店営業","ベーカリー","東京都江戸川区南小岩7-24-15","シャポー小岩　B-08",35.733238,139.881454,"03-6657-8090","株式会社ヴィ・ド・フランス","3010001074766","東京都千代田区岩本町３丁目１０番１号","23江衛調第45号",2023/04/19,2023/04/19,2023/04/19,2030/03/31,"","許可","",""
"013123","fBiz00001290610000000238","東京都","江戸川区","ヴィドフランス小岩店","ヴィドフランスコイワテン","⑪ 菓子製造業","ベーカリー","東京都江戸川区南小岩7-24-15","シャポー小岩　B-08",35.733238,139.881454,"03-6657-8090","株式会社ヴィ・ド・フランス","3010001074766","東京都千代田区岩本町３丁目１０番１号","22江衛調第1058号",2023/03/27,2023/03/27,2023/03/27,2030/03/31,"","許可","",""
"013123","fBiz00001290610000000238","東京都","江戸川区","ヴィドフランス小岩店","ヴィドフランスコイワテン","⑬ その他の食料・飲料販売業","ベーカリー","東京都江戸川区南小岩7-24-15","シャポー小岩　B-08",35.733238,139.881454,"03-6657-8090","株式会社ヴィ・ド・フランス","3010001074766","東京都千代田区岩本町３丁目１０番１号","","","","","","","届出","",""
"013123","fBiz00001298650000000001","東京都","江戸川区","","","⑬ その他の食料・飲料販売業","","","","","","","","","","","","","","","","届出","",""
"013123","fBiz00001305930000000030","東京都","江戸川区","小岩臨時A","コイワリンジエー","⑬ その他の食料・飲料販売業","物産販売","東京都江戸川区南小岩7丁目24番15号","小岩駅　改札外コンコース",35.733238,139.881454,"","株式会社ＪＲ東日本クロスステーション","3011101042662","東京都渋谷区千駄ヶ谷５丁目３３番８号","","","","","","","届出","",""
"013123","fBiz00001315150000000001","東京都","江戸川区","","","⑯ コーヒー製造・加工業（飲料の製造を除く。）","","","","","","","","","","","","","","","","届出","",""
"013123","fBiz00001351130000000001","東京都","江戸川区","ウエルシア江戸川西葛西店","ウエルシアエドガワニシカサイテン","⑪ 百貨店、総合スーパー","ドラッグストア","東京都江戸川区西葛西5-2-10","",35.666026,139.859746,"03-5679-6315","ウエルシア薬局株式会社","3030001002411","東京都千代田区外神田二丁目2番15号","","","","","","","届出","",""
"013123","fBiz00001354140000000001","東京都","江戸川区","けんたくん江戸川中央店","ケンタクンエドガワチュウオウテン","⑥ 弁当販売業","冷凍弁当の宅配","東京都江戸川区篠崎町7-8-21","",35.706195,139.900441,"0356664970","影山法明","","東京都江戸川区篠崎町7-8-21","","","","","","","届出","",""
"013123","fBiz00001357410000000003","東京都","江戸川区","株式会社パワーテクノ　物流・加工センター","カブシキカイシャパワーテクノ　ブツリュウ・カコウセンター","㉗ 器具、容器包装の製造・加工業（合成樹脂が使用された器具又は容器包装の製造、加工に限る。）","","東京都江戸川区中央3-9-7","三家第2ビル",35.711814,139.872186,"0356785023","株式会社パワーテクノ","7011801017927","東京都葛飾区新小岩4丁目21-20","","","","","","","届出","",""
"013123","fBiz00001361980000000002","東京都","江戸川区","","","㉖ 集団給食施設","","","","","","","","","","","","","","","","届出","",""
