"024000","fBiz00000884610000000104","三重県","津市","","","⑫ 自動販売機による販売業（コップ式自動販売機（自動洗浄・屋内設置）及び営業許可の対象となる自動販売機を除く）","","","","","","","株式会社ヤクルト東海","2200001008177","愛知県一宮市千秋町町屋字東蒲田28番地1","","","","","","","届出","",""
"024000","fBiz00000884610000000105","三重県","津市","","","⑫ 自動販売機による販売業（コップ式自動販売機（自動洗浄・屋内設置）及び営業許可の対象となる自動販売機を除く）","","","","","","","株式会社ヤクルト東海","2200001008177","愛知県一宮市千秋町町屋字東蒲田28番地1","","","","","","","届出","",""
"024000","fBiz00000884610000000106","三重県","津市","","","⑫ 自動販売機による販売業（コップ式自動販売機（自動洗浄・屋内設置）及び営業許可の対象となる自動販売機を除く）","","","","","","","株式会社ヤクルト東海","2200001008177","愛知県一宮市千秋町町屋字東蒲田28番地1","","","","","","","届出","",""
"024000","fBiz00000884610000000107","三重県","津市","","","⑫ 自動販売機による販売業（コップ式自動販売機（自動洗浄・屋内設置）及び営業許可の対象となる自動販売機を除く）","","","","","","","株式会社ヤクルト東海","2200001008177","愛知県一宮市千秋町町屋字東蒲田28番地1","","","","","","","届出","",""
"024000","fBiz00000884610000000108","三重県","津市","","","⑫ 自動販売機による販売業（コップ式自動販売機（自動洗浄・屋内設置）及び営業許可の対象となる自動販売機を除く）","","","","","","","株式会社ヤクルト東海","2200001008177","愛知県一宮市千秋町町屋字東蒲田28番地1","","","","","","","届出","",""
"024000","fBiz00000884610000000109","三重県","津市","","","⑫ 自動販売機による販売業（コップ式自動販売機（自動洗浄・屋内設置）及び営業許可の対象となる自動販売機を除く）","","","","","","","株式会社ヤクルト東海","2200001008177","愛知県一宮市千秋町町屋字東蒲田28番地1","","","","","","","届出","",""
"024000","fBiz00000884610000000110","三重県","津市","","","⑫ 自動販売機による販売業（コップ式自動販売機（自動洗浄・屋内設置）及び営業許可の対象となる自動販売機を除く）","","","","","","","株式会社ヤクルト東海","2200001008177","愛知県一宮市千秋町町屋字東蒲田28番地1","","","","","","","届出","",""
"024000","fBiz00000884610000000111","三重県","津市","","","⑫ 自動販売機による販売業（コップ式自動販売機（自動洗浄・屋内設置）及び営業許可の対象となる自動販売機を除く）","","","","","","","株式会社ヤクルト東海","2200001008177","愛知県一宮市千秋町町屋字東蒲田28番地1","","","","","","","届出","",""
"024000","fBiz00000884610000000112","三重県","津市","","","⑫ 自動販売機による販売業（コップ式自動販売機（自動洗浄・屋内設置）及び営業許可の対象となる自動販売機を除く）","","","","","","","株式会社ヤクルト東海","2200001008177","愛知県一宮市千秋町町屋字東蒲田28番地1","","","","","","","届出","",""
"024000","fBiz00000884610000000113","三重県","津市","","","⑫ 自動販売機による販売業（コップ式自動販売機（自動洗浄・屋内設置）及び営業許可の対象となる自動販売機を除く）","","","","","","","株式会社ヤクルト東海","2200001008177","愛知県一宮市千秋町町屋字東蒲田28番地1","","","","","","","届出","",""
"024000","fBiz00000884610000000114","三重県","津市","","","⑫ 自動販売機による販売業（コップ式自動販売機（自動洗浄・屋内設置）及び営業許可の対象となる自動販売機を除く）","","","","","","","株式会社ヤクルト東海","2200001008177","愛知県一宮市千秋町町屋字東蒲田28番地1","","","","","","","届出","",""
"024000","fBiz00000884610000000115","三重県","津市","","","⑫ 自動販売機による販売業（コップ式自動販売機（自動洗浄・屋内設置）及び営業許可の対象となる自動販売機を除く）","","","","","","","株式会社ヤクルト東海","2200001008177","愛知県一宮市千秋町町屋字東蒲田28番地1","","","","","","","届出","",""
"024000","fBiz00000884610000000116","三重県","津市","","","⑫ 自動販売機による販売業（コップ式自動販売機（自動洗浄・屋内設置）及び営業許可の対象となる自動販売機を除く）","","","","","","","株式会社ヤクルト東海","2200001008177","愛知県一宮市千秋町町屋字東蒲田28番地1","","","","","","","届出","",""
"024000","fBiz00000884610000000117","三重県","津市","","","⑫ 自動販売機による販売業（コップ式自動販売機（自動洗浄・屋内設置）及び営業許可の対象となる自動販売機を除く）","","","","","","","株式会社ヤクルト東海","2200001008177","愛知県一宮市千秋町町屋字東蒲田28番地1","","","","","","","届出","",""
"024000","fBiz00000884610000000118","三重県","津市","","","⑫ 自動販売機による販売業（コップ式自動販売機（自動洗浄・屋内設置）及び営業許可の対象となる自動販売機を除く）","","","","","","","株式会社ヤクルト東海","2200001008177","愛知県一宮市千秋町町屋字東蒲田28番地1","","","","","","","届出","",""
"024000","fBiz00000884610000000119","三重県","津市","","","⑫ 自動販売機による販売業（コップ式自動販売機（自動洗浄・屋内設置）及び営業許可の対象となる自動販売機を除く）","","","","","","","株式会社ヤクルト東海","2200001008177","愛知県一宮市千秋町町屋字東蒲田28番地1","","","","","","","届出","",""
"024000","fBiz00000884610000000120","三重県","津市","","","⑫ 自動販売機による販売業（コップ式自動販売機（自動洗浄・屋内設置）及び営業許可の対象となる自動販売機を除く）","","","","","","","株式会社ヤクルト東海","2200001008177","愛知県一宮市千秋町町屋字東蒲田28番地1","","","","","","","届出","",""
"024000","fBiz00000884610000000121","三重県","津市","","","⑫ 自動販売機による販売業（コップ式自動販売機（自動洗浄・屋内設置）及び営業許可の対象となる自動販売機を除く）","","","","","","","株式会社ヤクルト東海","2200001008177","愛知県一宮市千秋町町屋字東蒲田28番地1","","","","","","","届出","",""
"024000","fBiz00000884610000000122","三重県","津市","","","⑫ 自動販売機による販売業（コップ式自動販売機（自動洗浄・屋内設置）及び営業許可の対象となる自動販売機を除く）","","","","","","","株式会社ヤクルト東海","2200001008177","愛知県一宮市千秋町町屋字東蒲田28番地1","","","","","","","届出","",""
"024000","fBiz00000884610000000123","三重県","津市","","","⑫ 自動販売機による販売業（コップ式自動販売機（自動洗浄・屋内設置）及び営業許可の対象となる自動販売機を除く）","","","","","","","株式会社ヤクルト東海","2200001008177","愛知県一宮市千秋町町屋字東蒲田28番地1","","","","","","","届出","",""
"024000","fBiz00000884610000000124","三重県","津市","","","⑫ 自動販売機による販売業（コップ式自動販売機（自動洗浄・屋内設置）及び営業許可の対象となる自動販売機を除く）","","","","","","","株式会社ヤクルト東海","2200001008177","愛知県一宮市千秋町町屋字東蒲田28番地1","","","","","","","届出","",""
"024000","fBiz00000884610000000125","三重県","津市","","","⑫ 自動販売機による販売業（コップ式自動販売機（自動洗浄・屋内設置）及び営業許可の対象となる自動販売機を除く）","","","","","","","株式会社ヤクルト東海","2200001008177","愛知県一宮市千秋町町屋字東蒲田28番地1","","","","","","","届出","",""
"024000","fBiz00000907530000000004","三重県","津市","ハンズ桑名店","ハンズクワナテン","⑬ その他の食料・飲料販売業","","三重県桑名市新西方1-22","イオンモール桑名１番街３階",35.072290,136.662491,"0594230128","株式会社三交シーエルツー","5180001115782","愛知県名古屋市中区錦３丁目５番２７号","","","","","","","届出","",""
"024000","fBiz00000915470000000001","三重県","津市","ニチニチ製薬株式会社","ニチニチセイヤクカブシキガイシャ","⑮ いわゆる健康食品の製造・加工業","製造業","三重県伊賀市富永２３９－１","",34.765226,136.270905,"0595480201","ニチニチ製薬株式会社","5190001008606","三重県伊賀市富永２３９番地の１","","","","","","","届出","",""
"024000","fBiz00000916030000000089","三重県","津市","ココス津久居店","ココスツヒサイテン","⑬ その他の食料・飲料販売業","","三重県津市久居明神町2610-2","",34.683316,136.468652,"050-3643-4758","株式会社ココスジャパン","9010401054189","東京都港区港南２丁目１８番１号","","","","","","","届出","",""
"024000","fBiz00000916030000000143","三重県","津市","ココス名張平尾店","ココス　ナバリヒラオテン","⑬ その他の食料・飲料販売業","","三重県名張市希央台２番町115","",34.625599,136.101755,"050-3529-9504","株式会社ココスジャパン","9010401054189","東京都港区港南２丁目１８番１号","","","","","","","届出","",""
"024000","fBiz00000916030000000171","三重県","津市","ココス桑名店","ココス　クワナテン","⑬ その他の食料・飲料販売業","","三重県桑名市大仲新田319-103","",35.082452,136.611848,"050-3529-1144","株式会社ココスジャパン","9010401054189","東京都港区港南２丁目１８番１号","","","","","","","届出","",""
"024000","fBiz00000916030000000200","三重県","津市","ココス志摩店","ココス　シマテン","⑬ その他の食料・飲料販売業","","三重県志摩市阿児町鵜方390-20","",34.344519,136.815181,"050-3456-8137","株式会社ココスジャパン","9010401054189","東京都港区港南２丁目１８番１号","","","","","","","届出","",""
"024000","fBiz00000916030000000400","三重県","津市","ココス鈴鹿中央店","ココススズカチュウオウテン","⑬ その他の食料・飲料販売業","","三重県鈴鹿市神戸3-14-7","",34.876318,136.584205,"050-3333-2242","株式会社ココスジャパン","9010401054189","東京都港区港南２丁目１８番１号","","","","","","","届出","",""
"024000","fBiz00000916030000000402","三重県","津市","ココス松阪朝日店","ココスマツザカアサヒテン","⑬ その他の食料・飲料販売業","","三重県松阪市朝日町一区16-16","",34.580475,136.537626,"050-3529-1254","株式会社ココスジャパン","9010401054189","東京都港区港南２丁目１８番１号","","","","","","","届出","",""
"024000","fBiz00000916030000000403","三重県","津市","ココス津垂水店","ココスツタルミテン","⑬ その他の食料・飲料販売業","","三重県津市津興字四ツ辻2930-5","",34.700244,136.509440,"050-3529-7862","株式会社ココスジャパン","9010401054189","東京都港区港南２丁目１８番１号","","","","","","","届出","",""
"024000","fBiz00000916030000000404","三重県","津市","ココス津上浜町店","ココスツカミハマチョウテン","⑬ その他の食料・飲料販売業","","三重県津市上浜町六丁目101-3","",34.740612,136.507313,"050-3529-4260","株式会社ココスジャパン","9010401054189","東京都港区港南２丁目１８番１号","","","","","","","届出","",""
"024000","fBiz00000916030000000405","三重県","津市","ココス玉城店","ココスタマキテン","⑬ その他の食料・飲料販売業","","三重県度会郡玉城町長更826番地","",34.510193,136.644022,"050-3493-3585","株式会社ココスジャパン","9010401054189","東京都港区港南２丁目１８番１号","","","","","","","届出","",""
"024000","fBiz00000916030000000506","三重県","津市","ココス　志摩店","ココス　シマテン","① 飲食店営業","飲食店営業（レストラン）","三重県志摩市阿児町鵜方390-20","",34.344519,136.815181,"0599657325","株式会社ココスジャパン","9010401054189","東京都港区港南２丁目１８番１号","志2101-0231",2022/01/18,2022/01/18,2022/02/01,2028/01/31,"","許可","",""
"024000","fBiz00000916030000000517","三重県","津市","","","① 飲食店営業","飲食店営業","","","","","","","","","津2101-0484",2022/04/01,2022/03/08,2022/04/01,2028/03/31,"","許可","",""
"024000","fBiz00000916940000000001","三重県","津市","","","⑭ 添加物製造・加工業（法第13 条第１項の規定により規格が定められた添加物の製造を除く。）","小分け、希釈、バニラ/トンカビーンズの加工・裁断","","","","","","","","","","","","","","","届出","",""
"024000","fBiz00000919470000000079","三重県","津市","","","① 魚介類販売業（包装済みの魚介類のみの販売）","","","","","","","","","","","","","","","","届出","",""
"024000","fBiz00000919470000000152","三重県","津市","","","① 魚介類販売業（包装済みの魚介類のみの販売）","","","","","","","","","","","","","","","","届出","",""
"024000","fBiz00000919470000000154","三重県","津市","","","① 魚介類販売業（包装済みの魚介類のみの販売）","","","","","","","","","","","","","","","","届出","",""
"024000","fBiz00000919470000000344","三重県","津市","","","① 魚介類販売業（包装済みの魚介類のみの販売）","","","","","","","","","","","","","","","","届出","",""
"024000","fBiz00000919470000000354","三重県","津市","","","① 魚介類販売業（包装済みの魚介類のみの販売）","","","","","","","","","","","","","","","","届出","",""
"024000","fBiz00000919470000000356","三重県","津市","","","① 魚介類販売業（包装済みの魚介類のみの販売）","","","","","","","","","","","","","","","","届出","",""
"024000","fBiz00000919470000000367","三重県","津市","","","① 魚介類販売業（包装済みの魚介類のみの販売）","","","","","","","","","","","","","","","","届出","",""
"024000","fBiz00000919470000000374","三重県","津市","","","① 魚介類販売業（包装済みの魚介類のみの販売）","","","","","","","","","","","","","","","","届出","",""
"024000","fBiz00000919470000000465","三重県","津市","","","① 魚介類販売業（包装済みの魚介類のみの販売）","","","","","","","","","","","","","","","","届出","",""
"024000","fBiz00000919470000000545","三重県","津市","","","① 魚介類販売業（包装済みの魚介類のみの販売）","","","","","","","","","","","","","","","","届出","",""
"024000","fBiz00000919470000000650","三重県","津市","","","① 飲食店営業","すし屋","","","","","","","","","賀2101-0275",2022/02/24,2022/02/24,2022/03/01,2028/02/29,"","許可","なし",""
"024000","fBiz00000919470000000692","三重県","津市","","","① 飲食店営業","すし屋","","","","","","","","","松2201-0060",2022/06/01,2022/05/16,2022/06/01,2028/05/31,"","許可","",""
"024000","fBiz00000938190000000001","三重県","津市","サラダ館夏見店","サラダカンナツミテン","⑬ その他の食料・飲料販売業","","三重県名張市夏見8-1","",34.617640,136.102991,"0595-62-2600","株式会社ヨネダ","7150001010019","奈良県宇陀郡曽爾村大字長野７３番地の２","","","","","","","届出","",""
"024000","fBiz00000945590000000028","三重県","津市","","","① 飲食店営業","","","","","","","","","","賀2201-0284",2022/12/09,2022/12/08,2022/12/09,2027/12/31,"","許可","",""
"024000","fBiz00000963210000000009","三重県","津市","","","⑫ 自動販売機による販売業（コップ式自動販売機（自動洗浄・屋内設置）及び営業許可の対象となる自動販売機を除く）","","","","","","","","","","","","","","","","届出","",""
"024000","fBiz00000970110000000001","三重県","津市","","","⑬ その他の食料・飲料販売業","","","","","","","","","","","","","","","","届出","",""
"024000","fBiz00000970110000000002","三重県","津市","","","⑬ その他の食料・飲料販売業","","","","","","","","","","","","","","","","届出","",""
"024000","fBiz00000974590000000069","三重県","津市","","","⑫ 自動販売機による販売業（コップ式自動販売機（自動洗浄・屋内設置）及び営業許可の対象となる自動販売機を除く）","","","","","","","","","","","","","","","","届出","",""
"024000","fBiz00000994550000000001","三重県","津市","名張市立蔵持小学校","ナバリシリツクラモチショウガッコウ","㉖ 集団給食施設","","三重県名張市蔵持町原出338","",34.636046,136.110769,"0595-63-0068","名張市","4000020242080","三重県名張市鴻之台１番町1","","","","","","","届出","",""
"024000","fBiz00000994550000000002","三重県","津市","名張市立薦原小学校","ナバリシリツコモハラショウガッコウ","㉖ 集団給食施設","","三重県名張市薦生1595","",34.652783,136.088631,"0595-63-2800","名張市","4000020242080","三重県名張市鴻之台１番町1","","","","","","","届出","",""
"024000","fBiz00000994550000000003","三重県","津市","名張市立比奈知小学校","ナバリシリツヒナチショウガッコウ","㉖ 集団給食施設","","三重県名張市下比奈知1422","",34.622554,136.130625,"0595-68-1104","名張市","4000020242080","三重県名張市鴻之台１番町1","","","","","","","届出","",""
"024000","fBiz00000994550000000004","三重県","津市","名張市立箕曲小学校","ナバリシリツミノワショウガッコウ","㉖ 集団給食施設","","三重県名張市夏見351","",34.612431,136.096908,"0595-63-1802","名張市","4000020242080","三重県名張市鴻之台１番町1","","","","","","","届出","",""
"024000","fBiz00000994550000000005","三重県","津市","名張市立錦生赤目小学校","ナバリシリツニシキオアカメショウガッコウ","㉖ 集団給食施設","","三重県名張市赤目町檀116","",34.597858,136.077178,"0595-63-1803","名張市","4000020242080","三重県名張市鴻之台１番町1","","","","","","","届出","",""
"024000","fBiz00000994550000000006","三重県","津市","名張市立桔梗が丘南小学校","ナバリシリツキキョウガオカミナミショウガッコウ","㉖ 集団給食施設","","三重県名張市桔梗が丘５番町12-38","",34.637359,136.124460,"0595-65-0339","名張市","4000020242080","三重県名張市鴻之台１番町1","","","","","","","届出","",""
"024000","fBiz00000994550000000007","三重県","津市","名張市立桔梗が丘東小学校","ナバリシリツキキョウガオカヒガシショウガッコウ","㉖ 集団給食施設","","三重県名張市桔梗が丘７番町1-86","",34.646066,136.129058,"0595-65-4800","名張市","4000020242080","三重県名張市鴻之台１番町1","","","","","","","届出","",""
"024000","fBiz00000994550000000008","三重県","津市","名張市立すずらん台小学校","ナバリシリツスズランダイショウガッコウ","㉖ 集団給食施設","","三重県名張市すずらん台東３番町219","",34.632968,136.161753,"0595-68-0555","名張市","4000020242080","三重県名張市鴻之台１番町1","","","","","","","届出","",""
"024000","fBiz00000995120000000001","三重県","津市","無印良品イオンモール津南","ムジルシリョウヒンイオンモールツミナミ","⑬ その他の食料・飲料販売業","","三重県津市高茶屋小森町145番地","イオンモール津南１F",34.671003,136.517916,"0592385907","株式会社良品計画","5013301012443","東京都豊島区豊島区4丁目26-3","","","","","","","届出","",""
"024000","fBiz00001000090000000010","三重県","津市","阪急ベーカリー＆カフェ　イオンタウン菰野店","ハンキュウベーカリーアンドカフェ　イオンタウンコモノテン","③ 乳類販売業","","三重県三重郡菰野町宿野字神明田357","イオンタウン菰野１階",37.749167,140.441063,"059-329-6257","株式会社阪急ベーカリー","5120001103306","大阪府大阪市北区角田町8-7","","","","","","","届出","",""
"024000","fBiz00001000320000000001","三重県","津市","株式会社ハローメディカル","カブシキガイシャハローメディカル","⑮ いわゆる健康食品の製造・加工業","調剤薬局","三重県伊賀市小田町256-1","",34.776171,136.127027,"0595410240","株式会社ハローメディカル","5190001026715","三重県伊賀市小田町２５６番地の１","","","","","","","届出","",""
"024000","fBiz00001001340000000001","三重県","津市","ウエルシア津久居中町店","ウエルシアツヒサイナカマチテン","⑪ 百貨店、総合スーパー","ドラッグストア","三重県津市久居中町263-1","",34.677608,136.468656,"059-254-1012","ウエルシア薬局株式会社","3030001002411","東京都千代田区外神田2-2-15","","","","","","","届出","",""
"024000","fBiz00001001340000000001","三重県","津市","ウエルシア津久居中町店","ウエルシアツヒサイナカマチテン","⑫ 自動販売機による販売業（コップ式自動販売機（自動洗浄・屋内設置）及び営業許可の対象となる自動販売機を除く）","ドラッグストア","三重県津市久居中町263-1","",34.677608,136.468656,"059-254-1012","ウエルシア薬局株式会社","3030001002411","東京都千代田区外神田2-2-15","","","","","","","届出","",""
"024000","fBiz00001003630000000001","三重県","津市","九鬼産業株式会社 竹成工場","クキサンギョウカブシキガイシャ タケナリコウジョウ","㉔ その他の食料品製造・加工業","","三重県三重郡菰野町竹成2232-3","",35.052394,136.512426,"","九鬼産業株式会社","7190001014718","三重県四日市市尾上町11番地","","","","","","","届出","",""
"024000","fBiz00001006360000000001","三重県","津市","無印良品イオンモール鈴鹿店","ムジルシリョウヒンイオンモールスズカテン","⑬ その他の食料・飲料販売業","","三重県鈴鹿市庄野羽山4-1-2","",34.871764,136.531607,"","株式会社良品計画","5013301012443","東京都豊島区東池袋4丁目26-3","","","","","","","届出","",""
"024000","fBiz00001008750000000001","三重県","津市","無印良品イオンモール桑名店","ムジルシリョウヒンイオンモールクワナテン","⑬ その他の食料・飲料販売業","","三重県桑名市新西方1-22","イオンモール桑名SC　1番街　アンク専門店　3F",35.072290,136.662491,"0594259301","株式会社良品計画","5013301012443","東京都豊島区東池袋4丁目26-3","","","","","","","届出","",""
"024000","fBiz00001013290000000157","三重県","津市","すき家　伊賀上野店","スキヤ　イガウエノテン","⑬ その他の食料・飲料販売業","","三重県伊賀市平野中川原484-1","",34.774815,136.129889,"","株式会社すき家","2010401093920","東京都港区港南２丁目１８番１号","","","","","","","届出","",""
"024000","fBiz00001013290000000158","三重県","津市","すき家　165号名張蔵持店","スキヤ　ヒャクロクジュウゴゴウナバリクラモチテン","⑬ その他の食料・飲料販売業","","三重県名張市蔵持町原出778-1","",34.635663,136.116479,"","株式会社すき家","2010401093920","東京都港区港南２丁目１８番１号","","","","","","","届出","",""
"024000","fBiz00001013290000000159","三重県","津市","すき家　23号伊勢店","スキヤ　ニジュウサンゴウイセテン","⑬ その他の食料・飲料販売業","","三重県伊勢市小木町699-1","",34.508454,136.723614,"","株式会社すき家","2010401093920","東京都港区港南２丁目１８番１号","","","","","","","届出","",""
"024000","fBiz00001013290000000160","三重県","津市","すき家　伊勢上地店","スキヤ　イセウエジテン","⑬ その他の食料・飲料販売業","","三重県伊勢市上地町3112-3","",34.502078,136.658106,"","株式会社すき家","2010401093920","東京都港区港南２丁目１８番１号","","","","","","","届出","",""
"024000","fBiz00001013290000000161","三重県","津市","すき家　167号志摩鵜方店","スキヤ　ヒャクロクジュウナナゴウシマウガタテン","⑬ その他の食料・飲料販売業","","三重県志摩市阿児町鵜方4869","",34.329487,136.820768,"","株式会社すき家","2010401093920","東京都港区港南２丁目１８番１号","","","","","","","届出","",""
