"028202","fBiz00001093530000000019","兵庫県","尼崎市","セブン‐イレブンキヨスクＪＲ猪名寺駅改札口店","セブンイレブンキヨスクジェイアールイナデラエキカイサツグチテン","⑩ コンビニエンスストア","","兵庫県尼崎市猪名寺２丁目１番１号","",34.763775,135.422797,"06-4960-8380","株式会社ジェイアール西日本デイリーサービスネット","6140001055008","兵庫県尼崎市潮江１丁目２番１２号","","","","","","","届出","",""
"028202","fBiz00001093530000000021","兵庫県","尼崎市","セブン‐イレブンハートインＪＲ立花駅北口店","セブンイレブンハートインジェイアールタチバナエキキタグチテン","⑩ コンビニエンスストア","","兵庫県尼崎市立花町１丁目１番１号","",34.738055,135.399487,"06-6428-8510","株式会社ジェイアール西日本デイリーサービスネット","6140001055008","兵庫県尼崎市潮江１丁目２番１２号","","","","","","","届出","",""
"028202","fBiz00001106020000000132","兵庫県","尼崎市","ケンタッキー・フライド・チキンつかしん","ケンタッキー・フライド・チキンツカシン","⑬ その他の食料・飲料販売業","飲食業","兵庫県尼崎市塚口本町４－８－１","",34.761767,135.419519,"06-4961-5772","日本ケンタッキー・フライド・チキン株式会社","9011001095004","神奈川県横浜市西区みなとみらい4-4-5","","","","","","","届出","",""
"028202","fBiz00001106020000000145","兵庫県","尼崎市","ケンタッキー・フライド・チキン尼崎西店","ケンタッキー・フライド・チキンアマガサキニシテン","① 飲食店営業","飲食業","兵庫県尼崎市浜田町５－７８","",34.726611,135.397718,"06-6414-2475","日本ケンタッキー・フライド・チキン株式会社","9011001095004","神奈川県横浜市西区みなとみらい4-4-5","第１－０１６７１号",2022/10/11,2022/10/11,2022/10/11,2029/11/30,"","許可","　",""
"028202","fBiz00001106020000000145","兵庫県","尼崎市","ケンタッキー・フライド・チキン尼崎西","ケンタッキー・フライド・チキンアマガサキニシ","⑬ その他の食料・飲料販売業","飲食業","兵庫県尼崎市浜田町５－７８","",34.726611,135.397718,"06-6414-2475","日本ケンタッキー・フライド・チキン株式会社","9011001095004","神奈川県横浜市西区みなとみらい4-4-5","","","","","","","届出","",""
"028202","fBiz00001114720000000001","兵庫県","尼崎市","","","⑬ その他の食料・飲料販売業","飲食店","","","","","","","","","","","","","","","届出","",""
"028202","fBiz00001141550000000007","兵庫県","尼崎市","すし酒場　さしす","スシサカバサシス","① 飲食店営業","寿司屋","兵庫県尼崎市南塚口町2丁目1-3-105号室","ソコラ塚口",34.752065,135.415244,"06-6422-7700","株式会社ＪＯＵ　ＪＯＵ","9120001144404","大阪府大阪市中央区安土町２丁目５番５号","尼崎市指令（生）第１-01912号（04）",2022/11/22,2022/11/22,2022/11/22,2028/11/30,"","許可","　",""
"028202","fBiz00001151700000000030","兵庫県","尼崎市","高級「生」食パン  乃が美 SOCOLA塚口クロス販売店","コウキュウナマショクパンノガミソコラツカグチハンバイテン","⑬ その他の食料・飲料販売業","","兵庫県尼崎市南塚口町二丁目1番3号","SOCOLA塚口クロス",34.752065,135.415244,"","株式会社乃が美","1120001221796","大阪府大阪市西区靱本町一丁目６番１０号","","","","","","","届出","",""
"028202","fBiz00001152180000000004","兵庫県","尼崎市","東洋精機株式会社","トウヨウセイキカブシキガイシャ","① 飲食店営業","","兵庫県尼崎市長洲本通１－１４－３７","",34.727327,135.432329,"","マインフーズサービス株式会社","8140001051252","兵庫県尼崎市三反田町2丁目20-9","尼崎市指令（生）第1-02127号",2022/01/26,2022/01/26,2022/01/26,2029/02/28,"","許可","　",""
"028202","fBiz00001159590000001862","兵庫県","尼崎市","","","⑫ 自動販売機による販売業（コップ式自動販売機（自動洗浄・屋内設置）及び営業許可の対象となる自動販売機を除く）","","","","","","","","","","","","","","","","届出","",""
"028202","fBiz00001159590000001863","兵庫県","尼崎市","","","⑫ 自動販売機による販売業（コップ式自動販売機（自動洗浄・屋内設置）及び営業許可の対象となる自動販売機を除く）","","","","","","","","","","","","","","","","届出","",""
"028202","fBiz00001159590000001864","兵庫県","尼崎市","","","⑫ 自動販売機による販売業（コップ式自動販売機（自動洗浄・屋内設置）及び営業許可の対象となる自動販売機を除く）","","","","","","","","","","","","","","","","届出","",""
"028202","fBiz00001159590000001882","兵庫県","尼崎市","","","⑫ 自動販売機による販売業（コップ式自動販売機（自動洗浄・屋内設置）及び営業許可の対象となる自動販売機を除く）","","","","","","","","","","","","","","","","届出","",""
"028202","fBiz00001159590000001883","兵庫県","尼崎市","","","⑫ 自動販売機による販売業（コップ式自動販売機（自動洗浄・屋内設置）及び営業許可の対象となる自動販売機を除く）","","","","","","","","","","","","","","","","届出","",""
"028202","fBiz00001159590000001884","兵庫県","尼崎市","","","⑫ 自動販売機による販売業（コップ式自動販売機（自動洗浄・屋内設置）及び営業許可の対象となる自動販売機を除く）","","","","","","","","","","","","","","","","届出","",""
"028202","fBiz00001159590000001984","兵庫県","尼崎市","","","⑫ 自動販売機による販売業（コップ式自動販売機（自動洗浄・屋内設置）及び営業許可の対象となる自動販売機を除く）","","","","","","","","","","","","","","","","届出","",""
"028202","fBiz00001216070000000007","兵庫県","尼崎市","スパイス日和","スパイスビヨリ","① 飲食店営業","キッチンカー","","","","","","","","","尼崎市指令（生）第1-01628号(04)",2022/09/26,2022/09/26,2022/09/26,2027/11/30,"","許可","営業品目は、2工程程度までの加熱調理品、飲料の小分け・調製、アイスクリーム類の小分け及びかき氷に限ります。",""
"028202","fBiz00001263260000000001","兵庫県","尼崎市","ウエルシア尼崎御園店","ウエルシアアマガサキミソノテン","⑪ 百貨店、総合スーパー","ドラッグストア","兵庫県尼崎市御園3丁目18-20","",34.751471,135.432705,"06-6495-4338","ウエルシア薬局株式会社","3030001002411","東京都千代田区外神田二丁目２番１５号","","","","","","","届出","",""
"028202","fBiz00001273730000000001","兵庫県","尼崎市","無印良品あまがさきキューズモール","ムジルシリョウヒンアマガサキキューズモール","⑬ その他の食料・飲料販売業","","兵庫県尼崎市潮江1-3-1","あまがさきキューズモール3階",34.733707,135.430726,"0664703287","株式会社良品計画","5013301012443","東京都豊島区東池袋4丁目26-3","","","","","","","届出","",""
"028202","fBiz00001275270000000002","兵庫県","尼崎市","髙山堂　武庫之荘店","タカヤマドウ　ムコノソウテン","⑫ 自動販売機による販売業（コップ式自動販売機（自動洗浄・屋内設置）及び営業許可の対象となる自動販売機を除く）","和菓子の販売","兵庫県尼崎市武庫之荘本町3丁目11-22","",34.760013,135.398651,"06-6436-7503","株式会社高山堂","9140001069392","兵庫県西宮市門前町１番１４号","","","","","","","届出","",""
"028202","fBiz00001284900000000001","兵庫県","尼崎市","無印良品つかしん","ムジルシリョウヒンツカシン","⑬ その他の食料・飲料販売業","","兵庫県尼崎市塚口本町4-8-1","つかしんひがしまち南館４階",34.761717,135.419654,"0649615202","株式会社良品計画","5013301012443","東京都豊島区東池袋4丁目26-3","","","","","","","届出","",""
"028202","fBiz00001287220000000452","兵庫県","尼崎市","サイゼリヤ　尼崎つかしん店","サイゼリヤ　アマガサキツカシンテン","⑬ その他の食料・飲料販売業","","兵庫県尼崎市塚口本町4-8-1","ｸﾞﾝｾﾞﾀｳﾝｾﾝﾀｰつかしんにしまち1F",34.761717,135.419654,"06-4961-5571","株式会社サイゼリヤ","8030001065552","埼玉県吉川市旭2番地5","","","","","","","届出","",""
"028202","fBiz00001287220000000453","兵庫県","尼崎市","サイゼリヤ　尼崎立花店","サイゼリヤ　アマガサキタチバナテン","⑬ その他の食料・飲料販売業","","兵庫県尼崎市上ノ島町3-28-38","",34.744558,135.402696,"06-6424-6077","株式会社サイゼリヤ","8030001065552","埼玉県吉川市旭2番地5","","","","","","","届出","",""
"028202","fBiz00001287220000000454","兵庫県","尼崎市","サイゼリヤ　尼崎下坂部店","サイゼリヤ　アマガサキシモサカベテン","⑬ その他の食料・飲料販売業","","兵庫県尼崎市下坂部3-2-30","",34.741950,135.439395,"06-6495-3451","株式会社サイゼリヤ","8030001065552","埼玉県吉川市旭2番地5","","","","","","","届出","",""
"028202","fBiz00001287220000000456","兵庫県","尼崎市","サイゼリヤ　JR尼崎駅前店","サイゼリヤ　ジェイアールアマガサキエキマエテン","⑬ その他の食料・飲料販売業","","兵庫県尼崎市潮江1-4-5","ｱﾐﾝｸﾞ潮江ﾌﾟﾗｽﾄいきいき3F",34.733471,135.432983,"06-6496-5011","株式会社サイゼリヤ","8030001065552","埼玉県吉川市旭2番地5","","","","","","","届出","",""
"028202","fBiz00001287220000000457","兵庫県","尼崎市","サイゼリヤ　阪神尼崎駅北口店","サイゼリヤ　ハンシンアマガサキエキキタグチテン","⑬ その他の食料・飲料販売業","","兵庫県尼崎市神田北通1-3-1F","",34.719921,135.417572,"06-6430-5125","株式会社サイゼリヤ","8030001065552","埼玉県吉川市旭2番地5","","","","","","","届出","",""
"028202","fBiz00001287220000001122","兵庫県","尼崎市","サイゼリヤ　ビエラ塚口店","サイゼリヤ　ビエラツカグチテン","⑬ その他の食料・飲料販売業","","兵庫県尼崎市上坂部1-1-1","ﾋﾞｴﾗ塚口1F",34.750260,135.425720,"06-6495-1288","株式会社サイゼリヤ","8030001065552","埼玉県吉川市旭2番地5","","","","","","","届出","",""
"028202","fBiz00001302320000000063","兵庫県","尼崎市","","","⑬ その他の食料・飲料販売業","販売","","","","","","","","","","","","","","","届出","",""
"028202","fBiz00001302320000000064","兵庫県","尼崎市","","","⑬ その他の食料・飲料販売業","販売","","","","","","","","","","","","","","","届出","",""
"028202","fBiz00001302320000000065","兵庫県","尼崎市","","","⑬ その他の食料・飲料販売業","販売","","","","","","","","","","","","","","","届出","",""
"028202","fBiz00001302320000000066","兵庫県","尼崎市","","","⑬ その他の食料・飲料販売業","販売","","","","","","","","","","","","","","","届出","",""
"028202","fBiz00001302320000000067","兵庫県","尼崎市","","","⑬ その他の食料・飲料販売業","販売","","","","","","","","","","","","","","","届出","",""
"028202","fBiz00001302320000000068","兵庫県","尼崎市","","","⑬ その他の食料・飲料販売業","販売","","","","","","","","","","","","","","","届出","",""
"028202","fBiz00001302320000000069","兵庫県","尼崎市","","","⑬ その他の食料・飲料販売業","販売","","","","","","","","","","","","","","","届出","",""
"028202","fBiz00001309070000000001","兵庫県","尼崎市","","","⑬ その他の食料・飲料販売業","","","","","","","","","","","","","","","","届出","",""
"028202","fBiz00001313510000000006","兵庫県","尼崎市","株式会社マツヰ酒店","カブシキガイシャ　マツイサケテン","⑬ その他の食料・飲料販売業","","兵庫県尼崎市常松1丁目９－２６","",34.764881,135.381422,"0664326888","株式会社マツヰ酒店","3140001051298","兵庫県尼崎市常松１丁目９番２６号","","","","","","","届出","",""
"028202","fBiz00001342860000000003","兵庫県","尼崎市","ローゲンマイヤー塚口店","ローゲンマイヤーツカグチテン","⑪ 菓子製造業","","兵庫県尼崎市塚口町1丁目2-5","",34.753099,135.415298,"0664223918","株式会社ローゲンマイヤー","1140001023142","兵庫県芦屋市船戸町2-1","尼崎市指令（生）第1-01495号(05)",1999/07/15,2023/08/28,2023/08/28,2029/08/31,"","許可","",""
"028202","fBiz00001342860000000003","兵庫県","尼崎市","ローゲンマイヤー塚口店","ローゲンマイヤーツカグチテン","③ 乳類販売業","","兵庫県尼崎市塚口町1丁目2-5","",34.753099,135.415298,"0664223918","株式会社ローゲンマイヤー","1140001023142","兵庫県芦屋市船戸町2-1","","","","","","","届出","",""
"028202","fBiz00001342860000000004","兵庫県","尼崎市","ローゲンマイヤー尼崎店","ローゲンマイヤーアマガサキテン","⑪ 菓子製造業","","兵庫県尼崎市尾浜町２丁目32-19","",34.739140,135.418047,"0664224800","株式会社ローゲンマイヤー","1140001023142","兵庫県芦屋市船戸町2-1","尼崎市指令（生）第1-01524(05)号",2005/07/12,2023/08/31,2023/08/31,2029/08/31,"","許可","",""
"028202","fBiz00001342860000000004","兵庫県","尼崎市","ローゲンマイヤー尼崎店","ローゲンマイヤーアマガサキテン","③ 乳類販売業","","兵庫県尼崎市尾浜町２丁目32-19","",34.739140,135.418047,"0664224800","株式会社ローゲンマイヤー","1140001023142","兵庫県芦屋市船戸町2-1","","","","","","","届出","",""
"028202","fBiz00001367280000000004","兵庫県","尼崎市","ヤクルト大物駅前ステーション","ヤクルトダイモツエキマエステーション","③ 乳類販売業","","兵庫県尼崎市南城内1","レボンヌ尼崎1Ｆ",34.714338,135.422570,"06-6481-8381","南大阪ヤクルト販売株式会社","1120001004383","大阪府大阪市西成区岸里東1-8-24","","","","","","","届出","",""
"028202","fBiz00001373820000000220","兵庫県","尼崎市","ドラッグコスモス長洲本通店","ドラッグコスモスナガスホンドオリテン","⑪ 百貨店、総合スーパー","ドラッグストア","兵庫県尼崎市長洲本通１丁目１４－２０","",34.727749,135.432224,"06-4868-8777","株式会社コスモス薬品","9290001025414","福岡県福岡市博多区博多駅東２丁目１０番１号第一福岡ビルＳ館４階","","","","","","","届出","",""
"028202","fBiz00001373820000000221","兵庫県","尼崎市","ドラッグコスモス南武庫之荘店","ドラッグコスモスミナミムコノソウテン","⑪ 百貨店、総合スーパー","ドラッグストア","兵庫県尼崎市南武庫之荘１２丁目１４－５３","",34.740716,135.383791,"06-6439-1415","株式会社コスモス薬品","9290001025414","福岡県福岡市博多区博多駅東２丁目１０番１号第一福岡ビルＳ館４階","","","","","","","届出","",""
"028202","fBiz00001373820000000222","兵庫県","尼崎市","ドラッグコスモス大庄西町店","ドラッグコスモスオオショウニシマチテン","⑪ 百貨店、総合スーパー","ドラッグストア","兵庫県尼崎市大庄西町４丁目４-21","",34.718039,135.389962,"06-4869-6488","株式会社コスモス薬品","9290001025414","福岡県福岡市博多区博多駅東２丁目１０番１号第一福岡ビルＳ館４階","","","","","","","届出","",""
"028202","fBiz00001407920000000009","兵庫県","尼崎市","びっくりドンキー尼崎西店","ビックリドンキーアマガサキニシテン","⑬ その他の食料・飲料販売業","レストラン","兵庫県尼崎市水堂町4-2-13","",34.739670,135.386904,"","ワイ・テイ・ワイ産業（株）","3120101008002","大阪府堺市堺区市之町西2-1-15","","","","","","","届出","",""
"028202","fBiz00001407920000000015","兵庫県","尼崎市","びっくりドンキー尼崎昭和通店","ビックリドンキーアマガサキショウワトオリテン","⑬ その他の食料・飲料販売業","レストラン","兵庫県尼崎市昭和通7-247-1","",34.722962,135.407822,"","ワイ・テイ・ワイ産業（株）","3120101008002","大阪府堺市堺区市之町西2-1-15","","","","","","","届出","",""
"028202","fBiz00001429460000000001","兵庫県","尼崎市","株式会社阪本漢法製薬","カブシキガイシャサカモトカンポウセイヤク","⑮ いわゆる健康食品の製造・加工業","製造業","兵庫県尼崎市名神町1-5-12","",34.741382,135.420389,"0664242721","株式会社阪本漢法製薬","4120001064111","兵庫県尼崎市名神町1-5-12","","","","","","","届出","",""
"028202","fBiz00001430700000000001","兵庫県","尼崎市","デイサービス瓦宮ガーデンクラブ","デイサービスカワラノミヤガーデンクラブ","㉖ 集団給食施設","","兵庫県尼崎市瓦宮2-22-19","",34.752761,135.439329,"","杉原サポート株式会社","2140001092186","兵庫県尼崎市瓦宮2-22-19","","","","","","","届出","",""
"028202","fBiz00001445140000000076","兵庫県","尼崎市","松のや　武庫之荘店","マツノヤ　ムコノソウテン","① 飲食店営業","とんかつ屋","兵庫県尼崎市南武庫之荘1-14-1","森陽ビル1F",34.750731,135.393085,"080-6856-3549","株式会社松屋フーズ","8012401033917","東京都武蔵野市中町一丁目14番5号","尼崎市指令（生）第1-01939号（04）",2022/11/29,2022/11/29,2022/11/29,2028/11/30,"","許可","　",""
"028202","fBiz00001463810000000006","兵庫県","尼崎市","株式会社クボタケミックス","クボタケミックス","㉗ 器具、容器包装の製造・加工業（合成樹脂が使用された器具又は容器包装の製造、加工に限る。）","","兵庫県尼崎市平左衛門町13","",34.694527,135.375678,"0664305165","株式会社クボタケミックス","4120101022051","大阪府堺市西区石津西町１４番２号","","","","","","","届出","",""
"028202","fBiz00001489740000000001","兵庫県","尼崎市","ミスタードーナツあまがさきキューズモールショップ","ミスタードーナツアマガサキキューズモールショップ","㉔ その他の食料品製造・加工業","菓子製造業・飲食店営業","兵庫県尼崎市潮江１丁目３番１号","あまがさきキューズモール１F",34.733707,135.430726,"0664703277","株式会社ヤマヨフーズ","8120001071442","大阪府大阪市北区堂島１丁目2-10第二堂栄ビル302","","","","","","","届出","",""
"028202","fBiz00001489740000000006","兵庫県","尼崎市","ミスタードーナツあまがさきキューズモールショップ","ミスタードーナツアマガサキキューズモールショップ","㉔ その他の食料品製造・加工業","菓子製造業・飲食店営業","兵庫県尼崎市潮江１丁目３番１号","あまがさきキューズモール１F",34.733707,135.430726,"0664703277","株式会社ヤマヨフーズ","8120001071442","大阪府大阪市北区堂島１丁目2-10第二堂栄ビル302","","","","","","","届出","",""
"028202","fBiz00001510220000000005","兵庫県","尼崎市","ミャムミャム　つかしん店","ミャムミャムツカシンテン","⑬ その他の食料・飲料販売業","洋菓子の販売　カフェ","兵庫県尼崎市尼崎市塚口本町4-8-1","グンゼタウンセンターつかしん　ひがしまち南館１階",34.761767,135.419519,"06-6428-4177","株式会社ミャムミャム","9140001084466","兵庫県伊丹市東有岡１丁目３１番地　パレ伊丹ファインステイ1002","","","","","","","届出","",""
"028202","fBiz00001518550000000033","兵庫県","尼崎市","","","⑬ その他の食料・飲料販売業","移動販売業","","","","","","","","","","","","","","","届出","",""
"028202","fBiz00001526930000000059","兵庫県","尼崎市","エム・オー・エー商事　尼崎店","エムオーエーショウジ　アマガサキテン","⑬ その他の食料・飲料販売業","","兵庫県尼崎市七松町1-20-30","",34.734036,135.398651,"0664122604","株式会社エム・オー・エー商事","6080101012600","静岡県熱海市田原本町9番1号","","","","","","","届出","",""
"028202","fBiz00001529550000000127","兵庫県","尼崎市","すき家　南武庫之荘店","スキヤ　ミナミムコノソウテン","① 飲食店営業","牛丼屋","兵庫県尼崎市南武庫之荘4-19-10","",34.745037,135.387776,"050-3771-2222","株式会社すき家","2010401093920","東京都港区港南２丁目１８番１号","尼崎市指令（生）第1-01739号(05)",1999/10/04,2023/11/06,2023/11/06,2029/11/30,"","許可","　",""
"028202","fBiz00001529550000000127","兵庫県","尼崎市","すき家　南武庫之荘店","スキヤ　ミナミムコノソウテン","⑬ その他の食料・飲料販売業","","兵庫県尼崎市南武庫之荘4-19-10","",34.745042,135.387763,"","株式会社すき家","2010401093920","東京都港区港南２丁目１８番１号","","","","","","","届出","",""
"028202","fBiz00001529550000000129","兵庫県","尼崎市","すき家　南塚口七丁目店","スキヤ　ミナミツカグチナナチョウメテン","⑬ その他の食料・飲料販売業","","兵庫県尼崎市南塚口町7-6-19","",34.746037,135.412053,"","株式会社すき家","2010401093920","東京都港区港南２丁目１８番１号","","","","","","","届出","",""
"028202","fBiz00001529550000000132","兵庫県","尼崎市","すき家　東園田店","スキヤ　ヒガシソノダテン","⑬ その他の食料・飲料販売業","","兵庫県尼崎市東園田町4-63-1","",34.754847,135.446421,"","株式会社すき家","2010401093920","東京都港区港南２丁目１８番１号","","","","","","","届出","",""
"028202","fBiz00001529550000000135","兵庫県","尼崎市","すき家　尼崎浜田店","スキヤ　アマガサキハマダテン","⑬ その他の食料・飲料販売業","","兵庫県尼崎市浜田町4-41-1","",34.729390,135.399220,"","株式会社すき家","2010401093920","東京都港区港南２丁目１８番１号","","","","","","","届出","",""
"028202","fBiz00001529550000000138","兵庫県","尼崎市","すき家　阪急園田駅前店","スキヤ　ハンキュウソノダエキマエテン","⑬ その他の食料・飲料販売業","","兵庫県尼崎市東園田町9-17-16","ﾒｿﾞﾝ･ﾄﾞｩ･ﾌｧﾐﾘ‐1階",34.751978,135.447364,"","株式会社すき家","2010401093920","東京都港区港南２丁目１８番１号","","","","","","","届出","",""
"028202","fBiz00001529550000000140","兵庫県","尼崎市","すき家　JR尼崎駅北口店","スキヤ　ジェイアールアマガサキエキキタグチテン","⑬ その他の食料・飲料販売業","","兵庫県尼崎市潮江1-3-43","",34.734488,135.431568,"","株式会社すき家","2010401093920","東京都港区港南２丁目１８番１号","","","","","","","届出","",""
"028202","fBiz00001529550000000142","兵庫県","尼崎市","すき家　2国尼崎杭瀬店","スキヤ　ニコクアマガサキクイセテン","⑬ その他の食料・飲料販売業","","兵庫県尼崎市杭瀬北新町3-2-18","",34.719833,135.434453,"","株式会社すき家","2010401093920","東京都港区港南２丁目１８番１号","","","","","","","届出","",""
"028202","fBiz00001530460000000001","兵庫県","尼崎市","尼崎製罐株式会社　武庫川工場","アマガサキセイカンカブシキガイシャ　ムコガワコウジョウ","㉗ 器具、容器包装の製造・加工業（合成樹脂が使用された器具又は容器包装の製造、加工に限る。）","","兵庫県尼崎市大島1-41-1","",34.727315,135.385113,"","尼崎製罐株式会社","8140001047300","兵庫県尼崎市大島1-41-1","","","","","","","届出","",""
"028202","fBiz00001557900000000001","兵庫県","尼崎市","","","⑬ その他の食料・飲料販売業","飲食業","","","","","","","","","","","","","","","届出","",""
"028202","fBiz00001572870000000002","兵庫県","尼崎市","くるみ保育園","クルミホイクエン","㉖ 集団給食施設","保育所","兵庫県尼崎市尾浜町1-33-2","",34.738926,135.414334,"06-6427-9794","社会福祉法人桜谷福祉会","7140005007607","兵庫県赤穂市新田1444","","","","","","","届出","",""
"028202","fBiz00001647320000000001","兵庫県","尼崎市","","","㉖ 集団給食施設","","","","","","","","","","","","","","","","届出","",""
"028202","fBiz00001658910000000001","兵庫県","尼崎市","ｒｉｃｃｏ園田保育園","リッコソノダホイクエン","㉖ 集団給食施設","保育所","兵庫県尼崎市東園田町8丁目111番地9号","",34.750236,135.449997,"0664971515","社会福祉法人ウィステリア","2140005023187","兵庫県明石市大久保町谷八木1313番地","","","","","","","届出","",""
