"自治体コード","行番号","都道府県名","市区町村名","営業施設名称、屋号又は商号","営業施設名称、屋号又は商号（フリガナ）","営業の種類","業態","営業施設所在地","営業施設方書","緯度","経度","営業施設電話番号","法人名","法人番号","法人住所","許可番号","初回許可年月日","許可年月日","許可開始日","許可満了日","廃業年月日","申請区分","許可条件","備考"
"034202","fBiz00000114120000000039","広島県","呉市","スーパードラッグひまわり焼山店","スーパードラッグヒマワリヤケヤマテン","⑬ その他の食料・飲料販売業","","広島県呉市焼山西3丁目5番5号","",34.294793,132.553220,"0823-30-5380","株式会社ププレひまわり","7240001032020","広島県福山市西新涯町二丁目10番11号","","","","","","","届出","",""
"034202","fBiz00000114120000000059","広島県","呉市","スーパードラッグひまわり広店","スーパードラッグヒマワリヒロテン","⑬ その他の食料・飲料販売業","","広島県呉市広古新開7丁目25番7号","",34.240685,132.617288,"0823-27-7610","株式会社ププレひまわり","7240001032020","広島県福山市西新涯町二丁目10番11号","","","","","","","届出","",""
"034202","fBiz00000114120000000066","広島県","呉市","スーパードラッグひまわり広中央店","スーパードラッグヒマワリヒロチュウオウテン","⑬ その他の食料・飲料販売業","","広島県呉市広中町1-25","",34.228057,132.630766,"0823-27-3881","株式会社ププレひまわり","7240001032020","広島県福山市西新涯町二丁目10番11号","","","","","","","届出","",""
"034202","fBiz00000114120000000067","広島県","呉市","スーパードラッグひまわり呉築地店","スーパードラッグヒマワリクレツキジテン","⑬ その他の食料・飲料販売業","","広島県呉市築地町2-54","",34.243545,132.548042,"0823-27-5780","株式会社ププレひまわり","7240001032020","広島県福山市西新涯町二丁目10番11号","","","","","","","届出","",""
"034202","fBiz00000114540000000044","広島県","呉市","くすりのレデイ　広古新開店","クスリノレデイ　ヒロコシンガイテン","⑬ その他の食料・飲料販売業","","広島県呉市広古新開三丁目5番33号","",34.236820,132.613886,"0823-27-3663","株式会社レデイ薬局","1500001004428","愛媛県松山市南江戸4丁目3-37","","","","","","","届出","",""
"034202","fBiz00000115920000000124","広島県","呉市","カルディコーヒーファーム　ゆめタウン呉店","カルディコーヒーファーム　ユメタウンクレテン","③ 乳類販売業","食品販売","広島県呉市宝町5-10　","ゆめタウン呉　1Ｆ",34.242161,132.556296,"0823-32-5080","株式会社キャメル珈琲","6010901003292","東京都世田谷区代田2-31-8","","","","","","","届出","",""
"034202","fBiz00000115920000000124","広島県","呉市","カルディコーヒーファーム　ゆめタウン呉店","カルディコーヒーファーム　ユメタウンクレテン","⑬ その他の食料・飲料販売業","食品販売","広島県呉市宝町5-10　","ゆめタウン呉　1Ｆ",34.242161,132.556296,"0823-32-5080","株式会社キャメル珈琲","6010901003292","東京都世田谷区代田2-31-8","","","","","","","届出","",""
"034202","fBiz00000129180000000017","広島県","呉市","ダイソー　呉広店","ダイソー　クレヒロテン","⑬ その他の食料・飲料販売業","小売業","広島県呉市広古新開６－９－４","",34.238508,132.618778,"","株式会社大創産業","7240001022681","広島県東広島市西条吉行東一丁目４番１４号","","","","","","","届出","",""
"034202","fBiz00000129180000000018","広島県","呉市","ダイソー　広駅前店","ダイソー　ヒロエキマエテン","⑬ その他の食料・飲料販売業","小売業","広島県呉市広駅前２丁目８－３８","",34.228855,132.631706,"","株式会社大創産業","7240001022681","広島県東広島市西条吉行東一丁目４番１４号","","","","","","","届出","",""
"034202","fBiz00000129180000000260","広島県","呉市","ダイソー　クレアル店","ダイソー　クレアルテン","⑬ その他の食料・飲料販売業","小売業","広島県呉市中通３丁目２－１８","クレアル店　４階、５階",34.245622,132.564920,"","株式会社大創産業","7240001022681","広島県東広島市西条吉行東一丁目４番１４号","","","","","","","届出","",""
"034202","fBiz00000129180000000471","広島県","呉市","ダイソー　呉レクレ店","ダイソー　クレレクレテン","⑬ その他の食料・飲料販売業","","広島県呉市宝町２番５０号","レクレビル２階",34.244288,132.557110,"","株式会社大創産業","7240001022681","広島県東広島市西条吉行東一丁目４番１４号","","","","","","","届出","",""
"034202","fBiz00000129180000001701","広島県","呉市","ダイソー　呉宮原店","ダイソー　クレミヤハラテン","⑬ その他の食料・飲料販売業","","広島県呉市坪ノ内町３－５","",34.222807,132.553202,"","株式会社大創産業","7240001022681","広島県東広島市西条吉行東一丁目４番１４号","","","","","","","届出","",""
"034202","fBiz00000135490000000225","広島県","呉市","ファミリーマート呉中通三丁目","ファミリーマートクレナカドオリサンチョウメ","① 飲食店営業","コンビニエンスストア","広島県呉市中通3丁目1－30","",34.245804,132.563782,"0823-32-0123","株式会社ファミリーマート","2013301010706","東京都港区芝浦３丁目１番２１号 ","20213076",2021/08/26,2021/08/26,2021/08/26,2026/08/31,"","許可"," ",""
"034202","fBiz00000135490000000225","広島県","呉市","ファミリーマート呉中通三丁目","ファミリーマートクレナカドオリサンチョウメ","⑩ コンビニエンスストア","コンビニエンスストア","広島県呉市中通3丁目1－30","",34.245804,132.563782,"0823-32-0123","株式会社ファミリーマート","2013301010706","東京都港区芝浦３丁目１番２１号 ","","","","","","","届出","",""
"034202","fBiz00000138470000000282","広島県","呉市","ダイレックス焼山店","ダイレックスヤケヤマテン","⑪ 百貨店、総合スーパー","ﾃﾞｨｽｶｳﾝﾄｽﾄｱ","広島県呉市焼山中央1丁目12番15号","",34.294990,132.555173,"0823-27-3707","ダイレックス株式会社","6300001004245","佐賀県佐賀市高木瀬町大字長瀬９３０番地","","","","","","","届出","",""
"034202","fBiz00000146310000000952","広島県","呉市","スターバックスコーヒーゆめタウン呉店","スターバックスコーヒーユメタウンクレテン","⑬ その他の食料・飲料販売業","喫茶店","広島県呉市宝町5番10号","ゆめタウン呉1F",34.242161,132.556296,"0823-32-5370","スターバックスコーヒージャパン株式会社","7011001031943","東京都品川区上大崎2-25-2","","","","","","","届出","",""
"034202","fBiz00000147300000000001","広島県","呉市","","","⑬ その他の食料・飲料販売業","","","","","","","","","","","","","","","","届出","",""
"034202","fBiz00000157870000000033","広島県","呉市","エブリイ呉海岸店","エブリイクレカイガンテン","⑪ 百貨店、総合スーパー","","広島県呉市海岸4丁目18-17","",34.246674,132.538870,"0823367890","株式会社エブリイ","2240001047246","広島県福山市南蔵王町１丁目６番１１号","","","","","","","届出","",""
"034202","fBiz00000157870000000034","広島県","呉市","エブリイ焼山店","エブリイヤケヤマテン","⑪ 百貨店、総合スーパー","","広島県呉市焼山西3丁目5-4","",34.294740,132.552741,"0823690505","株式会社エブリイ","2240001047246","広島県福山市南蔵王町１丁目６番１１号","","","","","","","届出","",""
"034202","fBiz00000157870000000087","広島県","呉市","エブリイ　呉宮原店","エブリイ　クレミヤハラテン","⑪ 百貨店、総合スーパー","","広島県呉市宮原13丁目3‐17","",34.220439,132.552788,"0823-36-3211","株式会社エブリイ","2240001047246","広島県福山市南蔵王町１丁目６番１１号","","","","","","","届出","",""
"034202","fBiz00000158170000000260","広島県","呉市","かっぱ寿司　広島呉店","カッパズシ　ヒロシマクレテン","⑬ その他の食料・飲料販売業","","広島県呉市広大新開2丁目21番11号","",34.237479,132.625217,"0823-31-4611","カッパ・クリエイト株式会社","7030001001979","神奈川県横浜市西区みなとみらい2-2-1ランドマークタワー12階","","","","","","","届出","",""
"034202","fBiz00000158170000000324","広島県","呉市","かっぱ寿司　広島呉店","カッパズシ　ヒロシマクレテン","① 飲食店営業","","広島県呉市広大新開２丁目２１番１１号","",34.237479,132.625217,"0823-31-4611","カッパ・クリエイト株式会社","7030001001979","神奈川県横浜市西区みなとみらい2-2-1ランドマークタワー12階","20213212",2021/11/22,2021/11/22,2021/11/22,2027/12/31,"","許可"," ",""
"034202","fBiz00000159750000000001","広島県","呉市","宇都宮パック工業株式会社","ウツノミヤパックコウギョウカブシキガイシャ","㉗ 器具、容器包装の製造・加工業（合成樹脂が使用された器具又は容器包装の製造、加工に限る。）","","広島県呉市広多賀谷2丁目5番26号","",34.228510,132.612313,"","宇都宮パック工業株式会社","3240001025531","広島県呉市広多賀谷２丁目５番２６号","","","","","","","届出","",""
"034202","fBiz00000161450000000002","広島県","呉市","フレスタ　広店（寿司部門）　","フレスタ　ヒロテン　スシブモン","① 飲食店営業","","広島県呉市広白石１丁目５番１号","",34.229043,132.634249,"0823-76-5111","株式会社フレスタ","3240001010566","広島県広島市西区横川町3-2-36","20213109",2021/09/09,2021/09/09,2021/09/09,2026/12/31,"","許可"," ",""
"034202","fBiz00000161450000000039","広島県","呉市","フレスタ　広店","フレスタ　ヒロテン","⑪ 菓子製造業","","広島県呉市広白石一丁目5番1号","",34.229043,132.634249,"0823-76-5111","株式会社フレスタ","3240001010566","広島県広島市西区横川町3-2-36","20213110",2021/09/09,2021/09/09,2021/09/09,2026/12/31,"","許可"," ",""
"034202","fBiz00000161450000000062","広島県","呉市","フレスタ　呉駅ビル店","フレスタ　クレエキビルテン","⑪ 百貨店、総合スーパー","","広島県呉市宝町1番16号","",34.244743,132.557777,"0823-22-0112","株式会社フレスタ","3240001010566","広島県広島市西区横川町3-2-36","","","","","","","届出","",""
"034202","fBiz00000161450000000068","広島県","呉市","フレスタ　広店","フレスタ　ヒロテン","⑪ 百貨店、総合スーパー","","広島県呉市広白石一丁目5番1号","",34.229043,132.634249,"0823-76-5111","株式会社フレスタ","3240001010566","広島県広島市西区横川町3-2-36","","","","","","","届出","",""
"034202","fBiz00000161450000000104","広島県","呉市","フレスタ　警固屋店","フレスタ　ケゴヤテン","⑪ 百貨店、総合スーパー","","広島県呉市警固屋四丁目9番10号","",34.210270,132.544967,"0823-20-2828","株式会社フレスタ","3240001010566","広島県広島市西区横川町3-2-36","","","","","","","届出","",""
"034202","fBiz00000162850000000007","広島県","呉市","ウォンツ広白石店","ウォンツヒロシライシテン","⑬ その他の食料・飲料販売業","","広島県呉市広白石1-3-35","",34.228598,132.633473,"0823-76-5655","株式会社ツルハグループドラッグ&ファーマシー西日本","9240001021698","広島県広島市西区井口明神一丁目１番１０号","","","","","","","届出","",""
"034202","fBiz00000162850000000009","広島県","呉市","ウォンツ焼山店","ウォンツヤケヤマテン","⑬ その他の食料・飲料販売業","","広島県呉市焼山此原町22-11","",34.281082,132.551317,"0823-30-3200","株式会社ツルハグループドラッグ&ファーマシー西日本","9240001021698","広島県広島市西区井口明神一丁目１番１０号","","","","","","","届出","",""
"034202","fBiz00000162850000000021","広島県","呉市","ウォンツ警固屋店","ウォンツケゴヤテン","⑬ その他の食料・飲料販売業","","広島県呉市警固屋4-9-20","",34.209683,132.544728,"0823-20-2611","株式会社ツルハグループドラッグ&ファーマシー西日本","9240001021698","広島県広島市西区井口明神一丁目１番１０号","","","","","","","届出","",""
"034202","fBiz00000162850000000073","広島県","呉市","ウォンツ　呉片山店","ウォンツ　クレカタヤマテン","⑬ その他の食料・飲料販売業","","広島県呉市西片山町2-4","",34.254265,132.565097,"0823-32-1577","株式会社ツルハグループドラッグ&ファーマシー西日本","9240001021698","広島県広島市西区井口明神一丁目１番１０号","","","","","","","届出","",""
"034202","fBiz00000162850000000074","広島県","呉市","ウォンツ　川尻店","ウォンツ　カワジリテン","⑬ その他の食料・飲料販売業","","広島県呉市川尻町東4-2-4","",34.238100,132.700583,"0823-70-5870","株式会社ツルハグループドラッグ&ファーマシー西日本","9240001021698","広島県広島市西区井口明神一丁目１番１０号","","","","","","","届出","",""
"034202","fBiz00000162850000000075","広島県","呉市","ウォンツ　藤三広店","ウォンツ　フジサンヒロテン","⑬ その他の食料・飲料販売業","","広島県呉市広本町3丁目13番71号","",34.235823,132.623186,"0823-69-9117","株式会社ツルハグループドラッグ&ファーマシー西日本","9240001021698","広島県広島市西区井口明神一丁目１番１０号","","","","","","","届出","",""
"034202","fBiz00000162850000000136","広島県","呉市","ウォンツ　広本町店","ウォンツ　ヒロホンマチテン","⑬ その他の食料・飲料販売業","","広島県呉市広本町3-21-1","",34.238121,132.622925,"0823-76-0955","株式会社ツルハグループドラッグ&ファーマシー西日本","9240001021698","広島県広島市西区井口明神一丁目１番１０号","","","","","","","届出","",""
"034202","fBiz00000162850000000137","広島県","呉市","ウォンツ　音戸波多見店","ウォンツ　オンドハタミテン","⑬ その他の食料・飲料販売業","","広島県呉市音戸町波多見4-2-55","",34.179473,132.550115,"0823-50-0122","株式会社ツルハグループドラッグ&ファーマシー西日本","9240001021698","広島県広島市西区井口明神一丁目１番１０号","","","","","","","届出","",""
"034202","fBiz00000162850000000138","広島県","呉市","ウォンツ　呉中通店","ウォンツ　クレナカドオリテン","⑬ その他の食料・飲料販売業","","広島県呉市中通三丁目4番10号","",34.246455,132.565128,"0823-32-0710","株式会社ツルハグループドラッグ&ファーマシー西日本","9240001021698","広島県広島市西区井口明神一丁目１番１０号","","","","","","","届出","",""
"034202","fBiz00000162850000000139","広島県","呉市","ウォンツ　呉四ツ道路店","ウォンツ　クレヨツドウロテン","⑬ その他の食料・飲料販売業","","広島県呉市本通2-6-1","",34.242927,132.564989,"0823-32-1517","株式会社ツルハグループドラッグ&ファーマシー西日本","9240001021698","広島県広島市西区井口明神一丁目１番１０号","","","","","","","届出","",""
"034202","fBiz00000164290000000001","広島県","呉市","レストラン瀬戸","レストランセト","① 飲食店営業","","広島県呉市広古新開5丁目01番01号1号館","",34.238840,132.617716,"0823738317","株式会社常翔ウェルフェア","6120001141602","大阪府大阪市旭区大宮5丁目16-1","20210201",2021/06/01,2021/06/01,2021/06/01,2027/05/31,"","許可","　",""
"034202","fBiz00000164660000000001","広島県","呉市","（株）中元本店　トビキリ","ナカモトホンテン　トビキリ","㉔ その他の食料品製造・加工業","","広島県呉市三条１丁目４番８号","",34.244689,132.551333,"0823-25-4644","株式会社中元本店","6240001026295","広島県呉市三条１丁目４番８号","","","","","","","届出","",""
"034202","fBiz00000164660000000002","広島県","呉市","(株)中元本店","カブシキガイシャナカモトホンテン","㉕ そうざい製造業","","広島県呉市三条１丁目４番８号","",34.244689,132.551333,"0823254644","株式会社中元本店","6240001026295","広島県呉市三条１丁目４番８号","20210222",2021/06/01,2021/06/01,2021/06/01,2027/05/31,"","許可"," ",""
"034202","fBiz00000167570000000241","広島県","呉市","広島トヨペット呉営業所","ヒロシマトヨペットクレエイギョウショ","⑫ 自動販売機による販売業（コップ式自動販売機（自動洗浄・屋内設置）及び営業許可の対象となる自動販売機を除く）","","広島県呉市中通1丁目3番34号","",34.243785,132.562105,"0823252424","アシード株式会社","4240001035505","広島県福山市箕島町5725-1","","","","","","","届出","",""
"034202","fBiz00000174410000000002","広島県","呉市","藤三　光町ショッピングセンター","フジサン　ヒカリマチショッピングセンター","⑬ その他の食料・飲料販売業","各種食料品小売業","広島県呉市海岸4丁目16番3号","",34.246611,132.536989,"0823-21-3550","株式会社　藤三","9240001026516","広島県呉市広本町３丁目１２番２６号","","","","","","","届出","",""
"034202","fBiz00000174410000000018","広島県","呉市","藤三　仁方店","フジサン　ニガタテン","① 飲食店営業","","広島県呉市仁方西神町５番１０号","",34.224609,132.650661,"0823-79-1788","株式会社　藤三","9240001026516","広島県呉市広本町３丁目１２番２６号","20213139",2021/09/30,2021/09/30,2021/09/30,2028/01/31,"","許可","　",""
"034202","fBiz00000174410000000019","広島県","呉市","藤三　仁方店","フジサン　ニガタテン","⑪ 百貨店、総合スーパー","百貨店・総合スーパー","広島県呉市仁方西神町５番１０号","",34.224609,132.650661,"0823-79-1788","株式会社　藤三","9240001026516","広島県呉市広本町３丁目１２番２６号","","","","","","","届出","",""
"034202","fBiz00000174410000000020","広島県","呉市","藤三　阿賀ショッピングセンター","フジサン　アガショッピングセンター","③ 食肉販売業","百貨店・総合スーパー","広島県呉市阿賀中央6丁目1番34号","",34.235977,132.601978,"0823-72-3773","株式会社　藤三","9240001026516","広島県呉市広本町３丁目１２番２６号","20213188",2021/11/01,2021/11/01,2021/11/01,2027/10/31,"","許可"," ",""
"034202","fBiz00000174410000000021","広島県","呉市","藤三　阿賀ショッピングセンター","フジサン　アガショッピングセンター","④ 魚介類販売業","百貨店・総合スーパー","広島県呉市阿賀中央６丁目1番34号","",34.235977,132.601978,"0823-72-3773","株式会社　藤三","9240001026516","広島県呉市広本町３丁目１２番２６号","20213174",2021/10/29,2021/10/29,2021/10/29,2027/10/31,"","許可"," ",""
"034202","fBiz00000174410000000022","広島県","呉市","藤三　阿賀ショッピングセンター","フジサン　アガショッピングセンター","① 飲食店営業","百貨店・総合スーパー","広島県呉市阿賀中央6丁目1番34号","",34.235977,132.601978,"0823-72-3773","株式会社　藤三","9240001026516","広島県呉市広本町３丁目１２番２６号","20213178",2021/10/29,2021/10/29,2021/10/29,2027/10/31,"","許可"," ",""
"034202","fBiz00000174410000000023","広島県","呉市","藤三　広店","フジサン　ヒロテン","⑪ 百貨店、総合スーパー","百貨店・総合スーパー","広島県呉市広本町3丁目12番1号","",34.236006,132.622842,"0823-73-5050","株式会社　藤三","9240001026516","広島県呉市広本町３丁目１２番２６号","","","","","","","届出","",""
"034202","fBiz00000174410000000024","広島県","呉市","藤三　焼山ショッピングセンター","フジサン　ヤケヤマショッピングセンター","⑪ 百貨店、総合スーパー","","広島県呉市焼山中央1丁目14番1号","",34.294298,132.556271,"0823-33-5000","株式会社　藤三","9240001026516","広島県呉市広本町３丁目１２番２６号","","","","","","","届出","",""
"034202","fBiz00000174410000000025","広島県","呉市","藤三　阿賀ショッピングセンター","フジサン　アガショッピングセンター","⑪ 百貨店、総合スーパー","","広島県呉市阿賀中央6丁目1番34号","",34.235977,132.601978,"0823-72-3773","株式会社　藤三","9240001026516","広島県呉市広本町３丁目１２番２６号","","","","","","","届出","",""
"034202","fBiz00000174410000000026","広島県","呉市","藤三　安浦ショッピングセンター","フジサン　ヤスウラショッピングセンター","⑪ 百貨店、総合スーパー","","広島県呉市安浦町内海南4丁目4番7号","",34.278625,132.736381,"0823-84-6565","株式会社　藤三","9240001026516","広島県呉市広本町３丁目１２番２６号","","","","","","","届出","",""
"034202","fBiz00000174410000000027","広島県","呉市","藤三　御所の浦ショッピングセンター","フジサン　ゴショノウラショッピングセンター","⑪ 百貨店、総合スーパー","","広島県呉市音戸町高須3丁目7番5号","",34.188064,132.540311,"0823-51-2151","株式会社　藤三","9240001026516","広島県呉市広本町３丁目１２番２６号","","","","","","","届出","",""
"034202","fBiz00000174410000000028","広島県","呉市","藤三　宇和木店","フジサン　ウワギテン","⑪ 百貨店、総合スーパー","","広島県呉市倉橋町宇和木6409-1","",34.128246,132.500693,"0823-50-2020","株式会社　藤三","9240001026516","広島県呉市広本町３丁目１２番２６号","","","","","","","届出","",""
"034202","fBiz00000174410000000029","広島県","呉市","藤三　新広店","フジサン　シンヒロテン","⑪ 百貨店、総合スーパー","","広島県呉市広古新開7丁目24番18号","",34.240397,132.618180,"0823-36-2800","株式会社　藤三","9240001026516","広島県呉市広本町３丁目１２番２６号","","","","","","","届出","",""
"034202","fBiz00000174410000000030","広島県","呉市","藤三　片山店","フジサン　カタヤマテン","⑪ 百貨店、総合スーパー","","広島県呉市西片山町2-4","",34.254265,132.565097,"0823-36-4150","株式会社　藤三","9240001026516","広島県呉市広本町３丁目１２番２６号","","","","","","","届出","",""
"034202","fBiz00000175290000000001","広島県","呉市","鈴らん保育園","スズランホイクエン","㉖ 集団給食施設","","広島県呉市中央６－１１－１","",34.249769,132.567633,"0823213845","社会福祉法人岳瑛","9240005006209","","","","","","","","届出","",""
"034202","fBiz00000175290000000002","広島県","呉市","銀の鈴こども園","ギンノズズコドモエン","㉖ 集団給食施設","","広島県呉市東中央１－５－２","",34.250608,132.569910,"","社会福祉法人岳瑛","9240005006209","","","","","","","","届出","",""
"034202","fBiz00000175780000000002","広島県","呉市","ヤクルト広センター","ヤクルトヒロセンター","⑬ その他の食料・飲料販売業","","広島県呉市広古新開4-17-13","",34.240102,132.616473,"0823-71-8612","広島中央ヤクルト販売株式会社","8240001026426","広島県呉市苗代町９８番地１","","","","","","","届出","",""
"034202","fBiz00000175780000000003","広島県","呉市","ヤクルト阿賀センター","ヤクルトアガセンター","⑬ その他の食料・飲料販売業","","広島県呉市阿賀中央7-2-6","",34.235854,132.598529,"0823-71-1380","広島中央ヤクルト販売株式会社","8240001026426","広島県呉市苗代町９８番地１","","","","","","","届出","",""
"034202","fBiz00000175780000000005","広島県","呉市","ヤクルト安浦センター","ヤクルトヤスウラセンター","⑬ その他の食料・飲料販売業","","広島県呉市安浦町中央5-2-26","",34.283063,132.745974,"0823-84-5587","広島中央ヤクルト販売株式会社","8240001026426","広島県呉市苗代町９８番地１","","","","","","","届出","",""
"034202","fBiz00000175780000000006","広島県","呉市","ヤクルト音戸センター","ヤクルトオンドセンター","⑬ その他の食料・飲料販売業","","広島県呉市音戸町波多見5-7-10","",34.179173,132.551937,"0823-51-4632","広島中央ヤクルト販売株式会社","8240001026426","広島県呉市苗代町９８番地１","","","","","","","届出","",""
