"017201","fBiz00000422950000000004","石川県","金沢市","","","⑬ その他の食料・飲料販売業","","","","","","","","","","","","","","","","届出","",""
"017201","fBiz00000450050000000026","石川県","金沢市","ザ・ダイニング 香林坊店","ザ・ダイニングコウリンボウテン","⑬ その他の食料・飲料販売業","","石川県金沢市香林坊１丁目１－１","香林坊大和８Ｆ",36.563171,136.654125,"076-220-1104","ニラックス株式会社","3012401011662","東京都武蔵野市西久保１丁目２５番８号","","","","","","","届出","",""
"017201","fBiz00000474570000000002","石川県","金沢市","ドラッグストアコメヤ薬局久安店","ドラッグストアコメヤヤッキョクヒサヤステン","⑬ その他の食料・飲料販売業","","石川県金沢市久安２丁目２３５","",36.533346,136.631582,"0762422781","株式会社コメヤ薬局","8220001000110","石川県白山市鶴来本町２丁目ワ４３番地","","","","","","","届出","",""
"017201","fBiz00000474570000000009","石川県","金沢市","高尾コメヤ薬局","タカオコメヤヤッキョク","⑬ その他の食料・飲料販売業","","石川県金沢市高尾南３丁目17番地","",36.519424,136.628486,"0762969900","株式会社コメヤ薬局","8220001000110","石川県白山市鶴来本町２丁目ワ４３番地","","","","","","","届出","",""
"017201","fBiz00000474570000000010","石川県","金沢市","県庁前コメヤ薬局","ケンチョウマエコメヤヤッキョク","⑬ その他の食料・飲料販売業","","石川県金沢市西都1丁目62","",36.592815,136.626946,"0762678800","株式会社コメヤ薬局","8220001000110","石川県白山市鶴来本町２丁目ワ４３番地","","","","","","","届出","",""
"017201","fBiz00000497960000000731","石川県","金沢市","クスリのアオキ鈴見店","クスリノアオキスズミテン","⑪ 百貨店、総合スーパー","ドラッグストア","石川県金沢市もりの里3丁目183番地","",36.561038,136.681654,"076-234-0003","株式会社クスリのアオキ","2220001008745","石川県白山市松本町２５１２番地","","","","","","","届出","",""
"017201","fBiz00000497960000000742","石川県","金沢市","クスリのアオキ桜田店","クスリノアオキサクラダテン","⑪ 百貨店、総合スーパー","ドラッグストア","石川県金沢市桜田町1丁目31番地","",36.578644,136.618407,"076-223-0003","株式会社クスリのアオキ","2220001008745","石川県白山市松本町２５１２番地","","","","","","","届出","",""
"017201","fBiz00000497960000000749","石川県","金沢市","クスリのアオキ粟崎店","クスリノアオキアワガサキテン","⑪ 百貨店、総合スーパー","ドラッグストア","石川県金沢市粟崎町2丁目3番地","",36.628628,136.630083,"076-237-9611","株式会社クスリのアオキ","2220001008745","石川県白山市松本町２５１２番地","","","","","","","届出","",""
"017201","fBiz00000497960000000750","石川県","金沢市","クスリのアオキ御経塚店","クスリノアオキオキョウヅカテン","⑪ 百貨店、総合スーパー","ドラッグストア","石川県金沢市上荒屋1丁目222番地","",36.547031,136.594012,"076-269-8855","株式会社クスリのアオキ","2220001008745","石川県白山市松本町２５１２番地","","","","","","","届出","",""
"017201","fBiz00000497960000000752","石川県","金沢市","クスリのアオキ御影店","クスリノアオキミカゲテン","⑪ 百貨店、総合スーパー","ドラッグストア","石川県金沢市神田1丁目1番5号","",36.561131,136.639636,"076-245-0030","株式会社クスリのアオキ","2220001008745","石川県白山市松本町２５１２番地","","","","","","","届出","",""
"017201","fBiz00000497960000000753","石川県","金沢市","クスリのアオキ三口新町店","クスリノアオキミツクチシンマチテン","⑪ 百貨店、総合スーパー","ドラッグストア","石川県金沢市三口新町2丁目2番9号","",36.540942,136.680630,"076-261-0003","株式会社クスリのアオキ","2220001008745","石川県白山市松本町２５１２番地","","","","","","","届出","",""
"017201","fBiz00000497960000000755","石川県","金沢市","クスリのアオキ長田店","クスリノアオキナガタテン","⑪ 百貨店、総合スーパー","ドラッグストア","石川県金沢市長田町4番2号","",36.611799,136.603275,"076-233-6211","株式会社クスリのアオキ","2220001008745","石川県白山市松本町２５１２番地","","","","","","","届出","",""
"017201","fBiz00000497960000000758","石川県","金沢市","クスリのアオキ八日市店","クスリノアオキヨウカイチテン","⑪ 百貨店、総合スーパー","ドラッグストア","石川県金沢市八日市出町769番地","",36.554281,136.607918,"076-269-5200","株式会社クスリのアオキ","2220001008745","石川県白山市松本町２５１２番地","","","","","","","届出","",""
"017201","fBiz00000497960000000759","石川県","金沢市","クスリのアオキ長坂店","クスリノアオキナガサカテン","⑪ 百貨店、総合スーパー","ドラッグストア","石川県金沢市長坂3丁目1番35号","",36.537565,136.655600,"076-226-6555","株式会社クスリのアオキ","2220001008745","石川県白山市松本町２５１２番地","","","","","","","届出","",""
"017201","fBiz00000497960000000761","石川県","金沢市","クスリのアオキ浅野本町店","クスリノアオキアサノホンマチテン","⑪ 百貨店、総合スーパー","ドラッグストア","石川県金沢市昌永町15番50号","",36.580874,136.658536,"076-253-3400","株式会社クスリのアオキ","2220001008745","石川県白山市松本町２５１２番地","","","","","","","届出","",""
"017201","fBiz00000497960000000764","石川県","金沢市","クスリのアオキ伏見台店","クスリノアオキフシミダイテン","⑪ 百貨店、総合スーパー","ドラッグストア","石川県金沢市伏見台2丁目7番5号","",36.534264,136.636915,"076-287-5604","株式会社クスリのアオキ","2220001008745","石川県白山市松本町２５１２番地","","","","","","","届出","",""
"017201","fBiz00000497960000000765","石川県","金沢市","クスリのアオキ鞍月店","クスリノアオキクラツキテン","⑪ 百貨店、総合スーパー","ドラッグストア","石川県金沢市鞍月5丁目77番地","",36.599995,136.625169,"076-238-6006","株式会社クスリのアオキ","2220001008745","石川県白山市松本町２５１２番地","","","","","","","届出","",""
"017201","fBiz00000497960000000766","石川県","金沢市","クスリのアオキ安原店","クスリノアオキヤスハラテン","⑪ 百貨店、総合スーパー","ドラッグストア","石川県金沢市福増町南1252番地","",36.563568,136.582030,"076-249-7771","株式会社クスリのアオキ","2220001008745","石川県白山市松本町２５１２番地","","","","","","","届出","",""
"017201","fBiz00000497960000000772","石川県","金沢市","クスリのアオキ玉鉾店","クスリノアオキタマボコテン","⑪ 百貨店、総合スーパー","ドラッグストア","石川県金沢市玉鉾1丁目27番","",36.570530,136.628694,"076-291-1050","株式会社クスリのアオキ","2220001008745","石川県白山市松本町２５１２番地","","","","","","","届出","",""
"017201","fBiz00000497960000000777","石川県","金沢市","クスリのアオキ暁店","クスリノアオキアカツキテン","⑪ 百貨店、総合スーパー","ドラッグストア","石川県金沢市暁町20番6号","",36.563121,136.670956,"076-232-5100","株式会社クスリのアオキ","2220001008745","石川県白山市松本町２５１２番地","","","","","","","届出","",""
"017201","fBiz00000497960000000778","石川県","金沢市","クスリのアオキ西泉店","クスリノアオキニシイズミテン","⑪ 百貨店、総合スーパー","ドラッグストア","石川県金沢市西泉3丁目23番地","",36.547022,136.630303,"076-245-1101","株式会社クスリのアオキ","2220001008745","石川県白山市松本町２５１２番地","","","","","","","届出","",""
"017201","fBiz00000497960000000780","石川県","金沢市","クスリのアオキみずき店","クスリノアオキミズキテン","⑪ 百貨店、総合スーパー","ドラッグストア","石川県金沢市みずき1丁目3番1","",36.618468,136.672057,"076-258-3750","株式会社クスリのアオキ","2220001008745","石川県白山市松本町２５１２番地","","","","","","","届出","",""
"017201","fBiz00000497960000000783","石川県","金沢市","クスリのアオキ三馬店","クスリノアオキミンマテン","⑪ 百貨店、総合スーパー","ドラッグストア","石川県金沢市三馬2丁目254番","",36.529674,136.635197,"076-247-3030","株式会社クスリのアオキ","2220001008745","石川県白山市松本町２５１２番地","","","","","","","届出","",""
"017201","fBiz00000508980000000002","石川県","金沢市","佃の佃煮　金沢百番街店","ツクダノツクダニ　カナザワヒャクバンガイテン","⑬ その他の食料・飲料販売業","","石川県金沢市木ノ新保町1-1","",36.578238,136.647909,"076-260-3765","佃食品株式会社","9220001004309","石川県金沢市大場町東828番地","","","","","","","届出","",""
"017201","fBiz00000508980000000003","石川県","金沢市","佃の佃煮　本店","ツクダノツクダニ　ホンテン","⑬ その他の食料・飲料販売業","","石川県金沢市下新町６−１８","",36.571614,136.663155,"076-262-0003","佃食品株式会社","9220001004309","石川県金沢市大場町東828番地","","","","","","","届出","",""
"017201","fBiz00000508980000000004","石川県","金沢市","佃の佃煮　金沢エムザ店","ツクダノツクダニ　カナザワエムザテン","⑬ その他の食料・飲料販売業","","石川県金沢市武蔵町１５−１","",36.572005,136.655011,"076-260-2578","佃食品株式会社","9220001004309","石川県金沢市大場町東828番地","","","","","","","届出","",""
"017201","fBiz00000508980000000005","石川県","金沢市","佃の佃煮　有松店","ツクダノツクダニ　アリマツテン","⑬ その他の食料・飲料販売業","","石川県金沢市有松５丁目８−２２","",36.539847,136.638026,"076-226-0012","佃食品株式会社","9220001004309","石川県金沢市大場町東828番地","","","","","","","届出","",""
"017201","fBiz00000508980000000006","石川県","金沢市","佃の佃煮　香林坊大和店","ツクダノツクダニ　コウリンボウダイワテン","⑬ その他の食料・飲料販売業","","石川県金沢市香林坊１丁目１−１","",36.563171,136.654125,"076-220-1093","佃食品株式会社","9220001004309","石川県金沢市大場町東828番地","","","","","","","届出","",""
"017201","fBiz00000508980000000007","石川県","金沢市","佃の佃煮　東山店","ツクダノツクダニ　ヒガシヤマテン","⑬ その他の食料・飲料販売業","","石川県金沢市東山１丁目５−７","",36.572552,136.665813,"076-254-5225","佃食品株式会社","9220001004309","石川県金沢市大場町東828番地","","","","","","","届出","",""
"017201","fBiz00000514870000000001","石川県","金沢市","グループホーム　ゆとりの園","グループホーム　ユトリノソノ","㉖ 集団給食施設","認知症対応共同生活介護事業所","石川県金沢市糸田1-142","",36.558210,136.626495,"0762923030","株式会社　ゆとりの園","5220001014930","石川県金沢市糸田1-142","","","","","","","届出","",""
"017201","fBiz00000514870000000002","石川県","金沢市","小規模多機能型居宅介護事業所　ゆとりの園","ショウキボタキノウガタキョタクカイゴジギョウショ　ユトリノソノ","㉖ 集団給食施設","小規模多機能型居宅介護事業所","石川県金沢市糸田1-142","",36.558210,136.626495,"0762923030","株式会社　ゆとりの園","5220001014930","石川県金沢市糸田1-142","","","","","","","届出","",""
"017201","fBiz00000514870000000003","石川県","金沢市","ケアホーム　ゆとりの園入江","ケアホーム　ユトリノソノイリエ","㉖ 集団給食施設","有料老人ホーム","石川県金沢市入江1-219","",36.567353,136.631631,"0762922800","株式会社　ゆとりの園","5220001014930","石川県金沢市糸田1-142","","","","","","","届出","",""
"017201","fBiz00000514870000000004","石川県","金沢市","ケアホーム　ゆとりの園西金沢","ケアホーム　ユトリノソノニシカナザワ","㉖ 集団給食施設","有料老人ホーム","石川県金沢市米泉町7-59","",36.552023,136.623515,"0762423900","株式会社　ゆとりの園","5220001014930","石川県金沢市糸田1-142","","","","","","","届出","",""
"017201","fBiz00000522070000000001","石川県","金沢市","","","⑭ 添加物製造・加工業（法第13 条第１項の規定により規格が定められた添加物の製造を除く。）","製造業","","","","","","","","","","","","","","","届出","",""
"017201","fBiz00000568340000000225","石川県","金沢市","餃子の王将 杜の里店","ギョウザノオウショウ　モリノサトテン","⑬ その他の食料・飲料販売業","その他の食料・飲料販売業 ","石川県金沢市もりの里３－２４４","",36.559805,136.682036,"076-265-7797","株式会社王将フードサービス","3130001012441","京都府京都市山科区西野山射庭ノ上町２９４番地の１","","","","","","","届出","",""
"017201","fBiz00000568340000000226","石川県","金沢市","餃子の王将 イオン金沢示野店","ギョウザノオウショウ　イオンカナザワシメノテン","⑬ その他の食料・飲料販売業","その他の食料・飲料販売業 ","石川県金沢市戸板西2丁目7番地","",36.580466,136.614891,"076-267-1811","株式会社王将フードサービス","3130001012441","京都府京都市山科区西野山射庭ノ上町２９４番地の１","","","","","","","届出","",""
"017201","fBiz00000568340000000228","石川県","金沢市","餃子の王将 金沢東店","ギョウザノオウショウ　カナザワヒガシテン","⑬ その他の食料・飲料販売業","その他の食料・飲料販売業 ","石川県金沢市福久町ホ27","",36.613688,136.679922,"076-258-6606","株式会社王将フードサービス","3130001012441","京都府京都市山科区西野山射庭ノ上町２９４番地の１","","","","","","","届出","",""
"017201","fBiz00000593230000000016","石川県","金沢市","イオンもりの里店","イオンモリノサトテン","⑪ 百貨店、総合スーパー","","石川県金沢市もりの里１丁目７０番地","",36.551642,136.689980,"076-234-8888","イオンリテール株式会社","2040001000456","千葉県千葉市美浜区中瀬一丁目5番地１","","","","","","","届出","",""
"017201","fBiz00000622400000000002","石川県","金沢市","倉田商店　（富山483さ1007）","クラタショウテン","① 飲食店営業","自動車営業","石川県金沢市金沢市ｰ円","",36.617253,136.681406,"","株式会社倉田商会","1230001005940","富山県富山市水落１番地３０","金沢市指令収衛指第16761号",2021/10/26,2021/10/26,2021/10/26,2026/10/31,"","許可","営業車両は以下に限る 営業車両：富山４８３　さ１００７ 給水・廃水タンクの容量は4０リットル程度以上とすること",""
"017201","fBiz00000624470000000027","石川県","金沢市","桜ヶ丘病院売店","サクラガオカビョウインバイテン","⑩ コンビニエンスストア","コンビニエンス業","石川県金沢市観法寺町へ174","",36.618520,136.705202,"0764-257-3577","ワタキューセイモア株式会社　","7130001037872","京都府綴喜郡井手町大字多賀小字茶臼塚12-2","","","","","","","届出","",""
"017201","fBiz00000624470000000029","石川県","金沢市","千木病院売店","センギビョウインバイテン","⑩ コンビニエンスストア","コンビニエンス業","石川県金沢市千木へ33番地１","",36.606441,136.674678,"076-257-7011","ワタキューセイモア株式会社　","7130001037872","京都府綴喜郡井手町大字多賀小字茶臼塚12-2","","","","","","","届出","",""
"017201","fBiz00000624470000000030","石川県","金沢市","岡部病院売店","オカベビョウインバイテン","⑩ コンビニエンスストア","コンビニエンス業","石川県金沢市長坂町チ15番地","",36.561030,136.656647,"076-226-1160","ワタキューセイモア株式会社　","7130001037872","京都府綴喜郡井手町大字多賀小字茶臼塚12-2","","","","","","","届出","",""
"017201","fBiz00000630500000000001","石川県","金沢市","ウエルシア金沢有松店","ウエルシアカナザワアリマツテン","⑪ 百貨店、総合スーパー","ドラッグストア","石川県金沢市有松4丁目13番13号","",36.538251,136.635750,"076-259-1131","ウエルシア薬局株式会社","3030001002411","東京都千代田区外神田2-2-15","","","","","","","届出","",""
"017201","fBiz00000630590000000001","石川県","金沢市","ウエルシア金沢直江店","ウエルシアカナザワナオエテン","⑪ 百貨店、総合スーパー","ドラッグストア","石川県金沢市直江南1丁目44番地","",36.603498,136.632497,"076-238-4825","ウエルシア薬局株式会社","3030001002411","東京都千代田区外神田2-2-15","","","","","","","届出","",""
"017201","fBiz00000634820000000001","石川県","金沢市","泉の台幼稚舎","イズミノダイヨウチシャ","㉖ 集団給食施設","","石川県金沢市泉野町４−４−３","",36.545122,136.652202,"0762436775","社会福祉法人泉の台保育園","3220005001992","石川県金沢市泉野町４−４−３","","","","","","","届出","",""
"017201","fBiz00000645870000000001","石川県","金沢市","ウエルシア金沢三池店","ウエルシアカナザワミイケテン","⑪ 百貨店、総合スーパー","ドラッグストア","石川県金沢市三池栄町312番地","",36.597354,136.670420,"076-252-7212","ウエルシア薬局株式会社","3030001002411","東京都千代田区外神田2-2-15","","","","","","","届出","",""
"017201","fBiz00000651740000000001","石川県","金沢市","ウエルシア金沢大桑店","ウエルシアカナザワオオクワテン","⑪ 百貨店、総合スーパー","ドラッグストア","石川県金沢市大桑2丁目47番地","",36.538309,136.674040,"076-201-1577","ウエルシア薬局株式会社","3030001002411","東京都千代田区外神田2-2-15","","","","","","","届出","",""
"017201","fBiz00000652770000000001","石川県","金沢市","ウエルシア金沢新保本店","ウエルシアカナザワシンボホンテン","⑪ 百貨店、総合スーパー","ドラッグストア","石川県金沢市新保本3丁目152番地１","",36.555422,136.601783,"076-214-1117","ウエルシア薬局株式会社","3030001002411","東京都千代田区外神田2-2-15","","","","","","","届出","",""
"017201","fBiz00000652800000000001","石川県","金沢市","ウエルシア金沢額新保店","ウエルシアカナザワヌカシンボテン","⑪ 百貨店、総合スーパー","ドラッグストア","石川県金沢市額新保３丁目188","",36.516482,136.615344,"076-296-7717","ウエルシア薬局株式会社","3030001002411","東京都千代田区外神田2-2-15","","","","","","","届出","",""
"017201","fBiz00000652800000000001","石川県","金沢市","ウエルシア金沢額新保店","ウエルシアカナザワヌカシンボテン","⑫ 自動販売機による販売業（コップ式自動販売機（自動洗浄・屋内設置）及び営業許可の対象となる自動販売機を除く）","ドラッグストア","石川県金沢市額新保３丁目188","",36.516482,136.615344,"076-296-7717","ウエルシア薬局株式会社","3030001002411","東京都千代田区外神田2-2-15","","","","","","","届出","",""
"017201","fBiz00000654270000000001","石川県","金沢市","ウエルシア金沢末町店","ウエルシアカナザワスエマチテン","⑪ 百貨店、総合スーパー","ドラッグストア","石川県金沢市末町16の12番地１","",36.520959,136.686940,"076-229-8001","ウエルシア薬局株式会社","3030001002411","東京都千代田区外神田2-2-15","","","","","","","届出","",""
"017201","fBiz00000661790000000279","石川県","金沢市","なか卯金沢駅西本町店","ナカウカナザワエキニシホンマチテン","⑬ その他の食料・飲料販売業","飲食店営業","石川県金沢市駅西本町5-1-3","",36.581826,136.632197,"","株式会社なか卯","6010401089907","東京都港区港南二丁目１８番１号","","","","","","","届出","",""
"017201","fBiz00000661790000000288","石川県","金沢市","なか卯金沢入江店","ナカウカナザワイリエテン","⑬ その他の食料・飲料販売業","飲食店営業","石川県金沢市入江2-64","",36.565917,136.624470,"","株式会社なか卯","6010401089907","東京都港区港南二丁目１８番１号","","","","","","","届出","",""
"017201","fBiz00000661790000000339","石川県","金沢市","なか卯359号金沢柳橋店","ナカウサンビャクゴジュウキュウゴウカナザワヤナギバシテン","⑬ その他の食料・飲料販売業","飲食店営業","石川県金沢市柳橋町ハ15番","",36.601748,136.681805,"","株式会社なか卯","6010401089907","東京都港区港南二丁目１８番１号","","","","","","","届出","",""
"017201","fBiz00000752430000000004","石川県","金沢市","アル・プラザ金沢乃が美はなれ金沢店特設会場","アル・プラザカナザワノガミハナレカナザワテントクセツカイジョウ","⑬ その他の食料・飲料販売業","","石川県金沢市諸江町30-1","",36.590795,136.645661,"0762590854","株式会社うまいす","4290001079027","福岡県福岡市中央区荒戸1-3-18　井原コーポ101","","","","","","","届出","",""
"017201","fBiz00000761560000000021","石川県","金沢市","","","① 飲食店営業","居酒屋","","","","","","","","","金沢市指令収衛指第16736号",2022/01/11,2022/01/11,2022/01/11,2028/01/31,"","許可","",""
"017201","fBiz00000774750000000060","石川県","金沢市","株式会社HALLE JAPON","カブシキガイシャアルジャポン","㉕ 行商","","石川県金沢市市内一円","",36.624802,136.625574,"","株式会社HALLE JAPON","5120001168836","東京都港区港南2丁目16-2太陽生命品川ビル28F","","","","","","","届出","",""
"017201","fBiz00000777190000000002","石川県","金沢市","","","⑬ その他の食料・飲料販売業","","","","","","","","","","","","","","","","届出","",""
"017201","fBiz00000815870000000003","石川県","金沢市","","","⑬ その他の食料・飲料販売業","","","","","","","","","","","","","","","","届出","",""
"017201","fBiz00000816600000000001","石川県","金沢市","加賀麩不室屋　尾張町店","カガフフムロヤ　オワリチョウテン","⑬ その他の食料・飲料販売業","","石川県金沢市尾張町2-3-1","",36.571808,136.658083,"","株式会社加賀麩不室屋","9220001001990","石川県金沢市かたつ1番地","","","","","","","届出","",""
"017201","fBiz00000816600000000002","石川県","金沢市","加賀麩不室屋　東山店","カガフフムロヤ　ヒガシヤマテン","⑬ その他の食料・飲料販売業","","石川県金沢市東山1-25-3","",36.572313,136.667952,"","株式会社加賀麩不室屋","9220001001990","石川県金沢市かたつ1番地","","","","","","","届出","",""
"017201","fBiz00000816600000000003","石川県","金沢市","加賀麩不室屋　有松店","カガフフムロヤ　アリマツテン","⑬ その他の食料・飲料販売業","","石川県金沢市有松5-8-22","有松三軒家内",36.539847,136.638026,"","株式会社加賀麩不室屋","9220001001990","石川県金沢市かたつ1番地","","","","","","","届出","",""
"017201","fBiz00000816600000000004","石川県","金沢市","加賀麩不室屋　金沢百番街店","カガフフムロヤ　カナザワヒャクバンガイテン","⑬ その他の食料・飲料販売業","","石川県金沢市木ノ新保町1-1","JR金沢駅構内",36.578238,136.647909,"","株式会社加賀麩不室屋","9220001001990","石川県金沢市かたつ1番地","","","","","","","届出","",""
"017201","fBiz00000816600000000006","石川県","金沢市","加賀麩不室屋　香林坊大和店","カガフフムロヤ　コウリンボウダイワテン","⑬ その他の食料・飲料販売業","","石川県金沢市香林坊1－1－1","大和香林坊店内",36.563171,136.654125,"","株式会社加賀麩不室屋","9220001001990","石川県金沢市かたつ1番地","","","","","","","届出","",""
"017201","fBiz00000816600000000007","石川県","金沢市","加賀麩不室屋　金沢エムザ店","カガフフムロヤ　カナザワエムザテン","⑬ その他の食料・飲料販売業","","石川県金沢市武蔵町15-1","金沢エムザ内",36.572005,136.655011,"","株式会社加賀麩不室屋","9220001001990","石川県金沢市かたつ1番地","","","","","","","届出","",""
