"017201","fBiz00000192400000000003","石川県","金沢市","堀他香林坊大和店","ホリタコウリンボウダイワテン","⑦ 野菜果物販売業","","石川県金沢市香林坊1-1-1","大和香林坊店B１F",36.563171,136.654125,"","株式会社堀他","2220001006146","石川県金沢市駅西本町２丁目３番１号","","","","","","","届出","",""
"017201","fBiz00000194280000000301","石川県","金沢市","スギドラッグ　鞍月店","スギドラッグ　クラツキテン","⑬ その他の食料・飲料販売業","ドラッグストア","石川県金沢市割出町631番地","",36.599875,136.637694,"076-254-1658","株式会社スギ薬局","7180301016951","愛知県安城市三河安城町一丁目8番地4","","","","","","","届出","",""
"017201","fBiz00000194280000000620","石川県","金沢市","スギドラッグ  金沢昭和町店","スギドラッグ  カナザワショウワマチテン","⑬ その他の食料・飲料販売業","ドラッグストア","石川県金沢市昭和町6番23号","",36.573172,136.646375,"076-256-5283","株式会社スギ薬局","7180301016951","愛知県安城市三河安城町一丁目8番地4","","","","","","","届出","",""
"017201","fBiz00000194280000000624","石川県","金沢市","スギドラッグ  畝田店","スギドラッグ  ウネダテン","⑬ その他の食料・飲料販売業","ドラッグストア","石川県金沢市畝田東四丁目1114番地","",36.599227,136.614827,"076-225-8648","株式会社スギ薬局","7180301016951","愛知県安城市三河安城町一丁目8番地4","","","","","","","届出","",""
"017201","fBiz00000194280000000625","石川県","金沢市","スギドラッグ  久安店","スギドラッグ  ヒサヤステン","⑬ その他の食料・飲料販売業","ドラッグストア","石川県金沢市久安一丁目520番地","",36.534345,136.634012,"076-220-7546","株式会社スギ薬局","7180301016951","愛知県安城市三河安城町一丁目8番地4","","","","","","","届出","",""
"017201","fBiz00000194280000000629","石川県","金沢市","スギドラッグ  金沢大手町店","スギドラッグ  カナザワオオテマチテン","⑬ その他の食料・飲料販売業","ドラッグストア","石川県金沢市大手町9番23号","076-213-5418",36.568460,136.664109,"","株式会社スギ薬局","7180301016951","愛知県安城市三河安城町一丁目8番地4","","","","","","","届出","",""
"017201","fBiz00000194280000000631","石川県","金沢市","スギドラッグ  タテマチ店","スギドラッグ  タテマチテン","⑬ その他の食料・飲料販売業","ドラッグストア","石川県金沢市竪町45番地2","CoCoTTo　KANAZAWA 1階",36.560125,136.654205,"076-208-7490","株式会社スギ薬局","7180301016951","愛知県安城市三河安城町一丁目8番地4","","","","","","","届出","",""
"017201","fBiz00000194280000000632","石川県","金沢市","スギドラッグ  金沢駅西店","スギドラッグ  カナザワエキニシテン","⑬ その他の食料・飲料販売業","ドラッグストア","石川県金沢市駅西本町三丁目14番34号","",36.584412,136.637488,"076-213-5084","株式会社スギ薬局","7180301016951","愛知県安城市三河安城町一丁目8番地4","","","","","","","届出","",""
"017201","fBiz00000194280000000633","石川県","金沢市","スギドラッグ  元車店","スギドラッグ  モトグルマテン","⑬ その他の食料・飲料販売業","ドラッグストア","石川県金沢市長町三丁目2番18号","",36.527212,136.633239,"076-254-6296","株式会社スギ薬局","7180301016951","愛知県安城市三河安城町一丁目8番地4","","","","","","","届出","",""
"017201","fBiz00000194280000000635","石川県","金沢市","スギドラッグ  金沢泉本町店","スギドラッグ  カナザワイズミホンマチテン","⑬ その他の食料・飲料販売業","ドラッグストア","石川県金沢市泉本町三丁目91番地","",36.549092,136.635261,"076-227-9404","株式会社スギ薬局","7180301016951","愛知県安城市三河安城町一丁目8番地4","","","","","","","届出","",""
"017201","fBiz00000194910000000005","石川県","金沢市","","","① 魚介類販売業（包装済みの魚介類のみの販売）","","","","","","","","","","","","","","","","届出","",""
"017201","fBiz00000194910000000005","石川県","金沢市","","","② 食肉販売業（包装済みの食肉のみの販売）","","","","","","","","","","","","","","","","届出","",""
"017201","fBiz00000194910000000005","石川県","金沢市","","","③ 乳類販売業","","","","","","","","","","","","","","","","届出","",""
"017201","fBiz00000194910000000005","石川県","金沢市","","","⑬ その他の食料・飲料販売業","","","","","","","","","","","","","","","","届出","",""
"017201","fBiz00000200770000000002","石川県","金沢市","","","㉖ 集団給食施設","","","","","","","","","","","","","","","","届出","",""
"017201","fBiz00000201950000000005","石川県","金沢市","社会福祉法人すずらん保育園","シャカイフクシホウジンスズランホイクエン","㉖ 集団給食施設","","石川県金沢市西金沢新町266-2","",36.554044,136.616237,"0762494988","社会福祉法人すずらん保育園","9220005002028","石川県金沢市西金沢新町266-2","","","","","","","届出","",""
"017201","fBiz00000202990000000002","石川県","金沢市","ひばりキッズガーデン","ヒバリキッズガーデン","㉖ 集団給食施設","集団給食施設","石川県金沢市額新町2-124","",36.517677,136.622393,"","","","","","","","","","","届出","",""
"017201","fBiz00000205450000000001","石川県","金沢市","千坂こども園","チサカコドモエン","㉖ 集団給食施設","","石川県金沢市疋田町ハ302","",36.603461,136.676587,"0762581321","社会福祉法人千坂福祉協会","6220005002039","石川県金沢市疋田町ハ３０２番地","","","","","","","届出","",""
"017201","fBiz00000213470000000001","石川県","金沢市","株式会社平和堂アル・プラザ金沢","カブシキガイシャヘイワドウアル・プラザカナザワ","⑪ 百貨店、総合スーパー","","石川県金沢市諸江町30番1号","",36.590795,136.645661,"0762601331","株式会社平和堂","3160001008726","滋賀県彦根市西今町１番地","","","","","","","届出","",""
"017201","fBiz00000218930000000001","石川県","金沢市","株式会社平和堂アルプラフーズマーケット大河端","カブシキカイシャヘイワドウアルプラフーズマーケットオコバタ","⑪ 百貨店、総合スーパー","","石川県金沢市大河端西2丁目15番地","",36.616266,136.639936,"076-208-2410","株式会社平和堂","3160001008726","滋賀県彦根市西今町１番地","","","","","","","届出","",""
"017201","fBiz00000220080000000001","石川県","金沢市","医療法人明仁会　かないわ病院　栄養部","イリョウホウジンメイジンカイカナイワビョウインエイヨウブ","㉖ 集団給食施設","集団給食施設","石川県金沢市普正寺町9－6","",36.598346,136.587753,"0762670337","医療法人明仁会　かないわ病院","8220005001889","石川県金沢市普正寺町9－6","","","","","","","届出","",""
"017201","fBiz00000221330000000040","石川県","金沢市","大阪屋ショップ近岡店","オオサカヤショップチカオカテン","⑪ 百貨店、総合スーパー","","石川県金沢市近岡町358番地","",36.612228,136.633025,"0762392212","株式会社大阪屋ショップ","7230001000473","富山県富山市赤田487番地1","","","","","","","届出","",""
"017201","fBiz00000221330000000047","石川県","金沢市","大阪屋ショップ大徳店","オオサカヤショップダイトクテン","③ 乳類販売業","","石川県金沢市松村町ヌ７５番","",36.589219,136.617741,"0762663070","株式会社大阪屋ショップ","7230001000473","富山県富山市赤田487番地1","","","","","","","届出","",""
"017201","fBiz00000221330000000047","石川県","金沢市","大阪屋ショップ大徳店","オオサカヤショップダイトクテン","⑪ 百貨店、総合スーパー","","石川県金沢市松村町ヌ７５番","",36.589219,136.617741,"0762663070","株式会社大阪屋ショップ","7230001000473","富山県富山市赤田487番地1","","","","","","","届出","",""
"017201","fBiz00000224410000000002","石川県","金沢市","株式会社　和食","カブシキガイシャ　ワショク","⑬ その他の食料・飲料販売業","製造・販売","石川県金沢市近岡町820-1","",36.612839,136.630518,"0762381322","株式会社　和食","9220001007617","石川県金沢市金沢市近岡町820-1","","","","","","","届出","",""
"017201","fBiz00000224690000000138","石川県","金沢市","MEGAドン・キホーテ金沢鞍月店","メガドン・キホーテカナザワクラツキテン","⑪ 百貨店、総合スーパー","小売業","石川県金沢市無量寺4丁目121番地","",36.601170,136.613967,"076-266-6211","株式会社ドン・キホーテ","3011001096370","東京都目黒区青葉台二丁目１９番１０号","","","","","","","届出","",""
"017201","fBiz00000224690000000139","石川県","金沢市","ドン・キホーテ金沢森本店","ドン・キホーテカナザワモリモトテン","⑪ 百貨店、総合スーパー","小売業","石川県金沢市南森本町ニ11番地1","",36.619665,136.688303,"076-257-5311","株式会社ドン・キホーテ","3011001096370","東京都目黒区青葉台二丁目１９番１０号","","","","","","","届出","",""
"017201","fBiz00000225810000000019","石川県","金沢市","MEGAドン・キホーテラパーク金沢店","メガドン・キホーテラパークカナザワテン","⑪ 百貨店、総合スーパー","小売業","石川県金沢市西泉4丁目11番地","ラパーク金沢1F",36.550659,136.631701,"076-247-3810","株式会社長崎屋","9013201016185","東京都目黒区青葉台2-19-10","","","","","","","届出","",""
"017201","fBiz00000225810000000019","石川県","金沢市","MEGAドン・キホーテラパーク金沢店","メガドン・キホーテラパークカナザワテン","⑫ 自動販売機による販売業（コップ式自動販売機（自動洗浄・屋内設置）及び営業許可の対象となる自動販売機を除く）","小売業","石川県金沢市西泉4丁目11番地","ラパーク金沢1F",36.550659,136.631701,"076-247-3810","株式会社長崎屋","9013201016185","東京都目黒区青葉台2-19-10","","","","","","","届出","",""
"017201","fBiz00000229590000000001","石川県","金沢市","ファミリーマート金沢小立野店","ファミリーマートカナザワコダツノテン","⑩ コンビニエンスストア","","石川県金沢市小立野３丁目２７－２２","",36.547258,136.678931,"0762233931","原亜都志","","石川県河北郡内灘町向粟崎２丁目２８１－１","","","","","","","届出","",""
"017201","fBiz00000229590000000002","石川県","金沢市","ファミリーマート金沢問屋町二丁目店","ファミリーマートカナザワトイヤマチニチョウメテン","⑩ コンビニエンスストア","","石川県金沢市問屋町２丁目１５－２","",36.604732,136.643436,"0762377324","原亜都志","","石川県河北郡内灘町向粟崎２丁目２８１－１","","","","","","","届出","",""
"017201","fBiz00000229590000000003","石川県","金沢市","ファミリーマート金沢専光寺浜店","ファミリーマートカナザワセンコウジハマテン","⑩ コンビニエンスストア","","石川県金沢市専光寺町ニ２－１","",36.580704,136.586845,"0762686261","原亜都志","","石川県河北郡内灘町向粟崎２丁目２８１－１","","","","","","","届出","",""
"017201","fBiz00000230450000000049","石川県","金沢市","ホテル日航金沢","ホテルニッコウカナザワ","⑤ コップ式自動販売機（自動洗浄・屋内設置）","","石川県金沢市本町2-15-1","",36.576340,136.649432,"","株式会社コーシン","6220001000310","石川県野々市市押野２丁目２１６番地","","","","","","","届出","",""
"017201","fBiz00000230450000000050","石川県","金沢市","医療法人社団光仁会木島病院(売店)","イリョウホウジンコウジンカイキジマビョウイン","⑤ コップ式自動販売機（自動洗浄・屋内設置）","","石川県金沢市松寺町子41-1","",36.601189,136.653519,"","株式会社コーシン","6220001000310","石川県野々市市押野２丁目２１６番地","","","","","","","届出","",""
"017201","fBiz00000230450000000051","石川県","金沢市","NTT大手町ビル","エヌティーティーオオテマチビル","⑤ コップ式自動販売機（自動洗浄・屋内設置）","","石川県金沢市大手町16-1","",36.569838,136.659094,"","株式会社コーシン","6220001000310","石川県野々市市押野２丁目２１６番地","","","","","","","届出","",""
"017201","fBiz00000230450000000054","石川県","金沢市","ＪＲ金沢駅　３番ホーム","ジェイアールカナザワエキサンバンホーム","⑫ 自動販売機による販売業（コップ式自動販売機（自動洗浄・屋内設置）及び営業許可の対象となる自動販売機を除く）","","石川県金沢市木ノ新保町1-1","",36.578238,136.647909,"","株式会社コーシン","6220001000310","石川県野々市市押野２丁目２１６番地","","","","","","","届出","",""
"017201","fBiz00000230450000000057","石川県","金沢市","TOTO㈱北陸支社","トートーカブシキガイシャホクリクシシャ","⑫ 自動販売機による販売業（コップ式自動販売機（自動洗浄・屋内設置）及び営業許可の対象となる自動販売機を除く）","","石川県金沢市鞍月４－１１０","",36.597640,136.623924,"","株式会社コーシン","6220001000310","石川県野々市市押野２丁目２１６番地","","","","","","","届出","",""
"017201","fBiz00000231810000000002","石川県","金沢市","わかばこども園","ワカバコドモエン","㉖ 集団給食施設","","石川県金沢市西大桑町7-5","",36.540589,136.670396,"","社会福祉法人わかば保育園","1220005002092","石川県金沢市西大桑町7-5","","","","","","","届出","",""
"017201","fBiz00000245830000000002","石川県","金沢市","BABY TALE 問屋町","ベイビーテールトイヤマチ","㉖ 集団給食施設","給食","石川県金沢市問屋町1-16","",36.604956,136.637992,"076-255-3316","株式会社　CNARIO  ","1220001022367","石川県金沢市問屋町1-16","","","","","","","届出","",""
"017201","fBiz00000249690000000013","石川県","金沢市","ゲンキー金沢近岡店","ゲンキーカナザワチカオカテン","⑬ その他の食料・飲料販売業","ドラッグストア","石川県金沢市近岡町294-2","",36.609849,136.631978,"0776-57-1560","ゲンキー株式会社","9210001007535","福井県坂井市丸岡町下久米田38字33番","","","","","","","届出","",""
"017201","fBiz00000249690000000027","石川県","金沢市","ゲンキー金沢田上店","ゲンキーカナザワタガミテン","⑬ その他の食料・飲料販売業","ドラッグストア","石川県金沢市田上本町4丁目204番1","",36.540154,136.692741,"076-234-5630","ゲンキー株式会社","9210001007535","福井県坂井市丸岡町下久米田38字33番","","","","","","","届出","",""
"017201","fBiz00000249690000000042","石川県","金沢市","ゲンキー金沢森本店","ゲンキーカナザワモリモトテン","⑬ その他の食料・飲料販売業","ドラッグストア","石川県金沢市堅田町甲99番1","",36.609417,136.699436,"076-208-4340","ゲンキー株式会社","9210001007535","福井県坂井市丸岡町下久米田38字33番","","","","","","","届出","",""
"017201","fBiz00000249690000000188","石川県","金沢市","ゲンキー西金沢駅北店","ゲンキーニシカナザワエキキタテン","⑬ その他の食料・飲料販売業","ドラッグストア","石川県金沢市米泉町10-1-166","",36.554681,136.620613,"076-255-7820","ゲンキー株式会社","9210001007535","福井県坂井市丸岡町下久米田38字33番","","","","","","","届出","",""
"017201","fBiz00000257590000000019","石川県","金沢市","ミスタードーナツアルビス高柳ショップ","ミスタドーナツアルビスタカヤナギショップ","⑬ その他の食料・飲料販売業","その他・飲料販売","石川県金沢市高柳町2丁目63-1","",36.592132,136.661366,"0762540080","株式会社ニユーフード産業北陸","4220001000452","石川県金沢市三口新町１丁目３番３３号","","","","","","","届出","",""
"017201","fBiz00000260680000000006","石川県","金沢市","やよい軒金沢福久店","ヤヨイケンカナザワフクヒサテン","① 飲食店営業","飲食店","石川県金沢市福久東1丁目88番地","",36.619141,136.686754,"076-258-1039","株式会社プレナス","2290001034974","福岡県福岡市博多区上牟田1丁目19-21","金沢市指令収衛指第16265号",2021/09/01,2021/09/01,2021/09/01,2027/08/31,"","許可"," ",""
"017201","fBiz00000282530000000093","石川県","金沢市","ステーキ宮　金沢中央店","ステーキミヤ　カナザワチュウオウテン","⑬ その他の食料・飲料販売業","","石川県金沢市長田2丁目28番25号","",36.578903,136.636880,"076-234-3781","株式会社アトム","3180001058182","神奈川県横浜市西区みなとみらい二丁目2-1","","","","","","","届出","",""
"017201","fBiz00000282530000000094","石川県","金沢市","ステーキ宮　金沢有松店","ステーキミヤ　カナザワアリマツテン","⑬ その他の食料・飲料販売業","","石川県金沢市有松3丁目6番28号","",36.539846,136.640014,"076-247-1323","株式会社アトム","3180001058182","神奈川県横浜市西区みなとみらい二丁目2-1","","","","","","","届出","",""
"017201","fBiz00000301920000000273","石川県","金沢市","むさしの森珈琲 金沢入江店","ムサシノモリコーヒーカナザワイリエテン","⑬ その他の食料・飲料販売業","","石川県金沢市入江２丁目８９","",36.566769,136.623973,"076-292-4114","株式会社すかいらーくレストランツ","2012401030556","東京都武蔵野市西久保１丁目２５番８号","","","","","","","届出","",""
"017201","fBiz00000301920000000509","石川県","金沢市","ガスト 金沢駅前店","ガストカナザワエキマエテン","⑬ その他の食料・飲料販売業","","石川県金沢市昭和町１３－２０","",36.574782,136.647597,"076-233-8067","株式会社すかいらーくレストランツ","2012401030556","東京都武蔵野市西久保１丁目２５番８号","","","","","","","届出","",""
"017201","fBiz00000301920000000697","石川県","金沢市","しゃぶ葉　金沢八日市店","シャブヨウカナザワヨウカイチテン","⑬ その他の食料・飲料販売業","","石川県金沢市八日市出町331","",36.553616,136.608772,"076-240-6041","株式会社すかいらーくレストランツ","2012401030556","東京都武蔵野市西久保１丁目２５番８号","","","","","","","届出","",""
"017201","fBiz00000301920000001031","石川県","金沢市","ガスト　金沢伏見台店","ガストカナザワフシミダイテン","⑬ その他の食料・飲料販売業","","石川県金沢市伏見台３丁目１－１１","",36.531507,136.638096,"076-280-8100","株式会社すかいらーくレストランツ","2012401030556","東京都武蔵野市西久保１丁目２５番８号","","","","","","","届出","",""
"017201","fBiz00000301920000001214","石川県","金沢市","しゃぶ葉　金沢神宮寺店","シャブヨウカナザワジングウジテン","⑬ その他の食料・飲料販売業","","石川県金沢市神宮寺２丁目２０－８","",36.583753,136.667525,"03-3748-9521","株式会社すかいらーくレストランツ","2012401030556","東京都武蔵野市西久保１丁目２５番８号","","","","","","","届出","",""
"017201","fBiz00000301920000002013","石川県","金沢市","ガスト 金沢入江店","ガストカナザワイリエテン","⑬ その他の食料・飲料販売業","","石川県金沢市入江２丁目１６８","",36.565410,136.626017,"076-291-5166","株式会社すかいらーくレストランツ","2012401030556","東京都武蔵野市西久保１丁目２５番８号","","","","","","","届出","",""
"017201","fBiz00000309370000000001","石川県","金沢市","くるみ保育園","クルミホイクエン","㉖ 集団給食施設","","石川県金沢市入江３丁目２１５番地","",36.568639,136.624881,"0762912717","社会福祉法人くるみ保育園","3220005002009","石川県金沢市入江３丁目２１５番地","","","","","","","届出","",""
"017201","fBiz00000323380000000132","石川県","金沢市","","","⑪ 百貨店、総合スーパー","","","","","","","","","","","","","","","","届出","",""
"017201","fBiz00000338820000000001","石川県","金沢市","株式会社 MEGLIY","カブシキガイシャ メグリー","⑦ 野菜果物販売業","農家","石川県金沢市赤土町へ２４０","",36.585253,136.600425,"0762168859","株式会社ＭＥＧＬＩＹ","8220005008372","石川県金沢市赤土町ヘ２４０番地","","","","","","","届出","",""
"017201","fBiz00000348210000000001","石川県","金沢市","薄井青果株式会社","ウスイセイカカブシキガイシャ","⑦ 野菜果物販売業","青果仲卸し業","石川県金沢市西念4-7-1","",36.584407,136.632845,"","薄井青果株式会社","6220001001283","石川県金沢市西念4-7-1","","","","","","","届出","",""
"017201","fBiz00000351500000000001","石川県","金沢市","カネ五広島商店","カネゴヒロシマショウテン","⑦ 野菜果物販売業","","石川県金沢市西念4丁目7番1号","金沢市中央卸売市場内",36.584407,136.632845,"0762611450","株式会社カネ五広島商店","4220001001863","石川県金沢市西念４丁目７番１号","","","","","","","届出","",""
"017201","fBiz00000351500000000002","石川県","金沢市","カネ五広島商店","カネゴヒロシマショウテン","⑦ 野菜果物販売業","","石川県金沢市西念4丁目7番1号","金沢市中央卸売市場内",36.586655,136.633157,"0762611450","株式会社カネ五広島商店","4220001001863","石川県金沢市西念４丁目７番１号","","","","","","","届出","",""
"017201","fBiz00000363450000000001","石川県","金沢市","三谷の里ときわ苑","ミタニノサトトキワエン","㉖ 集団給食施設","","石川県金沢市高坂町ト1番地","三谷の里ときわ苑",36.594064,136.744501,"0762574946","社会福祉法人金沢市民生協会　三谷の里ときわ苑","8220005001971","石川県金沢市高坂町ト1番地","","","","","","","届出","",""
"017201","fBiz00000381280000000010","石川県","金沢市","","","① 飲食店営業","露店営業","","","","","","","","","金沢市指令収衛指第16479号",2021/09/02,2021/09/02,2021/09/02,2026/09/30,"","許可"," ",""
"017201","fBiz00000397910000000003","石川県","金沢市","金沢まいもん寿司金沢駅店","カナザワマイモンスシカナザワエキテン","① 飲食店営業","","石川県金沢市木ノ新保町１－１","金沢百番街あんと",36.578238,136.647909,"","株式会社エムアンドケイ","7220001001497","石川県金沢市八日市３丁目６０４番地","金沢市指令収衛指第16704号",2021/11/05,2021/11/05,2021/11/05,2027/11/30,"","許可"," ",""
"017201","fBiz00000400530000000009","石川県","金沢市","株式会社大三茶舗　金沢店","カブシキカイシャダイサンチャホ　カナザワテン","⑬ その他の食料・飲料販売業","販売業","石川県金沢市諸江町上丁３０－１","",36.591180,136.648595,"076-234-1733","株式会社大三茶舗","5210001001847","福井県福井市松本４丁目２番５号","","","","","","","届出","",""
"017201","fBiz00000411510000000002","石川県","金沢市","金沢百番街","カナザワヒャクバンガイ","⑥ 弁当販売業","飲食料品小売業","石川県金沢市木ノ新保町1-1","",36.578238,136.647909,"","","","","","","","","","","届出","",""
"017201","fBiz00000411510000000003","石川県","金沢市","百番銘華","ヒャクバンメイカ","⑬ その他の食料・飲料販売業","飲食料品小売業","石川県金沢市木ノ新保町1-1","金沢百番街あんと",36.578238,136.647909,"","","","","","","","","","","届出","",""
"017201","fBiz00000418940000000006","石川県","金沢市","源　金沢百番街店","ミナモト　ヒャクバンガイテン","⑥ 弁当販売業","","石川県金沢市木ノ新保町1番1号","金沢百番街店　あんと",36.578238,136.647909,"076-223-8086","株式会社源","6230001003171","富山県富山市南央町37-6","","","","","","","届出","",""
"017201","fBiz00000418940000000006","石川県","金沢市","源　金沢百番街店","ミナモト　ヒャクバンガイテン","⑬ その他の食料・飲料販売業","","石川県金沢市木ノ新保町1番1号","金沢百番街店　あんと",36.578238,136.647909,"076-223-8086","株式会社源","6230001003171","富山県富山市南央町37-6","","","","","","","届出","",""
"017201","fBiz00000422950000000003","石川県","金沢市","","","⑬ その他の食料・飲料販売業","","","","","","","","","","","","","","","","届出","",""
