"自治体コード","行番号","都道府県名","市区町村名","営業施設名称、屋号又は商号","営業施設名称、屋号又は商号（フリガナ）","営業の種類","業態","営業施設所在地","営業施設方書","緯度","経度","営業施設電話番号","法人名","法人番号","法人住所","許可番号","初回許可年月日","許可年月日","許可開始日","許可満了日","廃業年月日","申請区分","許可条件","備考"
"019201","fBiz00000116360000000001","山梨県","甲府市","株式会社UNKOROHIME","カブシキガイシャウンコロヒメ","⑨ 通信販売・訪問販売による販売業","通信販売・訪問販売による販売業","山梨県甲府市若松町４−７","アーバンシティ甲府若松ウインフォート２０７",35.655749,138.570749,"0552092490","株式会社ＵＮＫＯＲＯＨＩＭＥ","2012401035992","山梨県甲府市若松町４番７号アーバンシティ甲府若松ウインフォート２０７","","","","","","","届出","",""
"019201","fBiz00000116360000000004","山梨県","甲府市","天然酵母無添加冷凍宅配専門店　panKOROhime","テンネンコウボムテンカレイトウタクハイセンモンテン　パンコロヒメ","⑪ 菓子製造業","パン屋","山梨県甲府市小瀬町６８－６","",35.627346,138.576308,"090-6158-2480","株式会社ＵＮＫＯＲＯＨＩＭＥ","2012401035992","山梨県甲府市若松町４番７号アーバンシティ甲府若松ウインフォート２０７","福指令第20251号",2023/07/03,2023/07/03,2023/07/03,2029/12/31,"","許可","なし",""
"019201","fBiz00000126850000000002","山梨県","甲府市","清月　貢川店","セイゲツ　クガワテン","⑬ その他の食料・飲料販売業","","山梨県甲府市貢川本町9-33","",35.655019,138.550528,"0552207000","株式会社　清月","5090001004945","山梨県南アルプス市桃園591","","","","","","","届出","",""
"019201","fBiz00000126850000000007","山梨県","甲府市","清月　セレオ甲府店","セイゲツ　セレオコウフテン","⑬ その他の食料・飲料販売業","","山梨県甲府市丸の内1-1-8","",35.667335,138.567850,"055-236-0688","株式会社　清月","5090001004945","山梨県南アルプス市桃園591","","","","","","","届出","",""
"019201","fBiz00000129180000000855","山梨県","甲府市","ダイソー　オギノイーストモールショッピングセンターバリオ店","ダイソー　オギノイーストモールショッピングセンターバリオテン","⑬ その他の食料・飲料販売業","","山梨県甲府市朝気３－１－１２","オギノイーストモールＳＣバリオ２階",35.649965,138.584479,"","株式会社大創産業","7240001022681","広島県東広島市西条吉行東一丁目４番１４号","","","","","","","届出","",""
"019201","fBiz00000129180000000862","山梨県","甲府市","ダイソー　グリーンタウン甲府東店","ダイソー　グリーンタウンコウフヒガシテン","⑬ その他の食料・飲料販売業","","山梨県甲府市向町２０２","グリーンタウン甲府東内",35.648449,138.609290,"","株式会社大創産業","7240001022681","広島県東広島市西条吉行東一丁目４番１４号","","","","","","","届出","",""
"019201","fBiz00000138470000000294","山梨県","甲府市","ダイレックス貢川店","ダイレックスクガワテン","⑪ 百貨店、総合スーパー","ﾃﾞｨｽｶｳﾝﾄｽﾄｱ","山梨県甲府市徳行1丁目6番4号","",35.655113,138.543342,"055-298-4400","ダイレックス株式会社","6300001004245","佐賀県佐賀市高木瀬町大字長瀬９３０番地","","","","","","","届出","",""
"019201","fBiz00000138470000000381","山梨県","甲府市","ダイレックス蓬沢店","ダイレックスヨモギサワテン","⑪ 百貨店、総合スーパー","ﾃﾞｨｽｶｳﾝﾄｽﾄｱ","山梨県甲府市蓬沢1丁目7番22号","",35.643748,138.589863,"055-236-9691","ダイレックス株式会社","6300001004245","佐賀県佐賀市高木瀬町大字長瀬９３０番地","","","","","","","届出","",""
"019201","fBiz00000139870000000316","山梨県","甲府市","Private gym THE BANANA","プライベートジムザバナナ","⑫ 自動販売機による販売業（コップ式自動販売機（自動洗浄・屋内設置）及び営業許可の対象となる自動販売機を除く）","","山梨県甲府市寿町2-12　ＫＭ－５ビル1Ｆ","",35.659565,138.561505,"","株式会社ドクターズ・マン","5010401058417","神奈川県横浜市青葉区美しが丘2-14-5","","","","","","","届出","",""
"019201","fBiz00000139870000000525","山梨県","甲府市","FIT PLACE 24 甲府向町","フィットプレイスニジュウヨンコウフムカイマチ","⑫ 自動販売機による販売業（コップ式自動販売機（自動洗浄・屋内設置）及び営業許可の対象となる自動販売機を除く）","","山梨県甲府市向町202","グリーンタウン甲府東A棟",35.648449,138.609290,"","株式会社ドクターズ・マン","5010401058417","神奈川県横浜市青葉区美しが丘2-14-5","","","","","","","届出","",""
"019201","fBiz00000140920000000048","山梨県","甲府市","フレッシュダイトー　セレオ甲府店","フレッシュダイトー　セレオコウフテン","⑦ 野菜果物販売業","青果販売専門店","山梨県甲府市丸の内1-1-8","セレオ甲府店",35.667322,138.567840,"055-223-1180","株式会社大東青果","8012801003486","東京都東大和市中央1-3-3","","","","","","","届出","",""
"019201","fBiz00000145420000000039","山梨県","甲府市","いちやまマート増坪店　清流物語","イチヤママートマスツボテン　セイリュウモノガタリ","⑤ コップ式自動販売機（自動洗浄・屋内設置）","水の量り売り自動販売機","山梨県甲府市住吉本町1188","",35.638790,138.591643,"","ビーエスエス株式会社","3010001122467","東京都中央区日本橋二丁目16番2号","","","","","","","届出","",""
"019201","fBiz00000145420000000041","山梨県","甲府市","いちやまマート塩部店　清流物語","イチヤママートシオベテン　セイリュウモノガタリ","⑤ コップ式自動販売機（自動洗浄・屋内設置）","水の量り売り自動販売機","山梨県甲府市塩部1-1-10","",35.670178,138.559875,"","ビーエスエス株式会社","3010001122467","東京都中央区日本橋二丁目16番2号","","","","","","","届出","",""
"019201","fBiz00000145420000000042","山梨県","甲府市","いちやまマート徳行店　清流物語","イチヤママートトクギョウテン　セイリュウモノガタリ","⑤ コップ式自動販売機（自動洗浄・屋内設置）","水の量り売り自動販売機","山梨県甲府市徳行2-13-3","",35.650642,138.546032,"","ビーエスエス株式会社","3010001122467","東京都中央区日本橋二丁目16番2号","","","","","","","届出","",""
"019201","fBiz00000145420000000051","山梨県","甲府市","いちやまマート湯村店　清流物語","イチヤママートユムラテン　セイリュウモノガタリ","⑫ 自動販売機による販売業（コップ式自動販売機（自動洗浄・屋内設置）及び営業許可の対象となる自動販売機を除く）","水の量り売り自動販売機","山梨県甲府市千塚1-9-13","",35.680400,138.545143,"","ビーエスエス株式会社","3010001122467","東京都中央区日本橋二丁目16番2号","","","","","","","届出","",""
"019201","fBiz00000146310000000282","山梨県","甲府市","スターバックスコーヒー甲府和戸通り店","スターバックスコーヒーコウフワドドオリテン","⑬ その他の食料・飲料販売業","喫茶店","山梨県甲府市向町172-4","",35.648586,138.612599,"055-236-3115","スターバックスコーヒージャパン株式会社","7011001031943","東京都品川区上大崎2-25-2","","","","","","","届出","",""
"019201","fBiz00000146310000000333","山梨県","甲府市","スターバックスコーヒー甲府平和通り店","スターバックスコーヒーコウフヘイワドオリテン","⑬ その他の食料・飲料販売業","喫茶店","山梨県甲府市住吉2-6-17","",35.636265,138.566784,"055-242-7871","スターバックスコーヒージャパン株式会社","7011001031943","東京都品川区上大崎2-25-2","","","","","","","届出","",""
"019201","fBiz00000198770000000001","山梨県","甲府市","","","㉖ 集団給食施設","集団給食施設","","","","","","","","","","","","","","","届出","",""
"019201","fBiz00000204310000000118","山梨県","甲府市","","","⑤ コップ式自動販売機（自動洗浄・屋内設置）","","","","","","","","","","","","","","","","届出","",""
"019201","fBiz00000149180000000042","山梨県","甲府市","ツルハドラッグ甲府徳行店","ツルハドラッグコウフトクギョウテン","⑬ その他の食料・飲料販売業","","山梨県甲府市徳行2丁目17番3号","",35.648645,138.548583,"055-244-2767","株式会社ツルハ","1430001010672","北海道札幌市東区北二十四条東二十丁目1番21号","","","","","","","届出","",""
"019201","fBiz00000149180000000119","山梨県","甲府市","ツルハドラッグ和戸店","ツルハドラッグワドテン","⑪ 百貨店、総合スーパー","","山梨県甲府市和戸町814-1","ﾌﾚｽﾎﾟ甲府東SC内",35.653362,138.610309,"055-236-0108","株式会社ツルハ","1430001010672","北海道札幌市東区北二十四条東二十丁目1番21号","","","","","","","届出","",""
"019201","fBiz00000149180000000121","山梨県","甲府市","ツルハドラッグ甲府朝気店","ツルハドラッグコウフアサケテン","⑪ 百貨店、総合スーパー","ドラッグストア","山梨県甲府市朝気3丁目17-15","",35.648368,138.581354,"055-230-2322","株式会社ツルハ","1430001010672","北海道札幌市東区北二十四条東二十丁目1番21号","","","","","","","届出","",""
"019201","fBiz00000149180000000127","山梨県","甲府市","ツルハドラッグ甲府中小河原店","ツルハドラッグコウフナカコガワラテン","⑪ 百貨店、総合スーパー","","山梨県甲府市中小河原1丁目9番3号","",35.635055,138.570128,"055-220-2268","株式会社ツルハ","1430001010672","北海道札幌市東区北二十四条東二十丁目1番21号","","","","","","","届出","",""
"019201","fBiz00000149180000000130","山梨県","甲府市","ツルハドラッグ甲府向町店","ツルハドラッグコウフムカイマチテン","⑪ 百貨店、総合スーパー","","山梨県甲府市向町１４０－１","",35.649224,138.610591,"055-236-6268","株式会社ツルハ","1430001010672","北海道札幌市東区北二十四条東二十丁目1番21号","","","","","","","届出","",""
"019201","fBiz00000149180000000185","山梨県","甲府市","ツルハドラッグ甲府高畑店","ツルハドラッグコウフタカバタケテン","⑪ 百貨店、総合スーパー","","山梨県甲府市高畑1丁目10番5号","",35.653122,138.562030,"055-231-8858","株式会社ツルハ","1430001010672","北海道札幌市東区北二十四条東二十丁目1番21号","","","","","","","届出","",""
"019201","fBiz00000149180000000223","山梨県","甲府市","ツルハドラッグ甲府国母店","ツルハドラッグコウフコクボテン","⑪ 百貨店、総合スーパー","","山梨県甲府市国母2丁目3番15号","",35.642270,138.559296,"055-221-8268","株式会社ツルハ","1430001010672","北海道札幌市東区北二十四条東二十丁目1番21号","","","","","","","届出","",""
"019201","fBiz00000150970000000254","山梨県","甲府市","","","⑬ その他の食料・飲料販売業","","","","","","","","","","","","","","","","届出","",""
"019201","fBiz00000150970000000255","山梨県","甲府市","","","⑬ その他の食料・飲料販売業","","","","","","","","","","","","","","","","届出","",""
"019201","fBiz00000153630000000127","山梨県","甲府市","甲府国母営業所","コウフコクボエイギョウショ","㉖ 集団給食施設","集団給食施設(デイサービス)","山梨県甲府市国母８丁目２１番２５号","",35.631973,138.551787,"055-236-2772","株式会社ツクイ","1020001136162","神奈川県横浜市港南区上大岡西1丁目6番1号","","","","","","","届出","",""
"019201","fBiz00000153630000000242","山梨県","甲府市","甲府下飯田営業所","コウフシモイイダエイギョウショ","㉖ 集団給食施設","集団給食施設(デイサービス)","山梨県甲府市下飯田２－１２－１７","",35.665647,138.543247,"055-230-2286","株式会社ツクイ","1020001136162","神奈川県横浜市港南区上大岡西1丁目6番1号","","","","","","","届出","",""
"019201","fBiz00000153630000000516","山梨県","甲府市","甲府中央営業所","コウフチュウオウエイギョウショ","㉖ 集団給食施設","集団給食施設(デイサービス)","山梨県甲府市中央４－１２－４","",35.656453,138.573238,"055-221-1117","株式会社ツクイ","1020001136162","神奈川県横浜市港南区上大岡西1丁目6番1号","","","","","","","届出","",""
"019201","fBiz00000153630000000536","山梨県","甲府市","甲府富士見グループホーム","コウフフジミグループホーム","㉖ 集団給食施設","グループホーム","山梨県甲府市富士見二丁目２番２６号","",35.671420,138.548427,"055-255-5660","株式会社ツクイ","1020001136162","神奈川県横浜市港南区上大岡西1丁目6番1号","","","","","","","届出","",""
"019201","fBiz00000153630000000589","山梨県","甲府市","甲府大手営業所","コウフオオテエイギョウショ","㉖ 集団給食施設","集団給食施設(デイサービス)","山梨県甲府市大手２－４－４","",35.680326,138.577227,"055-251-3568","株式会社ツクイ","1020001136162","神奈川県横浜市港南区上大岡西1丁目6番1号","","","","","","","届出","",""
"019201","fBiz00000157080000000171","山梨県","甲府市","バロー国玉店","バロークダマテン","⑪ 百貨店、総合スーパー","","山梨県甲府市国玉町913番地1","",35.648176,138.598784,"055-236-7111","株式会社バロー","8200001031520","岐阜県多治見市大針町661-1","","","","","","","届出","",""
"019201","fBiz00000158150000000223","山梨県","甲府市","アルペンフィットネスクラブ甲府店","アルペンフィットネスクラブコウフテン","⑫ 自動販売機による販売業（コップ式自動販売機（自動洗浄・屋内設置）及び営業許可の対象となる自動販売機を除く）","","山梨県甲府市上阿原町345-1","",35.645382,138.610330,"0552333736","烏森電気株式会社","2180001029894","愛知県名古屋市中村区岩塚町3丁目34番地","","","","","","","届出","",""
"019201","fBiz00000158170000000128","山梨県","甲府市","かっぱ寿司　向町店","カッパズシ　ムコウマチテン","① 飲食店営業","寿司屋","山梨県甲府市向町298-1","",35.646760,138.612775,"055-228-6868","カッパ・クリエイト株式会社","7030001001979","神奈川県横浜市西区みなとみらい2-2-1ランドマークタワー12階","福指令第20975号",2023/02/16,2023/02/16,2023/02/16,2029/05/31,"","許可","なし",""
"019201","fBiz00000158170000000128","山梨県","甲府市","かっぱ寿司　向町店","カッパズシ　ムコウマチテン","⑬ その他の食料・飲料販売業","","山梨県甲府市向町298-1","",35.646760,138.612775,"055-228-6868","カッパ・クリエイト株式会社","7030001001979","神奈川県横浜市西区みなとみらい2-2-1ランドマークタワー12階","","","","","","","届出","",""
"019201","fBiz00000160330000000006","山梨県","甲府市","ニューデイズ甲府","ニューデイズコウフ","⑩ コンビニエンスストア","コンビニエンスストア","山梨県甲府市丸の内1－１－８","ＪＲ甲府駅構内",35.667322,138.567840,"055-236-0257","株式会社ＪＲ東日本クロスステーション","3011101042662","東京都渋谷区千駄ヶ谷５丁目３３番８号","","","","","","","届出","",""
"019201","fBiz00000160330000000007","山梨県","甲府市","ニューデイズキオスク甲府駅上りホーム","ニューデイズキオスクコウフエキノボリホーム","⑩ コンビニエンスストア","コンビニエンスストア","山梨県甲府市丸の内1－1－8","ＪＲ甲府駅構内",35.667322,138.567840,"042-521-6863","株式会社ＪＲ東日本クロスステーション","3011101042662","東京都渋谷区千駄ヶ谷５丁目３３番８号","","","","","","","届出","",""
"019201","fBiz00000160330000000066","山梨県","甲府市","kinseiken甲府","キンセイケンコウフ","⑬ その他の食料・飲料販売業","菓子販売業","山梨県甲府市丸の内１－１－８","ＪＲ甲府駅構内",35.667322,138.567840,"055-236-0258","株式会社ＪＲ東日本クロスステーション","3011101042662","東京都渋谷区千駄ヶ谷５丁目３３番８号","","","","","","","届出","",""
"019201","fBiz00000160330000000079","山梨県","甲府市","ニューデイズキオスク甲府エキナカフェスタンド","ニューデイズキオスクコウフエキナカフェスタンド","⑩ コンビニエンスストア","コンビニエンスストア","山梨県甲府市丸の内1-1-8　JR甲府駅構内","",35.667098,138.569063,"","株式会社ＪＲ東日本クロスステーション","3011101042662","東京都渋谷区千駄ヶ谷５丁目３３番８号","","","","","","","届出","",""
"019201","fBiz00000160330000000080","山梨県","甲府市","ニューデイズキオスク甲府エキナカフェスタンド","ニューデイズキオスクコウフエキナカフェスタンド","① 飲食店営業","コンビニエンスストア","山梨県甲府市丸の内１－１－８　ＪＲ甲府駅構内","",35.667098,138.569063,"055-236-0259","株式会社ＪＲ東日本クロスステーション","3011101042662","東京都渋谷区千駄ヶ谷５丁目３３番８号","福指令第20332号",2023/08/10,2023/08/10,2023/08/10,2029/01/31,"","許可","なし",""
"019201","fBiz00000161400000000013","山梨県","甲府市","","","⑪ 百貨店、総合スーパー","","","","","","","","","","","","","","","","届出","",""
"019201","fBiz00000161400000000014","山梨県","甲府市","","","⑪ 百貨店、総合スーパー","","","","","","","","","","","","","","","","届出","",""
"019201","fBiz00000161400000000015","山梨県","甲府市","","","⑪ 百貨店、総合スーパー","","","","","","","","","","","","","","","","届出","",""
"019201","fBiz00000161400000000016","山梨県","甲府市","","","⑪ 百貨店、総合スーパー","","","","","","","","","","","","","","","","届出","",""
"019201","fBiz00000161400000000017","山梨県","甲府市","","","⑪ 百貨店、総合スーパー","","","","","","","","","","","","","","","","届出","",""
"019201","fBiz00000161400000000018","山梨県","甲府市","","","⑪ 百貨店、総合スーパー","","","","","","","","","","","","","","","","届出","",""
"019201","fBiz00000161400000000019","山梨県","甲府市","","","⑪ 百貨店、総合スーパー","","","","","","","","","","","","","","","","届出","",""
"019201","fBiz00000161400000000020","山梨県","甲府市","","","⑪ 百貨店、総合スーパー","","","","","","","","","","","","","","","","届出","",""
"019201","fBiz00000161400000000021","山梨県","甲府市","","","⑪ 百貨店、総合スーパー","","","","","","","","","","","","","","","","届出","",""
"019201","fBiz00000168620000000065","山梨県","甲府市","コラニー文化ホール（山梨県立文化ホール）","コラニーブンカホールヤマナシケンリツブンカホール","⑫ 自動販売機による販売業（コップ式自動販売機（自動洗浄・屋内設置）及び営業許可の対象となる自動販売機を除く）","","山梨県甲府市寿町26-1","",35.658293,138.561400,"055-298-9131","ハーゲンダッツジャパン株式会社","1010401023721","東京都目黒区上目黒２丁目１番１号","","","","","","","届出","",""
"019201","fBiz00000174670000000002","山梨県","甲府市","","","⑦ 野菜果物販売業","直売所","","","","","","","","","","","","","","","届出","",""
"019201","fBiz00000174670000000003","山梨県","甲府市","","","⑦ 野菜果物販売業","直売所","","","","","","","","","","","","","","","届出","",""
"019201","fBiz00000175450000000004","山梨県","甲府市","マルハン甲府店","マルハンコウフテン","⑫ 自動販売機による販売業（コップ式自動販売機（自動洗浄・屋内設置）及び営業許可の対象となる自動販売機を除く）","","山梨県甲府市国母八丁目20番10号","",35.631724,138.553587,"","株式会社ロッテ","1011101044248","東京都新宿区西新宿3-20-1","","","","","","","届出","",""
"019201","fBiz00000181230000000013","山梨県","甲府市","まるごとやまなし館","マルゴトヤマナシカン","⑦ 野菜果物販売業","アンテナショップ","山梨県甲府市丸の内1-6-１防災新館１階","",35.663648,138.568681,"055-298-4081","株式会社アルプス","7090001003053","山梨県中巨摩郡昭和町西条2799","","","","","","","届出","",""
"019201","fBiz00000185280000000006","山梨県","甲府市","クスリのサンロード国玉店","クスリノサンロードクダマテン","⑪ 百貨店、総合スーパー","ドラッグストア","山梨県甲府市国玉町940-2","",35.647912,138.597620,"055-242-9010","株式会社クスリのサンロード","5090001000556","山梨県甲府市後屋町４５２番地","","","","","","","届出","",""
"019201","fBiz00000190450000000002","山梨県","甲府市","山梨ヤクルト販売株式会社美咲センター","ヤマナシヤクルトハンバイカブシキカイシャミサキセンター","⑬ その他の食料・飲料販売業","","山梨県甲府市美咲1丁目12-15","",35.674689,138.563964,"055-253-3617","山梨ヤクルト販賣株式会社","9090001002334","山梨県甲府市下飯田１丁目３番２号","","","","","","","届出","",""
"019201","fBiz00000190450000000003","山梨県","甲府市","山梨ヤクルト販売株式会社貢川センター","ヤマナシヤクルトハンバイカブシキカイシャクガワセンター","⑬ その他の食料・飲料販売業","","山梨県甲府市上石田1丁目17-2","",35.657103,138.552768,"055-231-2772","山梨ヤクルト販賣株式会社","9090001002334","山梨県甲府市下飯田１丁目３番２号","","","","","","","届出","",""
"019201","fBiz00000190450000000004","山梨県","甲府市","山梨ヤクルト販売株式会社中央センター","ヤマナシヤクルトハンバイカブシキカイシャチュウオウセンター","⑬ その他の食料・飲料販売業","","山梨県甲府市青沼2丁目6-18","",35.654820,138.577012,"055-231-2774","山梨ヤクルト販賣株式会社","9090001002334","山梨県甲府市下飯田１丁目３番２号","","","","","","","届出","",""
"019201","fBiz00000190450000000006","山梨県","甲府市","山梨ヤクルト販売株式会社甲府南センター","ヤマナシヤクルトハンバイカブシキカイシャコウフミナミセンター","⑬ その他の食料・飲料販売業","","山梨県甲府市上町1311-1","",35.633217,138.586150,"055-241-9831","山梨ヤクルト販賣株式会社","9090001002334","山梨県甲府市下飯田１丁目３番２号","","","","","","","届出","",""
"019201","fBiz00000190450000000013","山梨県","甲府市","山梨ヤクルト販売株式会社倉庫","ヤマナシヤクルトハンバイカブシキカイシャソウコ","⑬ その他の食料・飲料販売業","","山梨県甲府市下飯田1丁目3-2","",35.669241,138.544322,"055-237-8960","山梨ヤクルト販賣株式会社","9090001002334","山梨県甲府市下飯田１丁目３番２号","","","","","","","届出","",""
"019201","fBiz00000190450000000030","山梨県","甲府市","","","⑫ 自動販売機による販売業（コップ式自動販売機（自動洗浄・屋内設置）及び営業許可の対象となる自動販売機を除く）","","","","","","","","","","","","","","","","届出","",""
"019201","fBiz00000190450000000031","山梨県","甲府市","","","⑫ 自動販売機による販売業（コップ式自動販売機（自動洗浄・屋内設置）及び営業許可の対象となる自動販売機を除く）","","","","","","","","","","","","","","","","届出","",""
"019201","fBiz00000190450000000035","山梨県","甲府市","","","⑫ 自動販売機による販売業（コップ式自動販売機（自動洗浄・屋内設置）及び営業許可の対象となる自動販売機を除く）","","","","","","","","","","","","","","","","届出","",""
"019201","fBiz00000190450000000058","山梨県","甲府市","","","⑫ 自動販売機による販売業（コップ式自動販売機（自動洗浄・屋内設置）及び営業許可の対象となる自動販売機を除く）","","","","","","","","","","","","","","","","届出","",""
