"018201","fBiz00000400530000000002","福井県","福井市","株式会社大三茶舗　工場","カブシキカイシャダイサンチャホ　コウジョウ","⑬ その他の食料・飲料販売業","製造・加工業","福井県福井市高柳１丁目１７０１番地","",36.089484,136.244595,"0776-54-3350","株式会社大三茶舗","5210001001847","福井県福井市松本４丁目２番５号","","","","","","","届出","",""
"018201","fBiz00000400530000000002","福井県","福井市","株式会社大三茶舗　工場","カブシキカイシャダイサンチャホ　コウジョウ","㉑ 製茶業","製造・加工業","福井県福井市高柳１丁目１７０１番地","",36.089484,136.244595,"0776-54-3350","株式会社大三茶舗","5210001001847","福井県福井市松本４丁目２番５号","","","","","","","届出","",""
"018201","fBiz00000400530000000003","福井県","福井市","株式会社大三茶舗　卸売市場店","カブシキカイシャダイサンチャホ　オロシウリイチバテン","⑦ 野菜果物販売業","販売業","福井県福井市大和田１丁目１０１","",36.092286,136.246393,"0776-53-0030","株式会社大三茶舗","5210001001847","福井県福井市松本４丁目２番５号","","","","","","","届出","",""
"018201","fBiz00000400530000000003","福井県","福井市","株式会社大三茶舗　卸売市場店","カブシキカイシャダイサンチャホ　オロシウリイチバテン","⑬ その他の食料・飲料販売業","販売業","福井県福井市大和田１丁目１０１","",36.092286,136.246393,"0776-53-0030","株式会社大三茶舗","5210001001847","福井県福井市松本４丁目２番５号","","","","","","","届出","",""
"018201","fBiz00000400530000000004","福井県","福井市","株式会社大三茶舗　エルパ店","カブシキカイシャダイサンチャホ　エルパテン","⑦ 野菜果物販売業","販売業","福井県福井市大和田２丁目１２１２","",36.095593,136.249633,"0776-57-2533","株式会社大三茶舗","5210001001847","福井県福井市松本４丁目２番５号","","","","","","","届出","",""
"018201","fBiz00000400530000000004","福井県","福井市","株式会社大三茶舗　エルパ店","カブシキカイシャダイサンチャホ　エルパテン","⑬ その他の食料・飲料販売業","販売業","福井県福井市大和田２丁目１２１２","",36.095593,136.249633,"0776-57-2533","株式会社大三茶舗","5210001001847","福井県福井市松本４丁目２番５号","","","","","","","届出","",""
"018201","fBiz00000400530000000005","福井県","福井市","株式会社大三茶舗　パリオ店","カブシキカイシャダイサンチャホ　パリオテン","⑦ 野菜果物販売業","販売業","福井県福井市松城町１２－７","",36.062213,136.240738,"0776-25-8830","株式会社大三茶舗","5210001001847","福井県福井市松本４丁目２番５号","","","","","","","届出","",""
"018201","fBiz00000400530000000005","福井県","福井市","株式会社大三茶舗　パリオ店","カブシキカイシャダイサンチャホ　パリオテン","⑬ その他の食料・飲料販売業","販売業","福井県福井市松城町１２－７","",36.062213,136.240738,"0776-25-8830","株式会社大三茶舗","5210001001847","福井県福井市松本４丁目２番５号","","","","","","","届出","",""
"018201","fBiz00000400530000000006","福井県","福井市","株式会社大三茶舗　ベル店","カブシキカイシャダイサンチャホ　ベルテン","⑦ 野菜果物販売業","販売業","福井県福井市花堂南２丁目１６－１","",36.032448,136.211998,"0776-34-0333","株式会社大三茶舗","5210001001847","福井県福井市松本４丁目２番５号","","","","","","","届出","",""
"018201","fBiz00000400530000000006","福井県","福井市","株式会社大三茶舗　ベル店","カブシキカイシャダイサンチャホ　ベルテン","⑬ その他の食料・飲料販売業","販売業","福井県福井市花堂南２丁目１６－１","",36.032448,136.211998,"0776-34-0333","株式会社大三茶舗","5210001001847","福井県福井市松本４丁目２番５号","","","","","","","届出","",""
"018201","fBiz00000402000000000001","福井県","福井市","ふくい鮮市場　手摘屋","フクイセンイチバ　テヅミヤ","⑦ 野菜果物販売業","販売業","福井県福井市大和田１丁目１０１","",36.092286,136.246393,"0776-43-0604","有限会社手摘屋","3210002004818","福井県福井市松本４丁目２番５号","","","","","","","届出","",""
"018201","fBiz00000425590000000004","福井県","福井市","協立青果株式会社","キョウリツセイカカブシキカイシャ","⑦ 野菜果物販売業","青果卸売業","福井県福井市大和田1-101","",36.092286,136.246393,"0776-53-1166","協立青果株式会社","5210001001046","福井県福井市大和田1-101","","","","","","","届出","",""
"018201","fBiz00000451480000000025","福井県","福井市","丸源ラーメン 福井若杉店","マルゲンラーメンフクイワカスギテン","⑬ その他の食料・飲料販売業","","福井県福井市若杉1-2901","",36.058063,136.187909,"0776-35-6450","株式会社物語コーポレーション","7180301007414","愛知県豊橋市西岩田５丁目７番地の１１","","","","","","","届出","",""
"018201","fBiz00000458310000000001","福井県","福井市","マルナカ青果株式会社","マルナカセイカカブシキガイシャ","⑦ 野菜果物販売業","卸売","福井県福井市大和田１－１０１","福井中央卸売市場",36.092286,136.246393,"0776532350","マルナカ青果株式会社","8180301029184","福井県福井市大和田１－１０１　福井中央卸売市場","","","","","","","届出","",""
"018201","fBiz00000461710000000002","福井県","福井市","","","⑬ その他の食料・飲料販売業","","","","","","","","","","","","","","","","届出","",""
"018201","fBiz00000463880000000010","福井県","福井市","酒のソクハイ福井片町店","サケノソクハイフクイカタマチテン","⑬ その他の食料・飲料販売業","酒類全般、食料飲料水小売販売業","福井県福井市順化2丁目20-12","",36.066033,136.214809,"0776-89-1920","株式会社サケネット","1160001016276","滋賀県守山市水保町1125-1","","","","","","","届出","",""
"018201","fBiz00000581340000000405","福井県","福井市","","","⑫ 自動販売機による販売業（コップ式自動販売機（自動洗浄・屋内設置）及び営業許可の対象となる自動販売機を除く）","","","","","","","","","","","","","","","","届出","",""
"018201","fBiz00000476230000000004","福井県","福井市","大森整形外科医院2F本館","オオモリセイケイゲカイインニカイホンカン","⑫ 自動販売機による販売業（コップ式自動販売機（自動洗浄・屋内設置）及び営業許可の対象となる自動販売機を除く）","自動販売機","福井県福井市北四ツ居3-14-12","",36.067568,136.246014,"0776-57-5000","英光産業株式会社","7210001000368","福井県福井市成和２丁目306番地","","","","","","","届出","",""
"018201","fBiz00000476230000000007","福井県","福井市","(社)タクティクス福井 福井北営業所","シヤ　タクティクスフクイ　フクイキタエイギョウショ","⑤ コップ式自動販売機（自動洗浄・屋内設置）","自動販売機","福井県福井市田原2丁目5-11","",36.071383,136.212788,"0776-43-9320","英光産業株式会社","7210001000368","福井県福井市成和２丁目306番地","","","","","","","届出","",""
"018201","fBiz00000476230000000008","福井県","福井市","(社)タクティクス福井 FLAP","シヤ  タクティクスフクイ  フラップ","⑤ コップ式自動販売機（自動洗浄・屋内設置）","自動販売機","福井県福井市中央1丁目21-37","ﾘﾍﾞﾗﾙｱｰﾂﾋﾞﾙ302",36.060489,136.220127,"0776-63-5341","英光産業株式会社","7210001000368","福井県福井市成和２丁目306番地","","","","","","","届出","",""
"018201","fBiz00000476230000000009","福井県","福井市","えちぜん鉄道㈱","エチゼンテツドウカブシキガイシャ","⑤ コップ式自動販売機（自動洗浄・屋内設置）","自動販売機","福井県福井市松本上町15-3-1","",36.073070,136.233659,"0776-52-7788","英光産業株式会社","7210001000368","福井県福井市成和２丁目306番地","","","","","","","届出","",""
"018201","fBiz00000476230000000010","福井県","福井市","メモリーナ紫苑","メモリーナシオン","⑤ コップ式自動販売機（自動洗浄・屋内設置）","自動販売機","福井県福井市丸山1丁目407","",36.073648,136.242781,"0776-57-8277","英光産業株式会社","7210001000368","福井県福井市成和２丁目306番地","","","","","","","届出","",""
"018201","fBiz00000476230000000011","福井県","福井市","パナソニック㈱森田工場","パナソニックカブシキガイシャモリタコウジョウ","⑫ 自動販売機による販売業（コップ式自動販売機（自動洗浄・屋内設置）及び営業許可の対象となる自動販売機を除く）","自動販売機","福井県福井市定正町401番地","",36.120465,136.225754,"090-5159-3907","英光産業株式会社","7210001000368","福井県福井市成和２丁目306番地","","","","","","","届出","",""
"018201","fBiz00000478500000000002","福井県","福井市","若廣　福井店","ワカヒロ　フクイテン","⑥ 弁当販売業","","福井県福井市中央1丁目1","",36.062056,136.223088,"0776-23-3844","株式会社若廣","3210002014255","福井県小浜市川崎1-3-5","","","","","","","届出","",""
"018201","fBiz00000497010000000001","福井県","福井市","有）服部ブロー","ハットリブロー","㉗ 器具、容器包装の製造・加工業（合成樹脂が使用された器具又は容器包装の製造、加工に限る。）","","福井県福井市福井市和田中1－322","",36.047706,136.245459,"","有限会社服部ブロー","5210002008536","福井県福井市下馬１丁目１７０２番地","","","","","","","届出","",""
"018201","fBiz00000497960000000026","福井県","福井市","クスリのアオキ下江守店","クスリノアオキシモエモリテン","⑪ 百貨店、総合スーパー","ドラッグストア","福井県福井市下江守町27-12","",36.044044,136.181526,"0776-35-1641","株式会社クスリのアオキ","2220001008745","石川県白山市松本町２５１２番地","","","","","","","届出","",""
"018201","fBiz00000497960000000163","福井県","福井市","クスリのアオキ新田塚店","クスリノアオキニッタヅカテン","⑪ 百貨店、総合スーパー","ドラッグストア","福井県福井市新田塚2丁目33番5号","",36.089175,136.203073,"0776-20-1000","株式会社クスリのアオキ","2220001008745","石川県白山市松本町２５１２番地","","","","","","","届出","",""
"018201","fBiz00000497960000000164","福井県","福井市","クスリのアオキ高木中央店","クスリノアオキタカギチュウオウテン","⑪ 百貨店、総合スーパー","ドラッグストア","福井県福井市高木中央1丁目2201番地","",36.089934,136.234179,"0776-57-0410","株式会社クスリのアオキ","2220001008745","石川県白山市松本町２５１２番地","","","","","","","届出","",""
"018201","fBiz00000497960000000388","福井県","福井市","クスリのアオキ福井若杉店","クスリノアオキフクイワカスギテン","⑪ 百貨店、総合スーパー","ドラッグストア","福井県福井市若杉4丁目1701番地","",36.056861,136.182802,"0776-35-3811","株式会社クスリのアオキ","2220001008745","石川県白山市松本町２５１２番地","","","","","","","届出","",""
"018201","fBiz00000497960000000389","福井県","福井市","クスリのアオキ舞屋店","クスリノアオキマイヤテン","⑪ 百貨店、総合スーパー","ドラッグストア","福井県福井市舞屋町6-5-2","",36.034692,136.202966,"0776-32-5200","株式会社クスリのアオキ","2220001008745","石川県白山市松本町２５１２番地","","","","","","","届出","",""
"018201","fBiz00000497960000000396","福井県","福井市","クスリのアオキ日之出店","クスリノアオキヒノデテン","⑪ 百貨店、総合スーパー","ドラッグストア","福井県福井市志比口1丁目11番30号","",36.068112,136.234501,"0776-52-5360","株式会社クスリのアオキ","2220001008745","石川県白山市松本町２５１２番地","","","","","","","届出","",""
"018201","fBiz00000497960000000398","福井県","福井市","クスリのアオキ大宮店","クスリノアオキオオミヤテン","⑪ 百貨店、総合スーパー","ドラッグストア","福井県福井市大宮2丁目23番27号","",36.083338,136.224334,"0776-30-0037","株式会社クスリのアオキ","2220001008745","石川県白山市松本町２５１２番地","","","","","","","届出","",""
"018201","fBiz00000497960000000400","福井県","福井市","クスリのアオキ月見店","クスリノアオキツキミテン","⑪ 百貨店、総合スーパー","ドラッグストア","福井県福井市月見4丁目2番28号","",36.047868,136.204344,"0776-32-5150","株式会社クスリのアオキ","2220001008745","石川県白山市松本町２５１２番地","","","","","","","届出","",""
"018201","fBiz00000497960000000405","福井県","福井市","クスリのアオキ花堂店","クスリノアオキハナンドウテン","⑪ 百貨店、総合スーパー","ドラッグストア","福井県福井市花堂東1丁目17番3号","",36.040563,136.220831,"0776-32-6150","株式会社クスリのアオキ","2220001008745","石川県白山市松本町２５１２番地","","","","","","","届出","",""
"018201","fBiz00000497960000000413","福井県","福井市","クスリのアオキ灯明寺店","クスリノアオキトウミョウジテン","⑪ 百貨店、総合スーパー","ドラッグストア","福井県福井市舟橋黒竜2丁目111番地","",36.099025,136.213852,"0776-27-0521","株式会社クスリのアオキ","2220001008745","石川県白山市松本町２５１２番地","","","","","","","届出","",""
"018201","fBiz00000497960000000419","福井県","福井市","クスリのアオキ文京店","クスリノアオキブンキョウテン","⑪ 百貨店、総合スーパー","ドラッグストア","福井県福井市文京6丁目3番3号","",36.075224,136.201661,"0776-21-0611","株式会社クスリのアオキ","2220001008745","石川県白山市松本町２５１２番地","","","","","","","届出","",""
"018201","fBiz00000497960000000423","福井県","福井市","クスリのアオキ森田店","クスリノアオキモリタテン","⑪ 百貨店、総合スーパー","ドラッグストア","福井県福井市石盛1丁目1805番地","",36.115597,136.229530,"0776-56-4811","株式会社クスリのアオキ","2220001008745","石川県白山市松本町２５１２番地","","","","","","","届出","",""
"018201","fBiz00000497960000000424","福井県","福井市","クスリのアオキ米松店","クスリノアオキヨネマツテン","⑪ 百貨店、総合スーパー","ドラッグストア","福井県福井市米松2丁目4番12号","",36.068721,136.241545,"0776-52-6211","株式会社クスリのアオキ","2220001008745","石川県白山市松本町２５１２番地","","","","","","","届出","",""
"018201","fBiz00000497960000000426","福井県","福井市","クスリのアオキ南四ツ居店","クスリノアオキミナミヨツイテン","⑪ 百貨店、総合スーパー","ドラッグストア","福井県福井市南四ツ居1丁目3番13号","",36.062648,136.243709,"0776-52-3711","株式会社クスリのアオキ","2220001008745","石川県白山市松本町２５１２番地","","","","","","","届出","",""
"018201","fBiz00000497960000000436","福井県","福井市","クスリのアオキ板垣店","クスリノアオキイタガキテン","⑪ 百貨店、総合スーパー","ドラッグストア","福井県福井市板垣5丁目130番地","",36.044133,136.229532,"0776-43-6561","株式会社クスリのアオキ","2220001008745","石川県白山市松本町２５１２番地","","","","","","","届出","",""
"018201","fBiz00000497960000000438","福井県","福井市","クスリのアオキ江守中店","クスリノアオキエモリナカテン","⑪ 百貨店、総合スーパー","ドラッグストア","福井県福井市江守中2丁目1507番地","",36.037349,136.195388,"0776-43-6808","株式会社クスリのアオキ","2220001008745","石川県白山市松本町２５１２番地","","","","","","","届出","",""
"018201","fBiz00000497960000000439","福井県","福井市","クスリのアオキ新保店","クスリノアオキシンボテン","⑪ 百貨店、総合スーパー","ドラッグストア","福井県福井市新保三丁目2215番地","",36.080533,136.253129,"0776-58-7130","株式会社クスリのアオキ","2220001008745","石川県白山市松本町２５１２番地","","","","","","","届出","",""
"018201","fBiz00000497960000000888","福井県","福井市","クスリのアオキ志比口店","クスリノアオキシヒグチテン","④ 魚介類販売業","ドラッグストア","福井県福井市志比口3丁目1番7号","",36.071847,136.233817,"0776-97-9115","株式会社クスリのアオキ","2220001008745","石川県白山市松本町２５１２番地","福井市指令生衛第22-3-100号",2022/07/15,2022/07/15,2022/07/15,2028/07/31,"","許可","",""
"018201","fBiz00000497960000000888","福井県","福井市","クスリのアオキ志比口店","クスリノアオキシヒグチテン","⑪ 菓子製造業","ドラッグストア","福井県福井市志比口3丁目1番7号","",36.071847,136.233817,"0776-97-9115","株式会社クスリのアオキ","2220001008745","石川県白山市松本町２５１２番地","福井市指令生衛第22-3-101号",2022/07/15,2022/07/15,2022/07/15,2028/07/31,"","許可","",""
"018201","fBiz00000497960000000888","福井県","福井市","クスリのアオキ志比口店","クスリノアオキシヒグチテン","㉕ そうざい製造業","ドラッグストア","福井県福井市志比口3丁目1番7号","",36.071847,136.233817,"0776-97-9115","株式会社クスリのアオキ","2220001008745","石川県白山市松本町２５１２番地","福井市指令生衛第22-3-102号",2022/07/15,2022/07/15,2022/07/15,2028/07/31,"","許可","",""
"018201","fBiz00000497960000000893","福井県","福井市","クスリのアオキ志比口店","クスリノアオキシヒグチテン","⑪ 百貨店、総合スーパー","ドラッグストア","福井県福井市志比口3丁目1番7号","",36.071847,136.233817,"0776-97-9115","株式会社クスリのアオキ","2220001008745","石川県白山市松本町２５１２番地","","","","","","","届出","",""
"018201","fBiz00000499030000000391","福井県","福井市","","","⑬ その他の食料・飲料販売業","","","","","","","","","","","","","","","","届出","",""
"018201","fBiz00000522010000000002","福井県","福井市","","","㉗ 器具、容器包装の製造・加工業（合成樹脂が使用された器具又は容器包装の製造、加工に限る。）","プラスチック製造業","","","","","","","","","","","","","","","届出","",""
"018201","fBiz00000555260000000011","福井県","福井市","移動スーパーとくし丸","イドウスーパートクシマル","⑬ その他の食料・飲料販売業","移動スーパー","福井県福井市大東1丁目10-18","",36.064858,136.252232,"09070866540","明瀬浩二","","福井県福井市大東1丁目10-18","","","","","","","届出","",""
"018201","fBiz00000555340000000001","福井県","福井市","フィットネスジムFIT365ワイプラザ福井新保","フィットネスジムフィットサンロクゴワイプラザフクイシンボ","⑫ 自動販売機による販売業（コップ式自動販売機（自動洗浄・屋内設置）及び営業許可の対象となる自動販売機を除く）","","福井県福井市新保北1-303","ワイプラザ新保　２F",36.087142,136.249337,"08028673980","カナショク株式会社","2220001001873","石川県金沢市弥勒町力140-1","","","","","","","届出","",""
"018201","fBiz00000568340000000215","福井県","福井市","餃子の王将 福井幾久店","ギョウザノオウショウ　フクイイクヒサテン","⑬ その他の食料・飲料販売業","その他の食料・飲料販売業 ","福井県福井市大宮1丁目11-27","",36.083640,136.225862,"0776-23-0055","株式会社王将フードサービス","3130001012441","京都府京都市山科区西野山射庭ノ上町２９４番地の１","","","","","","","届出","",""
"018201","fBiz00000581340000000011","福井県","福井市","","","⑫ 自動販売機による販売業（コップ式自動販売機（自動洗浄・屋内設置）及び営業許可の対象となる自動販売機を除く）","","","","","","","","","","","","","","","","届出","",""
"018201","fBiz00000581340000000015","福井県","福井市","","","⑫ 自動販売機による販売業（コップ式自動販売機（自動洗浄・屋内設置）及び営業許可の対象となる自動販売機を除く）","","","","","","","","","","","","","","","","届出","",""
"018201","fBiz00000581340000000064","福井県","福井市","","","⑫ 自動販売機による販売業（コップ式自動販売機（自動洗浄・屋内設置）及び営業許可の対象となる自動販売機を除く）","","","","","","","","","","","","","","","","届出","",""
"018201","fBiz00000581340000000076","福井県","福井市","","","⑫ 自動販売機による販売業（コップ式自動販売機（自動洗浄・屋内設置）及び営業許可の対象となる自動販売機を除く）","","","","","","","","","","","","","","","","届出","",""
"018201","fBiz00000581340000000122","福井県","福井市","","","⑫ 自動販売機による販売業（コップ式自動販売機（自動洗浄・屋内設置）及び営業許可の対象となる自動販売機を除く）","","","","","","","","","","","","","","","","届出","",""
"018201","fBiz00000581340000000144","福井県","福井市","","","⑫ 自動販売機による販売業（コップ式自動販売機（自動洗浄・屋内設置）及び営業許可の対象となる自動販売機を除く）","","","","","","","","","","","","","","","","届出","",""
"018201","fBiz00000581340000000163","福井県","福井市","","","⑫ 自動販売機による販売業（コップ式自動販売機（自動洗浄・屋内設置）及び営業許可の対象となる自動販売機を除く）","","","","","","","","","","","","","","","","届出","",""
"018201","fBiz00000581340000000175","福井県","福井市","","","⑫ 自動販売機による販売業（コップ式自動販売機（自動洗浄・屋内設置）及び営業許可の対象となる自動販売機を除く）","","","","","","","","","","","","","","","","届出","",""
"018201","fBiz00000581340000000411","福井県","福井市","","","⑫ 自動販売機による販売業（コップ式自動販売機（自動洗浄・屋内設置）及び営業許可の対象となる自動販売機を除く）","","","","","","","","","","","","","","","","届出","",""
"018201","fBiz00000581340000000447","福井県","福井市","","","⑫ 自動販売機による販売業（コップ式自動販売機（自動洗浄・屋内設置）及び営業許可の対象となる自動販売機を除く）","","","","","","","","","","","","","","","","届出","",""
"018201","fBiz00000581340000000514","福井県","福井市","","","⑫ 自動販売機による販売業（コップ式自動販売機（自動洗浄・屋内設置）及び営業許可の対象となる自動販売機を除く）","","","","","","","","","","","","","","","","届出","",""
"018201","fBiz00000581340000000541","福井県","福井市","","","⑫ 自動販売機による販売業（コップ式自動販売機（自動洗浄・屋内設置）及び営業許可の対象となる自動販売機を除く）","","","","","","","","","","","","","","","","届出","",""
"018201","fBiz00000581340000000564","福井県","福井市","","","⑫ 自動販売機による販売業（コップ式自動販売機（自動洗浄・屋内設置）及び営業許可の対象となる自動販売機を除く）","","","","","","","","","","","","","","","","届出","",""
"018201","fBiz00000581340000000609","福井県","福井市","","","⑫ 自動販売機による販売業（コップ式自動販売機（自動洗浄・屋内設置）及び営業許可の対象となる自動販売機を除く）","","","","","","","","","","","","","","","","届出","",""
"018201","fBiz00000581340000000645","福井県","福井市","","","⑫ 自動販売機による販売業（コップ式自動販売機（自動洗浄・屋内設置）及び営業許可の対象となる自動販売機を除く）","","","","","","","","","","","","","","","","届出","",""
"018201","fBiz00000581340000000686","福井県","福井市","","","⑫ 自動販売機による販売業（コップ式自動販売機（自動洗浄・屋内設置）及び営業許可の対象となる自動販売機を除く）","","","","","","","","","","","","","","","","届出","",""
