"018201","fBiz00000230450000000821","福井県","福井市","ｱﾚｱﾜｰﾙﾄﾞ舞屋店ﾌﾛｱｰ１階","アレアワールドマイヤテンフロアーイッカイ","⑤ コップ式自動販売機（自動洗浄・屋内設置）","","福井県福井市舞屋町6-201","",36.034535,136.204652,"","株式会社コーシン","6220001000310","石川県野々市市押野２丁目２１６番地","","","","","","","届出","",""
"018201","fBiz00000230450000000823","福井県","福井市","NEOZOO大和田店ﾌﾛｱｰ１階","ネオズーオオワダテンフロアーイッカイ","⑤ コップ式自動販売機（自動洗浄・屋内設置）","","福井県福井市高柳1-1205","",36.091776,136.244515,"","株式会社コーシン","6220001000310","石川県野々市市押野２丁目２１６番地","","","","","","","届出","",""
"018201","fBiz00000230450000000826","福井県","福井市","松浦機械製作所休憩室２階","マツウラキカイセイサクジョキュウケイシツニカイ","⑤ コップ式自動販売機（自動洗浄・屋内設置）","","福井県福井市東森田4-201","",36.123293,136.254019,"","株式会社コーシン","6220001000310","石川県野々市市押野２丁目２１６番地","","","","","","","届出","",""
"018201","fBiz00000230450000000827","福井県","福井市","福井県立図書館ﾌﾛｱｰ１階","フクイケンリツトショカンフロアーイッカイ","⑤ コップ式自動販売機（自動洗浄・屋内設置）","","福井県福井市下馬町51-11","",36.037037,136.242399,"","株式会社コーシン","6220001000310","石川県野々市市押野２丁目２１６番地","","","","","","","届出","",""
"018201","fBiz00000230450000000828","福井県","福井市","第一稀元素化学工業株式会社福井工場食堂２階","ダイイチキゲンソカガクコウギョウカブシキガイシャフクイコウジョウショクドウニカイ","⑤ コップ式自動販売機（自動洗浄・屋内設置）","","福井県福井市石橋町3-7-2","",36.155070,136.099423,"","株式会社コーシン","6220001000310","石川県野々市市押野２丁目２１６番地","","","","","","","届出","",""
"018201","fBiz00000230450000000829","福井県","福井市","飛騨運輸福井支店休憩処１階","ヒダウンユフクイシテンキュウケイトコロイッカイ","⑤ コップ式自動販売機（自動洗浄・屋内設置）","","福井県福井市浅水三ケ町5-5-1","",35.997604,136.195703,"","株式会社コーシン","6220001000310","石川県野々市市押野２丁目２１６番地","","","","","","","届出","",""
"018201","fBiz00000230450000000830","福井県","福井市","福井市医師会看護専門学校 休憩室2F","フクイシイシカイカンゴセンモンガッコウ　キュウケイシツニカイ","⑤ コップ式自動販売機（自動洗浄・屋内設置）","","福井県福井市大願寺1-5-23","",36.081420,136.230948,"","株式会社コーシン","6220001000310","石川県野々市市押野２丁目２１６番地","","","","","","","届出","",""
"018201","fBiz00000230450000000831","福井県","福井市","株式会社福井新聞社休憩室３階","カブシキガイシャフクイシンブンシャキュウケイシツサンカイ","⑤ コップ式自動販売機（自動洗浄・屋内設置）","","福井県福井市大和田2-801","",36.098813,136.250686,"","株式会社コーシン","6220001000310","石川県野々市市押野２丁目２１６番地","","","","","","","届出","",""
"018201","fBiz00000230450000000832","福井県","福井市","福井中央市場冷蔵株式会社　１階事務所","フクイチュウオウイチバレイゾウカブシキガイシャ　イッカイジムショ","⑤ コップ式自動販売機（自動洗浄・屋内設置）","","福井県福井市大和田1-101","",36.092298,136.246399,"","株式会社コーシン","6220001000310","石川県野々市市押野２丁目２１６番地","","","","","","","届出","",""
"018201","fBiz00000230450000000833","福井県","福井市","北陸電話工事株式会社定正ｾﾝﾀｰ従業員食堂１階","ホクリクデンワコウジカブシキガイシャサダマサセンタージュウギョウインショクドウイツカイ","⑤ コップ式自動販売機（自動洗浄・屋内設置）","","福井県福井市定正町508","",36.120171,136.223716,"","株式会社コーシン","6220001000310","石川県野々市市押野２丁目２１６番地","","","","","","","届出","",""
"018201","fBiz00000230450000000834","福井県","福井市","松浦機械製作所2F 休憩室２階","マツウラキカイセイサクショニカイキュウケイシツニカイ","⑤ コップ式自動販売機（自動洗浄・屋内設置）","","福井県福井市東森田4-201","",36.123293,136.254019,"","株式会社コーシン","6220001000310","石川県野々市市押野２丁目２１６番地","","","","","","","届出","",""
"018201","fBiz00000230450000000845","福井県","福井市","株式会社ﾀﾞﾅｯｸｽ栄工場１階","カブシキガイシャダナックスサカエコウジョウイッカイ","⑤ コップ式自動販売機（自動洗浄・屋内設置）","","福井県福井市栄町10-1","",36.110745,136.224305,"","株式会社コーシン","6220001000310","石川県野々市市押野２丁目２１６番地","","","","","","","届出","",""
"018201","fBiz00000230450000000846","福井県","福井市","極楽湯店内 ﾌﾛｱｰ１階","ゴクラクユテンナイ　フロアーイッカイ","⑤ コップ式自動販売機（自動洗浄・屋内設置）","","福井県福井市開発1-118","",36.074522,136.239173,"","株式会社コーシン","6220001000310","石川県野々市市押野２丁目２１６番地","","","","","","","届出","",""
"018201","fBiz00000230450000000847","福井県","福井市","土田鶏卵本社GPｾﾝﾀｰ休憩室２階","ツチダケイランホンシャジーピセンターキュウケイシツニカイ","⑤ コップ式自動販売機（自動洗浄・屋内設置）","","福井県福井市御幸2-25-44","",36.058191,136.234159,"","株式会社コーシン","6220001000310","石川県野々市市押野２丁目２１６番地","","","","","","","届出","",""
"018201","fBiz00000230450000000848","福井県","福井市","ﾄﾅﾐ運輸福井支店 休憩室１階","トナミウンユフクイシテン　キュウケイシツイツカイ","⑤ コップ式自動販売機（自動洗浄・屋内設置）","","福井県福井市今市町１１字東三百歩７－１","",36.008977,136.205518,"","株式会社コーシン","6220001000310","石川県野々市市押野２丁目２１６番地","","","","","","","届出","",""
"018201","fBiz00000230450000000849","福井県","福井市","三菱ふそうﾄﾗｯｸ･ﾊﾞｽ株式会社福井支店自販機ｺｰﾅｰ1F","ミツビシフソウトラック・バスカブシキガイシャフクイシテンジハンキコーナーイッカイ","⑤ コップ式自動販売機（自動洗浄・屋内設置）","","福井県福井市今市町18-16","",36.009449,136.207058,"","株式会社コーシン","6220001000310","石川県野々市市押野２丁目２１６番地","","","","","","","届出","",""
"018201","fBiz00000230450000000850","福井県","福井市","福井県立病院 医局ﾌﾛｱｰ0５階","フクイケンリツビョウイン　イキョクフロアーゴカイ","⑤ コップ式自動販売機（自動洗浄・屋内設置）","","福井県福井市四ツ井2-8-1","",36.068779,136.239091,"","株式会社コーシン","6220001000310","石川県野々市市押野２丁目２１６番地","","","","","","","届出","",""
"018201","fBiz00000230450000000851","福井県","福井市","ｴﾙﾋﾟｽ株式会社店内１階","エルピスカブシキガイシャテンナイイッカイ","⑤ コップ式自動販売機（自動洗浄・屋内設置）","","福井県福井市松本4-11-11","",36.073386,136.218874,"","株式会社コーシン","6220001000310","石川県野々市市押野２丁目２１６番地","","","","","","","届出","",""
"018201","fBiz00000230450000000852","福井県","福井市","福井自動車学校ｽﾏｶﾌｪ通路１階","フクイジドウシャガッコウスマカフェツウロイッカイ","⑤ コップ式自動販売機（自動洗浄・屋内設置）","","福井県福井市上北野1-23-15","",36.063278,136.249070,"","株式会社コーシン","6220001000310","石川県野々市市押野２丁目２１６番地","","","","","","","届出","",""
"018201","fBiz00000230450000000853","福井県","福井市","ｾｰﾚﾝ株式会社新田塚(2F食堂)従業員食堂２階","セーレンカブシキガイシャニッタヅカニカイショクドウジュウギョウインショクドウニカイ","⑤ コップ式自動販売機（自動洗浄・屋内設置）","","福井県福井市新田塚1-60-1","",36.095174,136.206779,"","株式会社コーシン","6220001000310","石川県野々市市押野２丁目２１６番地","","","","","","","届出","",""
"018201","fBiz00000230450000000854","福井県","福井市","福井ｽﾀｼﾞｱﾑ自販機ｺｰﾅｰ１階","フクイスタジアムジハンキコーナーイッカイ","⑤ コップ式自動販売機（自動洗浄・屋内設置）","","福井県福井市新保町19-53","",36.084280,136.258100,"","株式会社コーシン","6220001000310","石川県野々市市押野２丁目２１６番地","","","","","","","届出","",""
"018201","fBiz00000230450000000855","福井県","福井市","ｽﾊﾞﾙ食品株式会社通路１階","スバルショクヒンカブシキガイシャツウロイッカイ","⑤ コップ式自動販売機（自動洗浄・屋内設置）","","福井県福井市森行町24-1","",35.994539,136.195730,"","株式会社コーシン","6220001000310","石川県野々市市押野２丁目２１６番地","","","","","","","届出","",""
"018201","fBiz00000230450000001245","福井県","福井市","ｱﾙﾋﾞｽ森田店休憩室１階","アルビスモリタテンキュウケイシツイッカイ","⑤ コップ式自動販売機（自動洗浄・屋内設置）","","福井県福井市石盛2-2221","",36.115103,136.230957,"","株式会社コーシン","6220001000310","石川県野々市市押野２丁目２１６番地","","","","","","","届出","",""
"018201","fBiz00000230450000001246","福井県","福井市","株式会社平和堂ﾌﾚﾝﾄﾞﾏｰﾄ開発店 社員食堂１階","カブシキガイシャヘイワドウフレンドマートカイホツテン　シャインショクドウイッカイ","⑤ コップ式自動販売機（自動洗浄・屋内設置）","","福井県福井市西開発2-101-1","",36.079071,136.236608,"","株式会社コーシン","6220001000310","石川県野々市市押野２丁目２１６番地","","","","","","","届出","",""
"018201","fBiz00000230450000001247","福井県","福井市","大原学園 福井校8F通路","オオハラガクエン フクイコウハチカイツウロ","⑤ コップ式自動販売機（自動洗浄・屋内設置）","","福井県福井市大手2-9-1","",36.063615,136.222663,"","株式会社コーシン","6220001000310","石川県野々市市押野２丁目２１６番地","","","","","","","届出","",""
"018201","fBiz00000230450000001248","福井県","福井市","ｱﾌﾟﾚｼｵ米松店右ﾌﾟﾚｲｿﾞｰﾝ２階","アプレシオヨネマツテンミギプレイゾーンニカイ","⑤ コップ式自動販売機（自動洗浄・屋内設置）","","福井県福井市長本町610","",36.072624,136.243021,"","株式会社コーシン","6220001000310","石川県野々市市押野２丁目２１６番地","","","","","","","届出","",""
"018201","fBiz00000230450000001249","福井県","福井市","ｱﾌﾟﾚｼｵ米松店左ﾌﾟﾚｲｿﾞｰﾝ２階","アプレシオヨネマツテンヒダリプレイゾーンニカイ","⑤ コップ式自動販売機（自動洗浄・屋内設置）","","福井県福井市長本町610","",36.072624,136.243021,"","株式会社コーシン","6220001000310","石川県野々市市押野２丁目２１６番地","","","","","","","届出","",""
"018201","fBiz00000230450000001253","福井県","福井市","SCSKｻｰﾋﾞｽｳｪｱ株式会社福井事業所","エスシイエスケイサービスウェアカブシキガイシャフクイジギョウショ","⑤ コップ式自動販売機（自動洗浄・屋内設置）","","福井県福井市春山1-1-14","",36.067345,136.216089,"","株式会社コーシン","6220001000310","石川県野々市市押野２丁目２１６番地","","","","","","","届出","",""
"018201","fBiz00000230450000001256","福井県","福井市","ｱﾙﾋﾞｽ福井南店　社員食堂１階","アルビスフクイミナミテン　シャインショクドウイッカイ","⑤ コップ式自動販売機（自動洗浄・屋内設置）","","福井県福井市下河北町４字蓼野２番６","",34.805322,134.663980,"","株式会社コーシン","6220001000310","石川県野々市市押野２丁目２１６番地","","","","","","","届出","",""
"018201","fBiz00000230450000001258","福井県","福井市","ﾊﾟﾅｿﾆｯｸ森田工場森田工場 休憩処３階","パナソニックモリタコウジョウモリタコウジョウ　キュウケイトコロサンカイ","⑤ コップ式自動販売機（自動洗浄・屋内設置）","","福井県福井市定正町401","",36.120465,136.225754,"","株式会社コーシン","6220001000310","石川県野々市市押野２丁目２１６番地","","","","","","","届出","",""
"018201","fBiz00000230450000001259","福井県","福井市","ﾊﾟﾅｿﾆｯｸ森田工場森田工場４階","パナソニックモリタコウジョウモリタコウジョウヨンカイ","⑤ コップ式自動販売機（自動洗浄・屋内設置）","","福井県福井市定正町401","",36.120465,136.225754,"","株式会社コーシン","6220001000310","石川県野々市市押野２丁目２１６番地","","","","","","","届出","",""
"018201","fBiz00000230450000001260","福井県","福井市","ﾊﾟﾅｿﾆｯｸ森田工場森田工場１階","パナソニックモリタコウジョウモリタコウジョウイッカイ","⑤ コップ式自動販売機（自動洗浄・屋内設置）","","福井県福井市定正町401","",36.120465,136.225754,"","株式会社コーシン","6220001000310","石川県野々市市押野２丁目２１６番地","","","","","","","届出","",""
"018201","fBiz00000230450000001269","福井県","福井市","日本郵便株式会社福井中央郵便局4階食堂４階","ニホンユウビンカブシキガイシャフクイチュウオウユウビンキョクヨンカイショクドウヨンカイ","⑤ コップ式自動販売機（自動洗浄・屋内設置）","","福井県福井市大手3-1-28","",36.063178,136.221018,"","株式会社コーシン","6220001000310","石川県野々市市押野２丁目２１６番地","","","","","","","届出","",""
"018201","fBiz00000230450000001270","福井県","福井市","福井県警察本部自販機ｺｰﾅｰ地下一階","フクイケンケイサツホンブジハンキコーナーチカイッカイ","⑤ コップ式自動販売機（自動洗浄・屋内設置）","","福井県福井市大手3-17-1","",36.065182,136.220481,"","株式会社コーシン","6220001000310","石川県野々市市押野２丁目２１６番地","","","","","","","届出","",""
"018201","fBiz00000230450000001272","福井県","福井市","福井太陽株式会社従業員食堂２階","フクイタイヨウカブシキガイシャジュウギョウインショクドウニカイ","⑤ コップ式自動販売機（自動洗浄・屋内設置）","","福井県福井市石新保町28-67-2","",36.157599,136.105608,"","株式会社コーシン","6220001000310","石川県野々市市押野２丁目２１６番地","","","","","","","届出","",""
"018201","fBiz00000230450000001273","福井県","福井市","日本郵便株式会社福井南郵便局自販機ｺｰﾅｰ３階","ニホンユウビンカブシキガイシャフクイミナミユウビンキョクジハンキコーナーサンカイ","⑤ コップ式自動販売機（自動洗浄・屋内設置）","","福井県福井市板垣4-201","",36.045148,136.227630,"","株式会社コーシン","6220001000310","石川県野々市市押野２丁目２１６番地","","","","","","","届出","",""
"018201","fBiz00000230450000001274","福井県","福井市","ｵﾒｶﾞ舞屋店自販機ｺｰﾅｰ１階","オメガマイヤテンジハンキコーナーイッカイ","⑤ コップ式自動販売機（自動洗浄・屋内設置）","","福井県福井市舞屋町16字開堂６－１","",36.035304,136.206087,"","株式会社コーシン","6220001000310","石川県野々市市押野２丁目２１６番地","","","","","","","届出","",""
"018201","fBiz00000230450000001275","福井県","福井市","興和江守株式会社ﾌﾛｱｰ４階","コウワエモリカブシキガイシャフロアーヨンカイ","⑤ コップ式自動販売機（自動洗浄・屋内設置）","","福井県福井市毛矢1-6-23","",36.057288,136.215491,"","株式会社コーシン","6220001000310","石川県野々市市押野２丁目２１６番地","","","","","","","届出","",""
"018201","fBiz00000230450000001291","福井県","福井市","株式会社ｼﾞｬﾛｯｸ食堂２階","カブシキガイシャジャロックショクドウニカイ","⑤ コップ式自動販売機（自動洗浄・屋内設置）","","福井県福井市下河北町22-1","",36.017138,136.217130,"","株式会社コーシン","6220001000310","石川県野々市市押野２丁目２１６番地","","","","","","","届出","",""
"018201","fBiz00000230450000001292","福井県","福井市","ﾔﾏﾄ運輸株式会社福井主管支店従業員食堂２階","ヤマトウンユカブシキガイシャフクイシュカンシテンジュウギョウインショクドウニカイ","⑤ コップ式自動販売機（自動洗浄・屋内設置）","","福井県福井市間山町３沖田６０","",36.083822,136.281332,"","株式会社コーシン","6220001000310","石川県野々市市押野２丁目２１６番地","","","","","","","届出","",""
"018201","fBiz00000230450000001293","福井県","福井市","ﾏﾙﾊﾝ福井店ﾎｰﾙ１階","マルハンフクイテンホールイッカイ","⑤ コップ式自動販売機（自動洗浄・屋内設置）","","福井県福井市丸山1-107","",36.072460,136.243954,"","株式会社コーシン","6220001000310","石川県野々市市押野２丁目２１６番地","","","","","","","届出","",""
"018201","fBiz00000230450000001294","福井県","福井市","福井県赤十字血液ｾﾝﾀｰﾛﾋﾞｰ１階","フクイケンセキジュウジケツエキセンターロビーイッカイ","⑤ コップ式自動販売機（自動洗浄・屋内設置）","","福井県福井市月見3-3-23","",36.046653,136.208241,"","株式会社コーシン","6220001000310","石川県野々市市押野２丁目２１６番地","","","","","","","届出","",""
"018201","fBiz00000230450000001295","福井県","福井市","ﾄﾅﾐ運輸株式会社福井支店休憩室１階","トナミウンユカブシキガイシャフクイシテンキュウケイシツイッカイ","⑤ コップ式自動販売機（自動洗浄・屋内設置）","","福井県福井市今市町11-7-1","",36.008977,136.205489,"","株式会社コーシン","6220001000310","石川県野々市市押野２丁目２１６番地","","","","","","","届出","",""
"018201","fBiz00000230450000001297","福井県","福井市","ｴﾈｯｸｽ株式会社福井工場 (ﾘｻｲｸﾙ推進１階)休憩室１階","エネックスカブシキガイシャフクイコウジョウ リサイクルスイシンイッカイキュウケイシツイッカイ","⑤ コップ式自動販売機（自動洗浄・屋内設置）","","福井県福井市花堂中2-15-1","",36.037056,136.209659,"","株式会社コーシン","6220001000310","石川県野々市市押野２丁目２１６番地","","","","","","","届出","",""
"018201","fBiz00000230450000001298","福井県","福井市","ｴﾈｯｸｽ株式会社技術開発 食堂２階","エネックスカブシキガイシャギジュツカイハツ　ショクドウニカイ","⑤ コップ式自動販売機（自動洗浄・屋内設置）","","福井県福井市花堂中2-15-1","",36.037056,136.209659,"","株式会社コーシン","6220001000310","石川県野々市市押野２丁目２１６番地","","","","","","","届出","",""
"018201","fBiz00000230450000001299","福井県","福井市","ﾊﾟﾅｿﾆｯｸ森田工場    NO2森田工場 食堂４階","パナソニックモリタコウジョウ　ナンバーニモリタコウジョウ　ショクドウヨンカイ","⑤ コップ式自動販売機（自動洗浄・屋内設置）","","福井県福井市定正町401","",36.120465,136.225754,"","株式会社コーシン","6220001000310","石川県野々市市押野２丁目２１６番地","","","","","","","届出","",""
"018201","fBiz00000230450000001300","福井県","福井市","ｴﾈｯｸｽ株式会社出荷ｾﾝﾀｰ 工場１階","エネックスカブシキガイシャシュッカセンター コウジョウイッカイ","⑤ コップ式自動販売機（自動洗浄・屋内設置）","","福井県福井市花堂中2-15-1","",36.037056,136.209659,"","株式会社コーシン","6220001000310","石川県野々市市押野２丁目２１６番地","","","","","","","届出","",""
"018201","fBiz00000230450000001301","福井県","福井市","ｴﾈｯｸｽ株式会社本社 休憩室１階","エネックスカブシキガイシャホンシャ キュウケイシツイッカイ","⑤ コップ式自動販売機（自動洗浄・屋内設置）","","福井県福井市花堂中2-15-1","",36.037056,136.209659,"","株式会社コーシン","6220001000310","石川県野々市市押野２丁目２１６番地","","","","","","","届出","",""
"018201","fBiz00000230450000001319","福井県","福井市","松浦機械製作所　1F事務所側工場","マツウラキカイセイサクショ　イッカイジムショガワコウジョウ","⑤ コップ式自動販売機（自動洗浄・屋内設置）","","福井県福井市東森田4丁目201番地","",36.123293,136.254019,"","株式会社コーシン","6220001000310","石川県野々市市押野２丁目２１６番地","","","","","","","届出","",""
"018201","fBiz00000230450000001326","福井県","福井市","ぼんた　福井医療大学食堂","ボンタ　フクイイリョウダイガクショクドウ","⑫ 自動販売機による販売業（コップ式自動販売機（自動洗浄・屋内設置）及び営業許可の対象となる自動販売機を除く）","","福井県福井市江上町55-13-1","",36.129374,136.165613,"","株式会社コーシン","6220001000310","石川県野々市市押野２丁目２１６番地","","","","","","","届出","",""
"018201","fBiz00000230450000001327","福井県","福井市","松浦機械製作所","マツウラキカイセイサクショ","⑫ 自動販売機による販売業（コップ式自動販売機（自動洗浄・屋内設置）及び営業許可の対象となる自動販売機を除く）","","福井県福井市東森田4丁目201番地","",36.123293,136.254019,"","株式会社コーシン","6220001000310","石川県野々市市押野２丁目２１６番地","","","","","","","届出","",""
"018201","fBiz00000230450000001333","福井県","福井市","株式会社アスワ村田製作所　食堂","カブシキガイシャアスワムラタセイサクショ　ショクドウ","⑤ コップ式自動販売機（自動洗浄・屋内設置）","","福井県福井市江守中2-1321","",36.037022,136.196975,"","株式会社コーシン","6220001000310","石川県野々市市押野２丁目２１６番地","","","","","","","届出","",""
"018201","fBiz00000581340000000257","福井県","福井市","","","⑫ 自動販売機による販売業（コップ式自動販売機（自動洗浄・屋内設置）及び営業許可の対象となる自動販売機を除く）","","","","","","","","","","","","","","","","届出","",""
"018201","fBiz00000230450000001364","福井県","福井市","㈱寺下機型製作所","カブシキガイシャテラシタキガタセイサクショ","② 調理機能を有する自動販売機（要許可）","紙コップ式自販機による飲料販売","福井県福井市三尾野町29-2-17","",36.010746,136.168378,"","株式会社コーシン","6220001000310","石川県野々市市押野２丁目２１６番地","福井市指令生衛第23-4-121号",2023/06/23,2023/06/23,2023/06/23,2028/06/30,"","許可","機種：FRB99G　機番：006006717",""
"018201","fBiz00000239070000000001","福井県","福井市","","","⑬ その他の食料・飲料販売業","飲食店営業（喫茶）","","","","","","","","","","","","","","","届出","",""
"018201","fBiz00000242860000000002","福井県","福井市","","","㉙ その他","食品の小分け業","","","","","","","","","","","","","","","届出","",""
"018201","fBiz00000242860000000003","福井県","福井市","","","㉙ その他","食品の小分け業","","","","","","","","","","","","","","","届出","",""
