"018201","fBiz00001268060000000304","福井県","福井市","クアトロブーム開発店　明治２","クアトロブームカイホツテン　メイジニ","⑫ 自動販売機による販売業（コップ式自動販売機（自動洗浄・屋内設置）及び営業許可の対象となる自動販売機を除く）","","福井県福井市開発5丁目2111","",36.086662,136.246663,"","株式会社ベネフレックス","7230001010927","富山県高岡市内島３５５０番地","","","","","","","届出","",""
"018201","fBiz00001268060000000306","福井県","福井市","タイヨーネオ福井店","タイヨーネオフクイテン　","⑫ 自動販売機による販売業（コップ式自動販売機（自動洗浄・屋内設置）及び営業許可の対象となる自動販売機を除く）","","福井県福井市西開発1丁目2503-2","",36.077407,136.236505,"","株式会社ベネフレックス","7230001010927","富山県高岡市内島３５５０番地","","","","","","","届出","",""
"018201","fBiz00001268060000000308","福井県","福井市","マルハン福井店","マルハンフクイテン","⑫ 自動販売機による販売業（コップ式自動販売機（自動洗浄・屋内設置）及び営業許可の対象となる自動販売機を除く）","","福井県福井市丸山1丁目107番地","",36.074169,136.243445,"","株式会社ベネフレックス","7230001010927","富山県高岡市内島３５５０番地","","","","","","","届出","",""
"018201","fBiz00001268060000000310","福井県","福井市","ｎａｍｃｏフェアモール福井大和田店","ナムコフェアモールフクイオオワダテン","⑫ 自動販売機による販売業（コップ式自動販売機（自動洗浄・屋内設置）及び営業許可の対象となる自動販売機を除く）","","福井県福井市大和田2-1230","",36.096676,136.250255,"","株式会社ベネフレックス","7230001010927","富山県高岡市内島３５５０番地","","","","","","","届出","",""
"018201","fBiz00001268060000000313","福井県","福井市","ワイプラザ店（明治ブリック②）","ワイプラザテンメイジブリックニ","⑫ 自動販売機による販売業（コップ式自動販売機（自動洗浄・屋内設置）及び営業許可の対象となる自動販売機を除く）","","福井県福井市新保北1-303","",36.087142,136.249337,"","株式会社ベネフレックス","7230001010927","富山県高岡市内島３５５０番地","","","","","","","届出","",""
"018201","fBiz00001268060000000319","福井県","福井市","福井あそびマーレ　明治","フクイアソビマーレ　メイジ","⑫ 自動販売機による販売業（コップ式自動販売機（自動洗浄・屋内設置）及び営業許可の対象となる自動販売機を除く）","","福井県福井市新保北1丁目303","",36.087142,136.249337,"","株式会社ベネフレックス","7230001010927","富山県高岡市内島３５５０番地","","","","","","","届出","",""
"018201","fBiz00001268060000000323","福井県","福井市","田中化学研究所新工場","タナカカガクケンキュウショシンコウジョウ","⑫ 自動販売機による販売業（コップ式自動販売機（自動洗浄・屋内設置）及び営業許可の対象となる自動販売機を除く）","","福井県福井市白方町45-5-10","",36.165693,136.107291,"","株式会社ベネフレックス","7230001010927","富山県高岡市内島３５５０番地","","","","","","","届出","",""
"018201","fBiz00001268060000000325","福井県","福井市","ポオトデリカトオカツ２Ｆ","ポオトデリカトオカツニカイ","⑫ 自動販売機による販売業（コップ式自動販売機（自動洗浄・屋内設置）及び営業許可の対象となる自動販売機を除く）","","福井県福井市西開発3丁目404-5","",36.083486,136.234588,"","株式会社ベネフレックス","7230001010927","富山県高岡市内島３５５０番地","","","","","","","届出","",""
"018201","fBiz00001268060000000326","福井県","福井市","松原病院（東館１Ｆ）","マツバラビョウイン　ヒガシカンイッカイ","⑫ 自動販売機による販売業（コップ式自動販売機（自動洗浄・屋内設置）及び営業許可の対象となる自動販売機を除く）","","福井県福井市文京2丁目9-1","",36.078127,136.219589,"","株式会社ベネフレックス","7230001010927","富山県高岡市内島３５５０番地","","","","","","","届出","",""
"018201","fBiz00001268060000000328","福井県","福井市","田中病院４Ｆ","タナカビョウインヨンカイ","⑫ 自動販売機による販売業（コップ式自動販売機（自動洗浄・屋内設置）及び営業許可の対象となる自動販売機を除く）","","福井県福井市大手2丁目3-1","",36.064459,136.224171,"","株式会社ベネフレックス","7230001010927","富山県高岡市内島３５５０番地","","","","","","","届出","",""
"018201","fBiz00001268060000000330","福井県","福井市","ＮＨＫ　２Ｆ食堂前","エヌエイチケイニカイショクドウマエ","⑫ 自動販売機による販売業（コップ式自動販売機（自動洗浄・屋内設置）及び営業許可の対象となる自動販売機を除く）","","福井県福井市宝永3丁目3-5","",36.067169,136.223654,"","株式会社ベネフレックス","7230001010927","富山県高岡市内島３５５０番地","","","","","","","届出","",""
"018201","fBiz00001268060000000334","福井県","福井市","北陸高等学校（本館）","ホクリクコウトウガッコウ　ホンカン","⑫ 自動販売機による販売業（コップ式自動販売機（自動洗浄・屋内設置）及び営業許可の対象となる自動販売機を除く）","","福井県福井市文京1丁目8-1","",36.077025,136.219367,"","株式会社ベネフレックス","7230001010927","富山県高岡市内島３５５０番地","","","","","","","届出","",""
"018201","fBiz00001268060000000336","福井県","福井市","福井青果組合","フクイセイカクミアイ","⑫ 自動販売機による販売業（コップ式自動販売機（自動洗浄・屋内設置）及び営業許可の対象となる自動販売機を除く）","","福井県福井市高柳1丁目1601","",36.089519,136.245221,"","株式会社ベネフレックス","7230001010927","富山県高岡市内島３５５０番地","","","","","","","届出","",""
"018201","fBiz00001268060000000339","福井県","福井市","増永眼鏡（株）１Ｆ","マスナガガンキョウカブ　イッカイ","⑫ 自動販売機による販売業（コップ式自動販売機（自動洗浄・屋内設置）及び営業許可の対象となる自動販売機を除く）","","福井県福井市今市町４-１５","",36.007306,136.203960,"","株式会社ベネフレックス","7230001010927","富山県高岡市内島３５５０番地","","","","","","","届出","",""
"018201","fBiz00001268060000000341","福井県","福井市","セーレン新田第五入口","セーレンニッタダイゴイリグチ","⑫ 自動販売機による販売業（コップ式自動販売機（自動洗浄・屋内設置）及び営業許可の対象となる自動販売機を除く）","","福井県福井市新田塚1丁目60-1","",36.095183,136.206770,"","株式会社ベネフレックス","7230001010927","富山県高岡市内島３５５０番地","","","","","","","届出","",""
"018201","fBiz00001268060000000352","福井県","福井市","嶋田病院","シマダビョウイン","⑫ 自動販売機による販売業（コップ式自動販売機（自動洗浄・屋内設置）及び営業許可の対象となる自動販売機を除く）","","福井県福井市西方1丁目2－11","",36.053599,136.234380,"","株式会社ベネフレックス","7230001010927","富山県高岡市内島３５５０番地","","","","","","","届出","",""
"018201","fBiz00001268060000000353","福井県","福井市","荒川整形外科１Ｆ待合所","アラカワセイケイゲカ　イッカイマチアイジョ","⑫ 自動販売機による販売業（コップ式自動販売機（自動洗浄・屋内設置）及び営業許可の対象となる自動販売機を除く）","","福井県福井市高木町51-8","",36.094283,136.230438,"","株式会社ベネフレックス","7230001010927","富山県高岡市内島３５５０番地","","","","","","","届出","",""
"018201","fBiz00001268060000000356","福井県","福井市","福井赤十字病院　ブリック機","フクイセキジュウジビョウイン　ブリックキ","⑫ 自動販売機による販売業（コップ式自動販売機（自動洗浄・屋内設置）及び営業許可の対象となる自動販売機を除く）","","福井県福井市月見2丁目4-1","",36.047784,136.214230,"","株式会社ベネフレックス","7230001010927","富山県高岡市内島３５５０番地","","","","","","","届出","",""
"018201","fBiz00001268060000000359","福井県","福井市","福井愛育病院　１Ｆブリック","フクイアイイクビョウイン　イッカイブリック","⑫ 自動販売機による販売業（コップ式自動販売機（自動洗浄・屋内設置）及び営業許可の対象となる自動販売機を除く）","","福井県福井市新保2丁目301","",36.077974,136.251019,"","株式会社ベネフレックス","7230001010927","富山県高岡市内島３５５０番地","","","","","","","届出","",""
"018201","fBiz00001268060000000362","福井県","福井市","福井愛育病院　２Ｆブリック","フクイアイイクビョウイン　ニカイブリック","⑫ 自動販売機による販売業（コップ式自動販売機（自動洗浄・屋内設置）及び営業許可の対象となる自動販売機を除く）","","福井県福井市新保2丁目301","",36.077974,136.251019,"","株式会社ベネフレックス","7230001010927","富山県高岡市内島３５５０番地","","","","","","","届出","",""
"018201","fBiz00001268060000000798","福井県","福井市","すまいる厚生","スマイルコウセイ","⑫ 自動販売機による販売業（コップ式自動販売機（自動洗浄・屋内設置）及び営業許可の対象となる自動販売機を除く）","","福井県福井市下馬3丁目2302番地","",36.037346,136.235272,"","株式会社ベネフレックス","7230001010927","富山県高岡市内島３５５０番地","","","","","","","届出","",""
"018201","fBiz00001269270000000015","福井県","福井市","８番餃子","ハチバンギョウザ","⑬ その他の食料・飲料販売業","","福井県福井市今市町35","",36.013516,136.204649,"","株式会社ハチバン","4220001005352","石川県金沢市新神田１丁目１２番１８号","","","","","","","届出","",""
"018201","fBiz00001287220000000828","福井県","福井市","サイゼリヤフェアモール福井店","サイゼリヤフェアモールフクイテン","⑬ その他の食料・飲料販売業","","福井県福井市大和田2-1230","フェアモール福井１Ｆ",36.096676,136.250255,"0776-52-2666","株式会社サイゼリヤ","8030001065552","埼玉県吉川市旭2番地5","","","","","","","届出","",""
"018201","fBiz00001287220000001017","福井県","福井市","株式会社サイゼリヤ福井駅前店","カブシキガイシャサイゼリヤフクイエキマエテン","⑬ その他の食料・飲料販売業","","福井県福井市中央1-3-3","ＫＩビル２Ｆ",36.062065,136.221664,"0776-23-0680","株式会社サイゼリヤ","8030001065552","埼玉県吉川市旭2番地5","","","","","","","届出","",""
"018201","fBiz00001290610000000073","福井県","福井市","ヴィドフランス","カブシキガイシャ　ヴィドフランス","⑬ その他の食料・飲料販売業","","福井県福井市中央１丁目1-25","ﾌﾟﾘｽﾞﾑ福井1F",36.061457,136.222899,"0776-29-2831","株式会社ヴィ・ド・フランス","3010001074766","東京都千代田区岩本町３丁目１０番１号","","","","","","","届出","",""
"018201","fBiz00001308700000000001","福井県","福井市","無印良品福井西武店","ムジルシリョウヒンフクイセイブテン","⑬ その他の食料・飲料販売業","","福井県福井市中央1丁目8-1","西武福井店　本館6階",36.061810,136.219090,"0776288461","株式会社良品計画","5013301012443","東京都豊島区東池袋4丁目26-3","","","","","","","届出","",""
"018201","fBiz00001320690000000003","福井県","福井市","えちぜん美食屋本舗","エチゼンビショクヤホンポ","③ 食肉販売業","","福井県福井市市波町３８－２","ルポの森本館１階",36.010862,136.329382,"0776967071","株式会社Ｏ３ｄｉｎｉｎｇ","4210001016747","福井県福井市大手２丁目５番１０号","福井市指令生衛第22-3-228号",2022/11/04,2022/11/04,2022/11/04,2028/08/31,"","許可","",""
"018201","fBiz00001373820000001265","福井県","福井市","ドラッグコスモス江守中店","ドラッグコスモスエモリナカテン","⑪ 百貨店、総合スーパー","ドラッグストア","福井県福井市江守中2丁目1413","",36.037818,136.196130,"0776-43-1899","株式会社コスモス薬品","9290001025414","福岡県福岡市博多区博多駅東２丁目１０番１号第一福岡ビルＳ館４階","","","","","","","届出","",""
"018201","fBiz00001440920000000024","福井県","福井市","","","⑬ その他の食料・飲料販売業","小売り","","","","","","","","","","","","","","","届出","",""
"018201","fBiz00001510250000000001","福井県","福井市","有限会社青山","ユウゲンガイシャアオヤマ","⑧ 米穀類販売業","","福井県福井市東郷二ケ町36-11","",36.016211,136.273733,"","有限会社青山","6210002000104","福井県福井市東郷二ケ町第３６号１１番地","","","","","","","届出","",""
"018201","fBiz00001526930000000031","福井県","福井市","エム・オー・エー商事　福井店","エムオーエーショウジ　フクイテン","⑬ その他の食料・飲料販売業","","福井県福井市文京2-16-8","",36.079487,136.219550,"0776255218","株式会社エム・オー・エー商事","6080101012600","静岡県熱海市田原本町9番1号","","","","","","","届出","",""
"018201","fBiz00001548650000000085","福井県","福井市","ココス西方店","ココスニシカタテン","⑬ その他の食料・飲料販売業","","福井県福井市西方2-201","",36.051356,136.238045,"0776287682","株式会社ファイブスター","1160001008703","滋賀県彦根市松原町１８８０番５","","","","","","","届出","",""
"018201","fBiz00001548650000000089","福井県","福井市","ココスベル店","ココスベルテン","⑬ その他の食料・飲料販売業","","福井県福井市江端町14-1-1","",36.031124,136.212281,"0776389063","株式会社ファイブスター","1160001008703","滋賀県彦根市松原町１８８０番５","","","","","","","届出","",""
"018201","fBiz00001548650000000093","福井県","福井市","ココス運動公園店","ココスウンドウコウエンテン","⑬ その他の食料・飲料販売業","","福井県福井市福1-2911","",36.048934,136.187025,"0776337213","株式会社ファイブスター","1160001008703","滋賀県彦根市松原町１８８０番５","","","","","","","届出","",""
"018201","fBiz00001548650000000096","福井県","福井市","ココス福井開発店","ココスフクイカイホツテン","⑬ その他の食料・飲料販売業","","福井県福井市開発町9-4-1","",36.084516,136.239775,"0776526180","株式会社ファイブスター","1160001008703","滋賀県彦根市松原町１８８０番５","","","","","","","届出","",""
"018201","fBiz00001563830000000001","福井県","福井市","福井ベルト工業株式会社","フクイベルトコウギョウカブシキカイシャ","㉗ 器具、容器包装の製造・加工業（合成樹脂が使用された器具又は容器包装の製造、加工に限る。）","","福井県福井市下江守町23-1-7","",36.046626,136.177760,"0776-36-3100","","","福井県福井市下江守町23-1-7","","","","","","","届出","",""
"018201","fBiz00001567370000000001","福井県","福井市","","","⑬ その他の食料・飲料販売業","卸売業　貨物輸送業","","","","","","","","","","","","","","","届出","",""
"018201","fBiz00001571810000000004","福井県","福井市","","","① 飲食店営業","","","","","","","","","","福井市指令生衛第22-3-374号",2023/03/23,2023/03/23,2023/03/23,2029/05/31,"","許可","",""
"018201","fBiz00001576510000000001","福井県","福井市","クルティエ　オンライン","クルティエ　オンライン","⑨ 通信販売・訪問販売による販売業","通信販売","福井県福井市二の宮４丁目４６１４番地","",36.084509,136.211670,"0776-27-5224","ゆたか商事株式会社","6210001004270","福井県福井市開発２丁目９０８番地","","","","","","","届出","",""
"018201","fBiz00001622090000000016","福井県","福井市","㈱佐々木実商店","カブササキミノルシヨウテン","⑬ その他の食料・飲料販売業","食品販売","福井県福井市大和田1丁目101","",36.092298,136.246399,"09013134279","㈱佐々木実商店","3210001001386","福井県福井市髙木中央2丁目3315","","","","","","","届出","",""
"018201","fBiz00001622090000000019","福井県","福井市","㈱佐々木実商店","カブササキミノルシヨウテン","㉔ その他の食料品製造・加工業","食品製造業","福井県福井市高木中央2丁目3315","",36.091421,136.234435,"0776-53-0798","㈱佐々木実商店","3210001001386","福井県福井市髙木中央2丁目3315","","","","","","","届出","",""
"018201","fBiz00001630730000000001","福井県","福井市","ウエルシア福井北四ツ居店","ウエルシアフクイキタヨツイテン","⑪ 百貨店、総合スーパー","ドラッグストア","福井県福井市北四ツ居1丁目２５番１号","",36.063457,136.246403,"0776-57-8550","ウエルシア薬局株式会社","3030001002411","東京都千代田区外神田二丁目2番15号","","","","","","","届出","",""
"018201","fBiz00001684620000000008","福井県","福井市","食いしん坊市場","クイシンボウイチバ","㉕ 行商","行商","福井県福井市福井市全域","",36.064138,136.219623,"","株式会社プリメーロ","7190001026820","三重県桑名市藤が丘6-321","","","","","","","届出","",""
"018201","fBiz00001692680000000002","福井県","福井市","株式会社日本アクセス福井フローズンセンター","カブシキガイシャニッポンアクセスフクイフローズンセンター","⑬ その他の食料・飲料販売業","","福井県福井市西開発3-404-5","",36.079845,136.239414,"","株式会社日本アクセス","1010701025541","東京都品川区西品川１丁目１番１号","","","","","","","届出","",""
"018201","fBiz00001760640000000002","福井県","福井市","","","⑬ その他の食料・飲料販売業","","","","","","","","","","","","","","","","届出","",""
"018201","fBiz00001941740000000009","福井県","福井市","ココス福井開発店","ココスフクイカイホツテン","① 飲食店営業","レストラン","福井県福井市開発町９－４－１","",36.084516,136.239775,"0776526180","株式会社ファイブスター","1160001008703","滋賀県彦根市松原町１８８０番５","福井市指令生衛第22-4-260号",2022/11/10,2022/11/10,2022/11/10,2028/12/31,"","許可","",""
"018201","fBiz00002115690000000022","福井県","福井市","福井厚生病院内　売店","フクイコウセイビョウインナイ　バイテン","① 飲食店営業","コンビニエンス　院内売店","福井県福井市下六条町1-6-1","福井厚生病院内",36.035598,136.233978,"0776-41-3118","株式会社光洋","5020001029800","神奈川県横浜市金沢区福浦１丁目５番１号","福井市指令生衛第22-3-21号",2022/05/06,2022/05/06,2022/05/06,2027/08/31,"","許可","",""
"018201","fBiz00002115690000000022","福井県","福井市","福井厚生病院内　売店","フクイコウセイビョウインナイ　バイテン","⑩ コンビニエンスストア","コンビニエンス　院内売店","福井県福井市下六条町1-6-1","福井厚生病院内",36.035598,136.233978,"0776-41-3118","株式会社光洋","5020001029800","神奈川県横浜市金沢区福浦１丁目５番１号","","","","","","","届出","",""
"018201","fBiz00002115690000000023","福井県","福井市","福井厚生病院内　焼き立てパン工房","フクイコウセイビョウインナイヤキタテパンコウボウ","⑪ 菓子製造業","","福井県福井市下六条町1-6-1","福井厚生病院内",36.035598,136.233978,"0776-41-3118","株式会社光洋","5020001029800","神奈川県横浜市金沢区福浦１丁目５番１号","福井市指令生衛第22-3-22号",2022/05/06,2022/05/06,2022/05/06,2027/08/31,"","許可","",""
"018201","fBiz00002144610000000041","福井県","福井市","ｎａｍｃｏフェアモール福井大和田店","ナムコフェアモールフクイオオワダテン","⑫ 自動販売機による販売業（コップ式自動販売機（自動洗浄・屋内設置）及び営業許可の対象となる自動販売機を除く）","","福井県福井市大和田２－１２３０","アピタ福井大和田店２Ｆ",36.096412,136.250320,"0776-57-2320","株式会社バンダイナムコアミューズメント","6010801015479","東京都港区芝浦３丁目１番35号","","","","","","","届出","",""
"018201","fBiz00002151010000000012","福井県","福井市","鷹巣荘入浴場","タカスソウニュウヨクジョウ","⑫ 自動販売機による販売業（コップ式自動販売機（自動洗浄・屋内設置）及び営業許可の対象となる自動販売機を除く）","","福井県福井市蓑町3-11-1","",36.128735,136.057538,"","株式会社ヤクルト北陸","3220001000230","石川県野々市市本町6丁目20番1号","","","","","","","届出","",""
"018201","fBiz00002151010000000016","福井県","福井市","福井健康の森県民健康センター","フクイケンコウノモリケンミンケンコウセンター","⑫ 自動販売機による販売業（コップ式自動販売機（自動洗浄・屋内設置）及び営業許可の対象となる自動販売機を除く）","","福井県福井市真栗町47-48","",36.014723,136.139607,"","株式会社ヤクルト北陸","3220001000230","石川県野々市市本町6丁目20番1号","","","","","","","届出","",""
"018201","fBiz00002151010000000017","福井県","福井市","福井日野自動車","フクイヒノジドウシャ","⑫ 自動販売機による販売業（コップ式自動販売機（自動洗浄・屋内設置）及び営業許可の対象となる自動販売機を除く）","","福井県福井市大和田1-501","",36.093242,136.249337,"","株式会社ヤクルト北陸","3220001000230","石川県野々市市本町6丁目20番1号","","","","","","","届出","",""
"018201","fBiz00002151010000000018","福井県","福井市","福井新聞社","フクイシンブンシャ","⑫ 自動販売機による販売業（コップ式自動販売機（自動洗浄・屋内設置）及び営業許可の対象となる自動販売機を除く）","","福井県福井市大和田2-801","",36.098813,136.250686,"","株式会社ヤクルト北陸","3220001000230","石川県野々市市本町6丁目20番1号","","","","","","","届出","",""
"018201","fBiz00002151010000000019","福井県","福井市","ラブリーパートナーエルパ2階","ラブリーパートナーエルパニカイ","⑫ 自動販売機による販売業（コップ式自動販売機（自動洗浄・屋内設置）及び営業許可の対象となる自動販売機を除く）","","福井県福井市大和田2-1212","",36.095593,136.249643,"","株式会社ヤクルト北陸","3220001000230","石川県野々市市本町6丁目20番1号","","","","","","","届出","",""
"018201","fBiz00002151010000000020","福井県","福井市","福井銀行事務センター新館3階","フクイギンコウジムセンターシンカンサンカイ","⑫ 自動販売機による販売業（コップ式自動販売機（自動洗浄・屋内設置）及び営業許可の対象となる自動販売機を除く）","","福井県福井市今市町66","",36.022623,136.208166,"","株式会社ヤクルト北陸","3220001000230","石川県野々市市本町6丁目20番1号","","","","","","","届出","",""
"018201","fBiz00002151010000000021","福井県","福井市","ハシノメディカル","ハシノメディカル","⑫ 自動販売機による販売業（コップ式自動販売機（自動洗浄・屋内設置）及び営業許可の対象となる自動販売機を除く）","","福井県福井市町屋3-12-12","",36.078831,136.228360,"","株式会社ヤクルト北陸","3220001000230","石川県野々市市本町6丁目20番1号","","","","","","","届出","",""
"018201","fBiz00002151010000000022","福井県","福井市","福井日産自動車","フクイニッサンジドウシャ","⑫ 自動販売機による販売業（コップ式自動販売機（自動洗浄・屋内設置）及び営業許可の対象となる自動販売機を除く）","","福井県福井市下荒井町21-3","",36.025898,136.209593,"","株式会社ヤクルト北陸","3220001000230","石川県野々市市本町6丁目20番1号","","","","","","","届出","",""
